,Date,Open,High,Low,Close,Average,Volume,Month,Year,Day,Annual Average Inflation,12-Month Inflation,Mean,Amount,Dividends per share,Earnings Per Share,Unemployment,Interest rates
,2/20/2024,110,110,109,110,110,"9,900",,,,,6.9,142.8,1,,,,13
,2/19/2024,111,111,110,110.5,110.5,"4,100",,,,,6.9,143.48,1,,,,13
,2/16/2024,110,114,110,112,111,"4,100",,,,,6.9,145.52,1,,,,13
,2/15/2024,115,115,110,110,112.5,"6,900",,,,,6.9,145.5,1,,,,13
,2/14/2024,115,115,113,113,114.25,"13,000",,,,,6.9,155.04,1,,,,13
,2/13/2024,114,115,113,115,115,"420,600",,,,,6.9,157.58,1,,,,13
,2/12/2024,115.5,117,114,117,114.25,"8,100",,,,,6.9,159.48,1,,,,13
,2/9/2024,117.25,117.25,114.25,117,114.25,"220,500",,,,,6.9,160.128,1,,,,13
,2/8/2024,116,118,116,118,117.25,"102,600",,,,,6.9,160.42,1,,,,13
,2/7/2024,115,118,115,117,115.75,"114,300",,,,,6.9,160.48,1,,,,13
,2/6/2024,117,119,115,115,115,"129,400",,,,,6.9,160.75,1,,,,13
,2/5/2024,114,116,113,115,114.5,"107,300",,,,,6.9,161.045,1,,,,13
,2/2/2024,110,114.5,110,113,113.5,"87,900",,,,,6.9,160.8045,1,,,,13
,2/1/2024,109,110,109,109,109.25,"14,400",,,,,6.9,160,1,,,,13
0,1/31/2024,104,111,104,110,106,42000,1,2024,31,,6.9,161,1,,,3.7,12.5
1,1/30/2024,105,105,101,104,104,15600,1,2024,30,,6.9,161,1,,,3.7,12.5
2,1/29/2024,105,105,99,103.5,100,596100,1,2024,29,,6.9,162,1,,,3.7,12.5
3,1/26/2024,116.25,116.25,100,100,104.5,60500,1,2024,26,,6.9,162,1,,,3.7,12.5
4,1/25/2024,119.75,120,118,118,118.25,5700,1,2024,25,,6.9,163,1.75,,,3.7,12.5
5,1/24/2024,115,120,115,120,116.5,9700,1,2024,24,,6.9,162.75,1.75,,,3.7,12.5
6,1/23/2024,117,117,117,117,117,1200,1,2024,23,,6.9,162.5,1.75,,,3.7,12.5
7,1/22/2024,118,123,115.25,117,117,900,1,2024,22,,6.9,162,1.75,,,3.7,12.5
8,1/19/2024,118,118,118,118,118,3200,1,2024,19,,6.9,161.5,1.75,,,3.7,12.5
9,1/18/2024,118,124.75,118,120,120,263800,1,2024,18,,6.9,161.25,1.75,,,3.7,12.5
10,1/17/2024,120,120,119,120,119.75,2700,1,2024,17,,6.9,160.5,1.75,,,3.7,12.5
11,1/16/2024,120,125,119,120,121.75,17800,1,2024,16,,6.9,159.7,1.75,,,3.7,12.5
12,1/15/2024,120,120,119,119.5,120,13000,1,2024,15,,6.9,159.5,1.75,,,3.7,12.5
13,1/12/2024,120,120,119.5,120,120,8300,1,2024,12,,6.9,159,1.75,,,3.7,12.5
14,1/11/2024,121,121,120,120,120.75,4600,1,2024,11,,6.9,158.5,1.75,,,3.7,12.5
15,1/10/2024,121,123.5,121,121,121,78600,1,2024,10,,6.9,157.7,1.75,,,3.7,12.5
16,1/9/2024,123,123.5,121,121,122,6900,1,2024,9,,6.9,157.75,1.75,,,3.7,12.5
17,1/8/2024,124,125,122,122,123.75,2100,1,2024,8,,6.9,157.5,1.75,,,3.7,12.5
18,1/5/2024,125,125,121,125,122.5,3400,1,2024,5,,6.9,157,1.75,,,3.7,12.5
19,1/4/2024,123,123,123,123,123,1300,1,2024,4,,6.9,157.3912,1.75,,,3.7,12.5
20,1/3/2024,125,125,120,120,120.5,2600,1,2024,3,,6.9,157.3235,1.75,5.5,,3.7,12.5
21,12/29/2023,114,114,114,114,114,1100,12,2023,29,7.67,6.63,156.4618,1.75,5.5,12.5,4.9,12.5
22,12/28/2023,115,115,113,115,114.25,1500,12,2023,28,7.67,6.63,156.0941,1.75,5.5,12.5,4.9,12.5
23,12/27/2023,114,118,114,118,115,1100,12,2023,27,7.67,6.63,155.4706,1.75,5.5,12.5,4.9,12.5
24,12/22/2023,114,114,114,114,114,1000,12,2023,22,7.67,6.63,155.0853,1.75,5.5,12.5,4.9,12.5
25,12/21/2023,108.5,110,108,110,108,305500,12,2023,21,7.67,6.63,154.6853,1.75,5.5,12.5,4.9,12.5
26,12/20/2023,109,109,108.5,108.5,108.5,76600,12,2023,20,7.67,6.63,154.3868,1.75,5.5,12.5,4.9,12.5
27,12/19/2023,110,110,108,109,109.5,17000,12,2023,19,7.67,6.63,154.1647,1.75,5.5,12.5,4.9,12.5
28,12/18/2023,112,112,109,109.5,109.75,7700,12,2023,18,7.67,6.63,153.7794,1.75,5.5,12.5,4.9,12.5
29,12/15/2023,112,112,110,112,111,10900,12,2023,15,7.67,6.63,153.7382,1.75,5.5,12.5,4.9,12.5
30,12/14/2023,112,112,111.25,111.5,111.5,21500,12,2023,14,7.67,6.63,153.3735,1.75,5.5,12.5,4.9,12.5
31,12/13/2023,112,112,111.5,112,111.75,17200,12,2023,13,7.67,6.63,153.3471,1.75,5.5,12.5,4.9,12.5
32,12/11/2023,111.75,112,111.5,112,112,7500,12,2023,11,7.67,6.63,153.3412,1.75,5.5,12.5,4.9,12.5
33,12/8/2023,111.75,112,111,111,111.75,12600,12,2023,8,7.67,6.63,153.3382,1.75,5.5,12.5,4.9,12.5
34,12/7/2023,112.25,112.25,111.25,111.5,112,264300,12,2023,7,7.67,6.63,153.3235,1.75,5.5,12.5,4.9,12.5
35,12/6/2023,112,112.5,112,112.5,112.25,13600,12,2023,6,7.67,6.63,153.2882,1.75,5.5,12.5,4.9,12.5
36,12/5/2023,112,112,112,112,112,0,12,2023,5,7.67,6.63,153.2765,1.75,5.5,12.5,4.9,12.5
37,12/4/2023,113,113,111.25,111.75,112,14300,12,2023,4,7.67,6.63,153.2412,1.75,5.5,12.5,4.9,12.5
38,12/1/2023,114,114,113,113,113.75,5000,12,2023,1,7.67,6.63,153.2353,1.75,5.5,12.5,4.9,12.5
39,11/22/2023,117,117,114,114,114.25,9600,11,2023,22,7.87,6.8,152.5529,1.75,5.5,12.5,4.9,10.5
40,11/21/2023,115,115,114.75,115,114.75,41000,11,2023,21,7.87,6.8,152.4471,1.75,5.5,12.5,4.9,10.5
41,11/20/2023,115,115,113,113,114.25,7700,11,2023,20,7.87,6.8,152.3382,1.75,5.5,12.5,4.9,10.5
42,11/17/2023,113,117,111,117,113.75,7400,11,2023,17,7.87,6.8,152.2265,1.75,5.5,12.5,4.9,10.5
43,11/16/2023,117.5,117.75,111,111.5,112.5,93300,11,2023,16,7.87,6.8,152.1088,1.75,5.5,12.5,4.9,10.5
44,11/15/2023,119,119,117,117.75,117.75,37600,11,2023,15,7.87,6.8,151.9353,1.75,5.5,12.5,4.9,10.5
45,11/14/2023,119,119.75,114.25,119.75,117.75,1400,11,2023,14,7.87,6.8,151.8382,1.75,5.5,12.5,4.9,10.5
46,11/10/2023,118.5,120,115,120,119,4800,11,2023,10,7.87,6.8,151.6794,1.75,5.5,12.5,4.9,10.5
47,11/9/2023,125,125,114,121,118.5,2600,11,2023,9,7.87,6.8,151.5324,1.75,5.5,12.5,4.9,10.5
48,11/8/2023,122.75,123,121,121,122,1100,11,2023,8,7.87,6.8,151.3794,1.75,5.5,12.5,4.9,10.5
49,11/7/2023,120,122,115,115,120,2900,11,2023,7,7.87,6.8,151.2676,1.75,5.5,12.5,4.9,10.5
50,11/6/2023,126,126,120,120,121.25,20300,11,2023,6,7.87,6.8,151.1647,1.75,5.5,12.5,4.9,10.5
51,11/3/2023,126,127,126,126,126,1500,11,2023,3,7.87,6.8,151.0588,1.75,5.5,12.5,4.9,10.5
52,11/2/2023,126,126,120.5,122,123,145400,11,2023,2,7.87,6.8,150.8588,1.75,5.5,12.5,4.9,10.5
53,11/1/2023,127,127,126.25,126.25,126.5,1200,11,2023,1,7.87,6.8,150.7029,1.75,5.5,12.5,4.9,10.5
54,10/31/2023,128,128,126,126,126.75,1400,10,2023,31,8.1,6.92,150.5588,1.75,5.5,12.5,4.9,10.5
55,10/30/2023,128,128.5,126.25,128,127,10900,10,2023,30,8.1,6.92,150.4588,1.75,5.5,12.5,4.9,10.5
56,10/27/2023,132,132,127,127,128.5,16900,10,2023,27,8.1,6.92,150.3618,1.75,5.5,12.5,4.9,10.5
57,10/26/2023,133,133,131.5,132,131.5,7900,10,2023,26,8.1,6.92,150.2735,1.75,5.5,12.5,4.9,10.5
58,10/25/2023,134,134,132,132,132.25,600,10,2023,25,8.1,6.92,150.1706,1.75,5.5,12.5,4.9,10.5
59,10/24/2023,134,134,130,133.5,131.5,3300,10,2023,24,8.1,6.92,150.0735,1.75,5.5,12.5,4.9,10.5
60,10/23/2023,134,134,131,131,131.75,3300,10,2023,23,8.1,6.92,149.9441,1.75,5.5,12.5,4.9,10.5
61,10/19/2023,130,135,130,131,132.25,2600,10,2023,19,8.1,6.92,149.7882,1.75,5.5,12.5,4.9,10.5
62,10/18/2023,135,135,135,135,135,1700,10,2023,18,8.1,6.92,149.5824,1.75,5.5,12.5,4.9,10.5
63,10/17/2023,130,130,130,130,130,2300,10,2023,17,8.1,6.92,149.4382,1.75,5.5,12.5,4.9,10.5
64,10/16/2023,130,130,128,128,129.25,1100,10,2023,16,8.1,6.92,149.2706,1.75,5.5,12.5,4.9,10.5
65,10/13/2023,130,130,124,130,126,4400,10,2023,13,8.1,6.92,149.1324,1.75,5.5,12.5,4.9,10.5
66,10/12/2023,130.25,130.25,130,130,130,600,10,2023,12,8.1,6.92,149.0059,1.75,5.5,12.5,4.9,10.5
67,10/11/2023,131,131,120,131,120.25,283900,10,2023,11,8.1,6.92,148.8824,1.75,5.5,12.5,4.9,10.5
68,10/9/2023,132,132,126,126,130.25,800,10,2023,9,8.1,6.92,148.7941,1.75,5.5,12.5,4.9,10.5
69,10/6/2023,132,132,120,120,124,6800,10,2023,6,8.1,6.92,148.6882,1.75,5.5,12.5,4.9,10.5
70,10/5/2023,132,132,131.5,131.5,131.75,3900,10,2023,5,8.1,6.92,148.5647,1.75,5.5,12.5,4.9,10.5
71,10/4/2023,131.5,132,131,132,131.5,600,10,2023,4,8.1,6.92,148.45,1.75,5.5,12.5,4.9,10.5
72,10/3/2023,132,132,120,132,124,8900,10,2023,3,8.1,6.92,148.3176,1.75,5.5,12.5,4.9,10.5
73,10/2/2023,132,132,131,131,131.75,2500,10,2023,2,8.1,6.92,148.2015,1.75,5.5,12.5,4.9,10.5
74,9/29/2023,131,131,131,131,131,1000,9,2023,29,8.32,6.78,148.1,1.75,5.5,12.5,4.9,10.5
75,9/28/2023,130,131,129,131,129.25,1500,9,2023,28,8.32,6.78,147.9412,1.75,5.5,12.5,4.9,10.5
76,9/27/2023,130,130,125.5,130,129.25,7000,9,2023,27,8.32,6.78,147.8088,1.75,5.5,12.5,4.9,10.5
77,9/26/2023,131,131,130,130,130,31100,9,2023,26,8.32,6.78,147.6412,1.75,5.5,12.5,4.9,10.5
78,9/25/2023,133.25,133.25,130,130,130.75,1900,9,2023,25,8.32,6.78,147.4706,1.75,5.5,12.5,4.9,10.5
79,9/22/2023,133,133,130,130,131,1800,9,2023,22,8.32,6.78,147.3559,1.75,5.5,12.5,4.9,10.5
80,9/21/2023,132,133.75,131,133.5,133.25,11800,9,2023,21,8.32,6.78,147.2647,1.75,5.5,12.5,4.9,10.5
81,9/20/2023,134,135,132,132,134,8200,9,2023,20,8.32,6.78,147.1412,1.75,5.5,12.5,4.9,10.5
82,9/19/2023,135,135,132,135,134,4000,9,2023,19,8.32,6.78,147.0059,1.75,5.5,12.5,4.9,10.5
83,9/18/2023,130,130,130,130,130,400,9,2023,18,8.32,6.78,146.9059,1.75,5.5,12.5,4.9,10.5
84,9/15/2023,136,136,130,130,130,15500,9,2023,15,8.32,6.78,146.7918,1.75,5.5,12.5,4.9,10.5
85,9/14/2023,131,131,131,131,131,100,9,2023,14,8.32,6.78,146.6588,1.75,5.5,12.5,4.9,10.5
86,9/13/2023,138,138,130.5,137,130.75,20800,9,2023,13,8.32,6.78,146.4912,1.75,5.5,12.5,4.9,10.5
87,9/12/2023,130,131,130,131,130.5,16700,9,2023,12,8.32,6.78,146.3618,1.75,5.5,12.5,4.9,10.5
88,9/11/2023,130.25,132,130,130,130.5,4800,9,2023,11,8.32,6.78,146.2206,1.75,5.5,12.5,4.9,10.5
89,9/8/2023,131,131,130.25,130.25,130.75,3900,9,2023,8,8.32,6.78,146.1353,1.75,5.5,12.5,4.9,10.5
90,9/7/2023,134,134,129,129,130,9600,9,2023,7,8.32,6.78,146.0412,1.75,5.5,12.5,4.9,10.5
91,9/6/2023,135,135,130,130,131,5000,9,2023,6,8.32,6.78,145.9147,1.75,5.5,12.5,4.9,10.5
92,9/5/2023,138.75,138.75,132,132,134.25,12400,9,2023,5,8.32,6.78,145.7559,1.75,5.5,12.5,4.9,10.5
93,9/4/2023,135,139.75,132,132,134.25,9200,9,2023,4,8.32,6.78,145.6324,1.75,5.5,12.5,4.9,10.5
94,9/1/2023,142,142,132,135,135.5,4100,9,2023,1,8.32,6.78,145.5088,1.75,5.5,12.5,4.9,10.5
95,8/31/2023,135,140,130,140,135.25,38800,8,2023,31,8.52,6.73,145.4059,1.75,5.5,12.5,4.9,10.5
96,8/30/2023,137,137,132,132,134.75,8500,8,2023,30,8.52,6.73,145.2618,1.75,5.5,12.5,4.9,10.5
97,8/29/2023,132,135,126.25,135,132.75,2800,8,2023,29,8.52,6.73,145.15,1.75,5.5,12.5,4.9,10.5
98,8/28/2023,135,135,126.25,135,134.75,3200,8,2023,28,8.52,6.73,144.9941,1.75,5.5,12.5,4.9,10.5
99,8/25/2023,135,135,132,132,134.25,400,8,2023,25,8.52,6.73,144.8735,1.75,5.5,12.5,4.9,10.5
100,8/24/2023,135,135,134.75,135,135,1400,8,2023,24,8.52,6.73,144.7176,1.75,5.5,12.5,4.9,10.5
101,8/23/2023,126,126,126,126,126,2600,8,2023,23,8.52,6.73,144.5559,1.75,5.5,12.5,4.9,10.5
102,8/22/2023,127,135,125,125.25,125.25,180600,8,2023,22,8.52,6.73,144.4059,1.75,5.5,12.5,4.9,10.5
103,8/21/2023,126,130,125,127,125,117600,8,2023,21,8.52,6.73,144.3176,1.75,5.5,12.5,4.9,10.5
104,8/18/2023,135,135,125,125.25,125.25,326300,8,2023,18,8.52,6.73,144.1824,1.75,5.5,12.5,4.9,10.5
105,8/17/2023,134,135,131,131.5,132.5,7100,8,2023,17,8.52,6.73,144.0441,1.75,5.5,12.5,4.9,10.5
106,8/16/2023,135,138,129,134,129.75,1955500,8,2023,16,8.52,6.73,143.9088,1.75,5.5,12.5,4.9,10.5
107,8/15/2023,138,139,134,135,135,10400,8,2023,15,8.52,6.73,143.7588,1.75,5.5,12.5,4.9,10.5
108,8/14/2023,138,139.75,136,139.75,137,3700,8,2023,14,8.52,6.73,143.6088,1.75,5.5,12.5,4.9,10.5
109,8/11/2023,140,141,134,134,138,23000,8,2023,11,8.52,6.73,143.5765,1.75,5.5,12.5,4.9,10.5
110,8/10/2023,141,141,138,140,139.75,3100,8,2023,10,8.52,6.73,143.4441,1.75,5.5,12.5,4.9,10.5
111,8/9/2023,141,145,141,144.75,144.75,13800,8,2023,9,8.52,6.73,143.2735,1.75,5.5,12.5,4.9,10.5
112,8/8/2023,143.5,145,135,142.75,141.25,27800,8,2023,8,8.52,6.73,143.1176,1.75,5.5,12.5,4.9,10.5
113,8/7/2023,145,145,143,143,144.75,25000,8,2023,7,8.52,6.73,142.9882,1.75,5.5,12.5,4.9,10.5
114,8/4/2023,145,145,141.5,142,143,21300,8,2023,4,8.52,6.73,142.8868,1.75,5.5,12.5,4.9,10.5
115,8/3/2023,154,154,143.25,145,145.5,4400,8,2023,3,8.52,6.73,142.7765,1.75,5.5,12.5,4.9,10.5
116,8/2/2023,144,154,141,154,143.25,2300,8,2023,2,8.52,6.73,142.6412,1.75,5.5,12.5,4.9,10.5
117,8/1/2023,142,144,141,141,141.25,35700,8,2023,1,8.52,6.73,142.5265,1.75,5.5,12.5,4.9,10.5
118,7/31/2023,148,148,140,140,141,19100,7,2023,31,8.68,7.28,142.3647,1.75,5.5,12.5,4.9,10.5
119,7/28/2023,162,162,149,149,153.5,11800,7,2023,28,8.68,7.28,142.2971,1.75,5.5,12.5,4.9,10.5
120,7/28/2023,162,162,149,149,153.5,11800,7,2023,28,8.68,7.28,142.2971,1.75,5.5,12.5,4.9,10.5
121,7/27/2023,162,165,162,165,164.5,1400,7,2023,27,8.68,7.28,142.2,3.75,5.5,12.5,4.9,10.5
122,7/26/2023,160,164,160,164,161.75,1500,7,2023,26,8.68,7.28,142.1176,3.75,5.5,12.5,4.9,10.5
123,7/25/2023,163.5,163.5,160,160,161.75,200,7,2023,25,8.68,7.28,141.9985,3.75,5.5,12.5,4.9,10.5
124,7/24/2023,160.75,160.75,160.75,160.75,160.75,0,7,2023,24,8.68,7.28,141.8426,3.75,5.5,12.5,4.9,10.5
125,7/21/2023,160,163.5,160,160,160.75,7200,7,2023,21,8.68,7.28,141.7747,3.75,5.5,12.5,4.9,10.5
126,7/20/2023,164.5,164.5,164,164,164.25,1400,7,2023,20,8.68,7.28,141.6971,3.75,5.5,12.5,4.9,10.5
127,7/19/2023,164.5,164.75,164,164,164.5,3300,7,2023,19,8.68,7.28,141.5912,3.75,5.5,12.5,4.9,10.5
128,7/18/2023,166.5,166.5,165,165,165,4500,7,2023,18,8.68,7.28,141.4971,3.75,5.5,12.5,4.9,10.5
129,7/17/2023,165,166.5,165,166.5,165.5,1700,7,2023,17,8.68,7.28,141.4412,3.75,5.5,12.5,4.9,10.5
130,7/14/2023,165,165,162,165,164,7500,7,2023,14,8.68,7.28,141.3824,3.75,5.5,12.5,4.9,10.5
131,7/13/2023,163,165,163,163,164.25,13400,7,2023,13,8.68,7.28,141.2853,3.75,5.5,12.5,4.9,10.5
132,7/12/2023,160,164.75,160,164.75,161.75,3300,7,2023,12,8.68,7.28,141.2088,3.75,5.5,12.5,4.9,10.5
133,7/11/2023,160,160,158,160,160,5800,7,2023,11,8.68,7.28,141.0647,3.75,5.5,12.5,4.9,10.5
134,7/10/2023,159.5,160,157,157,157.75,9600,7,2023,10,8.68,7.28,140.9853,3.75,5.5,12.5,4.9,10.5
135,7/7/2023,160,160,157,157,158.75,7400,7,2023,7,8.68,7.28,140.9206,3.75,5.5,12.5,4.9,10.5
136,7/6/2023,160,160,160,160,160,7500,7,2023,6,8.68,7.28,140.7824,3.75,5.5,12.5,4.9,10.5
137,7/5/2023,155,160,155,158,157.25,11900,7,2023,5,8.68,7.28,140.7235,3.75,5.5,12.5,4.9,10.5
138,7/4/2023,160,160,155,155,156.5,3400,7,2023,4,8.68,7.28,140.6735,3.75,5.5,12.5,4.9,10.5
139,7/3/2023,159,160,159,160,160,5100,7,2023,3,8.68,7.28,140.5735,3.75,5.5,12.5,4.9,10.5
140,6/30/2023,155,155,155,155,155,1100,6,2023,30,8.77,7.88,140.5235,3.75,5.5,12.5,4.9,10.5
141,6/29/2023,157,160,156,156,158.25,600,6,2023,29,8.77,7.88,140.45,3.75,5.5,12.5,4.9,10.5
142,6/27/2023,160,160,156,157,156.25,81000,6,2023,27,8.77,7.88,140.4441,3.75,5.5,12.5,4.9,10.5
143,6/26/2023,153,160,153,157,154,503300,6,2023,26,8.77,7.88,140.4412,3.75,5.5,12.5,4.9,10.5
144,6/23/2023,155,155,152,153,152,131400,6,2023,23,8.77,7.88,140.4029,3.75,5.5,12.5,4.9,10.5
145,6/22/2023,155,155,152,152.5,152,442800,6,2023,22,8.77,7.88,140.3059,3.75,5.5,12.5,4.9,10.5
146,6/21/2023,159,159,150,150,152.25,3400,6,2023,21,8.77,7.88,140.2,3.75,5.5,12.5,4.9,10.5
147,6/20/2023,154,156,150,155,151.5,202300,6,2023,20,8.77,7.88,140.1206,3.75,5.5,12.5,4.9,10.5
148,6/19/2023,155,155,154.5,154.5,155,28200,6,2023,19,8.77,7.88,140.0412,3.75,5.5,12.5,4.9,10.5
149,6/16/2023,160,160,156,159,158.75,3000,6,2023,16,8.77,7.88,139.8706,3.75,5.5,12.5,4.9,10.5
150,6/15/2023,163,163,154,154,160.5,461200,6,2023,15,8.77,7.88,139.7118,3.75,5.5,12.5,4.9,10.5
151,6/14/2023,165,165,162,162,163,111800,6,2023,14,8.77,7.88,139.6276,3.75,5.5,12.5,4.9,10.5
152,6/13/2023,169,169,163,165,165,155400,6,2023,13,8.77,7.88,139.4776,3.75,5.5,12.5,4.9,10.5
153,6/12/2023,167,169,165.25,167,167,72900,6,2023,12,8.77,7.88,139.35,3.75,5.5,12.5,4.9,10.5
154,6/9/2023,164.5,165.5,164.5,165.25,165.25,6200,6,2023,9,8.77,7.88,139.2235,3.75,5.5,12.5,4.9,10.5
155,6/8/2023,163.5,174,154.25,154.25,162.5,600,6,2023,8,8.77,7.88,139.1124,3.75,5.5,12.5,4.9,10.5
156,6/7/2023,166,173,154,154,162.75,7000,6,2023,7,8.77,7.88,138.9676,3.75,5.5,12.5,4.9,10.5
157,6/6/2023,165,175,165,165.25,165,30700,6,2023,6,8.77,7.88,138.8735,3.75,5.5,12.5,4.9,10.5
158,6/5/2023,165,165,160,163.5,163.5,1500,6,2023,5,8.77,7.88,138.7559,3.75,5.5,12.5,4.9,10.5
159,6/2/2023,160,165,147.25,160,154.75,100300,6,2023,2,8.77,7.88,138.6088,3.75,5.5,12.5,4.9,10.5
160,5/31/2023,155,155,150,150,151.75,3600,5,2023,31,8.78,8.03,138.4912,3.75,5.5,12.5,4.9,9.5
161,5/30/2023,154,157,150,156.75,154,600,5,2023,30,8.78,8.03,138.4176,3.75,5.5,12.5,4.9,9.5
162,5/29/2023,145,150,145,147,150,118300,5,2023,29,8.78,8.03,138.3324,3.75,5.5,12.5,4.9,9.5
163,5/26/2023,147,147,145.5,147,146.25,21100,5,2023,26,8.78,8.03,138.2529,3.75,5.5,12.5,4.9,9.5
164,5/25/2023,145.5,146,145.5,146,146,70800,5,2023,25,8.78,8.03,138.1324,3.75,5.5,12.5,4.9,9.5
165,5/24/2023,145,147,145,146,146,73100,5,2023,24,8.78,8.03,137.9559,3.75,5.5,12.5,4.9,9.5
166,5/23/2023,145,147,145,145.25,145.25,39400,5,2023,23,8.78,8.03,137.7618,3.75,5.5,12.5,4.9,9.5
167,5/22/2023,145.5,147,145.5,145.5,146,1700,5,2023,22,8.78,8.03,137.6265,3.75,5.5,12.5,4.9,9.5
168,5/19/2023,148.25,149.5,144,148,147,15100,5,2023,19,8.78,8.03,137.4912,3.75,5.5,12.5,4.9,9.5
169,5/18/2023,149,149,149,149,149,200,5,2023,18,8.78,8.03,137.3735,3.75,5.5,12.5,4.9,9.5
170,5/17/2023,150,150,145,150,147,73000,5,2023,17,8.78,8.03,137.2382,3.75,5.5,12.5,4.9,9.5
171,5/16/2023,142,154,142,150,145,150500,5,2023,16,8.78,8.03,137.1029,3.75,5.5,12.5,4.9,9.5
172,5/15/2023,141,144,140.5,142,142,783200,5,2023,15,8.78,8.03,136.9794,3.75,5.5,12.5,4.9,9.5
173,5/12/2023,135,142,135,138,140.25,9900,5,2023,12,8.78,8.03,136.8765,3.75,5.5,12.5,4.9,9.5
174,5/11/2023,144,144,135,135,142,906900,5,2023,11,8.78,8.03,136.7912,3.75,5.5,12.5,4.9,9.5
175,5/10/2023,145,145,140,142,143.75,332300,5,2023,10,8.78,8.03,136.6765,3.75,5.5,12.5,4.9,9.5
176,5/9/2023,149,149,145,145,146.75,12000,5,2023,9,8.78,8.03,136.5853,3.75,5.5,12.5,4.9,9.5
177,5/8/2023,149,149,149,149,149,2300,5,2023,8,8.78,8.03,136.4676,3.75,5.5,12.5,4.9,9.5
178,5/5/2023,149,149.5,148.5,149,149,111700,5,2023,5,8.78,8.03,136.3971,3.75,5.5,12.5,4.9,9.5
179,5/4/2023,150,150,147,150,149.5,4900,5,2023,4,8.78,8.03,136.2618,3.75,5.5,12.5,4.9,9.5
180,5/3/2023,155,155,145,145,149.5,222200,5,2023,3,8.78,8.03,136.1529,3.75,5.5,12.5,4.9,9.5
181,5/2/2023,160,160,150,155,156,348700,5,2023,2,8.78,8.03,136.0176,3.75,5.5,12.5,4.9,9.5
182,4/28/2023,160,160,158,160,158.75,5500,4,2023,28,8.71,7.9,135.9118,3.75,5.5,12.5,4.9,9.5
183,4/27/2023,162,162,159,160,160,18800,4,2023,27,8.71,7.9,135.8324,3.75,5.5,12.5,4.9,9.5
184,4/26/2023,163.75,163.75,159,159,160.75,1300,4,2023,26,8.71,7.9,135.6588,3.75,5.5,12.5,4.9,9.5
185,4/25/2023,158.25,165,158.25,165,160,11300,4,2023,25,8.71,7.9,135.4824,3.75,5.5,12.5,4.9,9.5
186,4/24/2023,160,165,158,158,164.75,80100,4,2023,24,8.71,7.9,135.3147,3.75,5.5,12.5,4.9,9.5
187,4/20/2023,160,160,158,160,158.25,19500,4,2023,20,8.71,7.9,135.1912,3.75,5.5,12.5,4.9,9.5
188,4/19/2023,166,166,160,164,165,8200,4,2023,19,8.71,7.9,134.9735,3.75,5.5,12.5,4.9,9.5
189,4/18/2023,168,168,165.5,168,167.5,1200,4,2023,18,8.71,7.9,134.7382,3.75,5.5,12.5,4.9,9.5
190,4/17/2023,168.75,170,168.75,169,168.75,34700,4,2023,17,8.71,7.9,134.5676,3.75,5.5,12.5,4.9,9.5
191,4/14/2023,169.5,170,165,169.5,168.5,17200,4,2023,14,8.71,7.9,134.3529,3.75,5.5,12.5,4.9,9.5
192,4/13/2023,169.5,169.5,168.5,169.5,169,105300,4,2023,13,8.71,7.9,133.9529,3.75,5.5,12.5,4.9,9.5
193,4/12/2023,169.5,169.5,169,169,169.5,2300,4,2023,12,8.71,7.9,133.7235,3.75,5.5,12.5,4.9,9.5
194,4/11/2023,169.5,170,167,169.5,170,85500,4,2023,11,8.71,7.9,133.5882,3.75,5.5,12.5,4.9,9.5
195,4/6/2023,172,172,167.25,167.25,170.75,400,4,2023,6,8.71,7.9,133.3,3.75,5.5,12.5,4.9,9.5
196,4/5/2023,160,170,160,170,167.25,5000,4,2023,5,8.71,7.9,132.9412,3.75,5.5,12.5,4.9,9.5
197,4/4/2023,170,171,170,170,170,4800,4,2023,4,8.71,7.9,132.6735,3.75,5.5,12.5,4.9,9.5
198,4/3/2023,172,174,168,170,170,567900,4,2023,3,8.71,7.9,132.5206,3.75,5.5,12.5,4.9,9.5
199,3/31/2023,171.25,172,170,170,170,320900,3,2023,31,8.59,9.19,132.3324,3.75,5.5,12.5,4.9,9.5
200,3/30/2023,173.5,173.5,171,171.25,171.25,224200,3,2023,30,8.59,9.19,132.1265,3.75,5.5,12.5,4.9,9.5
201,3/29/2023,173,175,171,175,174.5,6200,3,2023,29,8.59,9.19,131.7765,3.75,5.5,12.5,4.9,9.5
202,3/28/2023,171,172,170.25,171,171,120400,3,2023,28,8.59,9.19,131.5294,3.75,5.5,12.5,4.9,9.5
203,3/27/2023,175,175,170.5,172,170.75,43700,3,2023,27,8.59,9.19,131.3971,3.75,5.5,12.5,4.9,9.5
204,3/24/2023,170,172,170,172,170.75,237700,3,2023,24,8.59,9.19,131.2735,3.75,5.5,12.5,4.9,9.5
205,3/23/2023,170,171,167,170,170,97200,3,2023,23,8.59,9.19,130.9941,3.75,5.5,12.5,4.9,9.5
206,3/22/2023,168,171,162,162,169.75,152900,3,2023,22,8.59,9.19,130.6176,3.75,5.5,12.5,4.9,9.5
207,3/21/2023,182,182,170,170,170,35100,3,2023,21,8.59,9.19,130.3206,3.75,5.5,12.5,4.9,9.5
208,3/20/2023,170,170,170,170,170,100,3,2023,20,8.59,9.19,130.0088,3.75,5.5,12.5,4.9,9.5
209,3/17/2023,166.25,180,164,180,170.5,161800,3,2023,17,8.59,9.19,129.8824,3.75,5.5,12.5,4.9,9.5
210,3/16/2023,170,171,167,171,168.5,11200,3,2023,16,8.59,9.19,129.7618,3.75,5.5,12.5,4.9,9.5
211,3/15/2023,170,175,166,175,170.75,10200,3,2023,15,8.59,9.19,129.5882,3.75,5.5,12.5,4.9,9.5
212,3/14/2023,170,175,165,175,171.5,12100,3,2023,14,8.59,9.19,129.4529,3.75,5.5,12.5,4.9,9.5
213,3/13/2023,170,170,165,165,167,23700,3,2023,13,8.59,9.19,129.2412,3.75,5.5,12.5,4.9,9.5
214,3/10/2023,170,170,165,165,169.75,23900,3,2023,10,8.59,9.19,128.8882,3.75,5.5,12.5,4.9,9.5
215,3/9/2023,173,173,170,171,171,400,3,2023,9,8.59,9.19,128.5912,3.75,5.5,12.5,4.9,9.5
216,3/8/2023,173,174,170,170,172.75,10000,3,2023,8,8.59,9.19,128.3618,3.75,5.5,12.5,4.9,9.5
217,3/7/2023,178,178,170,170,174.5,17900,3,2023,7,8.59,9.19,128.1088,3.75,5.5,12.5,4.9,9.5
218,3/6/2023,190,190,175.25,175.25,187,500,3,2023,6,8.59,9.19,127.7559,3.75,5.5,12.5,4.9,9.5
219,3/2/2023,175,175,173.25,174.75,174.75,21600,3,2023,2,8.59,9.19,127.2941,3.75,5.5,12.5,4.9,9.5
220,3/1/2023,175,175,175,175,175,2600,3,2023,1,8.59,9.19,127.0794,3.75,5.5,12.5,4.9,9.5
221,2/28/2023,175,175,174,174,174.75,11700,2,2023,28,8.3,9.23,126.8529,3.75,5.5,12.5,4.9,8.75
222,2/27/2023,175,176,175,175,175,7800,2,2023,27,8.3,9.23,126.6147,3.75,5.5,12.5,4.9,8.75
223,2/24/2023,179,179,175,179,175.75,1200,2,2023,24,8.3,9.23,126.4294,3.75,5.5,12.5,4.9,8.75
224,2/23/2023,175,175,174,174,174,6800,2,2023,23,8.3,9.23,126.2676,3.75,5.5,12.5,4.9,8.75
225,2/22/2023,171,179.75,168.25,168.25,174,2100,2,2023,22,8.3,9.23,126.0794,3.75,5.5,12.5,4.9,8.75
226,2/21/2023,179,179,174,174,176,6100,2,2023,21,8.3,9.23,125.9353,3.75,5.5,12.5,4.9,8.75
227,2/20/2023,181,181,171,171,174,2400,2,2023,20,8.3,9.23,125.7706,3.75,5.5,12.5,4.9,8.75
228,2/17/2023,180.5,181.5,180,180,180.25,13300,2,2023,17,8.3,9.23,125.6265,3.75,5.5,12.5,4.9,8.75
229,2/16/2023,178.5,182,178.25,181.5,181.5,25700,2,2023,16,8.3,9.23,125.5235,3.75,5.5,12.5,4.9,8.75
230,2/15/2023,181,181.5,178.25,181.5,179.75,39700,2,2023,15,8.3,9.23,125.3824,3.75,5.5,12.5,4.9,8.75
231,2/14/2023,181,181.5,180,181.5,180.25,21700,2,2023,14,8.3,9.23,125.2735,3.75,5.5,12.5,4.9,8.75
232,2/13/2023,180,181.75,180,181,181.25,2200,2,2023,13,8.3,9.23,125.1882,3.75,5.5,12.5,4.9,8.75
233,2/10/2023,180,181,178,181,180,20400,2,2023,10,8.3,9.23,125.0765,3.75,5.5,12.5,4.9,8.75
234,2/9/2023,180,181,180,180,180,22400,2,2023,9,8.3,9.23,124.9824,3.75,5.5,12.5,4.9,8.75
235,2/8/2023,177.25,180.5,176,180,179.75,151000,2,2023,8,8.3,9.23,124.8794,3.75,5.5,12.5,4.9,8.75
236,2/7/2023,178.5,178.5,176.5,177.25,178.25,19000,2,2023,7,8.3,9.23,124.8,3.75,5.5,12.5,4.9,8.75
237,2/6/2023,176,182,176,177,177.25,12700,2,2023,6,8.3,9.23,124.6618,3.75,5.5,12.5,4.9,8.75
238,2/3/2023,178,178,176,176,178,6000,2,2023,3,8.3,9.23,124.5941,3.75,5.5,12.5,4.9,8.75
239,2/2/2023,177,177,176,176,176.25,2500,2,2023,2,8.3,9.23,124.5235,3.75,5.5,12.5,4.9,8.75
240,2/1/2023,175.25,177,175.25,176,176.5,59200,2,2023,1,8.3,9.23,124.4765,3.75,5.5,12.5,4.9,8.75
241,1/31/2023,174,180,174,180,176.25,32700,1,2023,31,7.95,8.98,124.4029,3.75,5.5,12.5,4.9,8.75
242,1/30/2023,173,175,170.5,175,174.5,7800,1,2023,30,7.95,8.98,124.3912,3.75,5.5,12.5,4.9,8.75
243,1/27/2023,168,174,168,173.5,172,42100,1,2023,27,7.95,8.98,124.35,3.75,5.5,12.5,4.9,8.75
244,1/26/2023,165,172,165,172,168.75,6900,1,2023,26,7.95,8.98,124.3,7.25,5.5,12.5,4.9,8.75
245,1/25/2023,169,170,167,168,167.25,145200,1,2023,25,7.95,8.98,124.2471,7.25,5.5,12.5,4.9,8.75
246,1/24/2023,170,170,166,166,168.25,11600,1,2023,24,7.95,8.98,124.1735,7.25,5.5,12.5,4.9,8.75
247,1/23/2023,170,170,167,170,169.5,10400,1,2023,23,7.95,8.98,124.1265,7.25,5.5,12.5,4.9,8.75
248,1/20/2023,170,170,167,170,168.5,30100,1,2023,20,7.95,8.98,124.0941,7.25,5.5,12.5,4.9,8.75
249,1/19/2023,171,171,170,170,170,150500,1,2023,19,7.95,8.98,124.05,7.25,5.5,12.5,4.9,8.75
250,1/18/2023,171,171,170,170,170,400900,1,2023,18,7.95,8.98,124.0088,7.25,5.5,12.5,4.9,8.75
251,1/17/2023,170,172,170,171.5,170,107000,1,2023,17,7.95,8.98,123.9441,7.25,5.5,12.5,4.9,8.75
252,1/16/2023,172.5,172.5,171,172.5,172,29100,1,2023,16,7.95,8.98,123.8912,7.25,5.5,12.5,4.9,8.75
253,1/13/2023,172,172.5,171.25,172.5,172.5,24100,1,2023,13,7.95,8.98,123.8353,7.25,5.5,12.5,4.9,8.75
254,1/12/2023,170,172,170,171.5,170,546300,1,2023,12,7.95,8.98,123.7794,7.25,5.5,12.5,4.9,8.75
255,1/11/2023,171,172,170,172,171.5,35300,1,2023,11,7.95,8.98,123.7176,7.25,5.5,12.5,4.9,8.75
256,1/10/2023,173.5,174.5,171,171,172.25,516500,1,2023,10,7.95,8.98,123.6471,7.25,5.5,12.5,4.9,8.75
257,1/9/2023,174,174.5,174,174,174,29900,1,2023,9,7.95,8.98,123.5882,7.25,5.5,12.5,4.9,8.75
258,1/6/2023,175,175,172,175,173.75,27900,1,2023,6,7.95,8.98,123.5471,7.25,5.5,12.5,4.9,8.75
259,1/5/2023,175,175,170.75,175,174.25,5800,1,2023,5,7.95,8.98,123.4824,7.25,5.5,12.5,4.9,8.75
260,1/4/2023,170,175,169,175,169,185200,1,2023,4,7.95,8.98,123.4412,7.25,5.5,12.5,4.9,8.75
261,1/3/2023,167,170.75,167,170,170,7300,1,2023,3,7.95,8.98,123.4235,7.25,5.5,12.5,4.9,8.75
262,12/30/2022,166.5,173,166.5,170,167.5,11900,12,2022,30,7.66,9.06,123.3735,7.25,11,15,4.9,8.75
263,12/29/2022,168,168,166,167,167,13000,12,2022,29,7.66,9.06,123.3294,7.25,11,15,4.9,8.75
264,12/28/2022,165.5,167,165.5,167,167,51200,12,2022,28,7.66,9.06,123.2588,7.25,11,15,4.9,8.75
265,12/23/2022,166,166.5,166,166,166,474400,12,2022,23,7.66,9.06,123.2088,7.25,11,15,4.9,8.75
266,12/22/2022,168,168,166,168,167.25,80400,12,2022,22,7.66,9.06,123.1647,7.25,11,15,4.9,8.75
267,12/21/2022,165.25,166,165,165.5,165.25,443200,12,2022,21,7.66,9.06,123.1441,7.25,11,15,4.9,8.75
268,12/20/2022,165.5,166,165,165.25,165.25,323400,12,2022,20,7.66,9.06,123.0941,7.25,11,15,4.9,8.75
269,12/19/2022,166,166.5,165.5,165.75,166,24200,12,2022,19,7.66,9.06,123.0471,7.25,11,15,4.9,8.75
270,12/16/2022,165.5,166,165.5,166,166,74300,12,2022,16,7.66,9.06,122.9882,7.25,11,15,4.9,8.75
271,12/15/2022,166,167,165.5,166,166,302900,12,2022,15,7.66,9.06,122.9412,7.25,11,15,4.9,8.75
272,12/14/2022,165.5,168,165,168,165.75,338300,12,2022,14,7.66,9.06,122.8971,7.25,11,15,4.9,8.75
273,12/13/2022,166.5,166,165.5,165.5,165.75,649900,12,2022,13,7.66,9.06,122.8382,7.25,11,15,4.9,8.75
274,12/9/2022,169,169,166,166,167,74700,12,2022,9,7.66,9.06,122.7912,7.25,11,15,4.9,8.75
275,12/8/2022,169,169,167,167,169,9600,12,2022,8,7.66,9.06,122.7382,7.25,11,15,4.9,8.75
276,12/7/2022,167,167,165,165,167,21300,12,2022,7,7.66,9.06,122.6853,7.25,11,15,4.9,8.75
277,12/6/2022,162.5,166,162.5,166,165.75,113000,12,2022,6,7.66,9.06,122.6324,7.25,11,15,4.9,8.75
278,12/5/2022,161,164.25,161,162.5,163,8300,12,2022,5,7.66,9.06,122.5912,7.25,11,15,4.9,8.75
279,12/2/2022,165,166,160,164.5,164.25,21900,12,2022,2,7.66,9.06,122.5324,7.25,11,15,4.9,8.75
280,12/1/2022,166,166.25,164.25,164.25,165.25,36700,12,2022,1,7.66,9.06,122.5,7.25,11,15,4.9,8.75
281,11/30/2022,166,168,165.25,166,166,816000,11,2022,30,7.38,9.48,122.4471,7.25,11,15,4.9,8.75
282,11/29/2022,165,168,165,166,166.25,1169300,11,2022,29,7.38,9.48,122.3765,7.25,11,15,4.9,8.75
283,11/28/2022,170,170,165,165.5,165.25,7500,11,2022,28,7.38,9.48,122.3353,7.25,11,15,4.9,8.75
284,11/25/2022,165,166.5,165,166.5,165.75,14100,11,2022,25,7.38,9.48,122.2794,7.25,11,15,4.9,8.75
285,11/24/2022,166.75,166.75,165,166,166,450200,11,2022,24,7.38,9.48,122.2294,7.25,11,15,4.9,8.75
286,11/23/2022,167,167,166.5,166.5,166.75,9800,11,2022,23,7.38,9.48,122.1824,7.25,11,15,4.9,8.75
287,11/22/2022,167,167,165,166.5,166.5,630900,11,2022,22,7.38,9.48,122.1265,7.25,11,15,4.9,8.75
288,11/21/2022,167,167.5,166,166,167,69900,11,2022,21,7.38,9.48,122.0794,7.25,11,15,4.9,8.75
289,11/18/2022,165,167,164.5,167,165.25,193500,11,2022,18,7.38,9.48,122.0294,7.25,11,15,4.9,8.75
290,11/17/2022,165,165,164,164.25,164,209600,11,2022,17,7.38,9.48,121.9794,7.25,11,15,4.9,8.75
291,11/16/2022,165,166,160.5,163,163,323400,11,2022,16,7.38,9.48,121.9294,7.25,11,15,4.9,8.75
292,11/15/2022,161,165,160,163,161.5,84100,11,2022,15,7.38,9.48,121.8971,7.25,11,15,4.9,8.75
293,11/14/2022,159,161,158,161,158.75,4400,11,2022,14,7.38,9.48,121.8265,7.25,11,15,4.9,8.75
294,11/11/2022,158,159,157.25,159,157.5,42700,11,2022,11,7.38,9.48,121.7824,7.25,11,15,4.9,8.75
295,11/10/2022,160,160,157,159,157.75,72500,11,2022,10,7.38,9.48,121.7382,7.25,11,15,4.9,8.75
296,11/9/2022,158,159,156,157,157,525500,11,2022,9,7.38,9.48,121.6706,7.25,11,15,4.9,8.75
297,11/8/2022,163,163,158.75,159,159,82600,11,2022,8,7.38,9.48,121.6118,7.25,11,15,4.9,8.75
298,11/7/2022,164,164,150,150,158.5,74800,11,2022,7,7.38,9.48,121.5382,7.25,11,15,4.9,8.75
299,11/4/2022,165,166,163,163,164.5,15600,11,2022,4,7.38,9.48,121.4971,7.25,11,15,4.9,8.75
300,11/3/2022,164,166,163.5,165,165.5,7600,11,2022,3,7.38,9.48,121.4529,7.25,11,15,4.9,8.75
301,11/2/2022,167.25,167.25,163,165,166,52700,11,2022,2,7.38,9.48,121.4147,7.25,11,15,4.9,8.75
302,11/1/2022,168,168,167,167,167.5,203400,11,2022,1,7.38,9.48,121.3794,7.25,11,15,4.9,8.75
303,10/31/2022,168,168,167,167,167.25,34100,10,2022,31,7.48,9.59,121.3324,7.25,11,15,4.9,8.25
304,10/28/2022,167.5,168,165,168,167.25,39200,10,2022,28,7.48,9.59,121.3118,7.25,11,15,4.9,8.25
305,10/27/2022,169,169,167.5,167.5,167.75,6300,10,2022,27,7.48,9.59,121.2735,7.25,11,15,4.9,8.25
306,10/26/2022,168,168,167,168,167.5,128500,10,2022,26,7.48,9.59,121.2324,7.25,11,15,4.9,8.25
307,10/25/2022,169,169,165.25,167.5,167.5,157400,10,2022,25,7.48,9.59,121.1941,7.25,11,15,4.9,8.25
308,10/24/2022,168,169,168,169,168.75,12200,10,2022,24,7.48,9.59,121.1676,7.25,11,15,4.9,8.25
309,10/21/2022,168,170,168,170,168.75,15700,10,2022,21,7.48,9.59,121.1353,7.25,11,15,4.9,8.25
310,10/19/2022,169.5,170,168,169.5,169.25,92300,10,2022,19,7.48,9.59,121.1059,7.25,11,15,4.9,8.25
311,10/18/2022,171,174,167.5,167.5,169.5,404300,10,2022,18,7.48,9.59,121.0706,7.25,11,15,4.9,8.25
312,10/17/2022,170,174,169.75,170,170.75,459500,10,2022,17,7.48,9.59,121.0306,7.25,11,15,4.9,8.25
313,10/14/2022,164.5,174.75,164.5,171,170,370600,10,2022,14,7.48,9.59,120.9735,7.25,11,15,4.9,8.25
314,10/13/2022,137.25,138.25,137.25,138,138,95500,10,2022,13,7.48,9.59,120.9353,7.25,11,15,4.9,8.25
315,10/12/2022,139,139,136.5,138,137.5,8300,10,2022,12,7.48,9.59,120.9118,7.25,11,15,4.9,8.25
316,10/11/2022,138.75,139,137,137,137.25,18200,10,2022,11,7.48,9.59,120.8647,7.25,11,15,4.9,8.25
317,10/7/2022,140,140,135,140,137,320000,10,2022,7,7.48,9.59,120.85,7.25,11,15,4.9,8.25
318,10/6/2022,139,140,135,138,138,408400,10,2022,6,7.48,9.59,120.8235,7.25,11,15,4.9,8.25
319,10/5/2022,144.75,144.75,135,135,141,7600,10,2022,5,7.48,9.59,120.8059,7.25,11,15,4.9,8.25
320,10/4/2022,145,147,142,142,144.5,20500,10,2022,4,7.48,9.59,120.7882,7.25,11,15,4.9,8.25
321,10/3/2022,148,148,145,145,147.5,700,10,2022,3,7.48,9.59,120.7765,7.25,11,15,4.9,8.25
322,9/30/2022,142,148,140,142,142,29800,9,2022,30,6.81,9.18,120.7324,7.25,11,15,5.3,8.25
323,9/29/2022,142,142,141,142,142,23700,9,2022,29,6.81,9.18,120.6971,7.25,11,15,5.3,8.25
324,9/28/2022,145,145,140.75,143,143.25,31800,9,2022,28,6.81,9.18,120.6735,7.25,11,15,5.3,8.25
325,9/27/2022,143,145,140,145,140.75,4800,9,2022,27,6.81,9.18,120.6235,7.25,11,15,5.3,8.25
326,9/26/2022,148,148,140,145,140.25,115700,9,2022,26,6.81,9.18,120.5971,7.25,11,15,5.3,8.25
327,9/23/2022,143.5,145,141,144,141.25,80200,9,2022,23,6.81,9.18,120.56,7.25,11,15,5.3,8.25
328,9/22/2022,142,148,142,142,145,325700,9,2022,22,6.81,9.18,120.5424,7.25,11,15,5.3,8.25
329,9/21/2022,143,148,142,142,143.75,213300,9,2022,21,6.81,9.18,120.4982,7.25,11,15,5.3,8.25
330,9/20/2022,147.75,148,140.75,142,142,160600,9,2022,20,6.81,9.18,120.4559,7.25,11,15,5.3,8.25
331,9/19/2022,142,148,139,148,140,534400,9,2022,19,6.81,9.18,120.4294,7.25,11,15,5.3,8.25
332,9/16/2022,145,148,138,148,142,69800,9,2022,16,6.81,9.18,120.4106,7.25,11,15,5.3,8.25
333,9/15/2022,153,153,145,148.5,150.25,29500,9,2022,15,6.81,9.18,120.4118,7.25,11,15,5.3,8.25
334,9/14/2022,152,153,151,153,151.25,299700,9,2022,14,6.81,9.18,120.3706,7.25,11,15,5.3,8.25
335,9/12/2022,153,153,152,152,152,512600,9,2022,12,6.81,9.18,120.3353,7.25,11,15,5.3,8.25
336,9/9/2022,153.75,154,153,153,153,222100,9,2022,9,6.81,9.18,120.3059,7.25,11,15,5.3,8.25
337,9/8/2022,157,157,153.75,153.75,154,147500,9,2022,8,6.81,9.18,120.2824,7.25,11,15,5.3,8.25
338,9/7/2022,157,158,156,158,157,6600,9,2022,7,6.81,9.18,120.2618,7.25,11,15,5.3,8.25
339,9/6/2022,157,157,155,157,155.5,1000,9,2022,6,6.81,9.18,120.2206,7.25,11,15,5.3,8.25
340,9/5/2022,157,157,154,155.25,157,210600,9,2022,5,6.81,9.18,120.1847,7.25,11,15,5.3,8.25
341,9/2/2022,153.75,155.75,153,155.75,154,61200,9,2022,2,6.81,9.18,120.1176,7.25,11,15,5.3,8.25
342,9/1/2022,152,153,151,151,152,412200,9,2022,1,6.81,9.18,120.0529,7.25,11,15,5.3,8.25
343,8/31/2022,153,153,150,150.75,151,5900,8,2022,31,6.61,8.53,120.0129,7.25,11,15,5.3,7.5
344,8/30/2022,153,153,150,153,153,74600,8,2022,30,6.61,8.53,119.9794,7.25,11,15,5.3,7.5
345,8/29/2022,153,153.5,150.5,153,153,185700,8,2022,29,6.61,8.53,119.9294,7.25,11,15,5.3,7.5
346,8/26/2022,154,154,150,150,153,168200,8,2022,26,6.61,8.53,119.9059,7.25,11,15,5.3,7.5
347,8/25/2022,154,154,153.75,153.75,153.75,5400,8,2022,25,6.61,8.53,119.8576,7.25,11,15,5.3,7.5
348,8/24/2022,153,156.75,153,153,153.75,13800,8,2022,24,6.61,8.53,119.8029,7.25,11,15,5.3,7.5
349,8/23/2022,154.5,156,153,153.5,153.5,90800,8,2022,23,6.61,8.53,119.7206,7.25,11,15,5.3,7.5
350,8/22/2022,155,157,153.75,157,154.5,900,8,2022,22,6.61,8.53,119.6294,7.25,11,15,5.3,7.5
351,8/19/2022,156,157,153,154.25,153.75,383300,8,2022,19,6.61,8.53,119.5735,7.25,11,15,5.3,7.5
352,8/18/2022,152.5,159.5,152,157,156.75,6100,8,2022,18,6.61,8.53,119.4735,7.25,11,15,5.3,7.5
353,8/17/2022,156.25,157,150,157,152.5,51600,8,2022,17,6.61,8.53,119.45,7.25,11,15,5.3,7.5
354,8/16/2022,156.5,157,152,155,156.25,57300,8,2022,16,6.61,8.53,119.4147,7.25,11,15,5.3,7.5
355,8/15/2022,159.75,159.75,157,157,157,64600,8,2022,15,6.61,8.53,119.3559,7.25,11,15,5.3,7.5
356,8/12/2022,158,159.75,155,157.75,157.25,9300,8,2022,12,6.61,8.53,119.3118,7.25,11,15,5.3,7.5
357,8/11/2022,163,163,155,155,158,25600,8,2022,11,6.61,8.53,119.2412,7.25,11,15,5.3,7.5
358,8/10/2022,156,160,156,159.75,157.5,73100,8,2022,10,6.61,8.53,119.1735,7.25,11,15,5.3,7.5
359,8/8/2022,155,155.5,155,155.5,155.25,39700,8,2022,8,6.61,8.53,119.1265,7.25,11,15,5.3,7.5
360,8/5/2022,155,156,150.25,155,155,134300,8,2022,5,6.61,8.53,119.0912,7.25,11,15,5.3,7.5
361,8/4/2022,154,155,154,155,154.75,674300,8,2022,4,6.61,8.53,119.0324,7.25,11,15,5.3,7.5
362,8/3/2022,155,155,154,154,154.25,4100,8,2022,3,6.61,8.53,118.9941,7.25,11,15,5.3,7.5
363,8/2/2022,154,157,152,157,154.25,190000,8,2022,2,6.61,8.53,118.9118,7.25,11,15,5.3,7.5
364,8/1/2022,155.25,155.25,153,154.5,155,319000,8,2022,1,6.61,8.53,118.85,7.25,11,15,5.3,7.5
365,7/29/2022,154,157,154,156,155.25,186400,7,2022,29,6.45,8.32,118.8,7.25,11,15,5.3,7.5
366,7/28/2022,147.75,157.5,147.75,154,153,39100,7,2022,28,6.45,8.32,118.7588,7.25,11,15,5.3,7.5
367,7/27/2022,140.5,145,140.5,145,143.25,82400,7,2022,27,6.45,8.32,118.7176,3.75,11,15,5.3,7.5
368,7/26/2022,140.5,140.5,140.5,140.5,140.5,25400,7,2022,26,6.45,8.32,118.6588,3.75,11,15,5.3,7.5
369,7/25/2022,143.25,143.25,143,143,143.25,9000,7,2022,25,6.45,8.32,118.6206,3.75,11,15,5.3,7.5
370,7/22/2022,142,145,142,143.75,143.5,5800,7,2022,22,6.45,8.32,118.5706,3.75,11,15,5.3,7.5
371,7/21/2022,140,143,140,142,140.25,147000,7,2022,21,6.45,8.32,118.5206,3.75,11,15,5.3,7.5
372,7/20/2022,138,141,138,140,140,581700,7,2022,20,6.45,8.32,118.4529,3.75,11,15,5.3,7.5
373,7/19/2022,140,140,137,138,138.75,1300,7,2022,19,6.45,8.32,118.3882,3.75,11,15,5.3,7.5
374,7/18/2022,139,140,137,137.25,137.25,95800,7,2022,18,6.45,8.32,118.3324,3.75,11,15,5.3,7.5
375,7/15/2022,140,140,138.5,140,139.5,12100,7,2022,15,6.45,8.32,118.2718,3.75,11,15,5.3,7.5
376,7/14/2022,140,140,139.75,140,140,8700,7,2022,14,6.45,8.32,118.2306,3.75,11,15,5.3,7.5
377,7/13/2022,140,140,139,140,139.75,94800,7,2022,13,6.45,8.32,118.1794,3.75,11,15,5.3,7.5
378,7/12/2022,139,140,139,140,140,12600,7,2022,12,6.45,8.32,118.1324,3.75,11,15,5.3,7.5
379,7/8/2022,140,140,139,140,140,6400,7,2022,8,6.45,8.32,118.0706,3.75,11,15,5.3,7.5
380,7/7/2022,140,140,138,140,139,11700,7,2022,7,6.45,8.32,118.0324,3.75,11,15,5.3,7.5
381,7/6/2022,139.25,140,137.25,138,138,30600,7,2022,6,6.45,8.32,117.9941,3.75,11,15,5.3,7.5
382,7/5/2022,141.5,141.5,139,139,139.25,22000,7,2022,5,6.45,8.32,117.9529,3.75,11,15,5.3,7.5
383,7/4/2022,140.5,141.75,137.25,140,139.5,12200,7,2022,4,6.45,8.32,117.8971,3.75,11,15,5.3,7.5
384,7/1/2022,137,140.5,135,140,139,1022000,7,2022,1,6.45,8.32,117.8735,3.75,11,15,5.3,7.5
385,6/30/2022,131.25,139,131,136,137.25,6700,6,2022,30,6.29,7.91,117.8324,3.75,11,15,5.8,7.5
386,6/29/2022,121,131.25,121,131.25,127,546400,6,2022,29,6.29,7.91,117.7912,3.75,11,15,5.8,7.5
387,6/28/2022,114,121,111,121,119.5,569700,6,2022,28,6.29,7.91,117.7029,3.75,11,15,5.8,7.5
388,6/27/2022,114.75,115,110,115,110,2854500,6,2022,27,6.29,7.91,117.6941,3.75,11,15,5.8,7.5
389,6/24/2022,117.75,117.75,114.75,114.75,115.25,377900,6,2022,24,6.29,7.91,117.6559,3.75,11,15,5.8,7.5
390,6/23/2022,118.75,118.75,117.75,118,117.75,265100,6,2022,23,6.29,7.91,117.5706,3.75,11,15,5.8,7.5
391,6/22/2022,120,120,118,119,118.75,133900,6,2022,22,6.29,7.91,117.5059,3.75,11,15,5.8,7.5
392,6/21/2022,123,124.75,118.5,118.75,120,429200,6,2022,21,6.29,7.91,117.4353,3.75,11,15,5.8,7.5
393,6/20/2022,125,125,123,123,124,16000,6,2022,20,6.29,7.91,117.3971,3.75,11,15,5.8,7.5
394,6/17/2022,125,125,124.5,124.75,124.5,84100,6,2022,17,6.29,7.91,117.3265,3.75,11,15,5.8,7.5
395,6/16/2022,127.75,128.5,124.5,124.75,125,808800,6,2022,16,6.29,7.91,117.2853,3.75,11,15,5.8,7.5
396,6/15/2022,130,130,127.5,130,128.75,18400,6,2022,15,6.29,7.91,117.2353,3.75,11,15,5.8,7.5
397,6/14/2022,129.75,131,129.5,129.75,129.5,92400,6,2022,14,6.29,7.91,117.1676,3.75,11,15,5.8,7.5
398,6/13/2022,133,133,130,130,131.25,307700,6,2022,13,6.29,7.91,117.1,3.75,11,15,5.8,7.5
399,6/10/2022,133.25,137,133,133,133,251900,6,2022,10,6.29,7.91,117.0471,3.75,11,15,5.8,7.5
400,6/9/2022,138.25,139.5,135,135,137.5,107100,6,2022,9,6.29,7.91,117.01,3.75,11,15,5.8,7.5
401,6/8/2022,140,141,138.5,138.75,140,82000,6,2022,8,6.29,7.91,116.95,3.75,11,15,5.8,7.5
402,6/7/2022,140,140,140,140,140,20300,6,2022,7,6.29,7.91,116.9,3.75,11,15,5.8,7.5
403,6/6/2022,140,140,138,139.75,139.75,5600,6,2022,6,6.29,7.91,116.8482,3.75,11,15,5.8,7.5
404,6/3/2022,140,140,139.5,140,139.75,16900,6,2022,3,6.29,7.91,116.8306,3.75,11,15,5.8,7.5
405,6/2/2022,141,141.5,139.5,140,140,17700,6,2022,2,6.29,7.91,116.81,3.75,11,15,5.8,7.5
406,5/31/2022,141,141.25,140.5,141,141,445500,5,2022,31,6.16,7.08,116.7382,3.75,11,15,5.8,7.5
407,5/30/2022,142,142,141,141.5,141.5,144600,5,2022,30,6.16,7.08,116.7147,3.75,11,15,5.8,7.5
408,5/27/2022,141,142,141,141.25,141,701900,5,2022,27,6.16,7.08,116.6868,3.75,11,15,5.8,7.5
409,5/26/2022,141,142,140,142,141,205100,5,2022,26,6.16,7.08,116.6165,3.75,11,15,5.8,7.5
410,5/25/2022,141,141,140.5,141,141,873200,5,2022,25,6.16,7.08,116.5794,3.75,11,15,5.8,7.5
411,5/24/2022,141,142,141,141.25,141,3153500,5,2022,24,6.16,7.08,116.5176,3.75,11,15,5.8,7.5
412,5/23/2022,140,142.75,139.25,140,141,758700,5,2022,23,6.16,7.08,116.4706,3.75,11,15,5.8,7.5
413,5/20/2022,144,144,139,140,142.75,325100,5,2022,20,6.16,7.08,116.4059,3.75,11,15,5.8,7.5
414,5/19/2022,140,140,140,140,140,31700,5,2022,19,6.16,7.08,116.3735,3.75,11,15,5.8,7.5
415,5/18/2022,142.5,142.5,140,140,140,204700,5,2022,18,6.16,7.08,116.3176,3.75,11,15,5.8,7.5
416,5/17/2022,143,143,142,142,142.5,17700,5,2022,17,6.16,7.08,116.2441,3.75,11,15,5.8,7.5
417,5/16/2022,142,142.5,142,142.5,142.5,510500,5,2022,16,6.16,7.08,116.1735,3.75,11,15,5.8,7.5
418,5/13/2022,142.5,142.5,140.5,142.5,141.5,14400,5,2022,13,6.16,7.08,116.1235,3.75,11,15,5.8,7.5
419,5/12/2022,140.25,142.5,140,141,140.25,2800,5,2022,12,6.16,7.08,116.0971,3.75,11,15,5.8,7.5
420,5/11/2022,145,145,140,140,140.5,21800,5,2022,11,6.16,7.08,116.0676,3.75,11,15,5.8,7.5
421,5/10/2022,140,141,140,140,140,350000,5,2022,10,6.16,7.08,115.9959,3.75,11,15,5.8,7.5
422,5/9/2022,139.25,142,139.25,140,139.75,548900,5,2022,9,6.16,7.08,115.9459,3.75,11,15,5.8,7.5
423,5/6/2022,143,143.75,139,139,139,1349400,5,2022,6,6.16,7.08,115.9047,3.75,11,15,5.8,7.5
424,5/5/2022,144,144,140,140,142.5,16400,5,2022,5,6.16,7.08,115.8441,3.75,11,15,5.8,7.5
425,5/4/2022,144,144,143,143,144,124600,5,2022,4,6.16,7.08,115.8059,3.75,11,15,5.8,7.5
426,4/28/2022,144,144,143.5,144,144,11300,4,2022,28,6.05,6.47,115.7735,3.75,11,15,5.8,7.5
427,4/27/2022,144.75,145,143.75,144,144.25,12900,4,2022,27,6.05,6.47,115.7412,3.75,11,15,5.8,7.5
428,4/26/2022,145.5,147,144.75,145,145,129700,4,2022,26,6.05,6.47,115.6971,3.75,11,15,5.8,7.5
429,4/25/2022,146,147,145,145.5,145,45200,4,2022,25,6.05,6.47,115.6529,3.75,11,15,5.8,7.5
430,4/22/2022,148,148,144,144,144.75,53500,4,2022,22,6.05,6.47,115.5971,3.75,11,15,5.8,7.5
431,4/21/2022,148.75,148.75,145.75,146,146,162800,4,2022,21,6.05,6.47,115.5441,3.75,11,15,5.8,7.5
432,4/20/2022,147,150,145,149,146,51900,4,2022,20,6.05,6.47,115.5059,3.75,11,15,5.8,7.5
433,4/19/2022,150,150,146,146,147,11100,4,2022,19,6.05,6.47,115.4847,3.75,11,15,5.8,7.5
434,4/14/2022,149,150,148,150,148.25,50400,4,2022,14,6.05,6.47,115.4382,3.75,11,15,5.8,7.5
435,4/13/2022,149,149.5,148,149.5,148.25,215000,4,2022,13,6.05,6.47,115.4088,3.75,11,15,5.8,7.5
436,4/12/2022,149.5,149.5,149,149,149,27800,4,2022,12,6.05,6.47,115.3765,3.75,11,15,5.8,7.5
437,4/11/2022,150,150,148.5,149.5,149.5,10800,4,2022,11,6.05,6.47,115.3324,3.75,11,15,5.8,7.5
438,4/8/2022,149.5,150,149.5,150,150,13600,4,2022,8,6.05,6.47,115.2882,3.75,11,15,5.8,7.5
439,4/7/2022,151.25,151.25,149.5,150,150,332600,4,2022,7,6.05,6.47,115.1941,3.75,11,15,5.8,7.5
440,4/6/2022,152,152,150.75,151.75,151.25,700,4,2022,6,6.05,6.47,115.1206,3.75,11,15,5.8,7.5
441,4/5/2022,151,151,150,151,150.75,13100,4,2022,5,6.05,6.47,115.0969,3.75,11,15,5.8,7.5
442,4/4/2022,151,151,150,150,151,203100,4,2022,4,6.05,6.47,115.0375,3.75,11,15,5.8,7.5
443,4/1/2022,149.5,154,149.5,154,150.75,51400,4,2022,1,6.05,6.47,114.995,3.75,11,15,5.8,7.5
444,3/31/2022,150,150,150,150,150,151900,3,2022,31,6.29,5.56,114.9513,3.75,11,15,5.5,7
445,3/30/2022,150.5,150.5,150,150,150,4600,3,2022,30,6.29,5.56,114.8731,3.75,11,15,5.5,7
446,3/29/2022,152,152,150,150,151,23600,3,2022,29,6.29,5.56,114.825,3.75,11,15,5.5,7
447,3/28/2022,153,155,150,152.5,150.25,74500,3,2022,28,6.29,5.56,114.7529,3.75,11,15,5.5,7
448,3/25/2022,149.75,150,149,150,149.75,182300,3,2022,25,6.29,5.56,114.6853,3.75,11,15,5.5,7
449,3/24/2022,150,150,148.75,149.5,149,409900,3,2022,24,6.29,5.56,114.6,3.75,11,15,5.5,7
450,3/23/2022,149,149,148,149,148.5,436600,3,2022,23,6.29,5.56,114.4971,3.75,11,15,5.5,7
451,3/22/2022,150,150,146.25,148,149,353300,3,2022,22,6.29,5.56,114.4353,3.75,11,15,5.5,7
452,3/21/2022,150,150,149.75,150,150,275900,3,2022,21,6.29,5.56,114.3953,3.75,11,15,5.5,7
453,3/18/2022,152,152,148.5,150,149.5,38900,3,2022,18,6.29,5.56,114.3806,3.75,11,15,5.5,7
454,3/17/2022,149.75,150,148,150,149,94300,3,2022,17,6.29,5.56,114.3144,3.75,11,15,5.5,7
455,3/16/2022,150,150,149.75,149.75,150,10800,3,2022,16,6.29,5.56,114.2865,3.75,11,15,5.5,7
456,3/15/2022,152,152,149.5,150,150,131500,3,2022,15,6.29,5.56,114.2324,3.75,11,15,5.5,7
457,3/14/2022,153,153,150,150,150,78000,3,2022,14,6.29,5.56,114.1853,3.75,11,15,5.5,7
458,3/11/2022,153.75,153.75,150,150,153,102800,3,2022,11,6.29,5.56,114.1794,3.75,11,15,5.5,7
459,3/10/2022,148,155,148,150,154.5,169700,3,2022,10,6.29,5.56,114.1353,3.75,11,15,5.5,7
460,3/9/2022,156.25,156.25,145,155,155,21600,3,2022,9,6.29,5.56,114.0753,3.75,11,15,5.5,7
461,3/8/2022,158,158,156.5,156.5,157.25,2100,3,2022,8,6.29,5.56,114.0129,3.75,11,15,5.5,7
462,3/7/2022,157,160,157,159,159.25,6500,3,2022,7,6.29,5.56,113.9471,3.75,11,15,5.5,7
463,3/4/2022,156.5,157,156.25,156.25,156.75,401300,3,2022,4,6.29,5.56,113.9147,3.75,11,15,5.5,7
464,3/3/2022,156.25,158,156.25,157,156.25,324500,3,2022,3,6.29,5.56,113.8894,3.75,11,15,5.5,7
465,3/2/2022,155.75,156.25,155.75,156.25,156.25,223500,3,2022,2,6.29,5.56,113.8529,3.75,11,15,5.5,7
466,3/1/2022,158,158,156.25,157.5,156.5,52400,3,2022,1,6.29,5.56,113.8412,3.75,11,15,5.5,7
467,2/28/2022,159,160,159,160,159,27600,2,2022,28,6.23,5.08,113.8353,3.75,11,15,5.5,7
468,2/25/2022,156,159.5,156,159.5,159,227900,2,2022,25,6.23,5.08,113.8206,3.75,11,15,5.5,7
469,2/24/2022,163,164,158,160,160,379200,2,2022,24,6.23,5.08,113.8,3.75,11,15,5.5,7
470,2/23/2022,163.75,163.75,160,160,161.75,7900,2,2022,23,6.23,5.08,113.7424,3.75,11,15,5.5,7
471,2/22/2022,164.75,164.75,162,162,162,1061000,2,2022,22,6.23,5.08,113.6941,3.75,11,15,5.5,7
472,2/21/2022,162,162.25,162,162.25,162,21000,2,2022,21,6.23,5.08,113.6882,3.75,11,15,5.5,7
473,2/18/2022,161,163,160.25,163,162,237300,2,2022,18,6.23,5.08,113.6735,3.75,11,15,5.5,7
474,2/17/2022,161,163,160,163,160,486800,2,2022,17,6.23,5.08,113.6382,3.75,11,15,5.5,7
475,2/16/2022,160,162,160,162,160.75,27000,2,2022,16,6.23,5.08,113.6353,3.75,11,15,5.5,7
476,2/15/2022,164.75,164.75,160,161,160,305200,2,2022,15,6.23,5.08,113.6294,3.75,11,15,5.5,7
477,2/14/2022,157.5,162.5,157.5,159,160.5,2500,2,2022,14,6.23,5.08,113.6265,3.75,11,15,5.5,7
478,2/11/2022,162,162,158,160,160,936900,2,2022,11,6.23,5.08,113.6265,3.75,11,15,5.5,7
479,2/10/2022,164.75,164.75,162,163.5,163.5,38200,2,2022,10,6.23,5.08,113.6265,3.75,11,15,5.5,7
480,2/9/2022,163,165,163,164,163.5,164600,2,2022,9,6.23,5.08,113.6265,3.75,11,15,5.5,7
481,2/8/2022,164,165,162,162.75,163,9200,2,2022,8,6.23,5.08,113.6206,3.75,11,15,5.5,7
482,2/7/2022,162.25,165,162,162,162.75,3700,2,2022,7,6.23,5.08,113.6088,3.75,11,15,5.5,7
483,2/4/2022,165,165,163,163,163.25,2200,2,2022,4,6.23,5.08,113.6029,3.75,11,15,5.5,7
484,2/3/2022,165,165,163.25,164.75,164.75,267700,2,2022,3,6.23,5.08,113.5865,3.75,11,15,5.5,7
485,2/2/2022,169,169,165,165,167,1500,2,2022,2,6.23,5.08,113.5765,3.75,11,15,5.5,7
486,2/1/2022,165,165,164,164,165,172300,2,2022,1,6.23,5.08,113.5765,3.75,11,15,5.5,7
487,1/31/2022,164,170,162,165,165,874800,1,2022,31,6.08,5.39,113.5735,3.75,11,15,5.5,7
488,1/28/2022,160,170.5,157,162,161,2022800,1,2022,28,6.08,5.39,113.5706,3.75,11,15,5.5,7
489,1/27/2022,156,158,155,155,155,1216000,1,2022,27,6.08,5.39,113.5471,3,11,15,5.5,7
490,1/26/2022,158,158,156,156,157.25,1100,1,2022,26,6.08,5.39,113.5471,3,11,15,5.5,7
491,1/25/2022,157,157,155,157,156.5,13700,1,2022,25,6.08,5.39,113.5382,3,11,15,5.5,7
492,1/24/2022,157,159,156,159,157.5,26800,1,2022,24,6.08,5.39,113.5294,3,11,15,5.5,7
493,1/21/2022,157.5,159,157.5,159,159,2600,1,2022,21,6.08,5.39,113.5176,3,11,15,5.5,7
494,1/20/2022,160,160,156,157,157.5,4000,1,2022,20,6.08,5.39,113.5,3,11,15,5.5,7
495,1/19/2022,160,160,155,155,157.5,1600,1,2022,19,6.08,5.39,113.4676,3,11,15,5.5,7
496,1/18/2022,158.5,159.5,158.5,159.5,159,17000,1,2022,18,6.08,5.39,113.4147,3,11,15,5.5,7
497,1/17/2022,154,163,154,159,158.25,1700,1,2022,17,6.08,5.39,113.3941,3,11,15,5.5,7
498,1/14/2022,155,160,153,154,158.25,135700,1,2022,14,6.08,5.39,113.3676,3,11,15,5.5,7
499,1/13/2022,155.25,160,150,152.25,151.5,847800,1,2022,13,6.08,5.39,113.3329,3,11,15,5.5,7
500,1/12/2022,160,161,160,160,160,8300,1,2022,12,6.08,5.39,113.3118,3,11,15,5.5,7
501,1/11/2022,161,161,161,161,161,100,1,2022,11,6.08,5.39,113.2765,3,11,15,5.5,7
502,1/10/2022,164.5,164.5,160,160,163.25,9100,1,2022,10,6.08,5.39,113.2382,3,11,15,5.5,7
503,1/7/2022,165,165,164.25,164.25,164.75,3200,1,2022,7,6.08,5.39,113.2206,3,11,15,5.5,7
504,1/6/2022,164,165,160,162,160.75,2800,1,2022,6,6.08,5.39,113.1853,3,11,15,5.5,7
505,1/5/2022,164,165,160,160,163.75,900,1,2022,5,6.08,5.39,113.1735,3,11,15,5.5,7
506,1/4/2022,165,165,165,165,165,87200,1,2022,4,6.08,5.39,113.1559,3,11,15,5.5,7
507,1/3/2022,156,168,156,165.5,165.5,1000,1,2022,3,6.08,5.39,113.1382,3,11,15,5.5,7
508,12/31/2021,160,166,160,166,165,144700,12,2021,31,5.62,5.73,113.1412,3,5.5,5.5,5.5,7
509,12/30/2021,165,168,165,165,165.25,50700,12,2021,30,5.62,5.73,113.1265,3,5.5,5.5,5.5,7
510,12/29/2021,169,169,165,166,167.75,3400,12,2021,29,5.62,5.73,113.1059,3,5.5,5.5,5.5,7
511,12/28/2021,167,168,167,168,168,560400,12,2021,28,5.62,5.73,113.1,3,5.5,5.5,5.5,7
512,12/24/2021,167,168,167,167,168,675800,12,2021,24,5.62,5.73,113.0794,3,5.5,5.5,5.5,7
513,12/23/2021,165,166,165,165,165,186600,12,2021,23,5.62,5.73,113.0618,3,5.5,5.5,5.5,7
514,12/22/2021,165,168,161,165.25,164.5,163700,12,2021,22,5.62,5.73,113.0471,3,5.5,5.5,5.5,7
515,12/21/2021,155,162,155,162,161.75,71500,12,2021,21,5.62,5.73,113.0441,3,5.5,5.5,5.5,7
516,12/20/2021,151,155,150.5,155,151,163200,12,2021,20,5.62,5.73,113.0265,3,5.5,5.5,5.5,7
517,12/17/2021,151,162,148,155,148.25,2816500,12,2021,17,5.62,5.73,113.0059,3,5.5,5.5,5.5,7
518,12/16/2021,149,150,149,150,150,114700,12,2021,16,5.62,5.73,112.9559,3,5.5,5.5,5.5,7
519,12/15/2021,150,150,148.5,148.5,149,106300,12,2021,15,5.62,5.73,112.9235,3,5.5,5.5,5.5,7
520,12/14/2021,150,150,149,149,149,113300,12,2021,14,5.62,5.73,112.9147,3,5.5,5.5,5.5,7
521,12/10/2021,150,150,148.5,150,149,28300,12,2021,10,5.62,5.73,112.8876,3,5.5,5.5,5.5,7
522,12/9/2021,148.5,150,148.5,150,149.5,736300,12,2021,9,5.62,5.73,112.8571,3,5.5,5.5,5.5,7
523,12/8/2021,150,152,149,149,150.5,576700,12,2021,8,5.62,5.73,112.8088,3,5.5,5.5,5.5,7
524,12/7/2021,150,151,148.5,148.5,150,30200,12,2021,7,5.62,5.73,112.7059,3,5.5,5.5,5.5,7
525,12/6/2021,149.5,151,148,150,148.5,34200,12,2021,6,5.62,5.73,112.6735,3,5.5,5.5,5.5,7
526,12/3/2021,149,150.5,149,149.75,150,248700,12,2021,3,5.62,5.73,112.6265,3,5.5,5.5,5.5,7
527,12/2/2021,151.5,151.5,149,150,149.75,230600,12,2021,2,5.62,5.73,112.5647,3,5.5,5.5,5.5,7
528,12/1/2021,152,152,151.25,151.75,152,49400,12,2021,1,5.62,5.73,112.5235,3,5.5,5.5,5.5,7
529,11/30/2021,155,155,151.25,152,153,253100,11,2021,30,6.1,5.8,112.4882,3,5.5,5.5,5.5,7
530,11/29/2021,154,155,153.75,154,154.5,16200,11,2021,29,6.1,5.8,112.4441,3,5.5,5.5,5.5,7
531,11/26/2021,155,155,150,155,154,8700,11,2021,26,6.1,5.8,112.3853,3,5.5,5.5,5.5,7
532,11/25/2021,153,155,153,155,153.5,556300,11,2021,25,6.1,5.8,112.3647,3,5.5,5.5,5.5,7
533,11/24/2021,158,158,153,155,155,326500,11,2021,24,6.1,5.8,112.35,3,5.5,5.5,5.5,7
534,11/23/2021,157.75,158,157,158,157.5,10300,11,2021,23,6.1,5.8,112.2882,3,5.5,5.5,5.5,7
535,11/22/2021,156.25,159,156.25,157,158,281700,11,2021,22,6.1,5.8,112.2529,3,5.5,5.5,5.5,7
536,11/19/2021,160,160,155,157,157,152900,11,2021,19,6.1,5.8,112.1824,3,5.5,5.5,5.5,7
537,11/18/2021,157.5,162,156,159,158.75,2400,11,2021,18,6.1,5.8,112.1088,3,5.5,5.5,5.5,7
538,11/17/2021,161,161,157,159,158.5,109800,11,2021,17,6.1,5.8,112.0118,3,5.5,5.5,5.5,7
539,11/16/2021,162,162,160,161,160.25,19100,11,2021,16,6.1,5.8,111.9735,3,5.5,5.5,5.5,7
540,11/15/2021,161,161,159.5,159.5,160,759700,11,2021,15,6.1,5.8,111.9118,3,5.5,5.5,5.5,7
541,11/12/2021,162.5,162.5,160,162,162.25,659400,11,2021,12,6.1,5.8,111.8147,3,5.5,5.5,5.5,7
542,11/11/2021,162,163,160,160.25,162.75,234600,11,2021,11,6.1,5.8,111.7735,3,5.5,5.5,5.5,7
543,11/10/2021,165,165,163,164,164,155400,11,2021,10,6.1,5.8,111.7,3,5.5,5.5,5.5,7
544,11/9/2021,161,165,160,162,165,204100,11,2021,9,6.1,5.8,111.6541,3,5.5,5.5,5.5,7
545,11/8/2021,169,169,164,164,165.25,50300,11,2021,8,6.1,5.8,111.5941,3,5.5,5.5,5.5,7
546,11/5/2021,169,169,168,169,169,60800,11,2021,5,6.1,5.8,111.5471,3,5.5,5.5,5.5,7
547,11/4/2021,169.5,169.5,169,169,169,13200,11,2021,4,6.1,5.8,111.4382,3,5.5,5.5,5.5,7
548,11/3/2021,169,170,169,170,169.25,251000,11,2021,3,6.1,5.8,111.3559,3,5.5,5.5,5.5,7
549,11/2/2021,165,169,165,169,167,127600,11,2021,2,6.1,5.8,111.2941,3,5.5,5.5,5.5,7
550,11/1/2021,168,168,165.25,166,165.75,146900,11,2021,1,6.1,5.8,111.2441,3,5.5,5.5,5.5,7
551,10/29/2021,165.25,169,165,167,166,76100,10,2021,29,6.07,6.45,111.2147,3,5.5,5.5,5.5,7
552,10/28/2021,166,166,165,166,165,1096900,10,2021,28,6.07,6.45,111.1529,3,5.5,5.5,5.5,7
553,10/27/2021,167,167,165,166,166,118600,10,2021,27,6.07,6.45,111.1471,3,5.5,5.5,5.5,7
554,10/26/2021,169,169,165.75,166,166,180300,10,2021,26,6.07,6.45,111.1265,3,5.5,5.5,5.5,7
555,10/25/2021,168,168,167,167,167,4800,10,2021,25,6.07,6.45,111.0853,3,5.5,5.5,5.5,7
556,10/22/2021,169,170,168,169,169.25,76500,10,2021,22,6.07,6.45,111.0559,3,5.5,5.5,5.5,7
557,10/21/2021,169,172,169,170,170,4000300,10,2021,21,6.07,6.45,111.0176,3,5.5,5.5,5.5,7
558,10/19/2021,164,170,164,165,165,533500,10,2021,19,6.07,6.45,110.9118,3,5.5,5.5,5.5,7
559,10/18/2021,165,165,164.5,165,164.75,300100,10,2021,18,6.07,6.45,110.8941,3,5.5,5.5,5.5,7
560,10/15/2021,164,167,164,165,164.75,319900,10,2021,15,6.07,6.45,110.8676,3,5.5,5.5,5.5,7
561,10/14/2021,163,163.5,162.75,163,163,292100,10,2021,14,6.07,6.45,110.8106,3,5.5,5.5,5.5,7
562,10/13/2021,165,165,162.5,163,163.5,19400,10,2021,13,6.07,6.45,110.7694,3,5.5,5.5,5.5,7
563,10/12/2021,164.75,165,162,162,164.75,1095200,10,2021,12,6.07,6.45,110.7371,3,5.5,5.5,5.5,7
564,10/8/2021,165,165,162,164.75,164.75,10100,10,2021,8,6.07,6.45,110.7165,3,5.5,5.5,5.5,7
565,10/7/2021,167,167,165,166.75,165,28200,10,2021,7,6.07,6.45,110.6929,3,5.5,5.5,5.5,7
566,10/6/2021,167,167,165,166,166.75,441800,10,2021,6,6.07,6.45,110.6194,3,5.5,5.5,5.5,7
567,10/5/2021,170,170,165,165.5,166.5,212100,10,2021,5,6.07,6.45,110.5529,3,5.5,5.5,5.5,7
568,10/4/2021,172,172,169,170,170.25,7800,10,2021,4,6.07,6.45,110.5088,3,5.5,5.5,5.5,7
569,10/1/2021,173,173,172,172,172,1000,10,2021,1,6.07,6.45,110.4947,3,5.5,5.5,5.5,7
570,9/30/2021,173,173,170,170.25,170.75,12900,9,2021,30,5.35,6.91,110.4859,3,5.5,5.5,5.55,7
571,9/29/2021,175,175,172,172,172,1615800,9,2021,29,5.35,6.91,110.4494,3,5.5,5.5,5.55,7
572,9/28/2021,173.75,174,173.75,174,174,7100,9,2021,28,5.35,6.91,110.4018,3,5.5,5.5,5.55,7
573,9/27/2021,175,175,173.75,173.75,174,3800,9,2021,27,5.35,6.91,110.3824,3,5.5,5.5,5.55,7
574,9/24/2021,173.25,174.75,173.25,174.75,173.5,2600,9,2021,24,5.35,6.91,110.3765,3,5.5,5.5,5.55,7
575,9/23/2021,173.5,174,173.5,173.5,173.5,415200,9,2021,23,5.35,6.91,110.3882,3,5.5,5.5,5.55,7
576,9/22/2021,174,174,173,173.5,173.25,14300,9,2021,22,5.35,6.91,110.2765,3,5.5,5.5,5.55,7
577,9/21/2021,175,175,174,174,174,3207400,9,2021,21,5.35,6.91,110.1971,3,5.5,5.5,5.55,7
578,9/20/2021,175,176,173.5,175,175,229500,9,2021,20,5.35,6.91,110.1659,3,5.5,5.5,5.55,7
579,9/17/2021,175,176,175,176,176,20500,9,2021,17,5.35,6.91,110.0941,3,5.5,5.5,5.55,7
580,9/16/2021,175.25,178,175,175,175,19200,9,2021,16,5.35,6.91,110.0294,3,5.5,5.5,5.55,7
581,9/15/2021,174.75,175,174.25,175,175,51600,9,2021,15,5.35,6.91,109.9441,3,5.5,5.5,5.55,7
582,9/14/2021,175,175,174.25,175,175,532900,9,2021,14,5.35,6.91,109.8529,3,5.5,5.5,5.55,7
583,9/13/2021,174.75,175,174.5,174.75,174.75,28800,9,2021,13,5.35,6.91,109.8676,3,5.5,5.5,5.55,7
584,9/10/2021,175,175,174.5,175,175,128100,9,2021,10,5.35,6.91,109.8735,3,5.5,5.5,5.55,7
585,9/9/2021,173,176,173,175,175,66800,9,2021,9,5.35,6.91,110.0988,3,5.5,5.5,5.55,7
586,9/8/2021,176,176,175,175,175,153800,9,2021,8,5.35,6.91,110.08,3,5.5,5.5,5.55,7
587,9/7/2021,173,177,173,175,175.5,6600,9,2021,7,5.35,6.91,110.0512,3,5.5,5.5,5.55,7
588,9/6/2021,172,175,170.5,171,171.25,4100,9,2021,6,5.35,6.91,110.0306,3,5.5,5.5,5.55,7
589,9/3/2021,176,177,175,175.5,175.5,500700,9,2021,3,5.35,6.91,109.9865,3,5.5,5.5,5.55,7
590,9/2/2021,176.75,178.5,175.5,175.5,175.75,37600,9,2021,2,5.35,6.91,109.9335,3,5.5,5.5,5.55,7
591,9/1/2021,176.5,177,176.5,177,176.75,15600,9,2021,1,5.35,6.91,109.8894,3,5.5,5.5,5.55,7
592,8/31/2021,178.5,178.5,175.25,175.25,175.75,287900,8,2021,31,5.71,6.57,109.8718,3,5.5,5.5,5.55,7
593,8/30/2021,178,179,178,179,178.5,2100,8,2021,30,5.71,6.57,109.8182,3,5.5,5.5,5.55,7
594,8/27/2021,179,179,178.5,179,178.5,55300,8,2021,27,5.71,6.57,109.7776,3,5.5,5.5,5.55,7
595,8/26/2021,177,178.5,175,176,178,77500,8,2021,26,5.71,6.57,109.7059,3,5.5,5.5,5.55,7
596,8/25/2021,178.5,178.5,175,175,175.75,78000,8,2021,25,5.71,6.57,109.6324,3,5.5,5.5,5.55,7
597,8/24/2021,180,180,178,178.5,178.5,260900,8,2021,24,5.71,6.57,109.5982,3,5.5,5.5,5.55,7
598,8/23/2021,180,180,179,180,180,41800,8,2021,23,5.71,6.57,109.5529,3,5.5,5.5,5.55,7
599,8/20/2021,180,180,180,180,180,467800,8,2021,20,5.71,6.57,109.5324,3,5.5,5.5,5.55,7
600,8/19/2021,180,180,180,180,180,61500,8,2021,19,5.71,6.57,109.4853,3,5.5,5.5,5.55,7
601,8/18/2021,180,180.75,180,180,180,718600,8,2021,18,5.71,6.57,109.4176,3,5.5,5.5,5.55,7
602,8/17/2021,179,181,179,179.5,180,5066600,8,2021,17,5.71,6.57,109.3588,3,5.5,5.5,5.55,7
603,8/16/2021,178,179,177,177,177,801700,8,2021,16,5.71,6.57,109.2559,3,5.5,5.5,5.55,7
604,8/13/2021,179,179,178,179,179,100500,8,2021,13,5.71,6.57,109.1971,3,5.5,5.5,5.55,7
605,8/12/2021,179,179.5,179,179.5,179,131300,8,2021,12,5.71,6.57,109.1353,3,5.5,5.5,5.55,7
606,8/11/2021,179,179.5,178,179.5,179,358400,8,2021,11,5.71,6.57,109.0176,3,5.5,5.5,5.55,7
607,8/10/2021,180,180,177,179,179.25,37400,8,2021,10,5.71,6.57,108.8382,3,5.5,5.5,5.55,7
608,8/9/2021,180,180,175,175,179.25,56800,8,2021,9,5.71,6.57,108.7688,3,5.5,5.5,5.55,7
609,8/6/2021,184.75,184.75,178,179,179,435300,8,2021,6,5.71,6.57,108.7241,3,5.5,5.5,5.55,7
610,8/5/2021,180.5,180.5,178,178,178.5,21400,8,2021,5,5.71,6.57,108.6735,3,5.5,5.5,5.55,7
611,8/4/2021,179.5,180,179,180,179.75,64400,8,2021,4,5.71,6.57,108.6471,3,5.5,5.5,5.55,7
612,8/3/2021,183,183,180,180,180,214400,8,2021,3,5.71,6.57,108.6324,3,5.5,5.5,5.55,7
613,8/2/2021,182,183,182,182,182.25,4600,8,2021,2,5.71,6.57,108.6265,3,5.5,5.5,5.55,7
614,7/30/2021,183,183,175,182,179.5,79500,7,2021,30,5.53,6.55,108.6088,3,5.5,5.5,5.55,7
615,7/29/2021,184,185,183.5,185,184.5,320200,7,2021,29,5.53,6.55,108.5912,3,5.5,5.5,5.55,7
616,7/28/2021,183.25,186,180,184,183,20100,7,2021,28,5.53,6.55,108.5206,3,5.5,5.5,5.55,7
617,7/27/2021,185,186,184,184,184,893500,7,2021,27,5.53,6.55,108.4941,3,5.5,5.5,5.55,7
618,7/26/2021,187,187,184,185,186,7200,7,2021,26,5.53,6.55,108.2941,3,5.5,5.5,5.55,7
619,7/23/2021,188,188,184,187,184.5,19300,7,2021,23,5.53,6.55,108.2,3,5.5,5.5,5.55,7
620,7/22/2021,184,187.75,184,187.75,184,140000,7,2021,22,5.53,6.55,108.2,3,5.5,5.5,5.55,7
621,7/21/2021,187,187,183,183,183,13000,7,2021,21,5.53,6.55,108.2,3,5.5,5.5,5.55,7
622,7/19/2021,188,188,185,188,187.75,6100,7,2021,19,5.53,6.55,108.2,3,5.5,5.5,5.55,7
623,7/16/2021,181.5,188,181.5,182,187,3400,7,2021,16,5.53,6.55,108.1882,3,5.5,5.5,5.55,7
624,7/15/2021,187.5,189,187.5,188,188.25,3100,7,2021,15,5.53,6.55,108.0324,3,5.5,5.5,5.55,7
625,7/14/2021,188.5,188.5,187.5,187.5,187.5,224200,7,2021,14,5.53,6.55,107.9824,3,5.5,5.5,5.55,7
626,7/13/2021,189,189,182.25,188.5,188.25,44400,7,2021,13,5.53,6.55,107.95,3,5.5,5.5,5.55,7
627,7/12/2021,189,189,180,188,184.5,46000,7,2021,12,5.53,6.55,107.95,3,5.5,5.5,5.55,7
628,7/9/2021,185.5,189,181,187.5,187.5,2311600,7,2021,9,5.53,6.55,107.95,3,5.5,5.5,5.55,7
629,7/8/2021,184.75,189,184.75,185.25,187,394300,7,2021,8,5.53,6.55,107.95,3,5.5,5.5,5.55,7
630,7/7/2021,180,185.5,180,185.5,184.75,8000,7,2021,7,5.53,6.55,107.95,3,5.5,5.5,5.55,7
631,7/6/2021,185,185.5,180,184.75,184.75,11900,7,2021,6,5.53,6.55,107.95,3,5.5,5.5,5.55,7
632,7/5/2021,184,185,184,185,184.5,3900,7,2021,5,5.53,6.55,107.9441,3,5.5,5.5,5.55,7
633,7/2/2021,180,185.25,179,181,181,179400,7,2021,2,5.53,6.55,107.9529,3,5.5,5.5,5.55,7
634,7/1/2021,180,180,180,180,180,6600,7,2021,1,5.53,6.55,107.9206,3,5.5,5.5,5.55,7
635,6/30/2021,180,183,180,183,180.75,66000,6,2021,30,5.35,6.32,107.85,3,5.5,5.5,5.58,7
636,6/29/2021,185,185,180,180,180.5,75800,6,2021,29,5.35,6.32,107.7824,3,5.5,5.5,5.58,7
637,6/28/2021,181.5,185,180,184.75,181.5,437700,6,2021,28,5.35,6.32,107.75,3,5.5,5.5,5.58,7
638,6/25/2021,185,185,180,180,181.5,191800,6,2021,25,5.35,6.32,107.7529,3,5.5,5.5,5.58,7
639,6/24/2021,180,180,179.75,180,180,107600,6,2021,24,5.35,6.32,107.7706,3,5.5,5.5,5.58,7
640,6/23/2021,185,185,180,185,185,52400,6,2021,23,5.35,6.32,107.7971,3,5.5,5.5,5.58,7
641,6/22/2021,189,189.75,185.25,188.75,189,598700,6,2021,22,5.35,6.32,107.8,3,5.5,5.5,5.58,7
642,6/21/2021,191,191,185,189,190,168700,6,2021,21,5.35,6.32,107.8,3,5.5,5.5,5.58,7
643,6/18/2021,191,193,177,177,189,108400,6,2021,18,5.35,6.32,107.8,3,5.5,5.5,5.58,7
644,6/17/2021,192,194,192,194,193.75,1131900,6,2021,17,5.35,6.32,107.7971,3,5.5,5.5,5.58,7
645,6/16/2021,191,192,190,191,191,74200,6,2021,16,5.35,6.32,107.7706,3,5.5,5.5,5.58,7
646,6/15/2021,190,190.25,190,190.25,190.25,40900,6,2021,15,5.35,6.32,107.7935,3,5.5,5.5,5.58,7
647,6/14/2021,190,191,190,190,190,527900,6,2021,14,5.35,6.32,107.8006,3,5.5,5.5,5.58,7
648,6/11/2021,190.5,190.5,190,190,190,30600,6,2021,11,5.35,6.32,107.9,3,5.5,5.5,5.58,7
649,6/10/2021,190,190.25,190,190.25,190,965300,6,2021,10,5.35,6.32,107.9029,3,5.5,5.5,5.58,7
650,6/9/2021,190,190,187,190,190,354300,6,2021,9,5.35,6.32,107.95,3,5.5,5.5,5.58,7
651,6/8/2021,191,191,190,190.75,190,161700,6,2021,8,5.35,6.32,107.9,3,5.5,5.5,5.58,7
652,6/7/2021,190,191,187,188,190,1395100,6,2021,7,5.35,6.32,107.8382,3,5.5,5.5,5.58,7
653,6/4/2021,191,191,186,190,190,105400,6,2021,4,5.35,6.32,107.7997,3,5.5,5.5,5.58,7
654,6/3/2021,186,190,186,190,190,313100,6,2021,3,5.35,6.32,107.7324,3,5.5,5.5,5.58,7
655,6/2/2021,185.25,190,185,190,189.5,2031400,6,2021,2,5.35,6.32,107.6941,3,5.5,5.5,5.58,7
656,5/31/2021,186.25,186.25,185,185.25,185.25,79900,5,2021,31,5.2,5.87,107.5912,3,5.5,5.5,5.58,7
657,5/28/2021,186,188,185,188,186.25,20000,5,2021,28,5.2,5.87,107.5382,3,5.5,5.5,5.58,7
658,5/27/2021,180,186,180,186,185.25,2984100,5,2021,27,5.2,5.87,107.5735,3,5.5,5.5,5.58,7
659,5/26/2021,181,181,180,180,180.5,9800,5,2021,26,5.2,5.87,107.7353,3,5.5,5.5,5.58,7
660,5/25/2021,179,182,179,181,181,204500,5,2021,25,5.2,5.87,108.0235,3,5.5,5.5,5.58,7
661,5/24/2021,174.75,185,174.75,180,180,1361500,5,2021,24,5.2,5.87,108.2382,3,5.5,5.5,5.58,7
662,5/21/2021,174,174,172.75,174,174,190700,5,2021,21,5.2,5.87,108.2294,3,5.5,5.5,5.58,7
663,5/20/2021,174,174,172.5,173,173.75,136300,5,2021,20,5.2,5.87,107.9235,3,5.5,5.5,5.58,7
664,5/19/2021,173,174,172.5,172.75,174,42300,5,2021,19,5.2,5.87,107.5224,3,5.5,5.5,5.58,7
665,5/18/2021,172,173.5,172,172.5,173.25,227200,5,2021,18,5.2,5.87,107.2824,3,5.5,5.5,5.58,7
666,5/17/2021,172,173,170,172,171.5,168400,5,2021,17,5.2,5.87,107.1735,3,5.5,5.5,5.58,7
667,5/13/2021,172,173,171.5,173,172.25,214600,5,2021,13,5.2,5.87,107.0235,3,5.5,5.5,5.58,7
668,5/12/2021,172,172,171.25,171.75,172,10200,5,2021,12,5.2,5.87,106.7971,3,5.5,5.5,5.58,7
669,5/11/2021,172,173,171.75,173,171.75,486500,5,2021,11,5.2,5.87,106.5382,3,5.5,5.5,5.58,7
670,5/10/2021,171.75,173,171.75,171.75,171.75,51800,5,2021,10,5.2,5.87,106.7353,3,5.5,5.5,5.58,7
671,5/7/2021,173,173,171.5,172,171.75,1700,5,2021,7,5.2,5.87,106.8588,3,5.5,5.5,5.58,7
672,5/6/2021,171,173,170.75,172,171.25,364000,5,2021,6,5.2,5.87,106.9794,3,5.5,5.5,5.58,7
673,5/5/2021,168.75,170,168.75,170,169.25,1400,5,2021,5,5.2,5.87,107.2559,3,5.5,5.5,5.58,7
674,5/4/2021,171,171,170,170,170,84000,5,2021,4,5.2,5.87,107.7147,3,5.5,5.5,5.58,7
675,5/3/2021,170,171.5,170,171.5,171,20900,5,2021,3,5.2,5.87,107.8441,3,5.5,5.5,5.58,7
676,4/30/2021,169,170,168.25,168.25,169.75,64400,4,2021,30,4.66,5.76,107.8441,3,5.5,5.5,5.58,7
677,4/29/2021,170,172,170,172,171,13100,4,2021,29,4.66,5.76,107.8382,3,5.5,5.5,5.58,7
678,4/28/2021,169,169,165,169,168.75,32000,4,2021,28,4.66,5.76,107.8471,3,5.5,5.5,5.58,7
679,4/27/2021,170,170,165,165,167.75,2900,4,2021,27,4.66,5.76,108.1,3,5.5,5.5,5.58,7
680,4/26/2021,168,169,168,168,168.5,1900,4,2021,26,4.66,5.76,108.5353,3,5.5,5.5,5.58,7
681,4/23/2021,170,170.75,170,170,170,132400,4,2021,23,4.66,5.76,108.5265,3,5.5,5.5,5.58,7
682,4/22/2021,170.25,170.25,170,170,170,326500,4,2021,22,4.66,5.76,108.4206,3,5.5,5.5,5.58,7
683,4/21/2021,170,172,170,170,170,254300,4,2021,21,4.66,5.76,108.1118,3,5.5,5.5,5.58,7
684,4/20/2021,173,173,170,170,170.25,64600,4,2021,20,4.66,5.76,107.9488,3,5.5,5.5,5.58,7
685,4/19/2021,171,173,171,173,172.5,800,4,2021,19,4.66,5.76,107.4929,3,5.5,5.5,5.58,7
686,4/16/2021,170,171,170,171,170,82400,4,2021,16,4.66,5.76,107.06,3,5.5,5.5,5.58,7
687,4/15/2021,169.75,170.25,169.75,170.25,170,133200,4,2021,15,4.66,5.76,106.8059,3,5.5,5.5,5.58,7
688,4/14/2021,170,170,165.25,170,169.25,13500,4,2021,14,4.66,5.76,106.8971,3,5.5,5.5,5.58,7
689,4/13/2021,165.75,170,165.75,170,169.75,2009100,4,2021,13,4.66,5.76,107.1,3,5.5,5.5,5.58,7
690,4/12/2021,164,166,164,164,165.75,383500,4,2021,12,4.66,5.76,107.2882,3,5.5,5.5,5.58,7
691,4/9/2021,164,164.25,160.75,164,163.75,6700,4,2021,9,4.66,5.76,107.9706,3,5.5,5.5,5.58,7
692,4/8/2021,158.25,164,158,164,159.25,38400,4,2021,8,4.66,5.76,108.2412,3,5.5,5.5,5.58,7
693,4/7/2021,159,160,158,158,158.25,988300,4,2021,7,4.66,5.76,108.6029,3,5.5,5.5,5.58,7
694,4/6/2021,160,160,156,158,158,599800,4,2021,6,4.66,5.76,108.9218,3,5.5,5.5,5.58,7
695,4/1/2021,159,160,158,158,158,825100,4,2021,1,4.66,5.76,109.35,3,5.5,5.5,5.58,7
696,3/31/2021,159,160,156.25,156.25,158,147300,3,2021,31,5.17,5.9,109.5118,3,5.5,5.5,5.6,7
697,3/30/2021,156,160,154,156.5,156,1755300,3,2021,30,5.17,5.9,109.7176,3,5.5,5.5,5.6,7
698,3/29/2021,167,167,155,155.25,158.5,326400,3,2021,29,5.17,5.9,109.7529,3,5.5,5.5,5.6,7
699,3/26/2021,168,169,167.5,167.5,167.75,35200,3,2021,26,5.17,5.9,109.7853,3,5.5,5.5,5.6,7
700,3/25/2021,169.5,169.5,168,168,168,269700,3,2021,25,5.17,5.9,109.8147,3,5.5,5.5,5.6,7
701,3/24/2021,170,170,169.5,169.5,169.5,129600,3,2021,24,5.17,5.9,109.85,3,5.5,5.5,5.6,7
702,3/23/2021,170,170,169,169,170,222300,3,2021,23,5.17,5.9,109.8588,3,5.5,5.5,5.6,7
703,3/22/2021,170,172,168,168,170,95700,3,2021,22,5.17,5.9,109.8559,3,5.5,5.5,5.6,7
704,3/19/2021,170,170.5,170,170.5,170,38600,3,2021,19,5.17,5.9,109.8576,3,5.5,5.5,5.6,7
705,3/18/2021,174.75,174.75,170,170,172,8700,3,2021,18,5.17,5.9,109.7971,3,5.5,5.5,5.6,7
706,3/17/2021,175.25,175.25,172,172,174.25,22200,3,2021,17,5.17,5.9,109.6941,3,5.5,5.5,5.6,7
707,3/16/2021,175,175.25,174,175,175,726700,3,2021,16,5.17,5.9,109.6547,3,5.5,5.5,5.6,7
708,3/15/2021,177,177,173,175.25,175,563100,3,2021,15,5.17,5.9,109.6488,3,5.5,5.5,5.6,7
709,3/12/2021,178,178,175,175.5,175.25,483000,3,2021,12,5.17,5.9,109.6488,3,5.5,5.5,5.6,7
710,3/11/2021,176,177,175,177,175.5,1022400,3,2021,11,5.17,5.9,109.6488,3,5.5,5.5,5.6,7
711,3/10/2021,172,175,172,175,174.75,1405100,3,2021,10,5.17,5.9,109.6488,3,5.5,5.5,5.6,7
712,3/9/2021,170,172,170,172,170,86500,3,2021,9,5.17,5.9,109.6488,3,5.5,5.5,5.6,7
713,3/8/2021,170,170,167,167.25,168.5,19100,3,2021,8,5.17,5.9,109.64,3,5.5,5.5,5.6,7
714,3/5/2021,168,170,167,169,169,15200,3,2021,5,5.17,5.9,109.6518,3,5.5,5.5,5.6,7
715,3/4/2021,165,168,165,166.25,167,603600,3,2021,4,5.17,5.9,109.6941,3,5.5,5.5,5.6,7
716,3/3/2021,167.25,167.25,165,167.25,167,166100,3,2021,3,5.17,5.9,109.8,3,5.5,5.5,5.6,7
717,3/2/2021,169,169,166,166.5,167.25,42900,3,2021,2,5.17,5.9,109.8,3,5.5,5.5,5.6,7
718,3/1/2021,166.5,169,166.5,169,167.5,433300,3,2021,1,5.17,5.9,109.8029,3,5.5,5.5,5.6,7
719,2/26/2021,166,169,166,168,166,224600,2,2021,26,5.16,5.78,109.8,3,5.5,5.5,5.6,7
720,2/25/2021,165,166,165,165.25,165.75,825000,2,2021,25,5.16,5.78,109.7676,3,5.5,5.5,5.6,7
721,2/24/2021,168,169,167,167,168,399600,2,2021,24,5.16,5.78,109.7015,3,5.5,5.5,5.6,7
722,2/23/2021,165,170,165,169.25,168.5,442100,2,2021,23,5.16,5.78,109.6,3,5.5,5.5,5.6,7
723,2/22/2021,172,172,169,169,169.25,47300,2,2021,22,5.16,5.78,109.5971,3,5.5,5.5,5.6,7
724,2/19/2021,171,172,169.75,170,171,541400,2,2021,19,5.16,5.78,109.55,3,5.5,5.5,5.6,7
725,2/18/2021,174,174,161.5,161.5,173,250200,2,2021,18,5.16,5.78,109.5471,3,5.5,5.5,5.6,7
726,2/17/2021,174,174,173,173,173,965100,2,2021,17,5.16,5.78,109.4588,3,5.5,5.5,5.6,7
727,2/16/2021,175,175,173,174,174.5,378700,2,2021,16,5.16,5.78,109.45,3,5.5,5.5,5.6,7
728,2/15/2021,176,176,175,175,175.5,170800,2,2021,15,5.16,5.78,109.4471,3,5.5,5.5,5.6,7
729,2/12/2021,177,178,172,175,175,450400,2,2021,12,5.16,5.78,109.4429,3,5.5,5.5,5.6,7
730,2/11/2021,178.5,178.5,172.25,176,177.25,836200,2,2021,11,5.16,5.78,109.4512,3,5.5,5.5,5.6,7
731,2/10/2021,172,179,172,176,177.5,902400,2,2021,10,5.16,5.78,109.5518,3,5.5,5.5,5.6,7
732,2/9/2021,170,170.75,170,170.75,170.25,53700,2,2021,9,5.16,5.78,109.6441,3,5.5,5.5,5.6,7
733,2/8/2021,167,170,165.5,170,169.75,80200,2,2021,8,5.16,5.78,109.6559,3,5.5,5.5,5.6,7
734,2/5/2021,164,167,164,166,165.25,222900,2,2021,5,5.16,5.78,109.8206,3,5.5,5.5,5.6,7
735,2/4/2021,156,163,156,163,162.75,110700,2,2021,4,5.16,5.78,109.8647,3,5.5,5.5,5.6,7
736,2/3/2021,155,163,155,160,156.75,163800,2,2021,3,5.16,5.78,110.0071,3,5.5,5.5,5.6,7
737,2/2/2021,154.75,155,152.25,155,154.75,13800,2,2021,2,5.16,5.78,110.1471,3,5.5,5.5,5.6,7
738,2/1/2021,150,155.75,150,152,152.25,21200,2,2021,1,5.16,5.78,110.15,3,5.5,5.5,5.6,7
739,1/29/2021,151,152,149,150,149.75,396200,1,2021,29,5.74,5.69,110.1441,3,5.5,5.5,5.6,7
740,1/28/2021,150,152,150,152,150.75,7800,1,2021,28,5.74,5.69,110.1482,3,5.5,5.5,5.6,7
741,1/27/2021,149,149.75,148,149,148.5,30500,1,2021,27,5.74,5.69,110.1,3,5.5,5.5,5.6,7
742,1/26/2021,150,150,148,148,148.25,99000,1,2021,26,5.74,5.69,110.0941,3,5.5,5.5,5.6,7
743,1/25/2021,150,150,149,149,149,276200,1,2021,25,5.74,5.69,110.0235,3,5.5,5.5,5.6,7
744,1/22/2021,150,150,150,150,150,16300,1,2021,22,5.74,5.69,109.8088,3,5.5,5.5,5.6,7
745,1/21/2021,150,150.5,149.5,150,150.25,350100,1,2021,21,5.74,5.69,110.1853,3,5.5,5.5,5.6,7
746,1/20/2021,151,151,150,150,150.25,60100,1,2021,20,5.74,5.69,110.1829,3,5.5,5.5,5.6,7
747,1/19/2021,151,151,150.5,151,151,534200,1,2021,19,5.74,5.69,110.1029,3,5.5,5.5,5.6,7
748,1/18/2021,152,152,151,151,151,39500,1,2021,18,5.74,5.69,110.0729,3,5.5,5.5,5.6,7
749,1/15/2021,152,152,151,151,151.25,15000,1,2021,15,5.74,5.69,110.1,3,5.5,5.5,5.6,7
750,1/14/2021,152,152.5,151,151,151.25,48900,1,2021,14,5.74,5.69,109.9706,3,5.5,5.5,5.6,7
751,1/13/2021,154,154,150.5,150.5,152.5,318500,1,2021,13,5.74,5.69,109.6682,3,5.5,5.5,5.6,7
752,1/12/2021,154.5,154.5,154,154,154,4600,1,2021,12,5.74,5.69,109.5471,3,5.5,5.5,5.6,7
753,1/11/2021,155,155,154,154.5,154.5,77900,1,2021,11,5.74,5.69,109.55,3,5.5,5.5,5.6,7
754,1/8/2021,158.5,158.5,155,155,155,118400,1,2021,8,5.74,5.69,109.55,3,5.5,5.5,5.6,7
755,1/7/2021,158,158,158,158,158,300,1,2021,7,5.74,5.69,109.4718,3,5.5,5.5,5.6,7
756,1/6/2021,154,160,154,158,155.5,8400,1,2021,6,5.74,5.69,109.3794,3,5.5,5.5,5.6,7
757,1/5/2021,154,158,154,154,155,6200,1,2021,5,5.74,5.69,109.2853,3,5.5,5.5,5.6,7
758,1/4/2021,156,156,154,154,154,168800,1,2021,4,5.74,5.69,109.2165,3,5.5,5.5,5.6,7
759,12/31/2020,154,156,154,156,154.25,71700,12,2020,31,5.41,5.62,109.1718,3,3,5.2,5.64,7
760,12/30/2020,155.75,156,154,154,154,37300,12,2020,30,5.41,5.62,109.0353,3,3,5.2,5.64,7
761,12/29/2020,156,156,153,153,153.25,11200,12,2020,29,5.41,5.62,108.7694,3,3,5.2,5.64,7
762,12/28/2020,154,154,153,154,153,3200,12,2020,28,5.41,5.62,108.7676,3,3,5.2,5.64,7
763,12/24/2020,155,158,155,156,156,313600,12,2020,24,5.41,5.62,108.7882,3,3,5.2,5.64,7
764,12/23/2020,150.5,155,150.5,155,155,18400,12,2020,23,5.41,5.62,109.4441,3,3,5.2,5.64,7
765,12/22/2020,150,154,150,150.5,150,156600,12,2020,22,5.41,5.62,111.0382,3,3,5.2,5.64,7
766,12/21/2020,150,152,150,150,150.25,87300,12,2020,21,5.41,5.62,111.4453,3,3,5.2,5.64,7
767,12/18/2020,152,152,150.25,150.25,150.25,70200,12,2020,18,5.41,5.62,111.5718,3,3,5.2,5.64,7
768,12/17/2020,151,152,150,151,150.25,424600,12,2020,17,5.41,5.62,111.5912,3,3,5.2,5.64,7
769,12/16/2020,152,152,149.25,150,150,457800,12,2020,16,5.41,5.62,111.5871,3,3,5.2,5.64,7
770,12/15/2020,152.25,152.25,151.25,151.5,151.5,265400,12,2020,15,5.41,5.62,111.5635,3,3,5.2,5.64,7
771,12/14/2020,154.75,154.75,151,152,152.25,55100,12,2020,14,5.41,5.62,111.5276,3,3,5.2,5.64,7
772,12/11/2020,155,155,154.75,154.75,154.75,30200,12,2020,11,5.41,5.62,111.4812,3,3,5.2,5.64,7
773,12/10/2020,155,155,155,155,155,1200,12,2020,10,5.41,5.62,111.4388,3,3,5.2,5.64,7
774,12/9/2020,155,155,154.5,155,155,1600,12,2020,9,5.41,5.62,111.41,3,3,5.2,5.64,7
775,12/8/2020,154,155,152,152.75,152.75,676400,12,2020,8,5.41,5.62,111.3971,3,3,5.2,5.64,7
776,12/7/2020,155,155,154,154,154,1900,12,2020,7,5.41,5.62,111.1318,3,3,5.2,5.64,7
777,12/4/2020,155,155,153.75,154.5,154.75,247800,12,2020,4,5.41,5.62,111.0618,3,3,5.2,5.64,7
778,12/3/2020,155,155,153.75,153.75,155,61100,12,2020,3,5.41,5.62,110.6694,3,3,5.2,5.64,7
779,12/2/2020,155,155,153,155,155,20600,12,2020,2,5.41,5.62,110.0959,3,3,5.2,5.64,7
780,12/1/2020,153,155,153,153,153,305500,12,2020,1,5.41,5.62,110.0712,3,3,5.2,5.64,7
781,11/30/2020,155,155,153,153,153,479500,11,2020,30,5.53,5.33,110.0535,3,3,5.2,5.64,7
782,11/27/2020,155,155,152,152,153.75,270100,11,2020,27,5.53,5.33,109.9847,3,3,5.2,5.64,7
783,11/26/2020,155,155,155,155,155,1000,11,2020,26,5.53,5.33,109.86,3,3,5.2,5.64,7
784,11/25/2020,160,160,155,155,155,368000,11,2020,25,5.53,5.33,109.7194,3,3,5.2,5.64,7
785,11/24/2020,155,160,155,155,155,617700,11,2020,24,5.53,5.33,109.54,3,3,5.2,5.64,7
786,11/23/2020,156,156,154,154,155,827100,11,2020,23,5.53,5.33,109.4547,3,3,5.2,5.64,7
787,11/20/2020,160,160,154,154,155,171800,11,2020,20,5.53,5.33,109.3924,3,3,5.2,5.64,7
788,11/19/2020,160,163,153,163,155,149600,11,2020,19,5.53,5.33,109.3188,3,3,5.2,5.64,7
789,11/18/2020,160,161,158,158,159.75,194700,11,2020,18,5.53,5.33,109.26,3,3,5.2,5.64,7
790,11/17/2020,162,162,160,160,160.25,95100,11,2020,17,5.53,5.33,109.2335,3,3,5.2,5.64,7
791,11/16/2020,160,160,159,160,159.25,319000,11,2020,16,5.53,5.33,109.2015,3,3,5.2,5.64,7
792,11/13/2020,159.5,159.5,158.75,159,159,219900,11,2020,13,5.53,5.33,109.1118,3,3,5.2,5.64,7
793,11/12/2020,160.25,161.5,159.75,159.75,160,212500,11,2020,12,5.53,5.33,109.0341,3,3,5.2,5.64,7
794,11/11/2020,160,164,160,162,163.5,376300,11,2020,11,5.53,5.33,108.9665,3,3,5.2,5.64,7
795,11/10/2020,155,158,153.25,156,155.75,10000,11,2020,10,5.53,5.33,108.9347,3,3,5.2,5.64,7
796,11/9/2020,155,155,151.5,151.5,151.5,13200,11,2020,9,5.53,5.33,108.9182,3,3,5.2,5.64,7
797,11/6/2020,151,152,150.25,150.75,150.75,265300,11,2020,6,5.53,5.33,108.9059,3,3,5.2,5.64,7
798,11/5/2020,150,151,150,150,150.25,776100,11,2020,5,5.53,5.33,108.8682,3,3,5.2,5.64,7
799,11/4/2020,150,151,150,151,150.5,277200,11,2020,4,5.53,5.33,108.8647,3,3,5.2,5.64,7
800,11/3/2020,151,151,151,151,151,78700,11,2020,3,5.53,5.33,108.8382,3,3,5.2,5.64,7
801,11/2/2020,150.5,154,150,151,150.5,516700,11,2020,2,5.53,5.33,108.8324,3,3,5.2,5.64,7
802,10/30/2020,153.5,153.5,149.75,150,150.25,1014000,10,2020,30,5.67,4.84,108.8188,3,3,5.2,5.64,7
803,10/29/2020,154.75,154.75,152,152,153.75,5600,10,2020,29,5.67,4.84,108.8265,3,3,5.2,5.64,7
804,10/28/2020,153,155,152,152,153,11400,10,2020,28,5.67,4.84,108.8353,3,3,5.2,5.64,7
805,10/27/2020,158,158,153.5,153.5,153.75,11500,10,2020,27,5.67,4.84,108.8265,3,3,5.2,5.64,7
806,10/26/2020,158,158,152.25,153,153.75,441600,10,2020,26,5.67,4.84,108.7882,3,3,5.2,5.64,7
807,10/23/2020,160,160,156.75,156.75,157,616500,10,2020,23,5.67,4.84,108.7735,3,3,5.2,5.64,7
808,10/22/2020,160,160,159,160,160,4500,10,2020,22,5.67,4.84,108.7482,3,3,5.2,5.64,7
809,10/21/2020,163,163,160,160,160,122400,10,2020,21,5.67,4.84,108.7185,3,3,5.2,5.64,7
810,10/19/2020,162,162,162,162,162,1100,10,2020,19,5.67,4.84,108.6765,3,3,5.2,5.64,7
811,10/16/2020,164,164,163,163,163,20400,10,2020,16,5.67,4.84,108.6224,3,3,5.2,5.64,7
812,10/15/2020,163,164.75,163,164,163,71200,10,2020,15,5.67,4.84,108.6053,3,3,5.2,5.64,7
813,10/14/2020,161.5,169.75,161,169.75,162.25,1100,10,2020,14,5.67,4.84,108.5853,3,3,5.2,5.64,7
814,10/13/2020,168.75,168.75,161,163,163.5,12800,10,2020,13,5.67,4.84,108.5497,3,3,5.2,5.64,7
815,10/12/2020,163,170,163,168,168.75,218800,10,2020,12,5.67,4.84,108.5262,3,3,5.2,5.64,7
816,10/9/2020,163,168,163,168,164.75,13600,10,2020,9,5.67,4.84,108.5168,3,3,5.2,5.64,7
817,10/8/2020,161,165,161,161.5,161.5,175400,10,2020,8,5.67,4.84,108.5294,3,3,5.2,5.64,7
818,10/7/2020,161.5,161.5,161.5,161.5,161.5,88500,10,2020,7,5.67,4.84,108.5276,3,3,5.2,5.64,7
819,10/6/2020,161,161.5,160.75,161.5,161,105800,10,2020,6,5.67,4.84,108.5026,3,3,5.2,5.64,7
820,10/5/2020,169.5,169.5,161,161,163,4500,10,2020,5,5.67,4.84,108.4921,3,3,5.2,5.64,7
821,10/2/2020,163,163,161,161,161.25,261000,10,2020,2,5.67,4.84,108.4853,3,3,5.2,5.64,7
822,10/1/2020,170,170,160.5,162,163.25,61300,10,2020,1,5.67,4.84,108.4471,3,3,5.2,5.64,7
823,9/30/2020,170,170,166,166,169.25,233800,9,2020,30,5.79,4.2,108.4971,3,3,5.2,5.63,7
824,9/29/2020,170,171,168,170,170,79300,9,2020,29,5.79,4.2,108.4879,3,3,5.2,5.63,7
825,9/28/2020,168,170,167,168,168,110200,9,2020,28,5.79,4.2,108.4779,3,3,5.2,5.63,7
826,9/25/2020,164,164.5,164,164,164.25,64900,9,2020,25,5.79,4.2,108.4691,3,3,5.2,5.63,7
827,9/24/2020,162,170,162,168,163,164400,9,2020,24,5.79,4.2,108.4126,3,3,5.2,5.63,7
828,9/23/2020,161.5,164.5,160.5,161.25,160.75,47300,9,2020,23,5.79,4.2,108.4176,3,3,5.2,5.63,7
829,9/22/2020,161,165,160.5,161,160.5,599900,9,2020,22,5.79,4.2,108.3618,3,3,5.2,5.63,7
830,9/21/2020,160.25,168,160.25,160.5,161.5,6200,9,2020,21,5.79,4.2,108.4,3,3,5.2,5.63,7
831,9/18/2020,169.5,169.5,160.25,168.5,168,43500,9,2020,18,5.79,4.2,108.3912,3,3,5.2,5.63,7
832,9/17/2020,166,169.5,160,169.5,160.25,808600,9,2020,17,5.79,4.2,108.3794,3,3,5.2,5.63,7
833,9/16/2020,165,165,162.5,163,164,451900,9,2020,16,5.79,4.2,108.6379,3,3,5.2,5.63,7
834,9/15/2020,166.5,167.5,164,165,165.5,261300,9,2020,15,5.79,4.2,108.5559,3,3,5.2,5.63,7
835,9/14/2020,168.25,168.25,166.5,166.5,168.25,12000,9,2020,14,5.79,4.2,108.5,3,3,5.2,5.63,7
836,9/11/2020,170,170,168,168,168.25,64800,9,2020,11,5.79,4.2,108.4488,3,3,5.2,5.63,7
837,9/10/2020,170,170,169,170,169.5,104900,9,2020,10,5.79,4.2,108.3971,3,3,5.2,5.63,7
838,9/9/2020,170,170,164,168,168,163600,9,2020,9,5.79,4.2,108.3735,3,3,5.2,5.63,7
839,9/8/2020,170,170,164,164,164,214400,9,2020,8,5.79,4.2,108.3353,3,3,5.2,5.63,7
840,9/7/2020,174.75,174.75,161,170,173.75,161600,9,2020,7,5.79,4.2,108.3282,3,3,5.2,5.63,7
841,9/4/2020,174.75,174.75,170,170.25,170.5,52100,9,2020,4,5.79,4.2,108.3224,3,3,5.2,5.63,7
842,9/3/2020,172,174.75,172,172,173,114500,9,2020,3,5.79,4.2,108.3029,3,3,5.2,5.63,7
843,9/2/2020,168,175,167.25,171,169,145600,9,2020,2,5.79,4.2,108.2615,3,3,5.2,5.63,7
844,9/1/2020,170,170,164,170,166.25,233500,9,2020,1,5.79,4.2,108.2147,3,3,5.2,5.63,7
845,8/31/2020,162,165,160,165,161,152700,8,2020,31,5.87,4.36,108.2088,3,3,5.2,5.63,7
846,8/28/2020,157,160,157,159,158.25,43800,8,2020,28,5.87,4.36,108.2221,3,3,5.2,5.63,7
847,8/27/2020,152,159,152,159,154.25,174300,8,2020,27,5.87,4.36,108.1529,3,3,5.2,5.63,7
848,8/26/2020,152,152.25,151.25,152,152,211900,8,2020,26,5.87,4.36,108.1203,3,3,5.2,5.63,7
849,8/25/2020,151,151.25,150,151.25,151.25,78500,8,2020,25,5.87,4.36,108.0379,3,3,5.2,5.63,7
850,8/24/2020,150.5,152,150,152,150,106700,8,2020,24,5.87,4.36,108.0147,3,3,5.2,5.63,7
851,8/21/2020,154,154,150,150,151,425800,8,2020,21,5.87,4.36,108.0088,3,3,5.2,5.63,7
852,8/20/2020,154.75,154.75,154,154,154.25,8400,8,2020,20,5.87,4.36,108.5588,3,3,5.2,5.63,7
853,8/19/2020,154,155,154,155,155,900,8,2020,19,5.87,4.36,108.4206,3,3,5.2,5.63,7
854,8/18/2020,154,154,154,154,154,49900,8,2020,18,5.87,4.36,108.3129,3,3,5.2,5.63,7
855,8/17/2020,154,154,154,154,154,3300,8,2020,17,5.87,4.36,108.3185,3,3,5.2,5.63,7
856,8/14/2020,154,155,154,154,154,215100,8,2020,14,5.87,4.36,108.2897,3,3,5.2,5.63,7
857,8/13/2020,154.75,154.75,151,154,154,92700,8,2020,13,5.87,4.36,108.3918,3,3,5.2,5.63,7
858,8/12/2020,152,155,150.25,155,152,45300,8,2020,12,5.87,4.36,108.3329,3,3,5.2,5.63,7
859,8/11/2020,152,152,150,150,150,613900,8,2020,11,5.87,4.36,108.1162,3,3,5.2,5.63,7
860,8/10/2020,155,155,153,155,153,103400,8,2020,10,5.87,4.36,108.0294,3,3,5.2,5.63,7
861,8/7/2020,155,155,152,155,155,40500,8,2020,7,5.87,4.36,108.0024,3,3,5.2,5.63,7
862,8/6/2020,155,156,155,155,155,51800,8,2020,6,5.87,4.36,107.9459,3,3,5.2,5.63,7
863,8/5/2020,155,155,154.75,155,155,3200,8,2020,5,5.87,4.36,107.8941,3,3,5.2,5.63,7
864,8/4/2020,154.75,157,152,152,152,977200,8,2020,4,5.87,4.36,107.8174,3,3,5.2,5.63,7
865,8/3/2020,160,160,154.5,154.75,156,6300,8,2020,3,5.87,4.36,107.7118,3,3,5.2,5.63,7
866,7/30/2020,160,160,150,154.75,154.75,437500,7,2020,30,6.01,4.36,107.7074,3,3,5.2,5.63,7
867,7/29/2020,162.75,162.75,160,160,160.75,613800,7,2020,29,6.01,4.36,107.7118,3,3,5.2,5.63,7
868,7/28/2020,165,165,160,163,163,104900,7,2020,28,6.01,4.36,107.7191,3,3,5.2,5.63,7
869,7/27/2020,161.75,167,161.75,166,163,311200,7,2020,27,6.01,4.36,107.7888,3,3,5.2,5.63,7
870,7/24/2020,162,170,161.25,161.25,167.75,2300,7,2020,24,6.01,4.36,108.02,3,3,5.2,5.63,7
871,7/23/2020,161.25,168.25,160,168.25,160.25,305300,7,2020,23,6.01,4.36,108.1288,3,3,5.2,5.63,7
872,7/22/2020,165,165,160.25,161,161,158300,7,2020,22,6.01,4.36,107.8797,3,3,5.2,5.63,7
873,7/21/2020,161,162,161,161,161,2600,7,2020,21,6.01,4.36,107.6209,3,3,5.2,5.63,7
874,7/20/2020,160,163,160,161,160.25,90400,7,2020,20,6.01,4.36,107.4329,3,3,5.2,5.63,7
875,7/17/2020,160,160,160,160,160,700,7,2020,17,6.01,4.36,107.4582,3,3,5.2,5.63,7
876,7/16/2020,169,169,155.25,158,156.75,4500,7,2020,16,6.01,4.36,107.3494,3,3,5.2,5.63,7
877,7/15/2020,158,158,156.5,156.5,156.5,100500,7,2020,15,6.01,4.36,107.285,3,3,5.2,5.63,7
878,7/14/2020,157,157.75,156,157.75,156.5,170800,7,2020,14,6.01,4.36,107.1471,3,3,5.2,5.63,7
879,7/13/2020,158,158,157,158,157.75,1600,7,2020,13,6.01,4.36,107.0512,3,3,5.2,5.63,7
880,7/10/2020,159,159,158,158,158,1374400,7,2020,10,6.01,4.36,106.9003,3,3,5.2,5.63,7
881,7/9/2020,160.5,165,158,158,158.25,126700,7,2020,9,6.01,4.36,106.9618,3,3,5.2,5.63,7
882,7/8/2020,160,160,159,160,159.25,384000,7,2020,8,6.01,4.36,106.7471,3,3,5.2,5.63,7
883,7/7/2020,158,160,155,157.25,156.5,96500,7,2020,7,6.01,4.36,106.5912,3,3,5.2,5.63,7
884,7/6/2020,162.5,162.5,155,156,157.25,427500,7,2020,6,6.01,4.36,106.6106,3,3,5.2,5.63,7
885,7/3/2020,162.5,162.5,162.5,162.5,162.5,300,7,2020,3,6.01,4.36,106.6662,3,3,5.2,5.63,7
886,7/2/2020,162.5,162.5,162.25,162.5,162.5,12500,7,2020,2,6.01,4.36,106.54,3,3,5.2,5.63,7
887,7/1/2020,164,164,162.25,162.25,162.25,6000,7,2020,1,6.01,4.36,106.5488,3,3,5.2,5.63,7
888,6/30/2020,170,170,160,160,162.5,263500,6,2020,30,6.16,4.59,106.5224,3,3,5.2,5.62,7
889,6/29/2020,170.25,172,168.5,169,170.25,395500,6,2020,29,6.16,4.59,106.4576,3,3,5.2,5.62,7
890,6/26/2020,173.5,173.5,168,170,170,84300,6,2020,26,6.16,4.59,106.51,3,3,5.2,5.62,7
891,6/25/2020,174.5,174.5,172,174,173,68300,6,2020,25,6.16,4.59,106.4029,3,3,5.2,5.62,7
892,6/24/2020,176,176,172,175,174.75,224600,6,2020,24,6.16,4.59,106.3694,3,3,5.2,5.62,7
893,6/23/2020,175,175,172,175,175,129400,6,2020,23,6.16,4.59,106.4194,3,3,5.2,5.62,7
894,6/22/2020,175,176,174.5,175,175,505200,6,2020,22,6.16,4.59,106.3265,3,3,5.2,5.62,7
895,6/19/2020,175,175,173,175,175,40000,6,2020,19,6.16,4.59,106.2882,3,3,5.2,5.62,7
896,6/18/2020,173,175,172,172,174.75,55000,6,2020,18,6.16,4.59,106.3206,3,3,5.2,5.62,7
897,6/17/2020,171.75,175,170,172,171.75,497400,6,2020,17,6.16,4.59,106.4853,3,3,5.2,5.62,7
898,6/16/2020,170,172,170,170,170,52200,6,2020,16,6.16,4.59,106.4912,3,3,5.2,5.62,7
899,6/15/2020,168.5,170,168.5,168.75,168.5,448800,6,2020,15,6.16,4.59,106.45,3,3,5.2,5.62,7
900,6/12/2020,168.5,170,166.25,166.25,168.5,121300,6,2020,12,6.16,4.59,106.5047,3,3,5.2,5.62,7
901,6/11/2020,169,172,168,170,169,180500,6,2020,11,6.16,4.59,106.5971,3,3,5.2,5.62,7
902,6/10/2020,168,172,166,172,166,68700,6,2020,10,6.16,4.59,106.43,3,3,5.2,5.62,7
903,6/9/2020,163,172,163,172,166,596100,6,2020,9,6.16,4.59,106.2971,3,3,5.2,5.62,7
904,6/8/2020,165,167,164,164,166.75,71300,6,2020,8,6.16,4.59,106.14,3,3,5.2,5.62,7
905,6/5/2020,175,175,166,166,167,18000,6,2020,5,6.16,4.59,106.0871,3,3,5.2,5.62,7
906,6/4/2020,170,170,164,164,166,241000,6,2020,4,6.16,4.59,106.1235,3,3,5.2,5.62,7
907,6/3/2020,175,175,162,165,165.25,299600,6,2020,3,6.16,4.59,106.4488,3,3,5.2,5.62,7
908,6/2/2020,166,170,160.5,165,163.75,188100,6,2020,2,6.16,4.59,106.7982,3,3,5.2,5.62,7
909,5/29/2020,175,175,159.25,159.25,162,338100,5,2020,29,6.18,5.33,106.9435,3,3,5.2,5.62,7
910,5/28/2020,163,165,163,163,164,124000,5,2020,28,6.18,5.33,107.0265,3,3,5.2,5.62,7
911,5/27/2020,164.75,165,163,163,163,663000,5,2020,27,6.18,5.33,107.1088,3,3,5.2,5.62,7
912,5/26/2020,165,165,164,164.75,164.75,461600,5,2020,26,6.18,5.33,107.0076,3,3,5.2,5.62,7
913,5/22/2020,165,165,162.5,165,162.75,119800,5,2020,22,6.18,5.33,106.9694,3,3,5.2,5.62,7
914,5/21/2020,163,163,161,161,161.25,586500,5,2020,21,6.18,5.33,106.8894,3,3,5.2,5.62,7
915,5/20/2020,165,165,163,163,163,501200,5,2020,20,6.18,5.33,106.8,3,3,5.2,5.62,7
916,5/19/2020,165,165,164,164.5,164.5,260600,5,2020,19,6.18,5.33,106.69,3,3,5.2,5.62,7
917,5/18/2020,167,167,165,165,165,113200,5,2020,18,6.18,5.33,107.0353,3,3,5.2,5.62,7
918,5/15/2020,170,170,165,165,165,3242600,5,2020,15,6.18,5.33,106.8112,3,3,5.2,5.62,7
919,5/14/2020,165,165,165,165,165,25000,5,2020,14,6.18,5.33,106.5947,3,3,5.2,5.62,7
920,5/13/2020,175,175,165,167,165.75,371400,5,2020,13,6.18,5.33,106.5276,3,3,5.2,5.62,7
921,5/12/2020,170,173,170,170,170,218000,5,2020,12,6.18,5.33,106.1385,3,3,5.2,5.62,7
922,5/11/2020,175,175,170,170,170,709000,5,2020,11,6.18,5.33,106.0268,3,3,5.2,5.62,7
923,5/8/2020,180,180,169.25,169.25,170.5,103800,5,2020,8,6.18,5.33,106.0088,3,3,5.2,5.62,7
924,5/7/2020,175.25,180,175.25,180,178.5,1600,5,2020,7,6.18,5.33,106.0768,3,3,5.2,5.62,7
925,5/6/2020,185,185,173.5,173.5,175.25,21100,5,2020,6,6.18,5.33,106.3091,3,3,5.2,5.62,7
926,5/5/2020,180,180,175,180,180,125000,5,2020,5,6.18,5.33,106.6091,3,3,5.2,5.62,7
927,5/4/2020,180,185,175,175,175.25,167000,5,2020,4,6.18,5.33,107.265,3,3,5.2,5.62,7
928,4/30/2020,163,175,163,175,172.75,91100,4,2020,30,6.03,6.01,107.2915,3,3,5.2,5.62,7
929,4/29/2020,162,163,160,163,161.25,16100,4,2020,29,6.03,6.01,107.275,3,3,5.2,5.62,7
930,4/28/2020,153,155.25,153,155,153.75,68600,4,2020,28,6.03,6.01,107.2382,3,3,5.2,5.62,7
931,4/27/2020,162,162,153,153,153,121000,4,2020,27,6.03,6.01,106.9265,3,3,5.2,5.62,7
932,4/24/2020,152.5,153,150,152,152,566100,4,2020,24,6.03,6.01,107.2444,3,3,5.2,5.62,7
933,4/23/2020,150,150,148.25,150,149,17100,4,2020,23,6.03,6.01,107.1412,3,3,5.2,5.62,7
934,4/22/2020,148.75,150,148,148.25,148,680600,4,2020,22,6.03,6.01,106.9941,3,3,5.2,5.62,7
935,4/21/2020,147.25,150,147.25,148.75,148.75,255300,4,2020,21,6.03,6.01,106.8824,3,3,5.2,5.62,7
936,4/20/2020,148,148,146,146,147.75,342600,4,2020,20,6.03,6.01,106.7941,3,3,5.2,5.62,7
937,4/17/2020,150,150,147.75,147.75,148,443400,4,2020,17,6.03,6.01,106.2029,3,3,5.2,5.62,7
938,4/16/2020,150,150,148,150,148.25,75500,4,2020,16,6.03,6.01,105.9088,3,3,5.2,5.62,7
939,4/15/2020,150,152.75,150,152.75,150,435100,4,2020,15,6.03,6.01,105.9034,3,3,5.2,5.62,7
940,4/14/2020,143.25,155,143.25,153,152.75,653800,4,2020,14,6.03,6.01,105.9088,3,3,5.2,5.62,7
941,4/9/2020,149,150,145,145,145,169800,4,2020,9,6.03,6.01,106.0035,3,3,5.2,5.62,7
942,4/8/2020,146,150,146,146,146.5,55800,4,2020,8,6.03,6.01,106.4741,3,3,5.2,5.62,7
943,4/7/2020,156,156,145.75,146,146.5,160100,4,2020,7,6.03,6.01,106.1765,3,3,5.2,5.62,7
944,4/6/2020,158,158,155,156,156,153100,4,2020,6,6.03,6.01,105.905,3,3,5.2,5.62,7
945,4/3/2020,155,159.25,153.5,156,155.25,280500,4,2020,3,6.03,6.01,105.6653,3,3,5.2,5.62,7
946,4/2/2020,149,156,149,150,149,318500,4,2020,2,6.03,6.01,105.1882,3,3,5.2,5.62,7
947,4/1/2020,150,150,149,150,149.25,168000,4,2020,1,6.03,6.01,105.1106,3,3,5.2,5.62,7
948,3/31/2020,140,150,138,150,149.5,86500,3,2020,31,5.84,5.84,104.6926,3,3,5.2,5.61,7.25
949,3/30/2020,138,140,138,140,139,10500,3,2020,30,5.84,5.84,104.4474,3,3,5.2,5.61,7.25
950,3/27/2020,140,145.5,135,135,135.25,837600,3,2020,27,5.84,5.84,105.1147,3,3,5.2,5.61,7.25
951,3/26/2020,147,147,135,140,135.75,1285100,3,2020,26,5.84,5.84,106.1971,3,3,5.2,5.61,7.25
952,3/25/2020,150,150,137.75,138,139.75,870800,3,2020,25,5.84,5.84,106.4206,3,3,5.2,5.61,7.25
953,3/24/2020,156,156,143,143,147,110300,3,2020,24,5.84,5.84,106.5441,3,3,5.2,5.61,7.25
954,3/23/2020,161,161,155,155.25,155.75,17600,3,2020,23,5.84,5.84,106.0118,3,3,5.2,5.61,7.25
955,3/20/2020,162,170,159,170,159.25,365800,3,2020,20,5.84,5.84,105.0971,3,3,5.2,5.61,7.25
956,3/19/2020,170,170,158,159,160.5,1879100,3,2020,19,5.84,5.84,104.2235,3,3,5.2,5.61,7.25
957,3/18/2020,174,175.25,171,171,172.25,133000,3,2020,18,5.84,5.84,103.7206,3,3,5.2,5.61,7.25
958,3/17/2020,179.75,180,171,171,175.25,141400,3,2020,17,5.84,5.84,103.3853,3,3,5.2,5.61,7.25
959,3/16/2020,185,186,175,175,180.5,419700,3,2020,16,5.84,5.84,102.9,3,3,5.2,5.61,7.25
960,3/13/2020,190,190,185,185,185,146900,3,2020,13,5.84,5.84,102.4235,3,3,5.2,5.61,7.25
961,3/12/2020,197,197.25,187,191,192.25,733600,3,2020,12,5.84,5.84,102.4735,3,3,5.2,5.61,7.25
962,3/11/2020,200,200,197,197,198.5,200,3,2020,11,5.84,5.84,102.7015,3,3,5.2,5.61,7.25
963,3/10/2020,195.25,200,193,195,195.5,338400,3,2020,10,5.84,5.84,102.8982,3,3,5.2,5.61,7.25
964,3/9/2020,207.75,207.75,195,195,195.25,514200,3,2020,9,5.84,5.84,102.6735,3,3,5.2,5.61,7.25
965,3/6/2020,202,210,201,210,207.75,522200,3,2020,6,5.84,5.84,102.5529,3,3,5.2,5.61,7.25
966,3/5/2020,202,202,202,202,202,600,3,2020,5,5.84,5.84,102.8912,3,3,5.2,5.61,7.25
967,3/4/2020,200,202,200,200,201.25,3300,3,2020,4,5.84,5.84,102.3765,3,3,5.2,5.61,7.25
968,3/3/2020,197,200,196,200,198,29600,3,2020,3,5.84,5.84,101.3735,3,3,5.2,5.61,7.25
969,3/2/2020,190,195,190,195,195,68900,3,2020,2,5.84,5.84,101.1647,3,3,5.2,5.61,7.25
970,2/28/2020,200,200,190,194,194.25,293600,2,2020,28,5.72,7.17,100.9824,3,3,5.2,5.61,8.25
971,2/27/2020,198,201,198,200,200,254100,2,2020,27,5.72,7.17,100.9265,3,3,5.2,5.61,8.25
972,2/26/2020,202.5,202.5,200,201,201.5,5900,2,2020,26,5.72,7.17,101.13,3,3,5.2,5.61,8.25
973,2/25/2020,206,206,202.75,203,203.25,47900,2,2020,25,5.72,7.17,101.15,3,3,5.2,5.61,8.25
974,2/24/2020,206,206,206,206,206,188800,2,2020,24,5.72,7.17,101.2324,3,3,5.2,5.61,8.25
975,2/21/2020,202.5,208,202.5,208,205.75,2700,2,2020,21,5.72,7.17,101.2853,3,3,5.2,5.61,8.25
976,2/20/2020,203,210,201,210,207,14100,2,2020,20,5.72,7.17,101.2482,3,3,5.2,5.61,8.25
977,2/19/2020,212,212,209.75,209.75,210,27600,2,2020,19,5.72,7.17,101.0824,3,3,5.2,5.61,8.25
978,2/18/2020,215,215,212,215,212,258700,2,2020,18,5.72,7.17,100.8853,3,3,5.2,5.61,8.25
979,2/17/2020,215,215,215,215,215,25000,2,2020,17,5.72,7.17,100.6153,3,3,5.2,5.61,8.25
980,2/14/2020,219,219,218,219,218.75,3100,2,2020,14,5.72,7.17,100.5794,3,3,5.2,5.61,8.25
981,2/13/2020,219,219.5,218,218,219.25,57800,2,2020,13,5.72,7.17,100.6924,3,3,5.2,5.61,8.25
982,2/12/2020,221.5,221.5,212,219,219.75,866500,2,2020,12,5.72,7.17,100.6265,3,3,5.2,5.61,8.25
983,2/10/2020,221.75,221.75,220,220,220.5,67400,2,2020,10,5.72,7.17,100.5794,3,3,5.2,5.61,8.25
984,2/7/2020,220,222.25,220,220,221.75,1133700,2,2020,7,5.72,7.17,100.4471,3,3,5.2,5.61,8.25
985,2/6/2020,217.5,222,217.5,220,219.75,173500,2,2020,6,5.72,7.17,100.3853,3,3,5.2,5.61,8.25
986,2/5/2020,216.5,218,215,218,217.5,24300,2,2020,5,5.72,7.17,100.3512,3,3,5.2,5.61,8.25
987,2/4/2020,214.25,215,212.75,215,214.5,36800,2,2020,4,5.72,7.17,100.4618,3,3,5.2,5.61,8.25
988,2/3/2020,215,215,212.5,212.75,212.75,4600,2,2020,3,5.72,7.17,100.4412,3,3,5.2,5.61,8.25
989,1/31/2020,214,215,212.5,212.5,214.25,245400,1,2020,31,5.29,5.78,100.585,3,3,5.2,5.61,8.25
990,1/30/2020,210,215,210,213,215,403100,1,2020,30,5.29,5.78,100.7471,6,3,5.2,5.61,8.25
991,1/29/2020,212.5,212.5,211,211,212,56900,1,2020,29,5.29,5.78,100.8735,6,3,5.2,5.61,8.25
992,1/28/2020,215,215,212,212,214.75,122100,1,2020,28,5.29,5.78,100.8715,6,3,5.2,5.61,8.25
993,1/27/2020,215,219,204,215,215.5,373900,1,2020,27,5.29,5.78,100.8765,6,3,5.2,5.61,8.25
994,1/27/2020,215,219,204,215,215.5,373900,1,2020,27,5.29,5.78,100.8765,6,3,5.2,5.61,8.25
995,1/24/2020,215,216,215,215,215,53700,1,2020,24,5.29,5.78,100.8553,6,3,5.2,5.61,8.25
996,1/23/2020,210.75,215,210,215,212.75,431300,1,2020,23,5.29,5.78,100.8735,6,3,5.2,5.61,8.25
997,1/22/2020,210,212,210,212,210.75,231600,1,2020,22,5.29,5.78,101.0324,6,3,5.2,5.61,8.25
998,1/21/2020,210,212,210,210,210,33300,1,2020,21,5.29,5.78,101.0971,6,3,5.2,5.61,8.25
999,1/20/2020,210,212,208,210,210,1155500,1,2020,20,5.29,5.78,100.9471,6,3,5.2,5.61,8.25
1000,1/17/2020,212,212,205,210,210,755000,1,2020,17,5.29,5.78,100.9735,6,3,5.2,5.61,8.25
1001,1/16/2020,205,206,205,206,205.5,4900,1,2020,16,5.29,5.78,101.3835,6,3,5.2,5.61,8.25
1002,1/15/2020,205,205.5,205,205.5,205,258600,1,2020,15,5.29,5.78,101.3912,6,3,5.2,5.61,8.25
1003,1/14/2020,205.5,205.5,205,205,205,341900,1,2020,14,5.29,5.78,101.4912,6,3,5.2,5.61,8.25
1004,1/13/2020,209.75,209.75,205,206,205.75,60500,1,2020,13,5.29,5.78,101.3412,6,3,5.2,5.61,8.25
1005,1/10/2020,201,210,201,210,205,513500,1,2020,10,5.29,5.78,101.5929,6,3,5.2,5.61,8.25
1006,1/9/2020,199,205,199,205,205,180600,1,2020,9,5.29,5.78,101.4688,6,3,5.2,5.61,8.25
1007,1/8/2020,198,198,197.25,198,198,2200,1,2020,8,5.29,5.78,101.2588,6,3,5.2,5.61,8.25
1008,1/7/2020,196.25,212,196,212,197.75,43300,1,2020,7,5.29,5.78,101.0618,6,3,5.2,5.61,8.25
1009,1/6/2020,197.5,197.5,197,197,197.25,5600,1,2020,6,5.29,5.78,100.9806,6,3,5.2,5.61,8.25
1010,1/3/2020,197.5,197.5,196,197.5,197.5,12800,1,2020,3,5.29,5.78,100.9588,6,3,5.2,5.61,8.25
1011,1/2/2020,196,196,196,196,196,1400,1,2020,2,5.29,5.78,101.3429,6,3,5.2,5.61,8.25
1012,12/31/2019,197,200,195,195,198.5,39200,12,2019,31,5.2,5.82,101.3365,6,8.5,11.2,5.6,8.5
1013,12/30/2019,197.25,200,195,200,196,204400,12,2019,30,5.2,5.82,101.1588,6,8.5,11.2,5.6,8.5
1014,12/27/2019,205,205,196,196,196,220700,12,2019,27,5.2,5.82,100.7676,6,8.5,11.2,5.6,8.5
1015,12/24/2019,198,198,197.25,197.25,197.75,1100,12,2019,24,5.2,5.82,100.6324,6,8.5,11.2,5.6,8.5
1016,12/23/2019,195.5,196,195,195,195.5,53000,12,2019,23,5.2,5.82,100.7,6,8.5,11.2,5.6,8.5
1017,12/20/2019,195,198,193.75,196,195.5,240900,12,2019,20,5.2,5.82,100.7118,6,8.5,11.2,5.6,8.5
1018,12/19/2019,193,193.75,193,193.75,193,177100,12,2019,19,5.2,5.82,100.9006,6,8.5,11.2,5.6,8.5
1019,12/18/2019,193,193,193,193,193,9200,12,2019,18,5.2,5.82,101.5424,6,8.5,11.2,5.6,8.5
1020,12/17/2019,196,196,190,190,192.25,630400,12,2019,17,5.2,5.82,101.6224,6,8.5,11.2,5.6,8.5
1021,12/16/2019,192,194,192,193,192.25,510900,12,2019,16,5.2,5.82,101.6788,6,8.5,11.2,5.6,8.5
1022,12/13/2019,193,196.75,192,192.25,192.5,82100,12,2019,13,5.2,5.82,101.6676,6,8.5,11.2,5.6,8.5
1023,12/11/2019,195,195,193,193.25,193,424500,12,2019,11,5.2,5.82,101.4953,6,8.5,11.2,5.6,8.5
1024,12/10/2019,196,196,192.25,192.25,193.25,868600,12,2019,10,5.2,5.82,101.4159,6,8.5,11.2,5.6,8.5
1025,12/9/2019,196,196,192.25,192.25,193.25,868600,12,2019,9,5.2,5.82,101.6691,6,8.5,11.2,5.6,8.5
1026,12/6/2019,197,199,197,197,197,297500,12,2019,6,5.2,5.82,101.7529,6,8.5,11.2,5.6,8.5
1027,12/5/2019,196,198,196,197,197,580100,12,2019,5,5.2,5.82,101.9576,6,8.5,11.2,5.6,8.5
1028,12/4/2019,196,196,196,196,196,600,12,2019,4,5.2,5.82,102.3,6,8.5,11.2,5.6,8.5
1029,12/3/2019,200,200,195,195,196.75,208400,12,2019,3,5.2,5.82,102.6147,6,8.5,11.2,5.6,8.5
1030,12/2/2019,197,199,197,197,197.5,1600,12,2019,2,5.2,5.82,102.5959,6,8.5,11.2,5.6,8.5
1031,11/29/2019,200,200,195,196,196,84700,11,2019,29,5.19,5.56,102.8065,6,8.5,11.2,5.6,8.5
1032,11/28/2019,196,200,195,196,196,29300,11,2019,28,5.19,5.56,102.5424,6,8.5,11.2,5.6,8.5
1033,11/27/2019,195,197,192,196,192,612600,11,2019,27,5.19,5.56,102.4253,6,8.5,11.2,5.6,8.5
1034,11/26/2019,200,200,192,192,197,523600,11,2019,26,5.19,5.56,102.0206,6,8.5,11.2,5.6,8.5
1035,11/25/2019,200,200,200,200,200,22400,11,2019,25,5.19,5.56,101.55,6,8.5,11.2,5.6,8.5
1036,11/22/2019,202,202,200,200,201.75,170100,11,2019,22,5.19,5.56,101.3618,6,8.5,11.2,5.6,8.5
1037,11/21/2019,202,202,201,202,202,547900,11,2019,21,5.19,5.56,101.4765,6,8.5,11.2,5.6,8.5
1038,11/20/2019,201.75,202,201.75,202,202,225500,11,2019,20,5.19,5.56,101.7971,6,8.5,11.2,5.6,8.5
1039,11/19/2019,202,202,201,202,202,139300,11,2019,19,5.19,5.56,101.9294,6,8.5,11.2,5.6,8.5
1040,11/18/2019,204,205,201,201,201,183600,11,2019,18,5.19,5.56,101.9676,6,8.5,11.2,5.6,8.5
1041,11/15/2019,200,202.5,200,202.5,201,54400,11,2019,15,5.19,5.56,102.0765,6,8.5,11.2,5.6,8.5
1042,11/14/2019,202.25,202.25,200,200,200,6400,11,2019,14,5.19,5.56,102.0971,6,8.5,11.2,5.6,8.5
1043,11/13/2019,200,200,196.5,200,200,53700,11,2019,13,5.19,5.56,102.4206,6,8.5,11.2,5.6,8.5
1044,11/12/2019,205,205,200,200,200,367000,11,2019,12,5.19,5.56,102.4106,6,8.5,11.2,5.6,8.5
1045,11/11/2019,190,210,200,210,205,4200,11,2019,11,5.19,5.56,102.4971,6,8.5,11.2,5.6,8.5
1046,11/8/2019,205,200,200,200,200,123300,11,2019,8,5.19,5.56,102.8088,6,8.5,11.2,5.6,8.5
1047,11/7/2019,205,205.25,205,205.25,205,198300,11,2019,7,5.19,5.56,102.9529,6,8.5,11.2,5.6,8.5
1048,11/6/2019,205,207,205,205,205,212800,11,2019,6,5.19,5.56,103.1871,6,8.5,11.2,5.6,8.5
1049,11/5/2019,205,205,204.5,205,205,61800,11,2019,5,5.19,5.56,103.2682,6,8.5,11.2,5.6,8.5
1050,11/4/2019,205,205,200.5,205,204.75,12400,11,2019,4,5.19,5.56,103.2653,6,8.5,11.2,5.6,8.5
1051,11/1/2019,210,210,209,210,209.75,140900,11,2019,1,5.19,5.56,103.2765,6,8.5,11.2,5.6,8.5
1052,10/31/2019,200,210,197,200.25,201,36100,10,2019,31,5.19,4.95,103.2059,6,8.5,11.2,5.6,9
1053,10/30/2019,195,200,195,200,199.75,880000,10,2019,30,5.19,4.95,103.4072,6,8.5,11.2,5.6,9
1054,10/29/2019,194,195,194,195,195,79900,10,2019,29,5.19,4.95,103.5567,6,8.5,11.2,5.6,9
1055,10/28/2019,196,196,194,194,194,231900,10,2019,28,5.19,4.95,103.5222,6,8.5,11.2,5.6,9
1056,10/25/2019,195,198,195,198,195,507200,10,2019,25,5.19,4.95,103.2528,6,8.5,11.2,5.6,9
1057,10/24/2019,193,193,191,193,192.5,3000,10,2019,24,5.19,4.95,103.5111,6,8.5,11.2,5.6,9
1058,10/23/2019,195,195,191,193,193,210300,10,2019,23,5.19,4.95,103.5756,6,8.5,11.2,5.6,9
1059,10/22/2019,191,195,191,191,191,242300,10,2019,22,5.19,4.95,103.7278,6,8.5,11.2,5.6,9
1060,10/18/2019,195,195,192,193,192,333100,10,2019,18,5.19,4.95,103.7,6,8.5,11.2,5.6,9
1061,10/17/2019,191,193,191,193,193,306400,10,2019,17,5.19,4.95,103.7139,6,8.5,11.2,5.6,9
1062,10/16/2019,195,195,191,191,191.75,32900,10,2019,16,5.19,4.95,103.7,6,8.5,11.2,5.6,9
1063,10/15/2019,193,193,193,193,193,0,10,2019,15,5.19,4.95,103.79,6,8.5,11.2,5.6,9
1064,10/14/2019,193,193,192.25,193,193,526200,10,2019,14,5.19,4.95,103.7678,6,8.5,11.2,5.6,9
1065,10/11/2019,195,196,190.5,191,192.25,82800,10,2019,11,5.19,4.95,103.7567,6,8.5,11.2,5.6,9
1066,10/9/2019,191,193,191,191,192.25,20600,10,2019,9,5.19,4.95,103.7806,6,8.5,11.2,5.6,9
1067,10/8/2019,192,192,190,190.5,191,155200,10,2019,8,5.19,4.95,103.7956,6,8.5,11.2,5.6,9
1068,10/7/2019,191.5,199.75,190,190,191,8400,10,2019,7,5.19,4.95,103.8406,6,8.5,11.2,5.6,9
1069,10/4/2019,195,199,195,195,195,10900,10,2019,4,5.19,4.95,103.8144,6,8.5,11.2,5.6,9
1070,10/3/2019,194.5,199.75,192,199.75,194.25,106000,10,2019,3,5.19,4.95,103.8617,6,8.5,11.2,5.6,9
1071,10/2/2019,192.5,200,192.5,200,193.5,194300,10,2019,2,5.19,4.95,103.8639,6,8.5,11.2,5.6,9
1072,10/1/2019,192,194,190.25,190.25,192.5,11600,10,2019,1,5.19,4.95,103.8572,6,8.5,11.2,5.6,9
1073,9/30/2019,194.5,194.75,192,192,193.75,31700,9,2019,30,5.24,3.83,103.8856,6,8.5,11.2,5.5,9
1074,9/27/2019,192.25,195,192.25,193,193,270800,9,2019,27,5.24,3.83,103.8167,6,8.5,11.2,5.5,9
1075,9/26/2019,192.5,197,192,194,192.5,211600,9,2019,26,5.24,3.83,103.8617,6,8.5,11.2,5.5,9
1076,9/25/2019,197,199,197,197,197,160400,9,2019,25,5.24,3.83,103.8283,6,8.5,11.2,5.5,9
1077,9/24/2019,200,200,196,196,197.75,276100,9,2019,24,5.24,3.83,103.8639,6,8.5,11.2,5.5,9
1078,9/23/2019,199,199,197,199,198.75,40700,9,2019,23,5.24,3.83,103.8319,6,8.5,11.2,5.5,9
1079,9/20/2019,200,200,197,197,199,380500,9,2019,20,5.24,3.83,103.8319,6,8.5,11.2,5.5,9
1080,9/19/2019,200.25,205,199,200,199.5,441400,9,2019,19,5.24,3.83,103.9133,6,8.5,11.2,5.5,9
1081,9/18/2019,201,201,200,201,200.75,6000,9,2019,18,5.24,3.83,103.86,6,8.5,11.2,5.5,9
1082,9/17/2019,199,200,199,199,199,332000,9,2019,17,5.24,3.83,103.7944,6,8.5,11.2,5.5,9
1083,9/16/2019,200,200,199,199,199,360200,9,2019,16,5.24,3.83,103.7739,6,8.5,11.2,5.5,9
1084,9/13/2019,198,201,198,200,199.25,376300,9,2019,13,5.24,3.83,103.7889,6,8.5,11.2,5.5,9
1085,9/12/2019,210,199.75,197.75,198,198,100000,9,2019,12,5.24,3.83,103.7778,6,8.5,11.2,5.5,9
1086,9/11/2019,205,198,197,198,197.75,62200,9,2019,11,5.24,3.83,103.665,6,8.5,11.2,5.5,9
1087,9/10/2019,198,198,197.25,198,197.75,1220500,9,2019,10,5.24,3.83,103.7283,6,8.5,11.2,5.5,9
1088,9/9/2019,197,197,197,197,197,98000,9,2019,9,5.24,3.83,103.825,6,8.5,11.2,5.5,9
1089,9/6/2019,195,201,195,201,195.25,10600,9,2019,6,5.24,3.83,103.8864,6,8.5,11.2,5.5,9
1090,9/5/2019,195,195,193,193,193.5,332700,9,2019,5,5.24,3.83,103.8211,6,8.5,11.2,5.5,9
1091,9/4/2019,195,201,195,201,196,57700,9,2019,4,5.24,3.83,103.825,6,8.5,11.2,5.5,9
1092,9/3/2019,193,195.25,193,195,194.75,1328400,9,2019,3,5.24,3.83,103.6375,6,8.5,11.2,5.5,9
1093,9/2/2019,195,196,195,195,195,10300,9,2019,2,5.24,3.83,103.5872,6,8.5,11.2,5.5,9
1094,8/30/2019,196,197,195,195,195,131600,8,2019,30,5.4,5,103.55,6,8.5,11.2,5.5,9
1095,8/29/2019,195.75,196,195.75,196,195.75,7000,8,2019,29,5.4,5,103.4839,6,8.5,11.2,5.5,9
1096,8/28/2019,200,200,195,199.75,199.75,9400,8,2019,28,5.4,5,103.4483,6,8.5,11.2,5.5,9
1097,8/27/2019,196,200,195.25,199.25,199.75,961200,8,2019,27,5.4,5,103.3228,6,8.5,11.2,5.5,9
1098,8/26/2019,196,201,195,195,195.75,20800,8,2019,26,5.4,5,103.1789,6,8.5,11.2,5.5,9
1099,8/23/2019,200,201,200,200,200,21100,8,2019,23,5.4,5,103.0583,6,8.5,11.2,5.5,9
1100,8/22/2019,200.75,201,200,201,200.75,357400,8,2019,22,5.4,5,102.9611,6,8.5,11.2,5.5,9
1101,8/21/2019,200,209,200,203,200.25,224000,8,2019,21,5.4,5,102.9694,6,8.5,11.2,5.5,9
1102,8/20/2019,200,200.5,200,200,200,42100,8,2019,20,5.4,5,103.2919,6,8.5,11.2,5.5,9
1103,8/19/2019,200.75,200.75,200,200,200,176300,8,2019,19,5.4,5,103.3817,6,8.5,11.2,5.5,9
1104,8/16/2019,200.5,204,200,200,200.5,15700,8,2019,16,5.4,5,103.3322,6,8.5,11.2,5.5,9
1105,8/15/2019,203.75,203.75,200,200,201.75,160000,8,2019,15,5.4,5,103.2633,6,8.5,11.2,5.5,9
1106,8/14/2019,203.75,203.75,203,203.75,203.5,2300,8,2019,14,5.4,5,103.2533,6,8.5,11.2,5.5,9
1107,8/13/2019,204,204.25,200,200,203.75,151800,8,2019,13,5.4,5,103.0667,6,8.5,11.2,5.5,9
1108,8/9/2019,205,205.25,202.5,204,204,34500,8,2019,9,5.4,5,103.3733,6,8.5,11.2,5.5,9
1109,8/8/2019,203.75,203.75,202.5,202.5,202.5,15100,8,2019,8,5.4,5,103.4375,6,8.5,11.2,5.5,9
1110,8/7/2019,202,204.75,202,202.5,202.25,107200,8,2019,7,5.4,5,103.2722,6,8.5,11.2,5.5,9
1111,8/6/2019,205,205,202,205,202,385400,8,2019,6,5.4,5,103.2014,6,8.5,11.2,5.5,9
1112,8/5/2019,203.25,203.75,200,203.75,203.5,259400,8,2019,5,5.4,5,103.0056,6,8.5,11.2,5.5,9
1113,8/2/2019,204,207.75,203,204,204,35700,8,2019,2,5.4,5,103.2322,6,8.5,11.2,5.5,9
1114,8/1/2019,204,207.75,201,202,203.25,206500,8,2019,1,5.4,5,104.1722,6,8.5,11.2,5.5,9
1115,7/31/2019,204,208,201,201,204,461300,7,2019,31,5.32,6.27,104.2098,6,8.5,11.2,5.5,9
1116,7/30/2019,207,208,204,208,207.75,52200,7,2019,30,5.32,6.27,104.0733,6,8.5,11.2,5.5,9
1117,7/29/2019,202,208,201,204,207.75,870000,7,2019,29,5.32,6.27,103.8194,6,8.5,11.2,5.5,9
1118,7/26/2019,201,210,200,208,203.25,397600,7,2019,26,5.32,6.27,103.8,6,8.5,11.2,5.5,9
1119,7/25/2019,198,204,196,201,200.5,1505900,7,2019,25,5.32,6.27,104.025,2.5,8.5,11.2,5.5,9
1120,7/24/2019,195.75,198,193,195.75,196.25,3300,7,2019,24,5.32,6.27,103.7628,2.5,8.5,11.2,5.5,9
1121,7/23/2019,191,199,191,199,191,5800,7,2019,23,5.32,6.27,103.6139,2.5,8.5,11.2,5.5,9
1122,7/22/2019,197,200,190.25,190.25,196.5,61800,7,2019,22,5.32,6.27,103.2167,2.5,8.5,11.2,5.5,9
1123,7/19/2019,198.5,200,197,198,198.75,133100,7,2019,19,5.32,6.27,103.1028,2.5,8.5,11.2,5.5,9
1124,7/18/2019,198,200,198,198.25,198,244600,7,2019,18,5.32,6.27,103.0575,2.5,8.5,11.2,5.5,9
1125,7/17/2019,200,200,197,198,199.75,86300,7,2019,17,5.32,6.27,103.0522,2.5,8.5,11.2,5.5,9
1126,7/16/2019,198,200,197,197,197.75,9600,7,2019,16,5.32,6.27,103.0278,2.5,8.5,11.2,5.5,9
1127,7/15/2019,200,200,198,198,199.5,7700,7,2019,15,5.32,6.27,102.9542,2.5,8.5,11.2,5.5,9
1128,7/12/2019,200,202,199.75,199.75,199.75,257100,7,2019,12,5.32,6.27,102.9217,2.5,8.5,11.2,5.5,9
1129,7/11/2019,200,200,199,200,199.75,568600,7,2019,11,5.32,6.27,102.9222,2.5,8.5,11.2,5.5,9
1130,7/10/2019,200,200,197,200,199.75,95600,7,2019,10,5.32,6.27,102.7494,2.5,8.5,11.2,5.5,9
1131,7/9/2019,190,197.25,195,197,196,209100,7,2019,9,5.32,6.27,102.6917,2.5,8.5,11.2,5.5,9
1132,7/8/2019,197,197.25,195,197.25,197,70700,7,2019,8,5.32,6.27,102.6083,2.5,8.5,11.2,5.5,9
1133,7/5/2019,197,197,195,195,195.25,403000,7,2019,5,5.32,6.27,102.6306,2.5,8.5,11.2,5.5,9
1134,7/4/2019,192,199,192,196,195,322300,7,2019,4,5.32,6.27,102.2944,2.5,8.5,11.2,5.5,9
1135,7/3/2019,198,198,195,195,197,50800,7,2019,3,5.32,6.27,103.0011,2.5,8.5,11.2,5.5,9
1136,7/2/2019,199,199,199,199,199,27900,7,2019,2,5.32,6.27,102.7194,2.5,8.5,11.2,5.5,9
1137,7/1/2019,200,200,197,197,199.25,51900,7,2019,1,5.32,6.27,102.3606,2.5,8.5,11.2,5.5,9
1138,6/28/2019,197,200,197,198,199.75,19900,6,2019,28,5.16,5.7,102.2983,2.5,8.5,11.2,5.3,9
1139,6/27/2019,200,200,199,200,199.75,785500,6,2019,27,5.16,5.7,102.17,2.5,8.5,11.2,5.3,9
1140,6/26/2019,200,204,200,200,200,54100,6,2019,26,5.16,5.7,102.1917,2.5,8.5,11.2,5.3,9
1141,6/25/2019,200,204,197.5,204,200.5,108400,6,2019,25,5.16,5.7,101.9144,2.5,8.5,11.2,5.3,9
1142,6/24/2019,204.75,204.75,195.5,200,199.75,482200,6,2019,24,5.16,5.7,101.8778,2.5,8.5,11.2,5.3,9
1143,6/21/2019,195,195,195,195,195,15700,6,2019,21,5.16,5.7,101.8722,2.5,8.5,11.2,5.3,9
1144,6/20/2019,204,205,190,205,200.5,74400,6,2019,20,5.16,5.7,101.9028,2.5,8.5,11.2,5.3,9
1145,6/19/2019,204,205,204,204,204,206100,6,2019,19,5.16,5.7,102.0222,2.5,8.5,11.2,5.3,9
1146,6/18/2019,204,205,204,205,204.25,11000,6,2019,18,5.16,5.7,102.0033,2.5,8.5,11.2,5.3,9
1147,6/17/2019,205,205,203.25,203.25,204.25,186300,6,2019,17,5.16,5.7,101.8167,2.5,8.5,11.2,5.3,9
1148,6/14/2019,205,206.5,205,205,205,505800,6,2019,14,5.16,5.7,101.5478,2.5,8.5,11.2,5.3,9
1149,6/13/2019,206,206,205,205,205.5,12900,6,2019,13,5.16,5.7,101.3883,2.5,8.5,11.2,5.3,9
1150,6/12/2019,203.25,206,203.25,205,204.75,132300,6,2019,12,5.16,5.7,101.3833,2.5,8.5,11.2,5.3,9
1151,6/11/2019,203.25,204,203.25,203.5,203.25,96200,6,2019,11,5.16,5.7,101.2767,2.5,8.5,11.2,5.3,9
1152,6/10/2019,205,205,203,203,204.75,77100,6,2019,10,5.16,5.7,101.205,2.5,8.5,11.2,5.3,9
1153,6/7/2019,205,206,205,206,205.25,300,6,2019,7,5.16,5.7,101.3,2.5,8.5,11.2,5.3,9
1154,6/6/2019,205,207,203.75,205,204.5,23900,6,2019,6,5.16,5.7,101.35,2.5,8.5,11.2,5.3,9
1155,6/4/2019,203.75,205,203,205,203.25,14400,6,2019,4,5.16,5.7,101.2806,2.5,8.5,11.2,5.3,9
1156,6/3/2019,214,205,201,203,203.75,4200,6,2019,3,5.16,5.7,101.2872,2.5,8.5,11.2,5.3,9
1157,5/31/2019,203,205,200,200,202.75,269600,5,2019,31,5.04,4.49,101.3556,2.5,8.5,11.2,5.3,9
1158,5/30/2019,203,203,200,200,201.75,756300,5,2019,30,5.04,4.49,101.4011,2.5,8.5,11.2,5.3,9
1159,5/29/2019,204,204,203,203,203.25,147300,5,2019,29,5.04,4.49,101.2778,2.5,8.5,11.2,5.3,9
1160,5/28/2019,204,205,202,204,204,1056000,5,2019,28,5.04,4.49,101.2378,2.5,8.5,11.2,5.3,9
1161,5/27/2019,205,205,200,200,203.25,600,5,2019,27,5.04,4.49,101.24,2.5,8.5,11.2,5.3,9
1162,5/24/2019,205,205.25,200,200,203.75,37800,5,2019,24,5.04,4.49,101.2261,2.5,8.5,11.2,5.3,9
1163,5/23/2019,205,206,204.75,205,205,121100,5,2019,23,5.04,4.49,101.2167,2.5,8.5,11.2,5.3,9
1164,5/22/2019,207,207,206,206,206.75,764400,5,2019,22,5.04,4.49,101.1694,2.5,8.5,11.2,5.3,9
1165,5/21/2019,207,210,206,207,206,602200,5,2019,21,5.04,4.49,101.1117,2.5,8.5,11.2,5.3,9
1166,5/20/2019,207,207,205,205,206.75,349600,5,2019,20,5.04,4.49,101.1111,2.5,8.5,11.2,5.3,9
1167,5/17/2019,206.75,207,206.75,207,206,130800,5,2019,17,5.04,4.49,101.1194,2.5,8.5,11.2,5.3,9
1168,5/16/2019,206,207,205,207,206.75,484600,5,2019,16,5.04,4.49,101.1069,2.5,8.5,11.2,5.3,9
1169,5/15/2019,205,205,205,205,205,125900,5,2019,15,5.04,4.49,101.0944,2.5,8.5,11.2,5.3,9
1170,5/14/2019,205,206,205,206,205,229300,5,2019,14,5.04,4.49,101.0692,2.5,8.5,11.2,5.3,9
1171,5/13/2019,205,205,200,202,204.75,22600,5,2019,13,5.04,4.49,101.0736,2.5,8.5,11.2,5.3,9
1172,5/10/2019,205.25,210,205.25,210,208.75,800,5,2019,10,5.04,4.49,101.1344,2.5,8.5,11.2,5.3,9
1173,5/9/2019,210,210,209,210,209.75,268600,5,2019,9,5.04,4.49,101.1856,2.5,8.5,11.2,5.3,9
1174,5/8/2019,215,215,210.25,213,213,186100,5,2019,8,5.04,4.49,101.0472,2.5,8.5,11.2,5.3,9
1175,5/7/2019,215,220,215,220,215.25,112700,5,2019,7,5.04,4.49,100.9417,2.5,8.5,11.2,5.3,9
1176,5/6/2019,210,220,205,220,214.5,92300,5,2019,6,5.04,4.49,101.0978,2.5,8.5,11.2,5.3,9
1177,5/3/2019,224.75,224.75,220,220,221.25,175800,5,2019,3,5.04,4.49,100.9,2.5,8.5,11.2,5.3,9
1178,5/2/2019,221.75,224.5,221.75,224.5,224.25,13500,5,2019,2,5.04,4.49,101.1972,2.5,8.5,11.2,5.3,9
1179,4/30/2019,220,224.75,220,224.75,221.75,917400,4,2019,30,4.91,6.58,101.3803,2.5,8.5,11.2,5.3,9
1180,4/30/2019,220,224.75,220,224.75,221.75,917400,4,2019,30,4.91,6.58,101.3803,2.5,8.5,11.2,5.3,9
1181,4/29/2019,220,220.25,220,220,220,25100,4,2019,29,4.91,6.58,101.49,2.5,8.5,11.2,5.3,9
1182,4/29/2019,220,220.25,220,220,220,25100,4,2019,29,4.91,6.58,101.49,2.5,8.5,11.2,5.3,9
1183,4/26/2019,220,221,220,220,220,400300,4,2019,26,4.91,6.58,101.5122,2.5,8.5,11.2,5.3,9
1184,4/26/2019,220,221,220,220,220,400300,4,2019,26,4.91,6.58,101.5122,2.5,8.5,11.2,5.3,9
1185,4/25/2019,220,221,220,220,220,784600,4,2019,25,4.91,6.58,101.5478,2.5,8.5,11.2,5.3,9
1186,4/25/2019,220,221,220,220,220,784600,4,2019,25,4.91,6.58,101.5478,2.5,8.5,11.2,5.3,9
1187,4/24/2019,220,220,220,220,220,30700,4,2019,24,4.91,6.58,101.5361,2.5,8.5,11.2,5.3,9
1188,4/24/2019,220,220,220,220,220,30700,4,2019,24,4.91,6.58,101.5361,2.5,8.5,11.2,5.3,9
1189,4/23/2019,214.5,220,214.5,220,219,127900,4,2019,23,4.91,6.58,101.3353,2.5,8.5,11.2,5.3,9
1190,4/23/2019,214.5,220,214.5,220,219,127900,4,2019,23,4.91,6.58,101.3353,2.5,8.5,11.2,5.3,9
1191,4/18/2019,210,215,210,215,214.25,468500,4,2019,18,4.91,6.58,101.2583,2.5,8.5,11.2,5.3,9
1192,4/18/2019,210,215,210,215,214.25,468500,4,2019,18,4.91,6.58,101.2583,2.5,8.5,11.2,5.3,9
1193,4/17/2019,208,214.25,211,214.25,213.75,90100,4,2019,17,4.91,6.58,101.0556,2.5,8.5,11.2,5.3,9
1194,4/17/2019,208,214.25,211,214.25,213.75,90100,4,2019,17,4.91,6.58,101.0556,2.5,8.5,11.2,5.3,9
1195,4/16/2019,0,210.25,210.25,210.25,210.25,6900,4,2019,16,4.91,6.58,100.9972,2.5,8.5,11.2,5.3,9
1196,4/16/2019,0,210.25,210.25,210.25,210.25,6900,4,2019,16,4.91,6.58,100.9972,2.5,8.5,11.2,5.3,9
1197,4/15/2019,0,215,210,212,211.5,2800,4,2019,15,4.91,6.58,100.9906,2.5,8.5,11.2,5.3,9
1198,4/15/2019,0,215,210,212,211.5,2800,4,2019,15,4.91,6.58,100.9906,2.5,8.5,11.2,5.3,9
1199,4/12/2019,0,210,208,210,209.75,84100,4,2019,12,4.91,6.58,100.9528,2.5,8.5,11.2,5.3,9
1200,4/12/2019,0,210,208,210,209.75,84100,4,2019,12,4.91,6.58,100.9528,2.5,8.5,11.2,5.3,9
1201,4/11/2019,0,208.25,208,208.25,208,7800,4,2019,11,4.91,6.58,101.0944,2.5,8.5,11.2,5.3,9
1202,4/11/2019,0,208.25,208,208.25,208,7800,4,2019,11,4.91,6.58,101.0944,2.5,8.5,11.2,5.3,9
1203,4/10/2019,0,208,208,208,208,882100,4,2019,10,4.91,6.58,100.8422,2.5,8.5,11.2,5.3,9
1204,4/10/2019,0,208,208,208,208,882100,4,2019,10,4.91,6.58,100.8422,2.5,8.5,11.2,5.3,9
1205,4/9/2019,0,210,205,210,208.25,395500,4,2019,9,4.91,6.58,100.6417,2.5,8.5,11.2,5.3,9
1206,4/9/2019,0,210,205,210,208.25,395500,4,2019,9,4.91,6.58,100.6417,2.5,8.5,11.2,5.3,9
1207,4/8/2019,0,210,206,210,208,38100,4,2019,8,4.91,6.58,100.6333,2.5,8.5,11.2,5.3,9
1208,4/8/2019,0,210,206,210,208,38100,4,2019,8,4.91,6.58,100.6333,2.5,8.5,11.2,5.3,9
1209,4/5/2019,0,209,208,208,208,30200,4,2019,5,4.91,6.58,100.7167,2.5,8.5,11.2,5.3,9
1210,4/5/2019,0,209,208,208,208,30200,4,2019,5,4.91,6.58,100.7167,2.5,8.5,11.2,5.3,9
1211,4/4/2019,210,210,208,208,208,191700,4,2019,4,4.91,6.58,100.8006,2.5,8.5,11.2,5.3,9
1212,4/4/2019,210,210,208,208,208,191700,4,2019,4,4.91,6.58,100.8006,2.5,8.5,11.2,5.3,9
1213,4/3/2019,210,212,208,210,210.25,807300,4,2019,3,4.91,6.58,100.9033,2.5,8.5,11.2,5.3,9
1214,4/3/2019,210,212,208,210,210.25,807300,4,2019,3,4.91,6.58,100.9033,2.5,8.5,11.2,5.3,9
1215,4/2/2019,206,210,206,210,209.75,488700,4,2019,2,4.91,6.58,100.8444,2.5,8.5,11.2,5.3,9
1216,4/2/2019,206,210,206,210,209.75,488700,4,2019,2,4.91,6.58,100.8444,2.5,8.5,11.2,5.3,9
1217,4/1/2019,210,210,206.5,210,209.25,52000,4,2019,1,4.91,6.58,100.7806,2.5,8.5,11.2,5.3,9
1218,4/1/2019,210,210,206.5,210,209.25,52000,4,2019,1,4.91,6.58,100.7806,2.5,8.5,11.2,5.3,9
1219,3/29/2019,206.25,210,206,206.25,206.25,248500,3,2019,29,4.67,4.35,100.75,2.5,8.5,11.2,5.1,9
1220,3/28/2019,205,210,205,210,206.25,2000,3,2019,28,4.67,4.35,100.8778,2.5,8.5,11.2,5.1,9
1221,3/27/2019,205,210,205,205.25,207.25,161700,3,2019,27,4.67,4.35,100.9556,2.5,8.5,11.2,5.1,9
1222,3/26/2019,206,207,205,205,205.25,6400,3,2019,26,4.67,4.35,100.9639,2.5,8.5,11.2,5.1,9
1223,3/25/2019,200,207,206,207,206,27100,3,2019,25,4.67,4.35,100.7028,2.5,8.5,11.2,5.1,9
1224,3/22/2019,205.75,207,205.75,207,205.75,151400,3,2019,22,4.67,4.35,100.7778,2.5,8.5,11.2,5.1,9
1225,3/21/2019,205.25,205.25,205,205.25,205.25,6300,3,2019,21,4.67,4.35,101.0072,2.5,8.5,11.2,5.1,9
1226,3/20/2019,205,205,205,205,205,535200,3,2019,20,4.67,4.35,100.85,2.5,8.5,11.2,5.1,9
1227,3/19/2019,200,207,192.25,204.75,201.5,245800,3,2019,19,4.67,4.35,100.6583,2.5,8.5,11.2,5.1,9
1228,3/18/2019,200,205,204,205,204.75,156100,3,2019,18,4.67,4.35,100.2956,2.5,8.5,11.2,5.1,9
1229,3/15/2019,204,204,200,200,200,341200,3,2019,15,4.67,4.35,100.1678,2.5,8.5,11.2,5.1,9
1230,3/14/2019,204,209,204,208,205,228700,3,2019,14,4.67,4.35,100.24,2.5,8.5,11.2,5.1,9
1231,3/13/2019,205,206,204,204,204,132700,3,2019,13,4.67,4.35,100.1861,2.5,8.5,11.2,5.1,9
1232,3/12/2019,204,205,204,205,204,453800,3,2019,12,4.67,4.35,99.6056,2.5,8.5,11.2,5.1,9
1233,3/11/2019,205.5,209.75,205.25,205.25,205.75,2800,3,2019,11,4.67,4.35,99.6511,2.5,8.5,11.2,5.1,9
1234,3/8/2019,210,210,208,210,209.75,43400,3,2019,8,4.67,4.35,99.71,2.5,8.5,11.2,5.1,9
1235,3/7/2019,184,210.25,206,210,209.75,789600,3,2019,7,4.67,4.35,100.0239,2.5,8.5,11.2,5.1,9
1236,3/6/2019,200,215,200,205.5,203.5,537900,3,2019,6,4.67,4.35,100.0483,2.5,8.5,11.2,5.1,9
1237,3/5/2019,196,198,195.25,198,195.75,28500,3,2019,5,4.67,4.35,100.0389,2.5,8.5,11.2,5.1,9
1238,3/4/2019,195.5,196,195.5,196,195.75,13800,3,2019,4,4.67,4.35,100.0417,2.5,8.5,11.2,5.1,9
1239,3/1/2019,194,194,194,194,194,103300,3,2019,1,4.67,4.35,100.0428,2.5,8.5,11.2,5.1,9
1240,2/28/2019,191,195,185,193,192.25,605200,2,2019,28,4.65,4.14,100.0861,2.5,8.5,11.2,5.1,9
1241,2/27/2019,190.5,190.5,190.5,190.5,190.5,400,2,2019,27,4.65,4.14,100.1278,2.5,8.5,11.2,5.1,9
1242,2/26/2019,194,195,193.5,193.5,194.5,5100,2,2019,26,4.65,4.14,100.0694,2.5,8.5,11.2,5.1,9
1243,2/25/2019,200,200,195,195,195,31100,2,2019,25,4.65,4.14,100.1822,2.5,8.5,11.2,5.1,9
1244,2/22/2019,199.5,199.5,195,199.5,198.75,600,2,2019,22,4.65,4.14,100.2228,2.5,8.5,11.2,5.1,9
1245,2/21/2019,195,199,195,195,195,208200,2,2019,21,4.65,4.14,100.24,2.5,8.5,11.2,5.1,9
1246,2/20/2019,200,202,195,195,195,1011500,2,2019,20,4.65,4.14,100.2678,2.5,8.5,11.2,5.1,9
1247,2/19/2019,205,206,200,200,200.75,366100,2,2019,19,4.65,4.14,100.1722,2.5,8.5,11.2,5.1,9
1248,2/18/2019,205,219,205,205,205,229400,2,2019,18,4.65,4.14,100.1917,2.5,8.5,11.2,5.1,9
1249,2/15/2019,220,222.75,210,211,210.25,1135600,2,2019,15,4.65,4.14,100.24,2.5,8.5,11.2,5.1,9
1250,2/14/2019,220,220,215,215,219.75,184600,2,2019,14,4.65,4.14,100.2489,2.5,8.5,11.2,5.1,9
1251,2/13/2019,223,223,220,220,220,29000,2,2019,13,4.65,4.14,100.2772,2.5,8.5,11.2,5.1,9
1252,2/12/2019,222,225,222,225,222.75,127100,2,2019,12,4.65,4.14,100.5289,2.5,8.5,11.2,5.1,9
1253,2/11/2019,220,223,219,223,222.25,109500,2,2019,11,4.65,4.14,100.3594,2.5,8.5,11.2,5.1,9
1254,2/8/2019,220,220.25,219,220,219,563200,2,2019,8,4.65,4.14,100.1478,2.5,8.5,11.2,5.1,9
1255,2/7/2019,212,219.75,212,215.25,214,151300,2,2019,7,4.65,4.14,100.095,2.5,8.5,11.2,5.1,9
1256,2/6/2019,212,212,212,212,212,7700,2,2019,6,4.65,4.14,100.0722,2.5,8.5,11.2,5.1,9
1257,2/5/2019,211,215,210,215,212.5,37900,2,2019,5,4.65,4.14,100.15,2.5,8.5,11.2,5.1,9
1258,2/4/2019,210,220,210,210,211,57400,2,2019,4,4.65,4.14,100.375,2.5,8.5,11.2,5.1,9
1259,2/1/2019,210,215,210,215,210.75,11700,2,2019,1,4.65,4.14,100.6194,2.5,8.5,11.2,5.1,9
1260,1/31/2019,215,215,210,213,213,707300,1,2019,31,4.68,4.7,100.89,2.5,8.5,11.2,5.1,9
1261,1/30/2019,210,215,210,215,211.75,420700,1,2019,30,4.68,4.7,100.8211,2.5,8.5,11.2,5.1,9
1262,1/29/2019,204,212,200,210,210.25,703400,1,2019,29,4.68,4.7,100.7139,2.5,8.5,11.2,5.1,9
1263,1/28/2019,190,200,190,190,198.25,169100,1,2019,28,4.68,4.7,100.8,2.5,8.5,11.2,5.1,9
1264,1/25/2019,180,190,180,190,186.5,194500,1,2019,25,4.68,4.7,101.0833,2.5,8.5,11.2,5.1,9
1265,1/24/2019,168,180,168,170,173,32900,1,2019,24,4.68,4.7,101.4056,5.5,8.5,11.2,5.1,9
1266,1/23/2019,171,171,171,171,171,400,1,2019,23,4.68,4.7,101.6011,5.5,8.5,11.2,5.1,9
1267,1/22/2019,168,170,168,169.5,169.5,55200,1,2019,22,4.68,4.7,101.6017,5.5,8.5,11.2,5.1,9
1268,1/21/2019,170,168,168,168,168,2200,1,2019,21,4.68,4.7,101.7089,5.5,8.5,11.2,5.1,9
1269,1/18/2019,168.5,169.75,165,169.75,168,777400,1,2019,18,4.68,4.7,101.7306,5.5,8.5,11.2,5.1,9
1270,1/17/2019,168,170,168,170,169.5,174800,1,2019,17,4.68,4.7,101.7017,5.5,8.5,11.2,5.1,9
1271,1/16/2019,170,170,169,169,169,266600,1,2019,16,4.68,4.7,101.7139,5.5,8.5,11.2,5.1,9
1272,1/15/2019,170,171,168,170,169.75,602300,1,2019,15,4.68,4.7,101.6972,5.5,8.5,11.2,5.1,9
1273,1/14/2019,163,170,163,170,165,316500,1,2019,14,4.68,4.7,101.7417,5.5,8.5,11.2,5.1,9
1274,1/11/2019,170,170,163,163,163,718500,1,2019,11,4.68,4.7,101.7544,5.5,8.5,11.2,5.1,9
1275,1/10/2019,170,170,163,163,164.75,104300,1,2019,10,4.68,4.7,101.8572,5.5,8.5,11.2,5.1,9
1276,1/9/2019,172,170,165,165,165,904100,1,2019,9,4.68,4.7,101.9572,5.5,8.5,11.2,5.1,9
1277,1/8/2019,169.5,170,168,169.5,169.5,1600,1,2019,8,4.68,4.7,101.8694,5.5,8.5,11.2,5.1,9
1278,1/7/2019,170,170,170,170,170,6400,1,2019,7,4.68,4.7,102.0972,5.5,8.5,11.2,5.1,9
1279,1/4/2019,173,173,168,168,169.25,39100,1,2019,4,4.68,4.7,102.1611,5.5,8.5,11.2,5.1,9
1280,1/3/2019,173.25,173.25,173,173,173.25,10200,1,2019,3,4.68,4.7,102.1183,5.5,8.5,11.2,5.1,9
1281,1/2/2019,175,175,173,173,173.5,7800,1,2019,2,4.68,4.7,101.8322,5.5,8.5,11.2,5.1,9
1282,12/31/2018,180,180,172.5,173.75,174.75,898900,12,2018,31,4.69,5.71,101.8461,5.5,7.5,9.7,5,9
1283,12/28/2018,180,180,180,180,180,5600,12,2018,28,4.69,5.71,101.8128,5.5,7.5,9.7,5,9
1284,12/27/2018,171,172,170,170,171.75,232200,12,2018,27,4.69,5.71,101.8239,5.5,7.5,9.7,5,9
1285,12/24/2018,172,173,172,172,172.5,300,12,2018,24,4.69,5.71,101.8461,5.5,7.5,9.7,5,9
1286,12/21/2018,165,180,165,180,168,335000,12,2018,21,4.69,5.71,101.4156,5.5,7.5,9.7,5,9
1287,12/20/2018,180,180,165,168,168,581900,12,2018,20,4.69,5.71,101.9361,5.5,7.5,9.7,5,9
1288,12/19/2018,177,180,170,170.25,172,10700,12,2018,19,4.69,5.71,102.3833,5.5,7.5,9.7,5,9
1289,12/18/2018,185,186,178,178,179.25,74500,12,2018,18,4.69,5.71,102.4789,5.5,7.5,9.7,5,9
1290,12/17/2018,186,186,182,182,183.5,3600,12,2018,17,4.69,5.71,102.5339,5.5,7.5,9.7,5,9
1291,12/14/2018,189,189,189,189,189,300,12,2018,14,4.69,5.71,102.5694,5.5,7.5,9.7,5,9
1292,12/13/2018,190,190.75,190,190,190.5,318700,12,2018,13,4.69,5.71,102.655,5.5,7.5,9.7,5,9
1293,12/11/2018,190,192,190,190,191.5,107200,12,2018,11,4.69,5.71,102.4722,5.5,7.5,9.7,5,9
1294,12/10/2018,185,195,185,185,190,400,12,2018,10,4.69,5.71,102.45,5.5,7.5,9.7,5,9
1295,12/7/2018,195,195,190,190,191.75,434200,12,2018,7,4.69,5.71,102.6,5.5,7.5,9.7,5,9
1296,12/6/2018,196,196.5,196,196,196,57500,12,2018,6,4.69,5.71,102.6389,5.5,7.5,9.7,5,9
1297,12/5/2018,197.25,197.5,196,196,197,307400,12,2018,5,4.69,5.71,102.5997,5.5,7.5,9.7,5,9
1298,12/4/2018,195,199,194.75,197,196.25,100100,12,2018,4,4.69,5.71,102.6794,5.5,7.5,9.7,5,9
1299,12/3/2018,205,205,190,191,193.5,11400,12,2018,3,4.69,5.71,102.5111,5.5,7.5,9.7,5,9
1300,11/30/2018,173,194,173,190,189,87200,11,2018,30,4.59,5.58,102.5444,5.5,7.5,9.7,5,9
1301,11/29/2018,180,181.25,180,181.25,180,63600,11,2018,29,4.59,5.58,102.5983,5.5,7.5,9.7,5,9
1302,11/28/2018,173,178,173,177,175.25,42500,11,2018,28,4.59,5.58,102.6794,5.5,7.5,9.7,5,9
1303,11/27/2018,169,172,169,171,171,30200,11,2018,27,4.59,5.58,102.4533,5.5,7.5,9.7,5,9
1304,11/26/2018,165,175,165,175,169,608700,11,2018,26,4.59,5.58,102.4683,5.5,7.5,9.7,5,9
1305,11/23/2018,164,167,164,166,165,515300,11,2018,23,4.59,5.58,102.4489,5.5,7.5,9.7,5,9
1306,11/22/2018,162,164,161,161,163,106400,11,2018,22,4.59,5.58,102.3583,5.5,7.5,9.7,5,9
1307,11/21/2018,164,165,160,160,161,515700,11,2018,21,4.59,5.58,102.8583,5.5,7.5,9.7,5,9
1308,11/20/2018,170,170,162,162,169,6000,11,2018,20,4.59,5.58,102.8056,5.5,7.5,9.7,5,9
1309,11/19/2018,168,170,164,164,165,361700,11,2018,19,4.59,5.58,103.1028,5.5,7.5,9.7,5,9
1310,11/16/2018,168,169,166,169,167,17100,11,2018,16,4.59,5.58,103.2072,5.5,7.5,9.7,5,9
1311,11/15/2018,168,169,168,169,169,1800,11,2018,15,4.59,5.58,102.9056,5.5,7.5,9.7,5,9
1312,11/14/2018,169,169,168,168,169,4000,11,2018,14,4.59,5.58,102.6639,5.5,7.5,9.7,5,9
1313,11/13/2018,170,170,168,169,170,64300,11,2018,13,4.59,5.58,102.4417,5.5,7.5,9.7,5,9
1314,11/12/2018,170,170,169,170,170,97600,11,2018,12,4.59,5.58,102.0961,5.5,7.5,9.7,5,9
1315,11/9/2018,170,170,170,170,170,4800,11,2018,9,4.59,5.58,101.8556,5.5,7.5,9.7,5,9
1316,11/8/2018,172,172,169,170,171,191300,11,2018,8,4.59,5.58,101.7806,5.5,7.5,9.7,5,9
1317,11/7/2018,172,174,170,172,173,47500,11,2018,7,4.59,5.58,101.8222,5.5,7.5,9.7,5,9
1318,11/6/2018,176,176,170,171,174,55700,11,2018,6,4.59,5.58,101.5089,5.5,7.5,9.7,5,9
1319,11/5/2018,170,174,170,174,173,11100,11,2018,5,4.59,5.58,101.4556,5.5,7.5,9.7,5,9
1320,11/2/2018,170,174,170,174,172,900,11,2018,2,4.59,5.58,101.7361,5.5,7.5,9.7,5,9
1321,11/1/2018,176,176,170,170,171,17700,11,2018,1,4.59,5.58,102.0544,5.5,7.5,9.7,5,9
1322,10/31/2018,177,177,174,174,175,50000,10,2018,31,4.53,5.53,101.8472,5.5,7.5,9.7,5,9
1323,10/30/2018,180,180,175,179,177,17600,10,2018,30,4.53,5.53,101.7028,5.5,7.5,9.7,5,9
1324,10/29/2018,179,190,179,179,180,94700,10,2018,29,4.53,5.53,101.3233,5.5,7.5,9.7,5,9
1325,10/26/2018,179,180,179,179,180,535300,10,2018,26,4.53,5.53,101.2333,5.5,7.5,9.7,5,9
1326,10/25/2018,180,181,179,180,180,66100,10,2018,25,4.53,5.53,101.2106,5.5,7.5,9.7,5,9
1327,10/24/2018,181,181,180,180,181,400,10,2018,24,4.53,5.53,101.1328,5.5,7.5,9.7,5,9
1328,10/23/2018,179,180,179,179,180,40600,10,2018,23,4.53,5.53,101.1044,5.5,7.5,9.7,5,9
1329,10/22/2018,180,180,179,179,180,24000,10,2018,22,4.53,5.53,101.0444,5.5,7.5,9.7,5,9
1330,10/19/2018,185,185,185,185,185,119900,10,2018,19,4.53,5.53,101.0261,5.5,7.5,9.7,5,9
1331,10/18/2018,185,185,180,185,185,38400,10,2018,18,4.53,5.53,100.9744,5.5,7.5,9.7,5,9
1332,10/17/2018,184,185,180,185,184,270100,10,2018,17,4.53,5.53,100.9706,5.5,7.5,9.7,5,9
1333,10/16/2018,185,185,180,180,185,147900,10,2018,16,4.53,5.53,100.925,5.5,7.5,9.7,5,9
1334,10/15/2018,185,189,185,185,188,4200,10,2018,15,4.53,5.53,100.8972,5.5,7.5,9.7,5,9
1335,10/12/2018,186,186,185,185,186,8400,10,2018,12,4.53,5.53,100.9183,5.5,7.5,9.7,5,9
1336,10/11/2018,185,186,185,185,186,91200,10,2018,11,4.53,5.53,100.915,5.5,7.5,9.7,5,9
1337,10/9/2018,185,190,185,190,186,69600,10,2018,9,4.53,5.53,100.9,5.5,7.5,9.7,5,9
1338,10/8/2018,185,189,185,185,186,10300,10,2018,8,4.53,5.53,100.85,5.5,7.5,9.7,5,9
1339,10/5/2018,188,190,186,186,187,74300,10,2018,5,4.53,5.53,100.95,5.5,7.5,9.7,5,9
1340,10/4/2018,189,190,186,186,189,200400,10,2018,4,4.53,5.53,100.9678,5.5,7.5,9.7,5,9
1341,10/3/2018,190,190,188,189,190,67400,10,2018,3,4.53,5.53,100.9483,5.5,7.5,9.7,5,9
1342,10/2/2018,190,192,190,190,191,3927400,10,2018,2,4.53,5.53,100.9194,5.5,7.5,9.7,5,9
1343,10/1/2018,190,192,190,192,192,1900,10,2018,1,4.53,5.53,100.9028,5.5,7.5,9.7,5,9
1344,9/28/2018,185,190,185,190,186,1064300,9,2018,28,4.53,5.7,100.9556,5.5,7.5,9.7,4.7,9
1345,9/27/2018,180,190,190,190,190,700,9,2018,27,4.53,5.7,100.9139,5.5,7.5,9.7,4.7,9
1346,9/26/2018,185,185,185,185,185,1568300,9,2018,26,4.53,5.7,101.055,5.5,7.5,9.7,4.7,9
1347,9/25/2018,185,192,181,192,185,486900,9,2018,25,4.53,5.7,100.9794,5.5,7.5,9.7,4.7,9
1348,9/24/2018,180,190,180,181,182,226000,9,2018,24,4.53,5.7,100.8583,5.5,7.5,9.7,4.7,9
1349,9/21/2018,195,190,180,180,181,581900,9,2018,21,4.53,5.7,100.7989,5.5,7.5,9.7,4.7,9
1350,9/20/2018,190,190,185,185,187,148600,9,2018,20,4.53,5.7,100.7917,5.5,7.5,9.7,4.7,9
1351,9/19/2018,194,194,190,190,191,17900,9,2018,19,4.53,5.7,100.7989,5.5,7.5,9.7,4.7,9
1352,9/18/2018,192,198,192,192,194,133500,9,2018,18,4.53,5.7,100.8417,5.5,7.5,9.7,4.7,9
1353,9/17/2018,195,195,192,192,194,2600,9,2018,17,4.53,5.7,100.9583,5.5,7.5,9.7,4.7,9
1354,9/14/2018,195,200,195,195,196,792100,9,2018,14,4.53,5.7,101.1778,5.5,7.5,9.7,4.7,9
1355,9/13/2018,205,205,194,195,196,49800,9,2018,13,4.53,5.7,100.9194,5.5,7.5,9.7,4.7,9
1356,9/12/2018,199,200,195,195,196,2000,9,2018,12,4.53,5.7,100.7472,5.5,7.5,9.7,4.7,9
1357,9/11/2018,200,200,194,195,195,36400,9,2018,11,4.53,5.7,100.7083,5.5,7.5,9.7,4.7,9
1358,9/10/2018,196,200,195,200,200,36900,9,2018,10,4.53,5.7,100.7206,5.5,7.5,9.7,4.7,9
1359,9/7/2018,195,196,194,196,196,40700,9,2018,7,4.53,5.7,100.7156,5.5,7.5,9.7,4.7,9
1360,9/6/2018,195,195,193,193,195,22500,9,2018,6,4.53,5.7,100.7133,5.5,7.5,9.7,4.7,9
1361,9/5/2018,198,200,195,195,197,159300,9,2018,5,4.53,5.7,100.7178,5.5,7.5,9.7,4.7,9
1362,9/4/2018,200,200,198,198,199,164800,9,2018,4,4.53,5.7,100.6572,5.5,7.5,9.7,4.7,9
1363,9/3/2018,197,199,197,197,198,114200,9,2018,3,4.53,5.7,100.6483,5.5,7.5,9.7,4.7,9
1364,8/31/2018,200,200,198,199,200,25400,8,2018,31,4.63,4.04,100.6456,5.5,7.5,9.7,4.7,9
1365,8/30/2018,197,205,197,205,200,7200,8,2018,30,4.63,4.04,100.6922,5.5,7.5,9.7,4.7,9
1366,8/29/2018,200,200,195,198,196,336900,8,2018,29,4.63,4.04,100.6778,5.5,7.5,9.7,4.7,9
1367,8/28/2018,195,195,194,194,195,55900,8,2018,28,4.63,4.04,100.79,5.5,7.5,9.7,4.7,9
1368,8/27/2018,191,195,191,191,195,600,8,2018,27,4.63,4.04,100.7856,5.5,7.5,9.7,4.7,9
1369,8/24/2018,209,209,200,204,206,83200,8,2018,24,4.63,4.04,100.6778,5.5,7.5,9.7,4.7,9
1370,8/23/2018,208,210,207,208,210,477200,8,2018,23,4.63,4.04,100.6356,5.5,7.5,9.7,4.7,9
1371,8/22/2018,212,212,207,208,210,78700,8,2018,22,4.63,4.04,100.8922,5.5,7.5,9.7,4.7,9
1372,8/20/2018,212,212,211,211,212,22900,8,2018,20,4.63,4.04,100.8583,5.5,7.5,9.7,4.7,9
1373,8/17/2018,213,214,210,212,212,144000,8,2018,17,4.63,4.04,100.7861,5.5,7.5,9.7,4.7,9
1374,8/16/2018,214,214,208,213,214,1830200,8,2018,16,4.63,4.04,100.7722,5.5,7.5,9.7,4.7,9
1375,8/15/2018,214,214,214,214,214,4400,8,2018,15,4.63,4.04,100.7278,5.5,7.5,9.7,4.7,9
1376,8/14/2018,215,215,214,214,215,4500,8,2018,14,4.63,4.04,100.7333,5.5,7.5,9.7,4.7,9
1377,8/13/2018,215,223,215,215,216,323400,8,2018,13,4.63,4.04,100.4872,5.5,7.5,9.7,4.7,9
1378,8/10/2018,220,220,215,215,218,81500,8,2018,10,4.63,4.04,100.3639,5.5,7.5,9.7,4.7,9
1379,8/9/2018,223,223,220,220,222,90500,8,2018,9,4.63,4.04,100.4222,5.5,7.5,9.7,4.7,9
1380,8/8/2018,223,224,223,223,224,6000,8,2018,8,4.63,4.04,100.4028,5.5,7.5,9.7,4.7,9
1381,8/7/2018,222,225,222,223,224,410700,8,2018,7,4.63,4.04,100.4694,5.5,7.5,9.7,4.7,9
1382,8/6/2018,224,229,225,225,226,56800,8,2018,6,4.63,4.04,100.3833,5.5,7.5,9.7,4.7,9
1383,8/3/2018,229,229,229,229,229,100,8,2018,3,4.63,4.04,100.3472,5.5,7.5,9.7,4.7,9
1384,8/2/2018,225,225,224,225,225,148900,8,2018,2,4.63,4.04,100.4556,5.5,7.5,9.7,4.7,9
1385,8/1/2018,225,225,220,220,225,426800,8,2018,1,4.63,4.04,100.475,5.5,7.5,9.7,4.7,9
1386,7/31/2018,225,225,225,225,225,118600,7,2018,31,4.95,4.35,100.4083,5.5,7.5,9.7,4.7,9
1387,7/30/2018,229,229,220,225,226,421100,7,2018,30,4.95,4.35,100.3378,5.5,7.5,9.7,4.7,9
1388,7/27/2018,230,230,227,227,228,34500,7,2018,27,4.95,4.35,100.4639,5.5,7.5,9.7,4.7,9
1389,7/26/2018,230,230,230,230,230,134400,7,2018,26,4.95,4.35,100.4889,2,7.5,9.7,4.7,9
1390,7/25/2018,225,240,221,240,228,211100,7,2018,25,4.95,4.35,100.5139,2,7.5,9.7,4.7,9
1391,7/24/2018,228,240,225,225,226,34300,7,2018,24,4.95,4.35,100.55,2,7.5,9.7,4.7,9
1392,7/23/2018,223,223,221,221,222,2700,7,2018,23,4.95,4.35,100.7417,2,7.5,9.7,4.7,9
1393,7/20/2018,221,221,221,221,221,162800,7,2018,20,4.95,4.35,100.7333,2,7.5,9.7,4.7,9
1394,7/19/2018,212,220,212,220,218,49700,7,2018,19,4.95,4.35,100.6339,2,7.5,9.7,4.7,9
1395,7/18/2018,212,215,210,212,212,14200,7,2018,18,4.95,4.35,100.6228,2,7.5,9.7,4.7,9
1396,7/17/2018,208,212,206,212,208,293100,7,2018,17,4.95,4.35,100.3944,2,7.5,9.7,4.7,9
1397,7/16/2018,218,218,205,210,207,4100,7,2018,16,4.95,4.35,100.66,2,7.5,9.7,4.7,9
1398,7/13/2018,210,210,202,202,209,5200,7,2018,13,4.95,4.35,100.7944,2,7.5,9.7,4.7,9
1399,7/12/2018,200,211,200,210,211,599700,7,2018,12,4.95,4.35,100.79,2,7.5,9.7,4.7,9
1400,7/11/2018,216,222,210,220,213,222100,7,2018,11,4.95,4.35,100.9056,2,7.5,9.7,4.7,9
1401,7/10/2018,218,220,216,216,217,159300,7,2018,10,4.95,4.35,100.8883,2,7.5,9.7,4.7,9
1402,7/9/2018,217,218,215,218,218,544200,7,2018,9,4.95,4.35,100.8083,2,7.5,9.7,4.7,9
1403,7/6/2018,215,218,215,218,218,549100,7,2018,6,4.95,4.35,100.7583,2,7.5,9.7,4.7,9
1404,7/5/2018,215,217,215,215,216,90500,7,2018,5,4.95,4.35,100.725,2,7.5,9.7,4.7,9
1405,7/4/2018,212,215,212,215,215,409700,7,2018,4,4.95,4.35,100.8411,2,7.5,9.7,4.7,9
1406,7/3/2018,216,216,210,214,214,535100,7,2018,3,4.95,4.35,100.8411,2,7.5,9.7,4.7,9
1407,7/2/2018,218,219,215,218,218,97900,7,2018,2,4.95,4.35,100.8861,2,7.5,9.7,4.7,9
1408,6/29/2018,216,220,216,220,218,9400,6,2018,29,5.2,4.28,101.05,2,7.5,9.7,4.6,9.5
1409,6/28/2018,220,225,218,220,220,262400,6,2018,28,5.2,4.28,101.045,2,7.5,9.7,4.6,9.5
1410,6/27/2018,215,220,215,220,219,1064300,6,2018,27,5.2,4.28,100.9439,2,7.5,9.7,4.6,9.5
1411,6/26/2018,214,215,213,215,215,106400,6,2018,26,5.2,4.28,100.8283,2,7.5,9.7,4.6,9.5
1412,6/25/2018,214,214,210,214,214,7600,6,2018,25,5.2,4.28,100.7628,2,7.5,9.7,4.6,9.5
1413,6/22/2018,230,215,214,214,215,20400,6,2018,22,5.2,4.28,100.83,2,7.5,9.7,4.6,9.5
1414,6/21/2018,216,217,214,215,216,516200,6,2018,21,5.2,4.28,100.96,2,7.5,9.7,4.6,9.5
1415,6/20/2018,216,218,215,215,216,37600,6,2018,20,5.2,4.28,101.1217,2,7.5,9.7,4.6,9.5
1416,6/19/2018,220,220,215,217,218,1007800,6,2018,19,5.2,4.28,101.1333,2,7.5,9.7,4.6,9.5
1417,6/18/2018,218,230,218,230,219,106600,6,2018,18,5.2,4.28,101.1056,2,7.5,9.7,4.6,9.5
1418,6/14/2018,200,220,217,217,219,1083400,6,2018,14,5.2,4.28,101.1406,2,7.5,9.7,4.6,9.5
1419,6/13/2018,216,220,216,220,220,220200,6,2018,13,5.2,4.28,101.1261,2,7.5,9.7,4.6,9.5
1420,6/12/2018,223,223,220,220,221,680900,6,2018,12,5.2,4.28,101.0461,2,7.5,9.7,4.6,9.5
1421,6/11/2018,223,224,221,223,223,201700,6,2018,11,5.2,4.28,101.0028,2,7.5,9.7,4.6,9.5
1422,6/8/2018,229,229,219,223,223,390600,6,2018,8,5.2,4.28,100.8444,2,7.5,9.7,4.6,9.5
1423,6/7/2018,231,231,225,225,231,152100,6,2018,7,5.2,4.28,100.825,2,7.5,9.7,4.6,9.5
1424,6/6/2018,232,232,229,229,231,350300,6,2018,6,5.2,4.28,101,2,7.5,9.7,4.6,9.5
1425,6/5/2018,232,233,231,231,232,279300,6,2018,5,5.2,4.28,100.9111,2,7.5,9.7,4.6,9.5
1426,6/4/2018,230,235,230,230,233,63600,6,2018,4,5.2,4.28,101.385,2,7.5,9.7,4.6,9.5
1427,5/31/2018,235,235,235,235,235,1080200,5,2018,31,5.61,3.95,101.5658,2,7.5,9.7,4.6,9.5
1428,5/30/2018,236,237,235,235,236,155300,5,2018,30,5.61,3.95,101.5658,2,7.5,9.7,4.6,9.5
1429,5/29/2018,237,237,235,236,236,57700,5,2018,29,5.61,3.95,101.5378,2,7.5,9.7,4.6,9.5
1430,5/28/2018,235,239,235,236,236,66000,5,2018,28,5.61,3.95,101.18,2,7.5,9.7,4.6,9.5
1431,5/25/2018,234,238,230,230,231,23200,5,2018,25,5.61,3.95,101.0711,2,7.5,9.7,4.6,9.5
1432,5/24/2018,234,234,234,234,234,13600,5,2018,24,5.61,3.95,101.0028,2,7.5,9.7,4.6,9.5
1433,5/23/2018,235,235,234,234,235,39100,5,2018,23,5.61,3.95,100.7989,2,7.5,9.7,4.6,9.5
1434,5/22/2018,238,238,235,235,238,176300,5,2018,22,5.61,3.95,100.6006,2,7.5,9.7,4.6,9.5
1435,5/21/2018,240,236,235,235,236,5100,5,2018,21,5.61,3.95,100.5461,2,7.5,9.7,4.6,9.5
1436,5/18/2018,244,244,244,244,244,100,5,2018,18,5.61,3.95,100.4244,2,7.5,9.7,4.6,9.5
1437,5/17/2018,245,245,230,244,245,354200,5,2018,17,5.61,3.95,100.4278,2,7.5,9.7,4.6,9.5
1438,5/16/2018,249,251,240,240,249,90300,5,2018,16,5.61,3.95,100.4506,2,7.5,9.7,4.6,9.5
1439,5/15/2018,252,252,248,249,249,371000,5,2018,15,5.61,3.95,100.2694,2,7.5,9.7,4.6,9.5
1440,5/14/2018,252,252,248,248,252,237200,5,2018,14,5.61,3.95,100.4317,2,7.5,9.7,4.6,9.5
1441,5/11/2018,252,252,246,252,252,434700,5,2018,11,5.61,3.95,100.4406,2,7.5,9.7,4.6,9.5
1442,5/10/2018,252,252,250,250,252,137300,5,2018,10,5.61,3.95,100.595,2,7.5,9.7,4.6,9.5
1443,5/9/2018,252,252,252,252,252,566400,5,2018,9,5.61,3.95,100.4611,2,7.5,9.7,4.6,9.5
1444,5/8/2018,252,255,252,255,253,81900,5,2018,8,5.61,3.95,100.2917,2,7.5,9.7,4.6,9.5
1445,5/7/2018,250,270,250,254,254,46500,5,2018,7,5.61,3.95,100.2644,2,7.5,9.7,4.6,9.5
1446,5/4/2018,251,255,251,255,255,618400,5,2018,4,5.61,3.95,100.2222,2,7.5,9.7,4.6,9.5
1447,5/3/2018,240,252,251,252,252,221800,5,2018,3,5.61,3.95,100.1856,2,7.5,9.7,4.6,9.5
1448,5/2/2018,251,253,250,252,253,262000,5,2018,2,5.61,3.95,100.335,2,7.5,9.7,4.6,9.5
1449,4/30/2018,251,251,250,250,251,10900,4,2018,30,6.24,3.73,100.3611,2,7.5,9.7,4.6,9.5
1450,4/27/2018,252,253,250,250,253,621400,4,2018,27,6.24,3.73,100.3294,2,7.5,9.7,4.6,9.5
1451,4/26/2018,252,253,252,252,253,446300,4,2018,26,6.24,3.73,100.1086,2,7.5,9.7,4.6,9.5
1452,4/25/2018,251,255,251,253,253,115300,4,2018,25,6.24,3.73,100.0478,2,7.5,9.7,4.6,9.5
1453,4/24/2018,235,252,251,252,252,172300,4,2018,24,6.24,3.73,99.9778,2,7.5,9.7,4.6,9.5
1454,4/23/2018,253,260,251,251,254,55300,4,2018,23,6.24,3.73,100.0556,2,7.5,9.7,4.6,9.5
1455,4/20/2018,253,253,253,253,253,564600,4,2018,20,6.24,3.73,100.2556,2,7.5,9.7,4.6,9.5
1456,4/19/2018,251,253,251,253,253,677100,4,2018,19,6.24,3.73,100.3989,2,7.5,9.7,4.6,9.5
1457,4/18/2018,251,251,250,251,251,41500,4,2018,18,6.24,3.73,100.4028,2,7.5,9.7,4.6,9.5
1458,4/17/2018,252,253,251,252,253,47100,4,2018,17,6.24,3.73,100.6267,2,7.5,9.7,4.6,9.5
1459,4/16/2018,251,251,251,251,251,330300,4,2018,16,6.24,3.73,100.7694,2,7.5,9.7,4.6,9.5
1460,4/13/2018,251,252,251,252,252,9900,4,2018,13,6.24,3.73,100.8667,2,7.5,9.7,4.6,9.5
1461,4/12/2018,251,252,251,252,252,220300,4,2018,12,6.24,3.73,100.9756,2,7.5,9.7,4.6,9.5
1462,4/11/2018,250,253,250,253,252,1059900,4,2018,11,6.24,3.73,101.0033,2,7.5,9.7,4.6,9.5
1463,4/10/2018,230,252,250,250,251,297800,4,2018,10,6.24,3.73,100.9906,2,7.5,9.7,4.6,9.5
1464,4/9/2018,252,252,251,252,252,50000,4,2018,9,6.24,3.73,101.0017,2,7.5,9.7,4.6,9.5
1465,4/6/2018,255,257,252,252,254,271600,4,2018,6,6.24,3.73,101.0278,2,7.5,9.7,4.6,9.5
1466,4/5/2018,257,257,250,256,256,293800,4,2018,5,6.24,3.73,101.0606,2,7.5,9.7,4.6,9.5
1467,4/4/2018,260,260,250,258,259,404400,4,2018,4,6.24,3.73,101.0656,2,7.5,9.7,4.6,9.5
1468,4/3/2018,240,260,250,260,260,118400,4,2018,3,6.24,3.73,100.8944,2,7.5,9.7,4.6,9.5
1469,3/29/2018,262,266,262,266,266,139000,3,2018,29,6.89,4.18,100.8472,2,7.5,9.7,4.4,9.5
1470,3/28/2018,263,264,260,264,263,39100,3,2018,28,6.89,4.18,100.8572,2,7.5,9.7,4.4,9.5
1471,3/27/2018,260,266,260,265,265,246300,3,2018,27,6.89,4.18,100.9083,2,7.5,9.7,4.4,9.5
1472,3/26/2018,260,262,255,262,262,856900,3,2018,26,6.89,4.18,100.9625,2,7.5,9.7,4.4,9.5
1473,3/23/2018,262,267,261,267,263,416100,3,2018,23,6.89,4.18,100.9669,2,7.5,9.7,4.4,9.5
1474,3/22/2018,260,265,260,261,261,55800,3,2018,22,6.89,4.18,101.0625,2,7.5,9.7,4.4,9.5
1475,3/21/2018,256,261,254,260,258,267200,3,2018,21,6.89,4.18,101.2667,2,7.5,9.7,4.4,9.5
1476,3/20/2018,250,257,252,255,255,198800,3,2018,20,6.89,4.18,101.2694,2,7.5,9.7,4.4,9.5
1477,3/19/2018,252,257,252,257,254,242600,3,2018,19,6.89,4.18,101.2783,2,7.5,9.7,4.4,9.5
1478,3/16/2018,246,255,245,252,253,469500,3,2018,16,6.89,4.18,101.2867,2,7.5,9.7,4.4,9.5
1479,3/15/2018,245,246,245,246,246,46300,3,2018,15,6.89,4.18,101.26,2,7.5,9.7,4.4,9.5
1480,3/14/2018,218,243,241,243,242,113400,3,2018,14,6.89,4.18,101.2744,2,7.5,9.7,4.4,9.5
1481,3/13/2018,222,242,236,241,240,162800,3,2018,13,6.89,4.18,101.2889,2,7.5,9.7,4.4,9.5
1482,3/12/2018,240,242,235,240,242,466400,3,2018,12,6.89,4.18,101.1472,2,7.5,9.7,4.4,9.5
1483,3/9/2018,240,245,235,240,240,220400,3,2018,9,6.89,4.18,101.2,2,7.5,9.7,4.4,9.5
1484,3/8/2018,240,242,240,240,241,41200,3,2018,8,6.89,4.18,101.2933,2,7.5,9.7,4.4,9.5
1485,3/7/2018,239,240,236,240,240,182400,3,2018,7,6.89,4.18,101.3078,2,7.5,9.7,4.4,9.5
1486,3/6/2018,220,240,235,240,240,307300,3,2018,6,6.89,4.18,101.3267,2,7.5,9.7,4.4,9.5
1487,3/5/2018,240,240,239,239,240,100900,3,2018,5,6.89,4.18,101.3222,2,7.5,9.7,4.4,9.5
1488,3/2/2018,239,240,239,240,240,117500,3,2018,2,6.89,4.18,101.2858,2,7.5,9.7,4.4,9.5
1489,3/1/2018,240,242,236,240,240,113800,3,2018,1,6.89,4.18,101.3833,2,7.5,9.7,4.4,9.5
1490,2/28/2018,240,240,238,239,240,621300,2,2018,28,7.4,4.46,101.6167,2,7.5,9.7,4.4,10
1491,2/27/2018,242,242,233,239,240,33800,2,2018,27,7.4,4.46,101.7417,2,7.5,9.7,4.4,10
1492,2/26/2018,240,243,240,243,241,22200,2,2018,26,7.4,4.46,101.8322,2,7.5,9.7,4.4,10
1493,2/23/2018,244,245,244,245,245,50300,2,2018,23,7.4,4.46,101.7322,2,7.5,9.7,4.4,10
1494,2/22/2018,245,245,232,232,245,164400,2,2018,22,7.4,4.46,101.4683,2,7.5,9.7,4.4,10
1495,2/21/2018,249,249,230,230,245,190300,2,2018,21,7.4,4.46,101.2972,2,7.5,9.7,4.4,10
1496,2/20/2018,245,249,245,245,246,435200,2,2018,20,7.4,4.46,101.3,2,7.5,9.7,4.4,10
1497,2/19/2018,245,248,245,245,248,25100,2,2018,19,7.4,4.46,101.3083,2,7.5,9.7,4.4,10
1498,2/16/2018,237,250,249,249,250,10400,2,2018,16,7.4,4.46,101.2517,2,7.5,9.7,4.4,10
1499,2/15/2018,247,250,246,250,250,20800,2,2018,15,7.4,4.46,101.2167,2,7.5,9.7,4.4,10
1500,2/14/2018,250,250,245,245,250,246100,2,2018,14,7.4,4.46,101.2333,2,7.5,9.7,4.4,10
1501,2/13/2018,250,250,249,250,250,130400,2,2018,13,7.4,4.46,101.0361,2,7.5,9.7,4.4,10
1502,2/12/2018,249,249,249,249,249,4800,2,2018,12,7.4,4.46,100.8483,2,7.5,9.7,4.4,10
1503,2/9/2018,250,251,249,251,251,1097600,2,2018,9,7.4,4.46,100.7956,2,7.5,9.7,4.4,10
1504,2/8/2018,251,251,250,250,251,14200,2,2018,8,7.4,4.46,101.0056,2,7.5,9.7,4.4,10
1505,2/7/2018,242,250,240,250,250,211400,2,2018,7,7.4,4.46,101.3061,2,7.5,9.7,4.4,10
1506,2/6/2018,250,250,247,247,250,77400,2,2018,6,7.4,4.46,101.3639,2,7.5,9.7,4.4,10
1507,2/5/2018,250,250,240,250,250,232300,2,2018,5,7.4,4.46,101.7361,2,7.5,9.7,4.4,10
1508,2/2/2018,251,252,250,251,251,217000,2,2018,2,7.4,4.46,101.9222,2,7.5,9.7,4.4,10
1509,2/1/2018,240,252,250,250,252,464100,2,2018,1,7.4,4.46,101.9917,2,7.5,9.7,4.4,10
1510,1/31/2018,253,257,252,252,253,113100,1,2018,31,7.79,4.83,102.3572,2,7.5,9.7,4.4,10
1511,1/30/2018,254,254,252,254,254,512300,1,2018,30,7.79,4.83,102.3611,2,7.5,9.7,4.4,10
1512,1/29/2018,251,254,251,254,253,37300,1,2018,29,7.79,4.83,102.3533,2,7.5,9.7,4.4,10
1513,1/26/2018,250,252,250,250,251,14700,1,2018,26,7.79,4.83,102.3667,2,7.5,9.7,4.4,10
1514,1/25/2018,249,250,249,250,250,213500,1,2018,25,7.79,4.83,102.3394,5.5,7.5,9.7,4.4,10
1515,1/24/2018,247,248,240,248,248,338200,1,2018,24,7.79,4.83,102.5556,5.5,7.5,9.7,4.4,10
1516,1/23/2018,240,250,245,250,248,340800,1,2018,23,7.79,4.83,102.785,5.5,7.5,9.7,4.4,10
1517,1/22/2018,242,246,242,246,245,17500,1,2018,22,7.79,4.83,102.8681,5.5,7.5,9.7,4.4,10
1518,1/19/2018,240,240,240,240,240,384500,1,2018,19,7.79,4.83,102.9083,5.5,7.5,9.7,4.4,10
1519,1/18/2018,237,239,237,238,238,133600,1,2018,18,7.79,4.83,102.8883,5.5,7.5,9.7,4.4,10
1520,1/17/2018,237,238,237,238,238,517900,1,2018,17,7.79,4.83,103.0361,5.5,7.5,9.7,4.4,10
1521,1/16/2018,237,239,235,238,239,236100,1,2018,16,7.79,4.83,103.0583,5.5,7.5,9.7,4.4,10
1522,1/15/2018,239,240,236,240,239,67200,1,2018,15,7.79,4.83,103.0667,5.5,7.5,9.7,4.4,10
1523,1/12/2018,230,240,235,237,240,437100,1,2018,12,7.79,4.83,103.0933,5.5,7.5,9.7,4.4,10
1524,1/11/2018,240,240,239,240,240,136600,1,2018,11,7.79,4.83,103.1433,5.5,7.5,9.7,4.4,10
1525,1/10/2018,236,240,236,240,240,638200,1,2018,10,7.79,4.83,103.1778,5.5,7.5,9.7,4.4,10
1526,1/9/2018,238,240,238,240,240,574600,1,2018,9,7.79,4.83,103.215,5.5,7.5,9.7,4.4,10
1527,1/8/2018,235,240,240,240,240,101000,1,2018,8,7.79,4.83,103.2606,5.5,7.5,9.7,4.4,10
1528,1/5/2018,240,240,240,240,240,666200,1,2018,5,7.79,4.83,103.2761,5.5,7.5,9.7,4.4,10
1529,1/4/2018,240,240,239,240,240,542800,1,2018,4,7.79,4.83,103.4389,5.5,7.5,9.7,4.4,10
1530,1/3/2018,237,240,234,234,240,58700,1,2018,3,7.79,4.83,103.3522,5.5,7.5,9.7,4.4,10
1531,1/2/2018,240,240,238,238,239,74400,1,2018,2,7.79,4.83,103.2944,5.5,7.5,9.7,4.4,10
1532,12/29/2017,243,243,233,236,239,500,12,2017,29,7.98,4.5,103.2317,5.5,7.5,9.71,4.2,10
1533,12/28/2017,243,233,233,233,233,21900,12,2017,28,7.98,4.5,103.1528,5.5,7.5,9.71,4.2,10
1534,12/27/2017,240,240,231,232,232,32600,12,2017,27,7.98,4.5,103.0806,5.5,7.5,9.71,4.2,10
1535,12/22/2017,245,245,239,239,245,400700,12,2017,22,7.98,4.5,103.0806,5.5,7.5,9.71,4.2,10
1536,12/21/2017,236,244,236,244,244,339600,12,2017,21,7.98,4.5,103.0889,5.5,7.5,9.71,4.2,10
1537,12/20/2017,245,245,235,242,243,3700,12,2017,20,7.98,4.5,103.1306,5.5,7.5,9.71,4.2,10
1538,12/19/2017,240,244,233,244,244,165200,12,2017,19,7.98,4.5,103.1572,5.5,7.5,9.71,4.2,10
1539,12/18/2017,245,245,245,245,245,37000,12,2017,18,7.98,4.5,103.1983,5.5,7.5,9.71,4.2,10
1540,12/15/2017,244,245,230,230,245,750100,12,2017,15,7.98,4.5,103.22,5.5,7.5,9.71,4.2,10
1541,12/14/2017,230,245,230,245,245,560800,12,2017,14,7.98,4.5,103.1667,5.5,7.5,9.71,4.2,10
1542,12/13/2017,247,247,235,236,244,301100,12,2017,13,7.98,4.5,103.1083,5.5,7.5,9.71,4.2,10
1543,12/11/2017,246,250,245,250,250,42200,12,2017,11,7.98,4.5,103.0778,5.5,7.5,9.71,4.2,10
1544,12/8/2017,243,245,241,245,244,13700,12,2017,8,7.98,4.5,102.9583,5.5,7.5,9.71,4.2,10
1545,12/7/2017,243,245,242,245,244,374700,12,2017,7,7.98,4.5,102.8778,5.5,7.5,9.71,4.2,10
1546,12/6/2017,241,245,241,245,245,188200,12,2017,6,7.98,4.5,102.9833,5.5,7.5,9.71,4.2,10
1547,12/5/2017,235,242,240,242,242,7000,12,2017,5,7.98,4.5,103.0611,5.5,7.5,9.71,4.2,10
1548,12/4/2017,240,242,238,242,241,88900,12,2017,4,7.98,4.5,103.0389,5.5,7.5,9.71,4.2,10
1549,12/1/2017,241,242,240,241,242,19700,12,2017,1,7.98,4.5,103.1028,5.5,7.5,9.71,4.2,10
1550,11/30/2017,240,241,239,241,241,392200,11,2017,30,8.15,4.73,103.2533,5.5,7.5,9.71,4.2,10
1551,11/29/2017,239,240,238,239,240,767100,11,2017,29,8.15,4.73,103.3533,5.5,7.5,9.71,4.2,10
1552,11/27/2017,242,242,238,238,242,31100,11,2017,27,8.15,4.73,103.3444,5.5,7.5,9.71,4.2,10
1553,11/24/2017,239,239,239,239,239,400,11,2017,24,8.15,4.73,103.2639,5.5,7.5,9.71,4.2,10
1554,11/23/2017,240,242,238,242,242,156000,11,2017,23,8.15,4.73,103.3861,5.5,7.5,9.71,4.2,10
1555,11/22/2017,238,239,238,238,239,266100,11,2017,22,8.15,4.73,103.365,5.5,7.5,9.71,4.2,10
1556,11/21/2017,238,245,237,238,239,477700,11,2017,21,8.15,4.73,103.6,5.5,7.5,9.71,4.2,10
1557,11/20/2017,238,238,231,231,238,548300,11,2017,20,8.15,4.73,103.7889,5.5,7.5,9.71,4.2,10
1558,11/17/2017,240,240,237,237,238,328900,11,2017,17,8.15,4.73,103.6939,5.5,7.5,9.71,4.2,10
1559,11/16/2017,240,241,240,240,241,237600,11,2017,16,8.15,4.73,103.7361,5.5,7.5,9.71,4.2,10
1560,11/15/2017,239,244,239,239,241,1071900,11,2017,15,8.15,4.73,103.6778,5.5,7.5,9.71,4.2,10
1561,11/14/2017,241,244,240,241,242,3500,11,2017,14,8.15,4.73,103.5861,5.5,7.5,9.71,4.2,10
1562,11/13/2017,240,242,240,241,241,53700,11,2017,13,8.15,4.73,103.5811,5.5,7.5,9.71,4.2,10
1563,11/10/2017,245,246,244,244,245,268000,11,2017,10,8.15,4.73,103.5933,5.5,7.5,9.71,4.2,10
1564,11/9/2017,245,250,245,246,246,45100,11,2017,9,8.15,4.73,103.6,5.5,7.5,9.71,4.2,10
1565,11/8/2017,244,245,244,245,245,75300,11,2017,8,8.15,4.73,103.6056,5.5,7.5,9.71,4.2,10
1566,11/7/2017,245,245,244,244,245,36400,11,2017,7,8.15,4.73,103.6194,5.5,7.5,9.71,4.2,10
1567,11/6/2017,245,245,244,245,245,604000,11,2017,6,8.15,4.73,103.6639,5.5,7.5,9.71,4.2,10
1568,11/3/2017,245,245,245,245,245,28700,11,2017,3,8.15,4.73,103.7389,5.5,7.5,9.71,4.2,10
1569,11/2/2017,260,260,244,244,246,275200,11,2017,2,8.15,4.73,103.7944,5.5,7.5,9.71,4.2,10
1570,11/1/2017,245,245,243,245,245,1154100,11,2017,1,8.15,4.73,103.75,5.5,7.5,9.71,4.2,10
1571,10/31/2017,245,245,240,245,245,1234200,10,2017,31,8.33,5.72,103.6944,5.5,7.5,9.71,4.2,10
1572,10/30/2017,245,245,245,245,245,141900,10,2017,30,8.33,5.72,103.6917,5.5,7.5,9.71,4.2,10
1573,10/30/2017,245,245,245,245,245,141900,10,2017,30,8.33,5.72,103.6917,5.5,7.5,9.71,4.2,10
1574,10/27/2017,247,248,244,245,246,247000,10,2017,27,8.33,5.72,103.8139,5.5,7.5,9.71,4.2,10
1575,10/24/2017,246,250,246,248,248,571400,10,2017,24,8.33,5.72,103.6961,5.5,7.5,9.71,4.2,10
1576,10/23/2017,240,247,244,245,245,681800,10,2017,23,8.33,5.72,103.5528,5.5,7.5,9.71,4.2,10
1577,10/19/2017,240,245,240,245,241,12900,10,2017,19,8.33,5.72,103.4167,5.5,7.5,9.71,4.2,10
1578,10/18/2017,240,249,240,240,243,28100,10,2017,18,8.33,5.72,103.3611,5.5,7.5,9.71,4.2,10
1579,10/17/2017,241,243,240,240,241,128000,10,2017,17,8.33,5.72,103.2961,5.5,7.5,9.71,4.2,10
1580,10/16/2017,241,242,241,242,242,119300,10,2017,16,8.33,5.72,103.2767,5.5,7.5,9.71,4.2,10
1581,10/13/2017,249,249,240,240,242,151500,10,2017,13,8.33,5.72,103.2783,5.5,7.5,9.71,4.2,10
1582,10/12/2017,250,250,250,250,250,100,10,2017,12,8.33,5.72,103.3028,5.5,7.5,9.71,4.2,10
1583,10/11/2017,245,250,245,250,246,461100,10,2017,11,8.33,5.72,103.225,5.5,7.5,9.71,4.2,10
1584,10/10/2017,250,250,245,250,247,300,10,2017,10,8.33,5.72,103.2667,5.5,7.5,9.71,4.2,10
1585,10/9/2017,250,250,245,245,246,289600,10,2017,9,8.33,5.72,103.225,5.5,7.5,9.71,4.2,10
1586,10/6/2017,249,249,247,247,249,39500,10,2017,6,8.33,5.72,103.2144,5.5,7.5,9.71,4.2,10
1587,10/5/2017,250,250,250,250,250,11300,10,2017,5,8.33,5.72,103.3139,5.5,7.5,9.71,4.2,10
1588,10/4/2017,253,253,249,250,250,192900,10,2017,4,8.33,5.72,103.3072,5.5,7.5,9.71,4.2,10
1589,10/2/2017,250,252,250,252,251,159700,10,2017,2,8.33,5.72,103.2222,5.5,7.5,9.71,4.2,10
1590,9/29/2017,252,252,250,250,251,249800,9,2017,29,8.4,7.06,103.2472,5.5,7.5,9.71,4.1,10
1591,9/28/2017,250,251,250,250,251,5500,9,2017,28,8.4,7.06,103.3439,5.5,7.5,9.71,4.1,10
1592,9/27/2017,248,255,250,255,251,60400,9,2017,27,8.4,7.06,103.34,5.5,7.5,9.71,4.1,10
1593,9/26/2017,250,250,247,250,250,409500,9,2017,26,8.4,7.06,103.2694,5.5,7.5,9.71,4.1,10
1594,9/25/2017,250,250,250,250,250,1600,9,2017,25,8.4,7.06,103.2611,5.5,7.5,9.71,4.1,10
1595,9/22/2017,248,248,248,248,248,300,9,2017,22,8.4,7.06,103.2872,5.5,7.5,9.71,4.1,10
1596,9/21/2017,250,250,247,247,248,649600,9,2017,21,8.4,7.06,103.315,5.5,7.5,9.71,4.1,10
1597,9/20/2017,250,254,250,250,253,29500,9,2017,20,8.4,7.06,103.275,5.5,7.5,9.71,4.1,10
1598,9/19/2017,249,260,249,260,254,14700,9,2017,19,8.4,7.06,103.1444,5.5,7.5,9.71,4.1,10
1599,9/18/2017,250,250,249,250,250,18300,9,2017,18,8.4,7.06,103.0333,5.5,7.5,9.71,4.1,10
1600,9/15/2017,249,250,246,249,250,450700,9,2017,15,8.4,7.06,102.8486,5.5,7.5,9.71,4.1,10
1601,9/14/2017,250,251,247,249,250,4900,9,2017,14,8.4,7.06,102.8706,5.5,7.5,9.71,4.1,10
1602,9/13/2017,245,250,245,247,247,87200,9,2017,13,8.4,7.06,102.8778,5.5,7.5,9.71,4.1,10
1603,9/12/2017,250,250,247,250,248,1298000,9,2017,12,8.4,7.06,102.7017,5.5,7.5,9.71,4.1,10
1604,9/11/2017,250,250,247,247,250,454700,9,2017,11,8.4,7.06,102.8944,5.5,7.5,9.71,4.1,10
1605,9/8/2017,250,250,247,247,250,301400,9,2017,8,8.4,7.06,103.1617,5.5,7.5,9.71,4.1,10
1606,9/7/2017,250,250,247,247,250,197700,9,2017,7,8.4,7.06,103.2417,5.5,7.5,9.71,4.1,10
1607,9/7/2017,250,250,247,247,250,197700,9,2017,7,8.4,7.06,103.2417,5.5,7.5,9.71,4.1,10
1608,9/6/2017,265,250,238,250,250,206400,9,2017,6,8.4,7.06,103.2528,5.5,7.5,9.71,4.1,10
1609,9/5/2017,246,250,244,244,247,617200,9,2017,5,8.4,7.06,103.2328,5.5,7.5,9.71,4.1,10
1610,9/4/2017,258,258,245,250,251,199800,9,2017,4,8.4,7.06,103.1639,5.5,7.5,9.71,4.1,10
1611,9/1/2017,260,262,250,250,258,456300,9,2017,1,8.4,7.06,102.8111,5.5,7.5,9.71,4.1,10
1612,8/31/2017,260,263,260,260,261,1600,8,2017,31,8.36,8.04,103.1433,5.5,7.5,9.71,4.1,10
1613,8/30/2017,263,263,260,260,263,529500,8,2017,30,8.36,8.04,103.1828,5.5,7.5,9.71,4.1,10
1614,8/29/2017,264,265,262,262,264,407400,8,2017,29,8.36,8.04,103.1728,5.5,7.5,9.71,4.1,10
1615,8/28/2017,267,268,267,267,268,21900,8,2017,28,8.36,8.04,103.1583,5.5,7.5,9.71,4.1,10
1616,8/25/2017,268,268,266,267,267,114400,8,2017,25,8.36,8.04,103.2528,5.5,7.5,9.71,4.1,10
1617,8/24/2017,267,267,267,267,267,514300,8,2017,24,8.36,8.04,103.2378,5.5,7.5,9.71,4.1,10
1618,8/23/2017,265,268,265,267,267,637400,8,2017,23,8.36,8.04,103.1778,5.5,7.5,9.71,4.1,10
1619,8/22/2017,268,268,262,267,268,605700,8,2017,22,8.36,8.04,103.1028,5.5,7.5,9.71,4.1,10
1620,8/21/2017,269,269,265,268,269,89900,8,2017,21,8.36,8.04,103.225,5.5,7.5,9.71,4.1,10
1621,8/18/2017,269,272,268,268,270,117500,8,2017,18,8.36,8.04,103.3878,5.5,7.5,9.71,4.1,10
1622,8/17/2017,250,269,269,269,269,5700,8,2017,17,8.36,8.04,103.6978,5.5,7.5,9.71,4.1,10
1623,8/16/2017,269,270,268,268,270,25900,8,2017,16,8.36,8.04,103.7456,5.5,7.5,9.71,4.1,10
1624,8/15/2017,267,268,265,268,267,365200,8,2017,15,8.36,8.04,103.7611,5.5,7.5,9.71,4.1,10
1625,8/14/2017,265,270,265,268,268,142900,8,2017,14,8.36,8.04,103.87,5.5,7.5,9.71,4.1,10
1626,8/11/2017,268,268,268,268,268,176600,8,2017,11,8.36,8.04,103.8972,5.5,7.5,9.71,4.1,10
1627,8/10/2017,268,268,265,268,268,50600,8,2017,10,8.36,8.04,103.9028,5.5,7.5,9.71,4.1,10
1628,8/9/2017,268,270,265,270,266,1300,8,2017,9,8.36,8.04,103.9039,5.5,7.5,9.71,4.1,10
1629,8/7/2017,267,267,264,265,267,88200,8,2017,7,8.36,8.04,103.8881,5.5,7.5,9.71,4.1,10
1630,8/4/2017,270,270,266,266,268,402600,8,2017,4,8.36,8.04,103.8672,5.5,7.5,9.71,4.1,10
1631,8/3/2017,269,270,269,270,270,1600,8,2017,3,8.36,8.04,103.8572,5.5,7.5,9.71,4.1,10
1632,8/2/2017,261,269,261,265,265,79800,8,2017,2,8.36,8.04,103.8739,5.5,7.5,9.71,4.1,10
1633,8/1/2017,260,266,265,266,266,511000,8,2017,1,8.36,8.04,103.9194,5.5,7.5,9.71,4.1,10
1634,7/31/2017,261,265,261,265,265,326500,7,2017,31,8.21,7.47,103.9111,5.5,7.5,9.71,4.1,10
1635,7/28/2017,265,267,264,266,265,1128800,7,2017,28,8.21,7.47,103.9094,5.5,7.5,9.71,4.1,10
1636,7/27/2017,260,265,256,265,265,258600,7,2017,27,8.21,7.47,103.9033,2,7.5,9.71,4.1,10
1637,7/26/2017,265,265,255,265,265,837000,7,2017,26,8.21,7.47,103.9072,2,7.5,9.71,4.1,10
1638,7/25/2017,256,265,256,265,263,461300,7,2017,25,8.21,7.47,103.8828,2,7.5,9.71,4.1,10
1639,7/24/2017,255,256,255,255,256,17500,7,2017,24,8.21,7.47,103.8661,2,7.5,9.71,4.1,10
1640,7/21/2017,250,255,253,255,255,23300,7,2017,21,8.21,7.47,103.8417,2,7.5,9.71,4.1,10
1641,7/20/2017,253,254,253,253,254,1600,7,2017,20,8.21,7.47,103.9469,2,7.5,9.71,4.1,10
1642,7/19/2017,255,255,252,253,253,15800,7,2017,19,8.21,7.47,103.9256,2,7.5,9.71,4.1,10
1643,7/18/2017,251,254,251,252,254,91900,7,2017,18,8.21,7.47,103.9072,2,7.5,9.71,4.1,10
1644,7/17/2017,250,251,250,251,251,107700,7,2017,17,8.21,7.47,103.9089,2,7.5,9.71,4.1,10
1645,7/14/2017,250,251,247,251,250,632900,7,2017,14,8.21,7.47,103.8889,2,7.5,9.71,4.1,10
1646,7/13/2017,246,246,246,246,246,665400,7,2017,13,8.21,7.47,103.9333,2,7.5,9.71,4.1,10
1647,7/12/2017,248,248,247,247,248,75900,7,2017,12,8.21,7.47,104.0167,2,7.5,9.71,4.1,10
1648,7/11/2017,248,250,246,246,247,1024600,7,2017,11,8.21,7.47,103.9217,2,7.5,9.71,4.1,10
1649,7/10/2017,245,250,248,249,250,20000,7,2017,10,8.21,7.47,103.835,2,7.5,9.71,4.1,10
1650,7/7/2017,250,260,249,260,252,8500,7,2017,7,8.21,7.47,103.8372,2,7.5,9.71,4.1,10
1651,7/6/2017,248,250,248,250,250,5100,7,2017,6,8.21,7.47,103.7839,2,7.5,9.71,4.1,10
1652,7/4/2017,240,250,240,245,246,139800,7,2017,4,8.21,7.47,103.8078,2,7.5,9.71,4.1,10
1653,7/3/2017,250,260,235,235,252,20500,7,2017,3,8.21,7.47,103.7167,2,7.5,9.71,4.1,10
1654,6/30/2017,260,260,240,240,260,179800,6,2017,30,8.13,9.21,103.7117,2,7.5,9.71,4,10
1655,6/29/2017,256,263,256,260,261,8300,6,2017,29,8.13,9.21,103.6783,2,7.5,9.71,4,10
1656,6/28/2017,260,263,258,260,260,74200,6,2017,28,8.13,9.21,103.6717,2,7.5,9.71,4,10
1657,6/28/2017,260,263,258,260,260,74200,6,2017,28,8.13,9.21,103.6717,2,7.5,9.71,4,10
1658,6/27/2017,260,265,260,264,264,201400,6,2017,27,8.13,9.21,103.6661,2,7.5,9.71,4,10
1659,6/23/2017,265,267,260,265,265,1008600,6,2017,23,8.13,9.21,103.6283,2,7.5,9.71,4,10
1660,6/22/2017,268,268,260,265,266,211700,6,2017,22,8.13,9.21,103.6256,2,7.5,9.71,4,10
1661,6/21/2017,268,269,265,268,268,322800,6,2017,21,8.13,9.21,103.62,2,7.5,9.71,4,10
1662,6/20/2017,250,267,250,267,261,1599800,6,2017,20,8.13,9.21,103.6156,2,7.5,9.71,4,10
1663,6/19/2017,260,260,260,260,260,12500,6,2017,19,8.13,9.21,103.5756,2,7.5,9.71,4,10
1664,6/16/2017,260,260,252,252,257,8700,6,2017,16,8.13,9.21,103.5547,2,7.5,9.71,4,10
1665,6/15/2017,248,260,246,260,250,309900,6,2017,15,8.13,9.21,103.4083,2,7.5,9.71,4,10
1666,6/14/2017,242,246,242,246,246,232400,6,2017,14,8.13,9.21,103.3694,2,7.5,9.71,4,10
1667,6/13/2017,238,242,238,242,242,32300,6,2017,13,8.13,9.21,103.34,2,7.5,9.71,4,10
1668,6/12/2017,240,242,238,239,240,82500,6,2017,12,8.13,9.21,103.3206,2,7.5,9.71,4,10
1669,6/9/2017,235,237,237,237,237,600,6,2017,9,8.13,9.21,103.3208,2,7.5,9.71,4,10
1670,6/8/2017,238,240,235,235,238,4000,6,2017,8,8.13,9.21,103.3194,2,7.5,9.71,4,10
1671,6/7/2017,240,240,232,239,239,337000,6,2017,7,8.13,9.21,103.3486,2,7.5,9.71,4,10
1672,6/6/2017,229,238,230,233,234,11500,6,2017,6,8.13,9.21,103.3622,2,7.5,9.71,4,10
1673,6/5/2017,241,242,240,240,241,93300,6,2017,5,8.13,9.21,103.3317,2,7.5,9.71,4,10
1674,6/2/2017,241,241,238,241,241,70400,6,2017,2,8.13,9.21,103.3544,2,7.5,9.71,4,10
1675,5/31/2017,241,241,240,241,241,973500,5,2017,31,7.84,11.7,103.3811,2,7.5,9.71,4,10
1676,5/30/2017,230,241,241,241,241,21800,5,2017,30,7.84,11.7,103.3561,2,7.5,9.71,4,10
1677,5/29/2017,240,242,240,242,242,642400,5,2017,29,7.84,11.7,103.3439,2,7.5,9.71,4,10
1678,5/26/2017,239,243,238,243,240,576300,5,2017,26,7.84,11.7,103.3094,2,7.5,9.71,4,10
1679,5/25/2017,237,240,235,239,239,303600,5,2017,25,7.84,11.7,103.2986,2,7.5,9.71,4,10
1680,5/24/2017,231,235,231,235,234,299700,5,2017,24,7.84,11.7,103.3,2,7.5,9.71,4,10
1681,5/23/2017,235,235,232,232,233,104600,5,2017,23,7.84,11.7,103.2883,2,7.5,9.71,4,10
1682,5/22/2017,233,234,233,234,234,224000,5,2017,22,7.84,11.7,103.3078,2,7.5,9.71,4,10
1683,5/19/2017,232,235,230,235,233,1632500,5,2017,19,7.84,11.7,103.3406,2,7.5,9.71,4,10
1684,5/18/2017,230,235,227,235,231,521400,5,2017,18,7.84,11.7,103.3378,2,7.5,9.71,4,10
1685,5/17/2017,227,230,227,230,228,75400,5,2017,17,7.84,11.7,103.3494,2,7.5,9.71,4,10
1686,5/16/2017,222,226,220,226,223,242400,5,2017,16,7.84,11.7,103.2333,2,7.5,9.71,4,10
1687,5/15/2017,230,233,222,222,231,87500,5,2017,15,7.84,11.7,103.2222,2,7.5,9.71,4,10
1688,5/12/2017,230,230,227,227,230,162200,5,2017,12,7.84,11.7,103.3778,2,7.5,9.71,4,10
1689,5/11/2017,233,233,230,233,233,14300,5,2017,11,7.84,11.7,103.3161,2,7.5,9.71,4,10
1690,5/10/2017,230,230,230,230,230,1800,5,2017,10,7.84,11.7,103.2006,2,7.5,9.71,4,10
1691,5/9/2017,230,233,224,224,231,212500,5,2017,9,7.84,11.7,103.175,2,7.5,9.71,4,10
1692,5/8/2017,233,233,230,230,231,126000,5,2017,8,7.84,11.7,103.1386,2,7.5,9.71,4,10
1693,5/5/2017,236,236,230,230,234,501100,5,2017,5,7.84,11.7,103.1442,2,7.5,9.71,4,10
1694,5/3/2017,230,230,230,230,230,100,5,2017,3,7.84,11.7,103.0972,2,7.5,9.71,4,10
1695,5/2/2017,234,234,230,234,234,248500,5,2017,2,7.84,11.7,103.1478,2,7.5,9.71,4,10
1696,4/28/2017,236,236,230,230,231,232800,4,2017,28,7.2,11.48,103.2222,2,7.5,9.71,4,10
1697,4/27/2017,237,238,235,236,237,28400,4,2017,27,7.2,11.48,103.2833,2,7.5,9.71,4,10
1698,4/26/2017,240,240,235,239,240,765300,4,2017,26,7.2,11.48,103.2711,2,7.5,9.71,4,10
1699,4/25/2017,235,240,235,239,239,302300,4,2017,25,7.2,11.48,103.2683,2,7.5,9.71,4,10
1700,4/24/2017,241,240,240,240,240,279800,4,2017,24,7.2,11.48,103.3247,2,7.5,9.71,4,10
1701,4/21/2017,240,241,240,240,241,690400,4,2017,21,7.2,11.48,103.3806,2,7.5,9.71,4,10
1702,4/20/2017,245,245,240,240,241,253500,4,2017,20,7.2,11.48,103.4139,2,7.5,9.71,4,10
1703,4/19/2017,243,243,240,241,241,396900,4,2017,19,7.2,11.48,103.4283,2,7.5,9.71,4,10
1704,4/18/2017,240,242,235,240,240,357000,4,2017,18,7.2,11.48,103.3617,2,7.5,9.71,4,10
1705,4/13/2017,240,243,240,240,243,1800,4,2017,13,7.2,11.48,103.4089,2,7.5,9.71,4,10
1706,4/12/2017,235,245,235,238,240,1600,4,2017,12,7.2,11.48,103.415,2,7.5,9.71,4,10
1707,4/11/2017,235,245,234,245,236,194900,4,2017,11,7.2,11.48,103.4444,2,7.5,9.71,4,10
1708,4/10/2017,231,232,231,232,232,62700,4,2017,10,7.2,11.48,103.3889,2,7.5,9.71,4,10
1709,4/7/2017,234,234,230,230,232,515100,4,2017,7,7.2,11.48,103.4372,2,7.5,9.71,4,10
1710,4/6/2017,230,234,230,234,232,3800,4,2017,6,7.2,11.48,103.2783,2,7.5,9.71,4,10
1711,4/5/2017,225,230,226,227,228,24100,4,2017,5,7.2,11.48,103.2367,2,7.5,9.71,4,10
1712,4/4/2017,225,227,225,227,227,24500,4,2017,4,7.2,11.48,103.1944,2,7.5,9.71,4,10
1713,4/3/2017,225,230,225,227,226,17000,4,2017,3,7.2,11.48,103.0989,2,7.5,9.71,4,10
1714,3/31/2017,225,228,225,228,228,67800,3,2017,31,6.76,10.28,103,2,7.5,9.71,3.7,10
1715,3/30/2017,226,226,226,226,226,200,3,2017,30,6.76,10.28,103.0167,2,7.5,9.71,3.7,10
1716,3/29/2017,230,230,225,225,226,24300,3,2017,29,6.76,10.28,102.9528,2,7.5,9.71,3.7,10
1717,3/28/2017,225,225,224,224,225,1800,3,2017,28,6.76,10.28,102.7061,2,7.5,9.71,3.7,10
1718,3/27/2017,199,225,218,225,224,19600,3,2017,27,6.76,10.28,102.9083,2,7.5,9.71,3.7,10
1719,3/24/2017,223,223,221,221,222,71700,3,2017,24,6.76,10.28,102.9472,2,7.5,9.71,3.7,10
1720,3/23/2017,225,225,221,221,222,6800,3,2017,23,6.76,10.28,102.8972,2,7.5,9.71,3.7,10
1721,3/22/2017,220,225,220,225,222,76400,3,2017,22,6.76,10.28,103.1056,2,7.5,9.71,3.7,10
1722,3/21/2017,220,220,215,220,219,137500,3,2017,21,6.76,10.28,103.1117,2,7.5,9.71,3.7,10
1723,3/20/2017,220,220,220,220,220,300,3,2017,20,6.76,10.28,103.1111,2,7.5,9.71,3.7,10
1724,3/17/2017,218,218,218,218,218,12300,3,2017,17,6.76,10.28,103.0306,2,7.5,9.71,3.7,10
1725,3/16/2017,218,218,218,218,218,22100,3,2017,16,6.76,10.28,102.8944,2,7.5,9.71,3.7,10
1726,3/15/2017,215,218,215,217,216,278900,3,2017,15,6.76,10.28,102.8122,2,7.5,9.71,3.7,10
1727,3/14/2017,214,216,211,215,215,2464600,3,2017,14,6.76,10.28,102.6711,2,7.5,9.71,3.7,10
1728,3/13/2017,213,215,213,215,215,537500,3,2017,13,6.76,10.28,102.615,2,7.5,9.71,3.7,10
1729,3/10/2017,210,214,210,214,214,27900,3,2017,10,6.76,10.28,102.5639,2,7.5,9.71,3.7,10
1730,3/9/2017,216,216,200,214,215,366300,3,2017,9,6.76,10.28,102.5628,2,7.5,9.71,3.7,10
1731,3/8/2017,215,217,215,216,216,5700,3,2017,8,6.76,10.28,102.6211,2,7.5,9.71,3.7,10
1732,3/7/2017,216,216,215,215,216,272600,3,2017,7,6.76,10.28,102.6428,2,7.5,9.71,3.7,10
1733,3/6/2017,216,216,215,216,216,450600,3,2017,6,6.76,10.28,102.6528,2,7.5,9.71,3.7,10
1734,3/3/2017,215,220,210,210,218,145800,3,2017,3,6.76,10.28,102.8761,2,7.5,9.71,3.7,10
1735,3/2/2017,220,229,218,219,220,517100,3,2017,2,6.76,10.28,102.8333,2,7.5,9.71,3.7,10
1736,3/1/2017,223,230,220,220,222,276700,3,2017,1,6.76,10.28,102.975,2,7.5,9.71,3.7,10
1737,2/28/2017,225,230,225,230,226,29100,2,2017,28,6.43,9.04,103.3417,2,7.5,9.71,3.7,10
1738,2/27/2017,230,226,226,226,226,100,2,2017,27,6.43,9.04,103.4678,2,7.5,9.71,3.7,10
1739,2/24/2017,230,230,225,226,227,290500,2,2017,24,6.43,9.04,103.5467,2,7.5,9.71,3.7,10
1740,2/23/2017,225,225,225,225,225,265600,2,2017,23,6.43,9.04,103.5944,2,7.5,9.71,3.7,10
1741,2/22/2017,225,226,220,226,225,50500,2,2017,22,6.43,9.04,103.5767,2,7.5,9.71,3.7,10
1742,2/22/2017,225,226,220,226,225,50500,2,2017,22,6.43,9.04,103.5767,2,7.5,9.71,3.7,10
1743,2/21/2017,225,225,220,220,225,10800,2,2017,21,6.43,9.04,103.5833,2,7.5,9.71,3.7,10
1744,2/20/2017,226,228,226,226,227,140800,2,2017,20,6.43,9.04,103.6222,2,7.5,9.71,3.7,10
1745,2/17/2017,226,230,221,224,225,369700,2,2017,17,6.43,9.04,103.6514,2,7.5,9.71,3.7,10
1746,2/16/2017,226,226,225,225,226,338700,2,2017,16,6.43,9.04,103.65,2,7.5,9.71,3.7,10
1747,2/15/2017,226,226,221,226,226,57100,2,2017,15,6.43,9.04,103.6608,2,7.5,9.71,3.7,10
1748,2/14/2017,221,225,221,222,223,5200,2,2017,14,6.43,9.04,103.67,2,7.5,9.71,3.7,10
1749,2/13/2017,226,226,220,220,226,251000,2,2017,13,6.43,9.04,103.6319,2,7.5,9.71,3.7,10
1750,2/10/2017,226,226,225,225,226,449200,2,2017,10,6.43,9.04,103.5333,2,7.5,9.71,3.7,10
1751,2/9/2017,225,229,225,229,226,7800,2,2017,9,6.43,9.04,103.6994,2,7.5,9.71,3.7,10
1752,2/8/2017,230,230,220,230,230,6800,2,2017,8,6.43,9.04,103.6989,2,7.5,9.71,3.7,10
1753,2/7/2017,230,232,229,230,231,409800,2,2017,7,6.43,9.04,103.6917,2,7.5,9.71,3.7,10
1754,2/6/2017,220,230,230,230,230,126800,2,2017,6,6.43,9.04,103.7583,2,7.5,9.71,3.7,10
1755,2/3/2017,221,230,225,230,230,423700,2,2017,3,6.43,9.04,103.8144,2,7.5,9.71,3.7,10
1756,2/2/2017,228,230,220,230,230,168100,2,2017,2,6.43,9.04,103.8233,2,7.5,9.71,3.7,10
1757,2/1/2017,228,230,228,230,230,104200,2,2017,1,6.43,9.04,103.8589,2,7.5,9.71,3.7,10
1758,1/31/2017,220,225,220,225,225,569100,1,2017,31,6.26,6.99,103.9556,2,7.5,9.71,3.7,10
1759,1/30/2017,220,228,219,226,221,12100,1,2017,30,6.26,6.99,103.9667,2,7.5,9.71,3.7,10
1760,1/27/2017,219,222,216,220,220,1203500,1,2017,27,6.26,6.99,103.9639,2,7.5,9.71,3.7,10
1761,1/26/2017,220,220,220,220,220,102100,1,2017,26,6.26,6.99,104.0028,5.5,7.5,9.71,3.7,10
1762,1/25/2017,220,220,218,218,220,142600,1,2017,25,6.26,6.99,103.9928,5.5,7.5,9.71,3.7,10
1763,1/24/2017,221,225,220,220,221,2352900,1,2017,24,6.26,6.99,103.9511,5.5,7.5,9.71,3.7,10
1764,1/23/2017,223,223,221,223,223,1055800,1,2017,23,6.26,6.99,103.8028,5.5,7.5,9.71,3.7,10
1765,1/20/2017,223,225,220,220,222,1422300,1,2017,20,6.26,6.99,103.8333,5.5,7.5,9.71,3.7,10
1766,1/19/2017,220,225,220,225,224,78200,1,2017,19,6.26,6.99,103.9494,5.5,7.5,9.71,3.7,10
1767,1/18/2017,220,222,220,220,221,1702300,1,2017,18,6.26,6.99,103.9611,5.5,7.5,9.71,3.7,10
1768,1/17/2017,215,223,215,223,221,9500,1,2017,17,6.26,6.99,103.9306,5.5,7.5,9.71,3.7,10
1769,1/16/2017,223,223,216,217,217,77700,1,2017,16,6.26,6.99,103.915,5.5,7.5,9.71,3.7,10
1770,1/13/2017,218,218,210,215,216,1623600,1,2017,13,6.26,6.99,103.8778,5.5,7.5,9.71,3.7,10
1771,1/12/2017,225,223,217,223,219,16300,1,2017,12,6.26,6.99,103.8283,5.5,7.5,9.71,3.7,10
1772,1/11/2017,225,227,215,215,224,385400,1,2017,11,6.26,6.99,103.8367,5.5,7.5,9.71,3.7,10
1773,1/10/2017,228,228,220,225,225,512700,1,2017,10,6.26,6.99,103.8056,5.5,7.5,9.71,3.7,10
1774,1/9/2017,228,230,225,225,226,12500,1,2017,9,6.26,6.99,103.6583,5.5,7.5,9.71,3.7,10
1775,1/6/2017,233,233,228,228,230,275100,1,2017,6,6.26,6.99,103.6094,5.5,7.5,9.71,3.7,10
1776,1/5/2017,235,239,232,233,234,806100,1,2017,5,6.26,6.99,103.4667,5.5,7.5,9.71,3.7,10
1777,1/4/2017,232,234,232,232,233,1100,1,2017,4,6.26,6.99,102.8128,5.5,7.5,9.71,3.7,10
1778,1/3/2017,240,245,240,245,241,52600,1,2017,3,6.26,6.99,102.5628,5.5,7.5,9.71,3.7,10
1779,12/30/2016,230,250,230,248,245,1200,12,2016,30,6.3,6.35,102.4858,5.5,12,12.2,3.5,10
1780,12/29/2016,229,230,228,230,229,432000,12,2016,29,6.3,6.35,102.4433,5.5,12,12.2,3.5,10
1781,12/28/2016,229,230,229,229,230,535500,12,2016,28,6.3,6.35,102.3589,5.5,12,12.2,3.5,10
1782,12/23/2016,230,230,228,230,230,24600,12,2016,23,6.3,6.35,102.3578,5.5,12,12.2,3.5,10
1783,12/22/2016,230,239,230,230,231,2100,12,2016,22,6.3,6.35,102.3472,5.5,12,12.2,3.5,10
1784,12/21/2016,239,239,230,230,233,173100,12,2016,21,6.3,6.35,102.3017,5.5,12,12.2,3.5,10
1785,12/20/2016,240,240,230,230,234,126300,12,2016,20,6.3,6.35,102.2417,5.5,12,12.2,3.5,10
1786,12/19/2016,237,237,226,226,236,235200,12,2016,19,6.3,6.35,102.1978,5.5,12,12.2,3.5,10
1787,12/16/2016,239,240,236,236,238,9600,12,2016,16,6.3,6.35,102.1861,5.5,12,12.2,3.5,10
1788,12/15/2016,240,240,238,240,240,95300,12,2016,15,6.3,6.35,102.1006,5.5,12,12.2,3.5,10
1789,12/14/2016,238,240,236,238,239,638500,12,2016,14,6.3,6.35,102.0978,5.5,12,12.2,3.5,10
1790,12/13/2016,238,240,236,238,239,497600,12,2016,13,6.3,6.35,102.0817,5.5,12,12.2,3.5,10
1791,12/9/2016,236,240,236,237,239,85400,12,2016,9,6.3,6.35,101.9739,5.5,12,12.2,3.5,10
1792,12/8/2016,242,245,238,240,241,612400,12,2016,8,6.3,6.35,101.9731,5.5,12,12.2,3.5,10
1793,12/7/2016,245,245,240,240,242,552500,12,2016,7,6.3,6.35,101.9144,5.5,12,12.2,3.5,10
1794,12/6/2016,245,245,244,244,245,239700,12,2016,6,6.3,6.35,101.8739,5.5,12,12.2,3.5,10
1795,12/5/2016,241,248,245,245,246,822400,12,2016,5,6.3,6.35,101.87,5.5,12,12.2,3.5,10
1796,12/2/2016,245,246,240,243,245,161800,12,2016,2,6.3,6.35,101.8586,5.5,12,12.2,3.5,10
1797,12/1/2016,246,246,240,240,245,356900,12,2016,1,6.3,6.35,101.8503,5.5,12,12.2,3.5,10
1798,11/30/2016,252,254,245,245,249,427700,11,2016,30,6.43,6.68,101.8769,5.5,12,12.2,3.5,10
1799,11/29/2016,250,260,249,260,250,441400,11,2016,29,6.43,6.68,101.8756,5.5,12,12.2,3.5,10
1800,11/28/2016,259,259,250,254,256,554100,11,2016,28,6.43,6.68,101.8939,5.5,12,12.2,3.5,10
1801,11/25/2016,260,260,255,258,258,169200,11,2016,25,6.43,6.68,101.8733,5.5,12,12.2,3.5,10
1802,11/24/2016,253,270,270,270,270,100,11,2016,24,6.43,6.68,101.865,5.5,12,12.2,3.5,10
1803,11/23/2016,260,260,255,260,260,105400,11,2016,23,6.43,6.68,101.8528,5.5,12,12.2,3.5,10
1804,11/22/2016,260,265,259,259,261,13400,11,2016,22,6.43,6.68,101.8556,5.5,12,12.2,3.5,10
1805,11/21/2016,260,260,260,260,260,17400,11,2016,21,6.43,6.68,101.8444,5.5,12,12.2,3.5,10
1806,11/18/2016,264,264,260,260,261,271800,11,2016,18,6.43,6.68,101.8278,5.5,12,12.2,3.5,10
1807,11/17/2016,270,275,260,275,263,171200,11,2016,17,6.43,6.68,101.8533,5.5,12,12.2,3.5,10
1808,11/16/2016,264,265,260,260,264,484700,11,2016,16,6.43,6.68,101.7717,5.5,12,12.2,3.5,10
1809,11/15/2016,260,266,262,262,265,159500,11,2016,15,6.43,6.68,101.7667,5.5,12,12.2,3.5,10
1810,11/14/2016,270,270,263,267,270,246700,11,2016,14,6.43,6.68,101.7417,5.5,12,12.2,3.5,10
1811,11/11/2016,268,268,263,263,266,94100,11,2016,11,6.43,6.68,101.7028,5.5,12,12.2,3.5,10
1812,11/10/2016,269,269,267,269,269,199900,11,2016,10,6.43,6.68,101.6983,5.5,12,12.2,3.5,10
1813,11/9/2016,270,275,266,266,272,117400,11,2016,9,6.43,6.68,101.7208,5.5,12,12.2,3.5,10
1814,11/8/2016,273,275,271,271,275,699000,11,2016,8,6.43,6.68,101.6222,5.5,12,12.2,3.5,10
1815,11/7/2016,272,279,272,275,276,31200,11,2016,7,6.43,6.68,101.6578,5.5,12,12.2,3.5,10
1816,11/4/2016,280,280,279,280,280,3000,11,2016,4,6.43,6.68,101.5911,5.5,12,12.2,3.5,10
1817,11/2/2016,282,282,280,282,282,118500,11,2016,2,6.43,6.68,101.5239,5.5,12,12.2,3.5,10
1818,11/1/2016,273,282,273,282,279,52600,11,2016,1,6.43,6.68,101.4761,5.5,12,12.2,3.5,10
1819,10/31/2016,270,279,271,279,277,35300,10,2016,31,6.48,6.47,101.4586,5.5,12,12.2,3.5,10
1820,10/28/2016,275,280,275,280,280,2000,10,2016,28,6.48,6.47,101.4342,5.5,12,12.2,3.5,10
1821,10/27/2016,275,275,275,275,275,1800,10,2016,27,6.48,6.47,101.3828,5.5,12,12.2,3.5,10
1822,10/26/2016,272,272,272,272,272,500,10,2016,26,6.48,6.47,101.3883,5.5,12,12.2,3.5,10
1823,10/25/2016,271,271,271,271,271,13800,10,2016,25,6.48,6.47,101.4039,5.5,12,12.2,3.5,10
1824,10/24/2016,271,280,271,273,273,1013500,10,2016,24,6.48,6.47,101.37,5.5,12,12.2,3.5,10
1825,10/21/2016,271,280,271,280,273,84300,10,2016,21,6.48,6.47,101.315,5.5,12,12.2,3.5,10
1826,10/19/2016,270,280,270,271,271,110900,10,2016,19,6.48,6.47,101.3078,5.5,12,12.2,3.5,10
1827,10/18/2016,261,280,270,280,273,400,10,2016,18,6.48,6.47,101.3528,5.5,12,12.2,3.5,10
1828,10/17/2016,279,280,265,265,269,2200,10,2016,17,6.48,6.47,101.3583,5.5,12,12.2,3.5,10
1829,10/14/2016,275,280,270,280,280,174900,10,2016,14,6.48,6.47,101.3475,5.5,12,12.2,3.5,10
1830,10/13/2016,280,280,267,280,280,56500,10,2016,13,6.48,6.47,101.2892,5.5,12,12.2,3.5,10
1831,10/12/2016,280,282,280,282,282,209300,10,2016,12,6.48,6.47,101.2953,5.5,12,12.2,3.5,10
1832,10/11/2016,270,285,280,285,284,713100,10,2016,11,6.48,6.47,101.2847,5.5,12,12.2,3.5,10
1833,10/10/2016,265,283,280,283,283,219600,10,2016,10,6.48,6.47,101.2653,5.5,12,12.2,3.5,10
1834,10/7/2016,280,285,280,280,281,23900,10,2016,7,6.48,6.47,101.25,5.5,12,12.2,3.5,10
1835,10/6/2016,282,285,280,280,284,116000,10,2016,6,6.48,6.47,101.27,5.5,12,12.2,3.5,10
1836,10/5/2016,280,283,280,283,281,148200,10,2016,5,6.48,6.47,101.26,5.5,12,12.2,3.5,10
1837,10/4/2016,279,281,277,280,280,101700,10,2016,4,6.48,6.47,101.2139,5.5,12,12.2,3.5,10
1838,10/3/2016,280,280,276,280,280,553700,10,2016,3,6.48,6.47,101.2206,5.5,12,12.2,3.5,10
1839,9/30/2016,280,278,277,278,278,97900,9,2016,30,6.5,6.34,101.2617,5.5,12,12.2,3.4,10
1840,9/29/2016,275,278,275,278,278,201800,9,2016,29,6.5,6.34,101.3133,5.5,12,12.2,3.4,10
1841,9/28/2016,270,275,270,275,272,408800,9,2016,28,6.5,6.34,101.2844,5.5,12,12.2,3.4,10
1842,9/27/2016,278,285,270,270,282,515100,9,2016,27,6.5,6.34,101.3011,5.5,12,12.2,3.4,10
1843,9/26/2016,284,288,284,288,286,245800,9,2016,26,6.5,6.34,101.1944,5.5,12,12.2,3.4,10
1844,9/23/2016,283,285,282,285,285,177100,9,2016,23,6.5,6.34,101.21,5.5,12,12.2,3.4,10
1845,9/22/2016,270,280,270,280,276,377000,9,2016,22,6.5,6.34,101.2706,5.5,12,12.2,3.4,10
1846,9/21/2016,265,270,270,270,270,2000,9,2016,21,6.5,6.34,101.2628,5.5,12,12.2,3.4,10
1847,9/20/2016,260,270,260,267,267,85300,9,2016,20,6.5,6.34,101.2856,5.5,12,12.2,3.4,10
1848,9/19/2016,260,265,259,265,264,50100,9,2016,19,6.5,6.34,101.2906,5.5,12,12.2,3.4,10
1849,9/16/2016,259,259,250,258,255,491200,9,2016,16,6.5,6.34,101.2872,5.5,12,12.2,3.4,10
1850,9/15/2016,250,251,250,251,251,100400,9,2016,15,6.5,6.34,101.2728,5.5,12,12.2,3.4,10
1851,9/14/2016,250,250,243,250,244,2800,9,2016,14,6.5,6.34,101.1844,5.5,12,12.2,3.4,10
1852,9/13/2016,245,250,239,250,243,274100,9,2016,13,6.5,6.34,101.2044,5.5,12,12.2,3.4,10
1853,9/9/2016,240,240,236,238,237,72900,9,2016,9,6.5,6.34,101.3028,5.5,12,12.2,3.4,10
1854,9/8/2016,240,250,236,241,237,138100,9,2016,8,6.5,6.34,101.3194,5.5,12,12.2,3.4,10
1855,9/7/2016,240,250,236,250,241,1386700,9,2016,7,6.5,6.34,101.3167,5.5,12,12.2,3.4,10
1856,9/6/2016,245,245,240,240,242,2092100,9,2016,6,6.5,6.34,101.2739,5.5,12,12.2,3.4,10
1857,9/5/2016,245,245,244,244,245,52800,9,2016,5,6.5,6.34,101.2356,5.5,12,12.2,3.4,10
1858,9/2/2016,245,245,244,244,245,115900,9,2016,2,6.5,6.34,101.2983,5.5,12,12.2,3.4,10
1859,9/1/2016,248,249,242,244,244,391400,9,2016,1,6.5,6.34,101.325,5.5,12,12.2,3.4,10
1860,8/31/2016,251,252,248,248,251,556300,8,2016,31,6.47,6.26,101.3589,5.5,12,12.2,3.4,10
1861,8/30/2016,260,260,250,250,252,834200,8,2016,30,6.47,6.26,101.3889,5.5,12,12.2,3.4,10
1862,8/29/2016,265,265,259,259,260,13800,8,2016,29,6.47,6.26,101.3817,5.5,12,12.2,3.4,10
1863,8/26/2016,266,266,263,263,266,147600,8,2016,26,6.47,6.26,101.3661,5.5,12,12.2,3.4,10
1864,8/25/2016,272,272,266,270,270,179900,8,2016,25,6.47,6.26,101.3744,5.5,12,12.2,3.4,10
1865,8/24/2016,269,282,266,273,273,11800,8,2016,24,6.47,6.26,101.3506,5.5,12,12.2,3.4,10
1866,8/23/2016,270,270,266,270,270,117200,8,2016,23,6.47,6.26,101.3756,5.5,12,12.2,3.4,10
1867,8/22/2016,270,270,265,270,267,400,8,2016,22,6.47,6.26,101.355,5.5,12,12.2,3.4,10
1868,8/19/2016,270,270,270,270,270,53600,8,2016,19,6.47,6.26,101.3722,5.5,12,12.2,3.4,10
1869,8/18/2016,270,270,270,270,270,52400,8,2016,18,6.47,6.26,101.4139,5.5,12,12.2,3.4,10
1870,8/17/2016,270,272,268,268,271,264600,8,2016,17,6.47,6.26,101.4811,5.5,12,12.2,3.4,10
1871,8/16/2016,271,272,271,271,272,264400,8,2016,16,6.47,6.26,101.4617,5.5,12,12.2,3.4,10
1872,8/15/2016,272,272,270,271,272,167100,8,2016,15,6.47,6.26,101.4639,5.5,12,12.2,3.4,10
1873,8/12/2016,273,273,271,273,273,336000,8,2016,12,6.47,6.26,101.4744,5.5,12,12.2,3.4,10
1874,8/11/2016,274,274,273,274,274,16000,8,2016,11,6.47,6.26,101.4939,5.5,12,12.2,3.4,10
1875,8/10/2016,275,275,272,272,275,73700,8,2016,10,6.47,6.26,101.4744,5.5,12,12.2,3.4,10
1876,8/9/2016,275,280,270,272,275,42300,8,2016,9,6.47,6.26,101.4489,5.5,12,12.2,3.4,10
1877,8/8/2016,275,278,275,275,276,357700,8,2016,8,6.47,6.26,101.3794,5.5,12,12.2,3.4,10
1878,8/5/2016,279,279,273,275,276,16600,8,2016,5,6.47,6.26,101.3939,5.5,12,12.2,3.4,10
1879,8/4/2016,270,280,273,273,280,15600,8,2016,4,6.47,6.26,101.4067,5.5,12,12.2,3.4,10
1880,8/3/2016,270,284,273,273,284,81200,8,2016,3,6.47,6.26,101.4117,5.5,12,12.2,3.4,10
1881,8/2/2016,287,287,280,286,287,362800,8,2016,2,6.47,6.26,101.4111,5.5,12,12.2,3.4,10
1882,8/1/2016,288,289,265,265,288,75600,8,2016,1,6.47,6.26,101.3972,5.5,12,12.2,3.4,10
1883,7/29/2016,285,290,285,290,290,211900,7,2016,29,6.44,6.4,101.3889,5.5,12,12.2,3.4,10.5
1884,7/28/2016,284,288,284,287,286,25700,7,2016,28,6.44,6.4,101.39,4.5,12,12.2,3.4,10.5
1885,7/27/2016,275,275,270,273,274,20600,7,2016,27,6.44,6.4,101.3167,4.5,12,12.2,3.4,10.5
1886,7/26/2016,267,270,267,270,268,67300,7,2016,26,6.44,6.4,101.3894,4.5,12,12.2,3.4,10.5
1887,7/25/2016,265,267,262,267,266,218100,7,2016,25,6.44,6.4,101.545,4.5,12,12.2,3.4,10.5
1888,7/22/2016,253,265,260,260,261,588500,7,2016,22,6.44,6.4,101.5544,4.5,12,12.2,3.4,10.5
1889,7/21/2016,262,270,265,265,266,459800,7,2016,21,6.44,6.4,101.5778,4.5,12,12.2,3.4,10.5
1890,7/20/2016,266,270,265,270,268,155700,7,2016,20,6.44,6.4,101.5678,4.5,12,12.2,3.4,10.5
1891,7/19/2016,265,270,264,270,266,114400,7,2016,19,6.44,6.4,101.4781,4.5,12,12.2,3.4,10.5
1892,7/18/2016,270,270,261,264,269,263000,7,2016,18,6.44,6.4,101.3847,4.5,12,12.2,3.4,10.5
1893,7/15/2016,270,270,269,269,270,135000,7,2016,15,6.44,6.4,101.3372,4.5,12,12.2,3.4,10.5
1894,7/14/2016,270,270,269,269,270,407100,7,2016,14,6.44,6.4,101.34,4.5,12,12.2,3.4,10.5
1895,7/13/2016,270,273,270,270,271,20300,7,2016,13,6.44,6.4,101.2872,4.5,12,12.2,3.4,10.5
1896,7/12/2016,274,275,270,270,273,182100,7,2016,12,6.44,6.4,101.2683,4.5,12,12.2,3.4,10.5
1897,7/11/2016,274,274,273,273,274,370100,7,2016,11,6.44,6.4,101.2372,4.5,12,12.2,3.4,10.5
1898,7/8/2016,273,274,273,274,274,276800,7,2016,8,6.44,6.4,101.1722,4.5,12,12.2,3.4,10.5
1899,7/6/2016,275,275,271,271,275,199400,7,2016,6,6.44,6.4,101.1194,4.5,12,12.2,3.4,10.5
1900,7/5/2016,284,275,260,274,274,352400,7,2016,5,6.44,6.4,101.1042,4.5,12,12.2,3.4,10.5
1901,7/4/2016,276,276,275,275,276,51000,7,2016,4,6.44,6.4,101.0867,4.5,12,12.2,3.4,10.5
1902,7/1/2016,278,277,275,276,276,611000,7,2016,1,6.44,6.4,101.0861,4.5,12,12.2,3.4,10.5
1903,6/30/2016,285,285,275,276,279,324300,6,2016,30,6.46,5.8,101.1022,4.5,12,12.2,3.3,10.5
1904,6/29/2016,288,288,288,288,288,0,6,2016,29,6.46,5.8,101.21,4.5,12,12.2,3.3,10.5
1905,6/28/2016,290,290,285,285,289,96800,6,2016,28,6.46,5.8,101.2417,4.5,12,12.2,3.3,10.5
1906,6/27/2016,285,285,280,285,283,200,6,2016,27,6.46,5.8,101.24,4.5,12,12.2,3.3,10.5
1907,6/24/2016,295,295,285,285,288,1800,6,2016,24,6.46,5.8,101.2739,4.5,12,12.2,3.3,10.5
1908,6/23/2016,299,299,285,294,296,22600,6,2016,23,6.46,5.8,101.2108,4.5,12,12.2,3.3,10.5
1909,6/22/2016,299,299,299,299,299,0,6,2016,22,6.46,5.8,101.1958,4.5,12,12.2,3.3,10.5
1910,6/21/2016,300,300,299,300,300,591300,6,2016,21,6.46,5.8,101.2456,4.5,12,12.2,3.3,10.5
1911,6/20/2016,300,300,300,300,300,558100,6,2016,20,6.46,5.8,101.2336,4.5,12,12.2,3.3,10.5
1912,6/17/2016,300,300,300,300,300,452000,6,2016,17,6.46,5.8,101.2603,4.5,12,12.2,3.3,10.5
1913,6/16/2016,300,305,300,304,303,266300,6,2016,16,6.46,5.8,101.2514,4.5,12,12.2,3.3,10.5
1914,6/15/2016,300,301,300,300,301,255900,6,2016,15,6.46,5.8,101.1442,4.5,12,12.2,3.3,10.5
1915,6/14/2016,286,300,285,300,300,196600,6,2016,14,6.46,5.8,101.1275,4.5,12,12.2,3.3,10.5
1916,6/13/2016,300,300,300,300,300,300,6,2016,13,6.46,5.8,101.1042,4.5,12,12.2,3.3,10.5
1917,6/10/2016,301,305,301,305,305,901400,6,2016,10,6.46,5.8,101.1203,4.5,12,12.2,3.3,10.5
1918,6/9/2016,301,302,300,301,302,2595900,6,2016,9,6.46,5.8,101.0889,4.5,12,12.2,3.3,10.5
1919,6/8/2016,300,301,300,301,301,431800,6,2016,8,6.46,5.8,101.1278,4.5,12,12.2,3.3,10.5
1920,6/7/2016,299,302,299,300,301,1148800,6,2016,7,6.46,5.8,101.1083,4.5,12,12.2,3.3,10.5
1921,6/6/2016,298,300,298,299,300,81500,6,2016,6,6.46,5.8,101.0042,4.5,12,12.2,3.3,10.5
1922,6/3/2016,297,325,278,295,307,5400,6,2016,3,6.46,5.8,100.9022,4.5,12,12.2,3.3,10.5
1923,6/2/2016,299,300,290,299,297,731500,6,2016,2,6.46,5.8,100.8444,4.5,12,12.2,3.3,10.5
1924,5/31/2016,275,295,275,292,292,287300,5,2016,31,6.59,5,100.8306,4.5,12,12.2,3.3,10.5
1925,5/30/2016,297,297,292,293,293,75500,5,2016,30,6.59,5,100.6606,4.5,12,12.2,3.3,10.5
1926,5/27/2016,304,305,301,303,303,258500,5,2016,27,6.59,5,100.6619,4.5,12,12.2,3.3,10.5
1927,5/26/2016,300,300,299,300,300,31300,5,2016,26,6.59,5,100.6722,4.5,12,12.2,3.3,10.5
1928,5/25/2016,299,300,298,300,300,255800,5,2016,25,6.59,5,100.8714,4.5,12,12.2,3.3,10.5
1929,5/24/2016,300,300,299,300,300,209600,5,2016,24,6.59,5,100.9272,4.5,12,12.2,3.3,10.5
1930,5/23/2016,298,300,297,300,299,1554200,5,2016,23,6.59,5,100.7947,4.5,12,12.2,3.3,10.5
1931,5/20/2016,298,298,297,297,298,55700,5,2016,20,6.59,5,100.6913,4.5,12,12.2,3.3,10.5
1932,5/19/2016,297,298,297,297,298,472000,5,2016,19,6.59,5,100.9712,4.5,12,12.2,3.3,10.5
1933,5/18/2016,296,300,296,300,298,13400,5,2016,18,6.59,5,100.8299,4.5,12,12.2,3.3,10.5
1934,5/17/2016,296,298,290,298,297,63100,5,2016,17,6.59,5,100.7127,4.5,12,12.2,3.3,10.5
1935,5/16/2016,297,298,279,298,298,68500,5,2016,16,6.59,5,100.6711,4.5,12,12.2,3.3,10.5
1936,5/13/2016,298,298,297,297,298,109800,5,2016,13,6.59,5,100.6,4.5,12,12.2,3.3,10.5
1937,5/12/2016,294,298,294,298,297,17000,5,2016,12,6.59,5,100.6339,4.5,12,12.2,3.3,10.5
1938,5/11/2016,297,300,297,297,298,4900,5,2016,11,6.59,5,100.6873,4.5,12,12.2,3.3,10.5
1939,5/10/2016,298,302,297,298,298,1607900,5,2016,10,6.59,5,100.5211,4.5,12,12.2,3.3,10.5
1940,5/9/2016,300,300,295,298,298,477700,5,2016,9,6.59,5,100.473,4.5,12,12.2,3.3,10.5
1941,5/6/2016,295,300,295,300,297,63700,5,2016,6,6.59,5,100.5744,4.5,12,12.2,3.3,10.5
1942,5/5/2016,297,297,295,295,296,36100,5,2016,5,6.59,5,100.6942,4.5,12,12.2,3.3,10.5
1943,5/4/2016,290,294,290,294,294,30100,5,2016,4,6.59,5,100.7896,4.5,12,12.2,3.3,10.5
1944,5/3/2016,298,300,291,294,295,290000,5,2016,3,6.59,5,101.1108,4.5,12,12.2,3.3,10.5
1945,4/29/2016,298,300,296,300,298,5300,4,2016,29,6.72,5.27,101.1413,4.5,12,12.2,3.3,11.5
1946,4/28/2016,300,300,289,292,297,5300,4,2016,28,6.72,5.27,101.1817,4.5,12,12.2,3.3,11.5
1947,4/27/2016,285,286,285,286,286,146400,4,2016,27,6.72,5.27,101.2029,2,12,12.2,3.3,11.5
1948,4/26/2016,282,286,282,286,286,587900,4,2016,26,6.72,5.27,101.2172,2,12,12.2,3.3,11.5
1949,4/25/2016,280,280,279,280,280,29100,4,2016,25,6.72,5.27,101.2115,2,12,12.2,3.3,11.5
1950,4/22/2016,281,285,278,284,284,372800,4,2016,22,6.72,5.27,101.14,2,12,12.2,3.3,11.5
1951,4/21/2016,280,280,273,280,280,298200,4,2016,21,6.72,5.27,101.1342,2,12,12.2,3.3,11.5
1952,4/20/2016,274,277,273,277,276,27500,4,2016,20,6.72,5.27,101.156,2,12,12.2,3.3,11.5
1953,4/19/2016,268,275,268,275,275,35400,4,2016,19,6.72,5.27,101.2046,2,12,12.2,3.3,11.5
1954,4/18/2016,270,275,270,275,274,188000,4,2016,18,6.72,5.27,101.2194,2,12,12.2,3.3,11.5
1955,4/15/2016,268,275,268,272,271,267400,4,2016,15,6.72,5.27,101.1662,2,12,12.2,3.3,11.5
1956,4/14/2016,270,272,269,270,272,42100,4,2016,14,6.72,5.27,101.137,2,12,12.2,3.3,11.5
1957,4/13/2016,270,278,270,270,271,36100,4,2016,13,6.72,5.27,101.1275,2,12,12.2,3.3,11.5
1958,4/12/2016,265,280,265,265,266,2100,4,2016,12,6.72,5.27,101.0896,2,12,12.2,3.3,11.5
1959,4/11/2016,265,284,279,279,280,9300,4,2016,11,6.72,5.27,101.1306,2,12,12.2,3.3,11.5
1960,4/8/2016,285,285,279,280,281,45000,4,2016,8,6.72,5.27,101.3413,2,12,12.2,3.3,11.5
1961,4/7/2016,282,286,280,285,285,417500,4,2016,7,6.72,5.27,101.3157,2,12,12.2,3.3,11.5
1962,4/6/2016,281,281,280,280,281,3100,4,2016,6,6.72,5.27,101.3785,2,12,12.2,3.3,11.5
1963,4/5/2016,280,280,280,280,280,200,4,2016,5,6.72,5.27,101.4799,2,12,12.2,3.3,11.5
1964,4/4/2016,285,285,280,283,282,1046500,4,2016,4,6.72,5.27,101.4292,2,12,12.2,3.3,11.5
1965,4/1/2016,285,290,281,281,284,2700,4,2016,1,6.72,5.27,101.3928,2,12,12.2,3.3,11.5
1966,3/31/2016,290,290,283,285,290,3100,3,2016,31,6.88,6.45,101.3339,2,12,12.2,3,11.5
1967,3/30/2016,290,290,285,285,286,154300,3,2016,30,6.88,6.45,101.5249,2,12,12.2,3,11.5
1968,3/29/2016,260,282,280,282,282,74600,3,2016,29,6.88,6.45,101.5292,2,12,12.2,3,11.5
1969,3/24/2016,284,285,284,284,285,50000,3,2016,24,6.88,6.45,101.5218,2,12,12.2,3,11.5
1970,3/23/2016,283,284,282,284,283,33400,3,2016,23,6.88,6.45,101.5248,2,12,12.2,3,11.5
1971,3/22/2016,280,284,280,284,282,8400,3,2016,22,6.88,6.45,101.4863,2,12,12.2,3,11.5
1972,3/21/2016,280,283,280,281,281,8200,3,2016,21,6.88,6.45,101.4599,2,12,12.2,3,11.5
1973,3/18/2016,284,285,284,284,285,465000,3,2016,18,6.88,6.45,101.4484,2,12,12.2,3,11.5
1974,3/17/2016,284,284,281,281,284,492600,3,2016,17,6.88,6.45,101.4848,2,12,12.2,3,11.5
1975,3/16/2016,257,283,280,283,283,105500,3,2016,16,6.88,6.45,101.4948,2,12,12.2,3,11.5
1976,3/15/2016,283,284,283,284,284,346100,3,2016,15,6.88,6.45,101.535,2,12,12.2,3,11.5
1977,3/14/2016,270,284,281,283,283,504800,3,2016,14,6.88,6.45,101.4445,2,12,12.2,3,11.5
1978,3/11/2016,270,283,256,270,283,662900,3,2016,11,6.88,6.45,101.4475,2,12,12.2,3,11.5
1979,3/10/2016,270,283,282,283,283,303100,3,2016,10,6.88,6.45,101.581,2,12,12.2,3,11.5
1980,3/9/2016,282,283,282,282,283,1402700,3,2016,9,6.88,6.45,101.602,2,12,12.2,3,11.5
1981,3/8/2016,282,284,282,284,283,79900,3,2016,8,6.88,6.45,101.4109,2,12,12.2,3,11.5
1982,3/7/2016,282,282,280,281,282,522500,3,2016,7,6.88,6.45,101.3895,2,12,12.2,3,11.5
1983,3/4/2016,250,280,273,276,278,10200,3,2016,4,6.88,6.45,101.335,2,12,12.2,3,11.5
1984,3/3/2016,274,275,270,275,271,5700,3,2016,3,6.88,6.45,101.3975,2,12,12.2,3,11.5
1985,3/2/2016,270,274,270,274,271,432900,3,2016,2,6.88,6.45,101.5671,2,12,12.2,3,11.5
1986,3/1/2016,266,270,265,269,269,222800,3,2016,1,6.88,6.45,101.6743,2,12,12.2,3,11.5
1987,2/29/2016,268,269,265,269,269,293500,2,2016,29,6.87,6.84,101.6971,2,12,12.2,3,11.5
1988,2/26/2016,275,285,262,269,269,10200,2,2016,26,6.87,6.84,101.7833,2,12,12.2,3,11.5
1989,2/25/2016,260,279,260,272,272,9100,2,2016,25,6.87,6.84,101.7805,2,12,12.2,3,11.5
1990,2/24/2016,278,279,260,260,276,146500,2,2016,24,6.87,6.84,101.7856,2,12,12.2,3,11.5
1991,2/23/2016,279,279,279,279,279,500,2,2016,23,6.87,6.84,101.8038,2,12,12.2,3,11.5
1992,2/22/2016,256,281,261,280,281,588800,2,2016,22,6.87,6.84,101.8133,2,12,12.2,3,11.5
1993,2/19/2016,267,284,257,284,283,91600,2,2016,19,6.87,6.84,101.7917,2,12,12.2,3,11.5
1994,2/18/2016,282,282,280,282,282,579300,2,2016,18,6.87,6.84,101.7954,2,12,12.2,3,11.5
1995,2/17/2016,275,285,275,285,282,102300,2,2016,17,6.87,6.84,101.7999,2,12,12.2,3,11.5
1996,2/16/2016,281,285,280,285,282,325800,2,2016,16,6.87,6.84,101.8257,2,12,12.2,3,11.5
1997,2/15/2016,282,282,279,280,280,9900,2,2016,15,6.87,6.84,101.8145,2,12,12.2,3,11.5
1998,2/12/2016,280,282,280,281,282,188500,2,2016,12,6.87,6.84,101.8271,2,12,12.2,3,11.5
1999,2/11/2016,280,285,279,284,282,352000,2,2016,11,6.87,6.84,101.7729,2,12,12.2,3,11.5
2000,2/10/2016,280,280,277,280,280,72400,2,2016,10,6.87,6.84,101.9284,2,12,12.2,3,11.5
2001,2/9/2016,277,280,273,273,280,2045300,2,2016,9,6.87,6.84,101.9427,2,12,12.2,3,11.5
2002,2/8/2016,279,279,275,277,276,92700,2,2016,8,6.87,6.84,102.1314,2,12,12.2,3,11.5
2003,2/5/2016,273,273,273,273,273,100,2,2016,5,6.87,6.84,102.1614,2,12,12.2,3,11.5
2004,2/4/2016,271,280,271,280,276,1036000,2,2016,4,6.87,6.84,102.2828,2,12,12.2,3,11.5
2005,2/3/2016,270,280,267,280,271,933300,2,2016,3,6.87,6.84,102.2685,2,12,12.2,3,11.5
2006,2/2/2016,260,270,265,270,267,4400,2,2016,2,6.87,6.84,102.288,2,12,12.2,3,11.5
2007,1/29/2016,265,266,265,265,266,1503000,1,2016,29,6.77,7.78,102.2834,2,12,12.2,3,11.5
2008,1/28/2016,267,280,265,265,266,911200,1,2016,28,6.77,7.78,102.277,2,12,12.2,3,11.5
2009,1/27/2016,256,280,265,280,266,348200,1,2016,27,6.77,7.78,102.3194,6,12,12.2,3,11.5
2010,1/26/2016,261,270,260,270,261,69100,1,2016,26,6.77,7.78,102.3437,6,12,12.2,3,11.5
2011,1/25/2016,255,260,255,260,260,251300,1,2016,25,6.77,7.78,102.3142,6,12,12.2,3,11.5
2012,1/22/2016,255,255,255,255,255,0,1,2016,22,6.77,7.78,102.3285,6,12,12.2,3,11.5
2013,1/21/2016,257,260,255,260,256,243100,1,2016,21,6.77,7.78,102.3828,6,12,12.2,3,11.5
2014,1/20/2016,255,260,255,260,256,34700,1,2016,20,6.77,7.78,102.4013,6,12,12.2,3,11.5
2015,1/19/2016,260,264,255,255,256,1413500,1,2016,19,6.77,7.78,102.3699,6,12,12.2,3,11.5
2016,1/18/2016,262,265,260,260,261,1049800,1,2016,18,6.77,7.78,102.3617,6,12,12.2,3,11.5
2017,1/15/2016,268,270,260,265,266,442600,1,2016,15,6.77,7.78,102.3525,6,12,12.2,3,11.5
2018,1/14/2016,270,270,248,268,269,919300,1,2016,14,6.77,7.78,102.3664,6,12,12.2,3,11.5
2019,1/13/2016,272,275,263,270,272,275300,1,2016,13,6.77,7.78,102.3583,6,12,12.2,3,11.5
2020,1/12/2016,272,279,272,272,276,1064300,1,2016,12,6.77,7.78,102.3357,6,12,12.2,3,11.5
2021,1/11/2016,280,281,260,260,280,13100,1,2016,11,6.77,7.78,102.2165,6,12,12.2,3,11.5
2022,1/8/2016,290,290,280,290,289,5400,1,2016,8,6.77,7.78,102.1471,6,12,12.2,3,11.5
2023,1/7/2016,270,300,281,299,299,6700,1,2016,7,6.77,7.78,102.2605,6,12,12.2,3,11.5
2024,1/6/2016,275,290,275,290,280,361300,1,2016,6,6.77,7.78,102.2742,6,12,12.2,3,11.5
2025,1/5/2016,273,277,273,277,277,237000,1,2016,5,6.77,7.78,102.2674,6,12,12.2,3,11.5
2026,1/4/2016,270,273,270,270,271,900,1,2016,4,6.77,7.78,102.2948,6,12,12.2,3,11.5
2027,12/31/2015,273,273,273,273,273,2100,12,2015,31,6.58,8.01,102.3114,6,7.5,11.32,2.8,11.5
2028,12/30/2015,273,273,270,273,273,4900,12,2015,30,6.58,8.01,102.2303,6,7.5,11.32,2.8,11.5
2029,12/29/2015,279,279,270,275,274,53900,12,2015,29,6.58,8.01,102.257,6,7.5,11.32,2.8,11.5
2030,12/28/2015,270,270,270,270,270,100,12,2015,28,6.58,8.01,102.2951,6,7.5,11.32,2.8,11.5
2031,12/24/2015,270,270,270,270,270,200,12,2015,24,6.58,8.01,102.3123,6,7.5,11.32,2.8,11.5
2032,12/23/2015,270,271,254,254,271,676000,12,2015,23,6.58,8.01,102.2526,6,7.5,11.32,2.8,11.5
2033,12/22/2015,270,270,270,270,270,56200,12,2015,22,6.58,8.01,102.2442,6,7.5,11.32,2.8,11.5
2034,12/21/2015,275,275,265,270,273,101300,12,2015,21,6.58,8.01,102.3204,6,7.5,11.32,2.8,11.5
2035,12/18/2015,275,275,272,275,275,190000,12,2015,18,6.58,8.01,102.3548,6,7.5,11.32,2.8,11.5
2036,12/17/2015,251,276,265,265,275,1155700,12,2015,17,6.58,8.01,102.3157,6,7.5,11.32,2.8,11.5
2037,12/16/2015,276,279,272,275,276,1132000,12,2015,16,6.58,8.01,102.2097,6,7.5,11.32,2.8,11.5
2038,12/15/2015,276,280,276,276,277,581800,12,2015,15,6.58,8.01,102.1685,6,7.5,11.32,2.8,11.5
2039,12/14/2015,269,280,268,280,279,6200,12,2015,14,6.58,8.01,102.0579,6,7.5,11.32,2.8,11.5
2040,12/11/2015,252,280,276,280,277,127100,12,2015,11,6.58,8.01,101.8771,6,7.5,11.32,2.8,11.5
2041,12/10/2015,280,280,267,267,277,337100,12,2015,10,6.58,8.01,101.8943,6,7.5,11.32,2.8,11.5
2042,12/9/2015,276,277,275,276,277,1019200,12,2015,9,6.58,8.01,102.0213,6,7.5,11.32,2.8,11.5
2043,12/8/2015,280,280,275,275,276,1056500,12,2015,8,6.58,8.01,102.1185,6,7.5,11.32,2.8,11.5
2044,12/7/2015,265,275,265,275,275,608600,12,2015,7,6.58,8.01,102.1611,6,7.5,11.32,2.8,11.5
2045,12/4/2015,275,276,267,276,276,1050500,12,2015,4,6.58,8.01,102.1814,6,7.5,11.32,2.8,11.5
2046,12/3/2015,270,275,270,275,275,68700,12,2015,3,6.58,8.01,102.1854,6,7.5,11.32,2.8,11.5
2047,12/2/2015,250,279,266,277,277,538900,12,2015,2,6.58,8.01,102.1529,6,7.5,11.32,2.8,11.5
2048,12/1/2015,278,278,275,275,276,223200,12,2015,1,6.58,8.01,102.1842,6,7.5,11.32,2.8,11.5
2049,11/30/2015,270,280,272,279,279,761400,11,2015,30,6.42,7.32,102.1143,6,7.5,11.32,2.8,11.5
2050,11/27/2015,277,279,277,278,278,355700,11,2015,27,6.42,7.32,102.1363,6,7.5,11.32,2.8,11.5
2051,11/25/2015,277,278,277,278,278,45000,11,2015,25,6.42,7.32,102.1793,6,7.5,11.32,2.8,11.5
2052,11/24/2015,275,277,273,277,276,1422800,11,2015,24,6.42,7.32,102.2,6,7.5,11.32,2.8,11.5
2053,11/23/2015,275,276,275,275,276,37700,11,2015,23,6.42,7.32,102.1806,6,7.5,11.32,2.8,11.5
2054,11/20/2015,276,280,268,277,278,390500,11,2015,20,6.42,7.32,102.2011,6,7.5,11.32,2.8,11.5
2055,11/19/2015,276,280,276,278,278,423600,11,2015,19,6.42,7.32,102.1859,6,7.5,11.32,2.8,11.5
2056,11/18/2015,280,280,276,280,277,385200,11,2015,18,6.42,7.32,102.214,6,7.5,11.32,2.8,11.5
2057,11/17/2015,280,280,276,280,280,397200,11,2015,17,6.42,7.32,102.2372,6,7.5,11.32,2.8,11.5
2058,11/16/2015,270,280,270,280,278,333200,11,2015,16,6.42,7.32,102.3085,6,7.5,11.32,2.8,11.5
2059,11/13/2015,250,279,275,277,276,747700,11,2015,13,6.42,7.32,102.2524,6,7.5,11.32,2.8,11.5
2060,11/12/2015,275,275,275,275,275,173600,11,2015,12,6.42,7.32,102.2926,6,7.5,11.32,2.8,11.5
2061,11/12/2015,275,275,275,275,275,173600,11,2015,12,6.42,7.32,101.8771,6,7.5,11.32,2.8,11.5
2062,11/11/2015,275,278,271,275,275,268200,11,2015,11,6.42,7.32,102.2474,6,7.5,11.32,2.8,11.5
2063,11/10/2015,275,278,275,276,276,40100,11,2015,10,6.42,7.32,102.2443,6,7.5,11.32,2.8,11.5
2064,11/9/2015,275,279,275,279,278,308400,11,2015,9,6.42,7.32,102.2398,6,7.5,11.32,2.8,11.5
2065,11/6/2015,279,279,275,275,277,7100,11,2015,6,6.42,7.32,102.1284,6,7.5,11.32,2.8,11.5
2066,11/5/2015,275,279,274,275,276,1575300,11,2015,5,6.42,7.32,101.9715,6,7.5,11.32,2.8,11.5
2067,11/4/2015,275,276,272,275,276,222200,11,2015,4,6.42,7.32,102.0086,6,7.5,11.32,2.8,11.5
2068,11/3/2015,279,280,272,272,280,592500,11,2015,3,6.42,7.32,102.0099,6,7.5,11.32,2.8,11.5
2069,11/2/2015,275,280,275,280,276,3800,11,2015,2,6.42,7.32,101.9657,6,7.5,11.32,2.8,11.5
2070,10/30/2015,275,276,275,275,276,134900,10,2015,30,6.31,6.72,101.8,6,7.5,11.32,2.8,11.5
2071,10/29/2015,273,292,272,292,275,54300,10,2015,29,6.31,6.72,101.5571,6,7.5,11.32,2.8,11.5
2072,10/28/2015,271,275,270,275,273,374200,10,2015,28,6.31,6.72,101.6399,6,7.5,11.32,2.8,11.5
2073,10/27/2015,272,273,270,271,272,1923800,10,2015,27,6.31,6.72,101.6613,6,7.5,11.32,2.8,11.5
2074,10/26/2015,270,275,270,275,271,23400,10,2015,26,6.31,6.72,102.1572,6,7.5,11.32,2.8,11.5
2075,10/23/2015,270,271,270,271,271,50700,10,2015,23,6.31,6.72,102.0201,6,7.5,11.32,2.8,11.5
2076,10/22/2015,261,270,261,270,270,142400,10,2015,22,6.31,6.72,102.0997,6,7.5,11.32,2.8,11.5
2077,10/21/2015,255,265,255,261,261,34200,10,2015,21,6.31,6.72,102.1205,6,7.5,11.32,2.8,11.5
2078,10/19/2015,255,256,253,256,254,214600,10,2015,19,6.31,6.72,102.4563,6,7.5,11.32,2.8,11.5
2079,10/16/2015,253,254,253,254,254,284000,10,2015,16,6.31,6.72,103.0499,6,7.5,11.32,2.8,11.5
2080,10/15/2015,255,255,246,253,254,557500,10,2015,15,6.31,6.72,103.2442,6,7.5,11.32,2.8,11.5
2081,10/14/2015,255,255,245,253,254,162000,10,2015,14,6.31,6.72,103.2257,6,7.5,11.32,2.8,11.5
2082,10/13/2015,255,255,254,255,255,105000,10,2015,13,6.31,6.72,102.9543,6,7.5,11.32,2.8,11.5
2083,10/12/2015,260,260,255,257,257,453000,10,2015,12,6.31,6.72,103.0214,6,7.5,11.32,2.8,11.5
2084,10/9/2015,245,261,260,260,261,41500,10,2015,9,6.31,6.72,103.0828,6,7.5,11.32,2.8,11.5
2085,10/8/2015,260,267,261,261,267,155100,10,2015,8,6.31,6.72,103.3171,6,7.5,11.32,2.8,11.5
2086,10/7/2015,267,271,265,265,267,374700,10,2015,7,6.31,6.72,103.1556,6,7.5,11.32,2.8,11.5
2087,10/5/2015,272,272,270,270,272,571800,10,2015,5,6.31,6.72,103.9313,6,7.5,11.32,2.8,11.5
2088,10/2/2015,270,277,274,274,275,362900,10,2015,2,6.31,6.72,104.3943,6,7.5,11.32,2.8,11.5
2089,10/1/2015,280,280,275,275,278,361000,10,2015,1,6.31,6.72,104.6829,6,7.5,11.32,2.8,11.5
2090,9/30/2015,280,287,270,279,280,347800,9,2015,30,6.29,5.97,105.2928,6,7.5,11.32,2.8,11.5
2091,9/29/2015,284,286,280,280,282,272900,9,2015,29,6.29,5.97,105.2743,6,7.5,11.32,2.8,11.5
2092,9/28/2015,287,289,285,285,288,119800,9,2015,28,6.29,5.97,105.2444,6,7.5,11.32,2.8,11.5
2093,9/25/2015,290,290,290,290,290,86300,9,2015,25,6.29,5.97,105.2757,6,7.5,11.32,2.8,11.5
2094,9/24/2015,292,297,292,297,296,8000,9,2015,24,6.29,5.97,105.56,6,7.5,11.32,2.8,11.5
2095,9/23/2015,290,292,290,290,291,55200,9,2015,23,6.29,5.97,105.5597,6,7.5,11.32,2.8,11.5
2096,9/22/2015,294,294,290,290,291,26800,9,2015,22,6.29,5.97,105.3599,6,7.5,11.32,2.8,11.5
2097,9/21/2015,291,298,290,290,292,33500,9,2015,21,6.29,5.97,105.1067,6,7.5,11.32,2.8,11.5
2098,9/18/2015,300,300,290,290,295,16500,9,2015,18,6.29,5.97,105.6028,6,7.5,11.32,2.8,11.5
2099,9/17/2015,300,300,290,300,300,334300,9,2015,17,6.29,5.97,105.6784,6,7.5,11.32,2.8,11.5
2100,9/16/2015,305,305,299,300,301,165700,9,2015,16,6.29,5.97,105.6298,6,7.5,11.32,2.8,11.5
2101,9/15/2015,298,305,290,299,299,69000,9,2015,15,6.29,5.97,105.3783,6,7.5,11.32,2.8,11.5
2102,9/14/2015,298,300,290,298,298,132600,9,2015,14,6.29,5.97,105.2931,6,7.5,11.32,2.8,11.5
2103,9/11/2015,296,300,295,300,300,120200,9,2015,11,6.29,5.97,105.3575,6,7.5,11.32,2.8,11.5
2104,9/10/2015,290,301,282,282,299,414100,9,2015,10,6.29,5.97,105.214,6,7.5,11.32,2.8,11.5
2105,9/9/2015,285,290,282,290,287,97200,9,2015,9,6.29,5.97,105.4057,6,7.5,11.32,2.8,11.5
2106,9/8/2015,283,283,280,280,283,21900,9,2015,8,6.29,5.97,106.2455,6,7.5,11.32,2.8,11.5
2107,9/7/2015,281,281,277,281,281,1700,9,2015,7,6.29,5.97,105.5471,6,7.5,11.32,2.8,11.5
2108,9/4/2015,277,281,276,281,278,495500,9,2015,4,6.29,5.97,105.147,6,7.5,11.32,2.8,11.5
2109,9/3/2015,272,277,272,277,275,180900,9,2015,3,6.29,5.97,104.6886,6,7.5,11.32,2.8,11.5
2110,9/2/2015,275,277,273,273,275,688900,9,2015,2,6.29,5.97,104.227,6,7.5,11.32,2.8,11.5
2111,9/1/2015,275,280,275,275,276,177300,9,2015,1,6.29,5.97,103.9576,6,7.5,11.32,2.8,11.5
2112,8/31/2015,270,278,267,275,276,28300,8,2015,31,6.34,5.84,103.8699,6,7.5,11.32,2.8,11.5
2113,8/28/2015,270,273,265,273,271,1647600,8,2015,28,6.34,5.84,103.7533,6,7.5,11.32,2.8,11.5
2114,8/27/2015,265,270,261,261,266,3300,8,2015,27,6.34,5.84,103.604,6,7.5,11.32,2.8,11.5
2115,8/26/2015,270,279,270,270,271,334600,8,2015,26,6.34,5.84,103.8061,6,7.5,11.32,2.8,11.5
2116,8/25/2015,285,285,275,277,282,223500,8,2015,25,6.34,5.84,103.7712,6,7.5,11.32,2.8,11.5
2117,8/24/2015,291,295,290,290,291,53200,8,2015,24,6.34,5.84,103.6042,6,7.5,11.32,2.8,11.5
2118,8/21/2015,295,295,295,295,295,100100,8,2015,21,6.34,5.84,103.4756,6,7.5,11.32,2.8,11.5
2119,8/20/2015,300,300,292,292,300,138000,8,2015,20,6.34,5.84,103.5285,6,7.5,11.32,2.8,11.5
2120,8/19/2015,306,306,300,300,302,291900,8,2015,19,6.34,5.84,103.1596,6,7.5,11.32,2.8,11.5
2121,8/18/2015,306,307,305,306,306,120600,8,2015,18,6.34,5.84,102.9,6,7.5,11.32,2.8,11.5
2122,8/17/2015,305,311,304,306,307,158300,8,2015,17,6.34,5.84,102.2911,6,7.5,11.32,2.8,11.5
2123,8/14/2015,303,309,303,309,308,9700,8,2015,14,6.34,5.84,102.2534,6,7.5,11.32,2.8,11.5
2124,8/13/2015,305,305,300,302,302,342700,8,2015,13,6.34,5.84,101.1539,6,7.5,11.32,2.8,11.5
2125,8/12/2015,300,310,302,303,310,77900,8,2015,12,6.34,5.84,100.9167,6,7.5,11.32,2.8,11.5
2126,8/11/2015,310,315,310,313,314,723300,8,2015,11,6.34,5.84,101.1317,6,7.5,11.32,2.8,11.5
2127,8/10/2015,310,312,310,310,311,108500,8,2015,10,6.34,5.84,101.1142,6,7.5,11.32,2.8,11.5
2128,8/7/2015,300,305,300,305,305,57000,8,2015,7,6.34,5.84,101.2045,6,7.5,11.32,2.8,11.5
2129,8/6/2015,295,300,295,298,298,43500,8,2015,6,6.34,5.84,101.2954,6,7.5,11.32,2.8,11.5
2130,8/5/2015,295,298,285,296,296,326200,8,2015,5,6.34,5.84,101.1118,6,7.5,11.32,2.8,11.5
2131,8/4/2015,296,297,295,295,296,6200,8,2015,4,6.34,5.84,101.3255,6,7.5,11.32,2.8,11.5
2132,8/3/2015,288,300,285,296,296,78600,8,2015,3,6.34,5.84,101.7743,6,7.5,11.32,2.8,11.5
2133,7/31/2015,290,297,285,295,295,578900,7,2015,31,6.54,6.62,102.5212,6,7.5,11.32,2.8,11.5
2134,7/30/2015,285,290,285,286,286,9500,7,2015,30,6.54,6.62,101.8798,1.5,7.5,11.32,2.8,11.5
2135,7/29/2015,290,290,288,288,290,101400,7,2015,29,6.54,6.62,102.4316,1.5,7.5,11.32,2.8,11.5
2136,7/28/2015,297,298,292,295,297,68500,7,2015,28,6.54,6.62,102.0455,1.5,7.5,11.32,2.8,11.5
2137,7/27/2015,298,305,296,300,298,31400,7,2015,27,6.54,6.62,101.2913,1.5,7.5,11.32,2.8,11.5
2138,7/24/2015,290,291,290,290,291,86700,7,2015,24,6.54,6.62,100.7268,1.5,7.5,11.32,2.8,11.5
2139,7/23/2015,290,291,290,290,291,73300,7,2015,23,6.54,6.62,100.5213,1.5,7.5,11.32,2.8,11.5
2140,7/22/2015,287,292,287,289,290,154600,7,2015,22,6.54,6.62,101.4984,1.5,7.5,11.32,2.8,11.5
2141,7/21/2015,290,290,285,290,288,158800,7,2015,21,6.54,6.62,102.551,1.5,7.5,11.32,2.8,11.5
2142,7/20/2015,285,285,285,285,285,373200,7,2015,20,6.54,6.62,102.4957,1.5,7.5,11.32,2.8,11.5
2143,7/17/2015,289,290,285,290,286,1098200,7,2015,17,6.54,6.62,102.5016,1.5,7.5,11.32,2.8,11.5
2144,7/16/2015,283,290,283,290,284,30600,7,2015,16,6.54,6.62,102.0386,1.5,7.5,11.32,2.8,11.5
2145,7/15/2015,289,289,283,283,284,320200,7,2015,15,6.54,6.62,101.5598,1.5,7.5,11.32,2.8,11.5
2146,7/14/2015,262,290,282,285,286,371600,7,2015,14,6.54,6.62,101.8089,1.5,7.5,11.32,2.8,11.5
2147,7/13/2015,290,300,288,289,290,2500,7,2015,13,6.54,6.62,101.8489,1.5,7.5,11.32,2.8,11.5
2148,7/9/2015,280,280,275,280,277,2297400,7,2015,9,6.54,6.62,100.3683,1.5,7.5,11.32,2.8,11.5
2149,7/8/2015,285,285,276,280,281,386900,7,2015,8,6.54,6.62,100.4845,1.5,7.5,11.32,2.8,11.5
2150,7/7/2015,281,290,280,280,281,232900,7,2015,7,6.54,6.62,100.1084,1.5,7.5,11.32,2.8,11.5
2151,7/6/2015,262,289,262,275,278,1651300,7,2015,6,6.54,6.62,99.9769,1.5,7.5,11.32,2.8,11.5
2152,7/3/2015,290,290,290,290,290,6600,7,2015,3,6.54,6.62,99.5654,1.5,7.5,11.32,2.8,11.5
2153,7/2/2015,291,296,290,290,291,257700,7,2015,2,6.54,6.62,99.3197,1.5,7.5,11.32,2.8,11.5
2154,7/1/2015,290,305,290,297,299,1142000,7,2015,1,6.54,6.62,99.2226,1.5,7.5,11.32,2.8,11.5
2155,6/30/2015,305,310,301,305,305,332100,6,2015,30,6.63,7.03,98.6394,1.5,7.5,11.32,2.8,10
2156,6/29/2015,305,305,305,305,305,842400,6,2015,29,6.63,7.03,98.4997,1.5,7.5,11.32,2.8,10
2157,6/26/2015,308,309,300,309,309,278800,6,2015,26,6.63,7.03,98.5242,1.5,7.5,11.32,2.8,10
2158,6/25/2015,310,311,305,307,309,819400,6,2015,25,6.63,7.03,98.4483,1.5,7.5,11.32,2.8,10
2159,6/24/2015,310,317,301,310,310,467500,6,2015,24,6.63,7.03,98.7823,1.5,7.5,11.32,2.8,10
2160,6/23/2015,314,314,309,309,311,295000,6,2015,23,6.63,7.03,98.5884,1.5,7.5,11.32,2.8,10
2161,6/22/2015,315,315,310,310,315,170200,6,2015,22,6.63,7.03,98.554,1.5,7.5,11.32,2.8,10
2162,6/19/2015,315,317,315,315,316,527900,6,2015,19,6.63,7.03,98.181,1.5,7.5,11.32,2.8,10
2163,6/18/2015,315,316,315,315,316,316000,6,2015,18,6.63,7.03,97.8703,1.5,7.5,11.32,2.8,10
2164,6/17/2015,316,317,316,316,317,14200,6,2015,17,6.63,7.03,97.4944,1.5,7.5,11.32,2.8,10
2165,6/16/2015,316,318,316,318,318,113200,6,2015,16,6.63,7.03,97.3296,1.5,7.5,11.32,2.8,10
2166,6/15/2015,320,320,315,315,318,695900,6,2015,15,6.63,7.03,97.2465,1.5,7.5,11.32,2.8,10
2167,6/12/2015,318,320,315,317,318,155100,6,2015,12,6.63,7.03,97.2083,1.5,7.5,11.32,2.8,10
2168,6/11/2015,316,318,315,318,317,656100,6,2015,11,6.63,7.03,97.0741,1.5,7.5,11.32,2.8,10
2169,6/10/2015,315,317,315,316,316,223000,6,2015,10,6.63,7.03,97.2041,1.5,7.5,11.32,2.8,10
2170,6/9/2015,315,318,313,318,316,134900,6,2015,9,6.63,7.03,97.8668,1.5,7.5,11.32,2.8,10
2171,6/8/2015,313,316,313,316,314,14000,6,2015,8,6.63,7.03,96.9395,1.5,7.5,11.32,2.8,10
2172,6/5/2015,316,320,315,316,316,105300,6,2015,5,6.63,7.03,96.114,1.5,7.5,11.32,2.8,10
2173,6/4/2015,317,317,312,312,317,316000,6,2015,4,6.63,7.03,96.8198,1.5,7.5,11.32,2.8,10
2174,6/3/2015,320,320,310,315,315,939600,6,2015,3,6.63,7.03,96.8727,1.5,7.5,11.32,2.8,10
2175,6/2/2015,301,310,301,310,305,153400,6,2015,2,6.63,7.03,97.5458,1.5,7.5,11.32,2.8,10
2176,5/29/2015,300,315,297,314,301,1723900,5,2015,29,6.65,6.87,97.781,1.5,7.5,11.32,2.8,8.5
2177,5/28/2015,299,300,292,298,298,31200,5,2015,28,6.65,6.87,98.235,1.5,7.5,11.32,2.8,8.5
2178,5/27/2015,300,300,286,300,300,564700,5,2015,27,6.65,6.87,98.3128,1.5,7.5,11.32,2.8,8.5
2179,5/26/2015,275,300,270,300,300,132700,5,2015,26,6.65,6.87,97.8957,1.5,7.5,11.32,2.8,8.5
2180,5/25/2015,295,305,295,298,301,757400,5,2015,25,6.65,6.87,97.3884,1.5,7.5,11.32,2.8,8.5
2181,5/22/2015,300,302,300,302,302,185700,5,2015,22,6.65,6.87,96.8052,1.5,7.5,11.32,2.8,8.5
2182,5/21/2015,304,304,300,300,301,19900,5,2015,21,6.65,6.87,96.7994,1.5,7.5,11.32,2.8,8.5
2183,5/20/2015,305,307,303,303,305,1274200,5,2015,20,6.65,6.87,96.5352,1.5,7.5,11.32,2.8,8.5
2184,5/19/2015,305,306,304,305,306,550700,5,2015,19,6.65,6.87,96.3111,1.5,7.5,11.32,2.8,8.5
2185,5/18/2015,304,318,304,305,305,528900,5,2015,18,6.65,6.87,95.9712,1.5,7.5,11.32,2.8,8.5
2186,5/15/2015,305,305,301,302,303,2433000,5,2015,15,6.65,6.87,96.1498,1.5,7.5,11.32,2.8,8.5
2187,5/14/2015,304,304,300,303,304,426000,5,2015,14,6.65,6.87,96.5341,1.5,7.5,11.32,2.8,8.5
2188,5/13/2015,302,320,302,302,307,269800,5,2015,13,6.65,6.87,96.5461,1.5,7.5,11.32,2.8,8.5
2189,5/12/2015,315,315,305,310,311,31400,5,2015,12,6.65,6.87,96.1868,1.5,7.5,11.32,2.8,8.5
2190,5/11/2015,315,315,315,315,315,22600,5,2015,11,6.65,6.87,95.4269,1.5,7.5,11.32,2.8,8.5
2191,5/8/2015,325,325,320,320,322,362300,5,2015,8,6.65,6.87,95.3079,1.5,7.5,11.32,2.8,8.5
2192,5/7/2015,325,329,325,325,326,217800,5,2015,7,6.65,6.87,95.1534,1.5,7.5,11.32,2.8,8.5
2193,5/6/2015,325,326,322,325,326,34600,5,2015,6,6.65,6.87,95.0431,1.5,7.5,11.32,2.8,8.5
2194,5/5/2015,325,330,322,330,329,78500,5,2015,5,6.65,6.87,94.7597,1.5,7.5,11.32,2.8,8.5
2195,5/4/2015,321,330,321,330,323,412000,5,2015,4,6.65,6.87,94.6444,1.5,7.5,11.32,2.8,8.5
2196,4/30/2015,320,322,320,320,322,322300,4,2015,30,6.69,7.08,94.6,1.5,7.5,11.32,2.8,8.5
2197,4/29/2015,318,326,320,320,321,15600,4,2015,29,6.69,7.08,94.4139,1.5,7.5,11.32,2.8,8.5
2198,4/28/2015,310,325,307,320,320,621100,4,2015,28,6.69,7.08,94.3,1.5,7.5,11.32,2.8,8.5
2199,4/27/2015,321,321,320,320,321,323200,4,2015,27,6.69,7.08,94.2222,1.5,7.5,11.32,2.8,8.5
2200,4/24/2015,307,320,307,320,320,152900,4,2015,24,6.69,7.08,94.0478,1.5,7.5,11.32,2.8,8.5
2201,4/23/2015,306,320,306,306,320,4800,4,2015,23,6.69,7.08,93.7944,1.5,7.5,11.32,2.8,8.5
2202,4/22/2015,310,330,310,320,321,785400,4,2015,22,6.69,7.08,93.7183,1.5,7.5,11.32,2.8,8.5
2203,4/21/2015,330,330,305,305,330,235900,4,2015,21,6.69,7.08,93.7778,1.5,7.5,11.32,2.8,8.5
2204,4/20/2015,330,330,330,330,330,152600,4,2015,20,6.69,7.08,93.4756,1.5,7.5,11.32,2.8,8.5
2205,4/17/2015,335,335,332,332,335,462300,4,2015,17,6.69,7.08,93.475,1.5,7.5,11.32,2.8,8.5
2206,4/16/2015,335,336,335,335,336,74100,4,2015,16,6.69,7.08,93.5,1.5,7.5,11.32,2.8,8.5
2207,4/15/2015,335,340,335,340,338,122500,4,2015,15,6.69,7.08,93.3767,1.5,7.5,11.32,2.8,8.5
2208,4/14/2015,335,338,330,338,338,128300,4,2015,14,6.69,7.08,93.245,1.5,7.5,11.32,2.8,8.5
2209,4/13/2015,300,335,320,335,334,363500,4,2015,13,6.69,7.08,92.975,1.5,7.5,11.32,2.8,8.5
2210,4/10/2015,325,326,323,326,326,76900,4,2015,10,6.69,7.08,92.8489,1.5,7.5,11.32,2.8,8.5
2211,4/9/2015,322,327,322,322,324,6700,4,2015,9,6.69,7.08,92.6847,1.5,7.5,11.32,2.8,8.5
2212,4/8/2015,321,329,321,326,325,18400,4,2015,8,6.69,7.08,92.55,1.5,7.5,11.32,2.8,8.5
2213,4/7/2015,321,326,321,326,325,16200,4,2015,7,6.69,7.08,92.775,1.5,7.5,11.32,2.8,8.5
2214,4/2/2015,325,325,318,324,322,139900,4,2015,2,6.69,7.08,92.5833,1.5,7.5,11.32,2.8,8.5
2215,4/1/2015,315,324,315,324,317,284300,4,2015,1,6.69,7.08,92.3917,1.5,7.5,11.32,2.8,8.5
2216,3/31/2015,301,323,294,310,312,273000,3,2015,31,6.63,6.31,92.335,1.5,7.5,11.32,2.8,8.5
2217,3/30/2015,325,325,320,320,325,200100,3,2015,30,6.63,6.31,92.1861,1.5,7.5,11.32,2.8,8.5
2218,3/27/2015,325,329,320,325,325,481800,3,2015,27,6.63,6.31,92.0319,1.5,7.5,11.32,2.8,8.5
2219,3/26/2015,325,326,325,325,326,338300,3,2015,26,6.63,6.31,91.7669,1.5,7.5,11.32,2.8,8.5
2220,3/25/2015,326,328,325,328,328,237300,3,2015,25,6.63,6.31,91.8144,1.5,7.5,11.32,2.8,8.5
2221,3/24/2015,321,329,321,329,326,112100,3,2015,24,6.63,6.31,91.965,1.5,7.5,11.32,2.8,8.5
2222,3/23/2015,324,327,320,327,326,326300,3,2015,23,6.63,6.31,92.0333,1.5,7.5,11.32,2.8,8.5
2223,3/20/2015,320,325,320,325,325,159700,3,2015,20,6.63,6.31,91.9856,1.5,7.5,11.32,2.8,8.5
2224,3/19/2015,320,326,320,325,326,868700,3,2015,19,6.63,6.31,91.8858,1.5,7.5,11.32,2.8,8.5
2225,3/18/2015,315,320,314,320,320,566100,3,2015,18,6.63,6.31,92.0506,1.5,7.5,11.32,2.8,8.5
2226,3/17/2015,307,320,307,317,315,622600,3,2015,17,6.63,6.31,92.0222,1.5,7.5,11.32,2.8,8.5
2227,3/16/2015,310,310,304,307,306,700,3,2015,16,6.63,6.31,91.7472,1.5,7.5,11.32,2.8,8.5
2228,3/13/2015,304,310,304,310,305,156400,3,2015,13,6.63,6.31,91.685,1.5,7.5,11.32,2.8,8.5
2229,3/12/2015,300,300,300,300,300,0,3,2015,12,6.63,6.31,91.7183,1.5,7.5,11.32,2.8,8.5
2230,3/11/2015,295,308,300,300,301,68600,3,2015,11,6.63,6.31,91.6278,1.5,7.5,11.32,2.8,8.5
2231,3/10/2015,300,309,299,309,301,438300,3,2015,10,6.63,6.31,91.4444,1.5,7.5,11.32,2.8,8.5
2232,3/9/2015,298,300,298,299,300,783300,3,2015,9,6.63,6.31,91.2194,1.5,7.5,11.32,2.8,8.5
2233,3/6/2015,297,300,297,300,300,679500,3,2015,6,6.63,6.31,91.1575,1.5,7.5,11.32,2.8,8.5
2234,3/5/2015,297,300,295,297,296,1151800,3,2015,5,6.63,6.31,91.1708,1.5,7.5,11.32,2.8,8.5
2235,3/4/2015,297,299,295,295,296,2463800,3,2015,4,6.63,6.31,91.3267,1.5,7.5,11.32,2.8,8.5
2236,3/3/2015,299,299,295,295,299,1027800,3,2015,3,6.63,6.31,91.4144,1.5,7.5,11.32,2.8,8.5
2237,3/2/2015,309,309,299,300,304,2067100,3,2015,2,6.63,6.31,91.4139,1.5,7.5,11.32,2.8,8.5
2238,2/27/2015,315,318,305,305,310,198500,2,2015,27,6.63,5.61,91.4231,1.5,7.5,11.32,2.8,8.5
2239,2/26/2015,332,332,314,318,319,131800,2,2015,26,6.63,5.61,91.4189,1.5,7.5,11.32,2.8,8.5
2240,2/25/2015,335,337,304,334,333,91500,2,2015,25,6.63,5.61,91.4106,1.5,7.5,11.32,2.8,8.5
2241,2/24/2015,337,340,335,337,337,50000,2,2015,24,6.63,5.61,91.4167,1.5,7.5,11.32,2.8,8.5
2242,2/23/2015,340,340,338,338,340,500900,2,2015,23,6.63,5.61,91.4008,1.5,7.5,11.32,2.8,8.5
2243,2/20/2015,320,350,345,346,346,797200,2,2015,20,6.63,5.61,91.4017,1.5,7.5,11.32,2.8,8.5
2244,2/19/2015,345,355,342,353,351,988000,2,2015,19,6.63,5.61,91.3639,1.5,7.5,11.32,2.8,8.5
2245,2/18/2015,338,344,338,344,342,593600,2,2015,18,6.63,5.61,91.4217,1.5,7.5,11.32,2.8,8.5
2246,2/17/2015,339,340,334,339,337,16300,2,2015,17,6.63,5.61,91.5367,1.5,7.5,11.32,2.8,8.5
2247,2/16/2015,330,338,330,338,335,224800,2,2015,16,6.63,5.61,91.5567,1.5,7.5,11.32,2.8,8.5
2248,2/13/2015,332,335,332,332,333,205100,2,2015,13,6.63,5.61,91.5422,1.5,7.5,11.32,2.8,8.5
2249,2/12/2015,323,332,323,332,327,97000,2,2015,12,6.63,5.61,91.5544,4,7.5,11.32,2.8,8.5
2250,2/11/2015,321,325,321,325,325,63900,2,2015,11,6.63,5.61,91.5733,4,7.5,11.32,2.8,8.5
2251,2/10/2015,316,325,316,320,321,131400,2,2015,10,6.63,5.61,91.5967,4,7.5,11.32,2.8,8.5
2252,2/9/2015,314,315,313,315,314,170800,2,2015,9,6.63,5.61,91.3183,4,7.5,11.32,2.8,8.5
2253,2/6/2015,310,312,310,312,312,50600,2,2015,6,6.63,5.61,91.3317,4,7.5,11.32,2.8,8.5
2254,2/5/2015,312,314,312,314,313,101700,2,2015,5,6.63,5.61,91.5556,4,7.5,11.32,2.8,8.5
2255,2/4/2015,311,312,311,312,312,118100,2,2015,4,6.63,5.61,91.5861,4,7.5,11.32,2.8,8.5
2256,2/3/2015,310,312,310,312,312,152000,2,2015,3,6.63,5.61,91.6683,4,7.5,11.32,2.8,8.5
2257,2/2/2015,313,315,309,315,313,108300,2,2015,2,6.63,5.61,91.6944,4,7.5,11.32,2.8,8.5
2258,1/30/2015,310,315,310,315,312,28900,1,2015,30,6.74,5.53,91.6736,4,7.5,11.32,2.8,8.5
2259,1/29/2015,315,314,309,309,311,578200,1,2015,29,6.74,5.53,91.5533,4,7.5,11.32,2.8,8.5
2260,1/28/2015,345,345,310,313,315,218900,1,2015,28,6.74,5.53,91.6694,4,7.5,11.32,2.8,8.5
2261,1/27/2015,314,318,313,318,316,339900,1,2015,27,6.74,5.53,91.6867,4,7.5,11.32,2.8,8.5
2262,1/26/2015,313,314,310,310,314,169800,1,2015,26,6.74,5.53,91.7472,4,7.5,11.32,2.8,8.5
2263,1/23/2015,310,318,309,315,314,368000,1,2015,23,6.74,5.53,91.7364,4,7.5,11.32,2.8,8.5
2264,1/22/2015,310,310,308,310,310,179600,1,2015,22,6.74,5.53,91.7367,4,7.5,11.32,2.8,8.5
2265,1/21/2015,310,307,303,307,307,16300,1,2015,21,6.74,5.53,91.6342,4,7.5,11.32,2.8,8.5
2266,1/20/2015,306,310,306,310,310,109200,1,2015,20,6.74,5.53,91.5944,4,7.5,11.32,2.8,8.5
2267,1/19/2015,305,306,304,306,306,12100,1,2015,19,6.74,5.53,91.4992,4,7.5,11.32,2.8,8.5
2268,1/16/2015,290,310,305,306,306,105300,1,2015,16,6.74,5.53,91.4831,4,7.5,11.32,2.8,8.5
2269,1/15/2015,303,306,303,306,305,6100,1,2015,15,6.74,5.53,91.3583,4,7.5,11.32,2.8,8.5
2270,1/14/2015,300,306,300,306,306,117000,1,2015,14,6.74,5.53,91.3333,4,7.5,11.32,2.8,8.5
2271,1/13/2015,301,310,300,301,306,104300,1,2015,13,6.74,5.53,91.2428,4,7.5,11.32,2.8,8.5
2272,1/12/2015,306,310,300,300,307,168800,1,2015,12,6.74,5.53,91.13,4,7.5,11.32,2.8,8.5
2273,1/9/2015,306,312,310,311,311,21400,1,2015,9,6.74,5.53,91.0989,4,7.5,11.32,2.8,8.5
2274,1/8/2015,305,310,305,310,309,58900,1,2015,8,6.74,5.53,91.1056,4,7.5,11.32,2.8,8.5
2275,1/7/2015,304,306,304,306,306,126800,1,2015,7,6.74,5.53,90.9228,4,7.5,11.32,2.8,8.5
2276,1/6/2015,303,308,303,307,308,264100,1,2015,6,6.74,5.53,90.8222,4,7.5,11.32,2.8,8.5
2277,1/5/2015,303,305,303,303,304,19500,1,2015,5,6.74,5.53,90.7944,4,7.5,11.32,2.8,8.5
2278,1/2/2015,302,302,302,302,302,804000,1,2015,2,6.74,5.53,90.7031,4,7.5,11.32,2.8,8.5
2279,12/31/2014,314,314,295,310,309,438400,12,2014,31,6.88,6.02,90.5978,4,5.5,8.22,2.7,8.5
2280,12/30/2014,306,314,302,314,310,226000,12,2014,30,6.88,6.02,90.7083,4,5.5,8.22,2.7,8.5
2281,12/29/2014,304,307,300,306,306,1956100,12,2014,29,6.88,6.02,90.5686,4,5.5,8.22,2.7,8.5
2282,12/24/2014,295,308,292,303,305,1621800,12,2014,24,6.88,6.02,90.5017,4,5.5,8.22,2.7,8.5
2283,12/23/2014,296,311,295,311,305,294800,12,2014,23,6.88,6.02,90.3756,4,5.5,8.22,2.7,8.5
2284,12/22/2014,296,296,295,296,296,1110100,12,2014,22,6.88,6.02,90.4289,4,5.5,8.22,2.7,8.5
2285,12/19/2014,280,295,273,295,281,657300,12,2014,19,6.88,6.02,90.4811,4,5.5,8.22,2.7,8.5
2286,12/18/2014,309,310,290,290,303,434500,12,2014,18,6.88,6.02,90.45,4,5.5,8.22,2.7,8.5
2287,12/17/2014,311,314,290,290,312,394600,12,2014,17,6.88,6.02,90.5947,4,5.5,8.22,2.7,8.5
2288,12/16/2014,311,313,310,312,312,233800,12,2014,16,6.88,6.02,90.6283,4,5.5,8.22,2.7,8.5
2289,12/15/2014,310,311,290,311,311,818700,12,2014,15,6.88,6.02,90.5317,4,5.5,8.22,2.7,8.5
2290,12/11/2014,300,320,300,317,316,567700,12,2014,11,6.88,6.02,90.5672,4,5.5,8.22,2.7,8.5
2291,12/10/2014,290,322,300,300,320,709400,12,2014,10,6.88,6.02,90.4583,4,5.5,8.22,2.7,8.5
2292,12/9/2014,321,324,321,323,323,271700,12,2014,9,6.88,6.02,90.3917,4,5.5,8.22,2.7,8.5
2293,12/8/2014,320,329,320,329,326,163100,12,2014,8,6.88,6.02,90.3261,4,5.5,8.22,2.7,8.5
2294,12/5/2014,314,323,314,323,319,737400,12,2014,5,6.88,6.02,90.2917,4,5.5,8.22,2.7,8.5
2295,12/4/2014,307,315,312,313,315,169000,12,2014,4,6.88,6.02,90.2222,4,5.5,8.22,2.7,8.5
2296,12/3/2014,311,315,310,315,315,147100,12,2014,3,6.88,6.02,90.3294,4,5.5,8.22,2.7,8.5
2297,12/2/2014,307,312,306,311,310,796000,12,2014,2,6.88,6.02,90.2431,4,5.5,8.22,2.7,8.5
2298,12/1/2014,300,308,304,307,307,203300,12,2014,1,6.88,6.02,90.1878,4,5.5,8.22,2.7,8.5
2299,11/28/2014,302,305,302,305,304,185700,11,2014,28,6.97,6.09,90.1792,4,5.5,8.22,2.7,8.5
2300,11/27/2014,300,305,299,305,304,955000,11,2014,27,6.97,6.09,90.1344,4,5.5,8.22,2.7,8.5
2301,11/26/2014,296,301,295,301,300,438600,11,2014,26,6.97,6.09,90.3069,4,5.5,8.22,2.7,8.5
2302,11/25/2014,295,298,295,297,297,449100,11,2014,25,6.97,6.09,90.2156,4,5.5,8.22,2.7,8.5
2303,11/24/2014,295,296,294,296,295,64100,11,2014,24,6.97,6.09,90.1792,4,5.5,8.22,2.7,8.5
2304,11/21/2014,295,297,294,296,296,293100,11,2014,21,6.97,6.09,90.0503,4,5.5,8.22,2.7,8.5
2305,11/20/2014,295,297,291,295,295,156200,11,2014,20,6.97,6.09,90.1472,4,5.5,8.22,2.7,8.5
2306,11/19/2014,270,296,295,296,296,298100,11,2014,19,6.97,6.09,90.1083,4,5.5,8.22,2.7,8.5
2307,11/18/2014,298,298,295,296,297,53500,11,2014,18,6.97,6.09,89.9575,4,5.5,8.22,2.7,8.5
2308,11/17/2014,298,299,298,299,299,49800,11,2014,17,6.97,6.09,89.9028,4,5.5,8.22,2.7,8.5
2309,11/14/2014,298,300,292,300,300,572800,11,2014,14,6.97,6.09,90.2181,4,5.5,8.22,2.7,8.5
2310,11/13/2014,269,299,295,298,299,657000,11,2014,13,6.97,6.09,90.0656,4,5.5,8.22,2.7,8.5
2311,11/12/2014,292,299,292,299,295,117400,11,2014,12,6.97,6.09,90.0083,4,5.5,8.22,2.7,8.5
2312,11/11/2014,265,294,291,292,293,61600,11,2014,11,6.97,6.09,89.8172,4,5.5,8.22,2.7,8.5
2313,11/10/2014,289,291,289,291,291,8800,11,2014,10,6.97,6.09,89.8808,4,5.5,8.22,2.7,8.5
2314,11/7/2014,289,293,289,293,291,108500,11,2014,7,6.97,6.09,89.7308,4,5.5,8.22,2.7,8.5
2315,11/6/2014,287,291,285,290,290,175000,11,2014,6,6.97,6.09,89.7125,4,5.5,8.22,2.7,8.5
2316,11/5/2014,286,290,285,288,289,185800,11,2014,5,6.97,6.09,89.6178,4,5.5,8.22,2.7,8.5
2317,11/4/2014,287,287,285,287,287,650400,11,2014,4,6.97,6.09,89.6144,4,5.5,8.22,2.7,8.5
2318,11/3/2014,283,288,283,287,287,494700,11,2014,3,6.97,6.09,89.415,4,5.5,8.22,2.7,8.5
2319,10/31/2014,278,285,277,285,281,290200,10,2014,31,7.08,6.43,89.3522,4,5.5,8.22,2.7,8.5
2320,10/30/2014,275,278,275,277,277,482100,10,2014,30,7.08,6.43,89.3556,4,5.5,8.22,2.7,8.5
2321,10/29/2014,276,276,275,275,276,111600,10,2014,29,7.08,6.43,89.125,4,5.5,8.22,2.7,8.5
2322,10/28/2014,273,276,273,275,275,54000,10,2014,28,7.08,6.43,89.4131,4,5.5,8.22,2.7,8.5
2323,10/27/2014,270,276,270,276,276,410500,10,2014,27,7.08,6.43,89.4028,4,5.5,8.22,2.7,8.5
2324,10/24/2014,270,276,270,276,275,135400,10,2014,24,7.08,6.43,89.3375,4,5.5,8.22,2.7,8.5
2325,10/23/2014,270,272,270,272,271,54300,10,2014,23,7.08,6.43,89.1278,4,5.5,8.22,2.7,8.5
2326,10/22/2014,273,274,270,270,271,409800,10,2014,22,7.08,6.43,88.9083,4,5.5,8.22,2.7,8.5
2327,10/21/2014,270,273,272,273,273,20200,10,2014,21,7.08,6.43,89.1083,4,5.5,8.22,2.7,8.5
2328,10/17/2014,274,276,273,273,274,1080400,10,2014,17,7.08,6.43,88.9792,4,5.5,8.22,2.7,8.5
2329,10/16/2014,274,276,274,276,276,356400,10,2014,16,7.08,6.43,89.1694,4,5.5,8.22,2.7,8.5
2330,10/15/2014,274,276,274,275,275,2166600,10,2014,15,7.08,6.43,89.3322,4,5.5,8.22,2.7,8.5
2331,10/14/2014,277,277,275,276,277,105300,10,2014,14,7.08,6.43,89.2639,4,5.5,8.22,2.7,8.5
2332,10/13/2014,250,276,270,276,276,625100,10,2014,13,7.08,6.43,89.1167,4,5.5,8.22,2.7,8.5
2333,10/10/2014,274,275,271,275,274,301200,10,2014,10,7.08,6.43,89.0475,4,5.5,8.22,2.7,8.5
2334,10/9/2014,273,275,270,270,275,76700,10,2014,9,7.08,6.43,89.0903,4,5.5,8.22,2.7,8.5
2335,10/8/2014,274,275,274,275,275,15500,10,2014,8,7.08,6.43,89.2253,4,5.5,8.22,2.7,8.5
2336,10/7/2014,280,280,275,275,280,33100,10,2014,7,7.08,6.43,89.3014,4,5.5,8.22,2.7,8.5
2337,10/6/2014,286,286,274,281,283,18400,10,2014,6,7.08,6.43,89.3231,4,5.5,8.22,2.7,8.5
2338,10/6/2014,286,286,274,281,283,18400,10,2014,6,7.08,6.43,89.3231,4,5.5,8.22,2.7,8.5
2339,10/3/2014,286,286,284,286,286,193000,10,2014,3,7.08,6.43,89.3306,4,5.5,8.22,2.7,8.5
2340,10/2/2014,281,288,281,288,285,799100,10,2014,2,7.08,6.43,89.3611,4,5.5,8.22,2.7,8.5
2341,10/1/2014,280,283,277,283,280,447900,10,2014,1,7.08,6.43,89.3275,4,5.5,8.22,2.7,8.5
2342,9/30/2014,276,277,276,277,277,8100,9,2014,30,7.19,6.6,89.2794,4,5.5,8.22,2.7,8.5
2343,9/29/2014,265,277,276,277,277,130500,9,2014,29,7.19,6.6,89.1417,4,5.5,8.22,2.7,8.5
2344,9/26/2014,272,280,272,280,275,209600,9,2014,26,7.19,6.6,89.125,4,5.5,8.22,2.7,8.5
2345,9/25/2014,269,271,269,271,270,537300,9,2014,25,7.19,6.6,89.0986,4,5.5,8.22,2.7,8.5
2346,9/24/2014,268,270,268,269,269,137700,9,2014,24,7.19,6.6,89.125,4,5.5,8.22,2.7,8.5
2347,9/23/2014,267,270,267,270,270,373800,9,2014,23,7.19,6.6,88.9114,4,5.5,8.22,2.7,8.5
2348,9/22/2014,267,274,265,267,268,431400,9,2014,22,7.19,6.6,88.5856,4,5.5,8.22,2.7,8.5
2349,9/19/2014,278,278,270,272,272,215800,9,2014,19,7.19,6.6,88.9456,4,5.5,8.22,2.7,8.5
2350,9/18/2014,279,279,275,278,279,214800,9,2014,18,7.19,6.6,89.2681,4,5.5,8.22,2.7,8.5
2351,9/17/2014,280,281,275,275,280,101200,9,2014,17,7.19,6.6,88.9894,4,5.5,8.22,2.7,8.5
2352,9/16/2014,281,282,280,281,282,464200,9,2014,16,7.19,6.6,88.7944,4,5.5,8.22,2.7,8.5
2353,9/15/2014,277,285,277,285,283,163400,9,2014,15,7.19,6.6,88.8167,4,5.5,8.22,2.7,8.5
2354,9/12/2014,277,279,277,278,278,25900,9,2014,12,7.19,6.6,88.7961,4,5.5,8.22,2.7,8.5
2355,9/11/2014,275,282,275,277,282,149300,9,2014,11,7.19,6.6,88.7433,4,5.5,8.22,2.7,8.5
2356,9/10/2014,282,284,281,281,283,183100,9,2014,10,7.19,6.6,88.6319,4,5.5,8.22,2.7,8.5
2357,9/9/2014,283,285,283,283,284,408500,9,2014,9,7.19,6.6,88.6181,4,5.5,8.22,2.7,8.5
2358,9/8/2014,285,290,285,290,288,17100,9,2014,8,7.19,6.6,88.6289,4,5.5,8.22,2.7,8.5
2359,9/5/2014,285,286,283,285,286,15800,9,2014,5,7.19,6.6,88.6378,4,5.5,8.22,2.7,8.5
2360,9/4/2014,286,287,280,280,286,70800,9,2014,4,7.19,6.6,88.6789,4,5.5,8.22,2.7,8.5
2361,9/3/2014,285,288,285,288,287,158000,9,2014,3,7.19,6.6,88.6269,4,5.5,8.22,2.7,8.5
2362,9/2/2014,282,288,282,286,285,310800,9,2014,2,7.19,6.6,88.5167,4,5.5,8.22,2.7,8.5
2363,9/1/2014,250,283,277,283,280,260200,9,2014,1,7.19,6.6,88.4306,4,5.5,8.22,2.7,8.5
2364,8/29/2014,278,278,276,277,278,37600,8,2014,29,7.33,8.36,88.3944,4,5.5,8.22,2.7,8.5
2365,8/28/2014,280,280,280,280,280,103900,8,2014,28,7.33,8.36,88.3786,4,5.5,8.22,2.7,8.5
2366,8/27/2014,286,286,282,282,285,149000,8,2014,27,7.33,8.36,88.35,4,5.5,8.22,2.7,8.5
2367,8/26/2014,287,287,286,287,287,36300,8,2014,26,7.33,8.36,88.5828,4,5.5,8.22,2.7,8.5
2368,8/25/2014,290,290,287,287,288,3900,8,2014,25,7.33,8.36,88.3261,4,5.5,8.22,2.7,8.5
2369,8/22/2014,293,293,290,290,291,393400,8,2014,22,7.33,8.36,88.3144,4,5.5,8.22,2.7,8.5
2370,8/21/2014,280,293,290,293,293,53300,8,2014,21,7.33,8.36,88.2761,4,5.5,8.22,2.7,8.5
2371,8/20/2014,270,295,290,293,294,64400,8,2014,20,7.33,8.36,88.3039,4,5.5,8.22,2.7,8.5
2372,8/19/2014,295,295,290,294,295,630600,8,2014,19,7.33,8.36,88.185,4,5.5,8.22,2.7,8.5
2373,8/18/2014,295,296,285,285,296,240900,8,2014,18,7.33,8.36,88.1194,4,5.5,8.22,2.7,8.5
2374,8/15/2014,295,297,294,297,297,91000,8,2014,15,7.33,8.36,88.0361,4,5.5,8.22,2.7,8.5
2375,8/14/2014,300,300,295,295,299,318600,8,2014,14,7.33,8.36,88.0769,4,5.5,8.22,2.7,8.5
2376,8/13/2014,297,297,297,297,297,17800,8,2014,13,7.33,8.36,87.9864,4,5.5,8.22,2.7,8.5
2377,8/12/2014,295,299,295,295,298,18000,8,2014,12,7.33,8.36,87.9514,4,5.5,8.22,2.7,8.5
2378,8/11/2014,290,300,294,300,300,2125900,8,2014,11,7.33,8.36,87.9031,4,5.5,8.22,2.7,8.5
2379,8/8/2014,282,300,296,298,298,279600,8,2014,8,7.33,8.36,87.8728,4,5.5,8.22,2.7,8.5
2380,8/7/2014,312,312,302,302,310,871500,8,2014,7,7.33,8.36,87.8783,1.5,5.5,8.22,2.7,8.5
2381,8/6/2014,312,317,310,314,314,137100,8,2014,6,7.33,8.36,87.8197,1.5,5.5,8.22,2.7,8.5
2382,8/5/2014,301,315,301,315,308,309200,8,2014,5,7.33,8.36,87.8042,1.5,5.5,8.22,2.7,8.5
2383,8/4/2014,300,302,300,301,301,27100,8,2014,4,7.33,8.36,87.8244,1.5,5.5,8.22,2.7,8.5
2384,8/1/2014,270,300,295,300,300,96700,8,2014,1,7.33,8.36,87.84,1.5,5.5,8.22,2.7,8.5
2385,7/31/2014,290,297,290,297,293,67800,7,2014,31,7.19,7.67,87.8042,1.5,5.5,8.22,2.7,8.5
2386,7/30/2014,295,300,291,300,298,43300,7,2014,30,7.19,7.67,87.7444,1.5,5.5,8.22,2.7,8.5
2387,7/28/2014,287,288,285,288,288,46300,7,2014,28,7.19,7.67,87.6903,1.5,5.5,8.22,2.7,8.5
2388,7/25/2014,289,289,286,289,289,455300,7,2014,25,7.19,7.67,87.7997,1.5,5.5,8.22,2.7,8.5
2389,7/24/2014,290,292,290,290,291,105500,7,2014,24,7.19,7.67,87.8039,1.5,5.5,8.22,2.7,8.5
2390,7/23/2014,295,295,290,290,295,227500,7,2014,23,7.19,7.67,87.8597,1.5,5.5,8.22,2.7,8.5
2391,7/22/2014,295,296,294,295,295,543200,7,2014,22,7.19,7.67,87.7994,1.5,5.5,8.22,2.7,8.5
2392,7/21/2014,294,295,294,295,295,447000,7,2014,21,7.19,7.67,87.7958,1.5,5.5,8.22,2.7,8.5
2393,7/18/2014,295,300,285,286,295,3400,7,2014,18,7.19,7.67,87.7706,1.5,5.5,8.22,2.7,8.5
2394,7/17/2014,300,300,296,300,300,152400,7,2014,17,7.19,7.67,87.7069,1.5,5.5,8.22,2.7,8.5
2395,7/16/2014,300,302,300,302,302,177300,7,2014,16,7.19,7.67,87.7447,1.5,5.5,8.22,2.7,8.5
2396,7/15/2014,270,301,296,301,301,144800,7,2014,15,7.19,7.67,87.7083,1.5,5.5,8.22,2.7,8.5
2397,7/14/2014,300,301,300,301,301,65500,7,2014,14,7.19,7.67,87.6306,1.5,5.5,8.22,2.7,8.5
2398,7/11/2014,304,304,300,300,302,179200,7,2014,11,7.19,7.67,87.6486,1.5,5.5,8.22,2.7,8.5
2399,7/10/2014,305,308,305,307,307,76100,7,2014,10,7.19,7.67,87.775,1.5,5.5,8.22,2.7,8.5
2400,7/9/2014,304,305,301,305,304,21300,7,2014,9,7.19,7.67,87.8589,1.5,5.5,8.22,2.7,8.5
2401,7/8/2014,305,307,305,307,306,801100,7,2014,8,7.19,7.67,87.8919,1.5,5.5,8.22,2.7,8.5
2402,7/7/2014,301,306,301,305,305,386500,7,2014,7,7.19,7.67,87.8792,1.5,5.5,8.22,2.7,8.5
2403,7/4/2014,300,302,300,301,302,55400,7,2014,4,7.19,7.67,87.825,1.5,5.5,8.22,2.7,8.5
2404,7/3/2014,302,303,300,302,302,351100,7,2014,3,7.19,7.67,87.7222,1.5,5.5,8.22,2.7,8.5
2405,7/2/2014,295,305,294,300,302,916700,7,2014,2,7.19,7.67,87.8278,1.5,5.5,8.22,2.7,8.5
2406,7/1/2014,284,293,284,292,291,50200,7,2014,1,7.19,7.67,87.6361,1.5,5.5,8.22,2.7,8.5
2407,6/30/2014,283,290,283,288,284,3400,6,2014,30,7.05,7.39,87.6269,1.5,5.5,8.22,2.7,8.5
2408,6/27/2014,284,295,283,295,290,1949500,6,2014,27,7.05,7.39,87.6828,1.5,5.5,8.22,2.7,8.5
2409,6/26/2014,282,290,282,283,284,2700,6,2014,26,7.05,7.39,87.6083,1.5,5.5,8.22,2.7,8.5
2410,6/25/2014,278,290,278,290,282,340800,6,2014,25,7.05,7.39,87.4756,1.5,5.5,8.22,2.7,8.5
2411,6/24/2014,279,280,277,277,279,168100,6,2014,24,7.05,7.39,87.3785,1.5,5.5,8.22,2.7,8.5
2412,6/23/2014,279,280,278,278,280,101800,6,2014,23,7.05,7.39,87.4308,1.5,5.5,8.22,2.7,8.5
2413,6/20/2014,280,280,277,280,279,205400,6,2014,20,7.05,7.39,87.4056,1.5,5.5,8.22,2.7,8.5
2414,6/19/2014,270,282,276,278,279,2323900,6,2014,19,7.05,7.39,87.6094,1.5,5.5,8.22,2.7,8.5
2415,6/18/2014,276,277,275,277,277,241000,6,2014,18,7.05,7.39,87.5367,1.5,5.5,8.22,2.7,8.5
2416,6/17/2014,278,278,273,276,277,272400,6,2014,17,7.05,7.39,87.92,1.5,5.5,8.22,2.7,8.5
2417,6/16/2014,288,288,275,275,288,52000,6,2014,16,7.05,7.39,87.8889,1.5,5.5,8.22,2.7,8.5
2418,6/13/2014,290,290,283,289,289,117700,6,2014,13,7.05,7.39,87.8319,1.5,5.5,8.22,2.7,8.5
2419,6/12/2014,288,290,287,290,290,371300,6,2014,12,7.05,7.39,87.7639,1.5,5.5,8.22,2.7,8.5
2420,6/11/2014,288,290,283,290,290,429400,6,2014,11,7.05,7.39,87.6972,1.5,5.5,8.22,2.7,8.5
2421,6/10/2014,288,291,288,288,289,947900,6,2014,10,7.05,7.39,87.55,1.5,5.5,8.22,2.7,8.5
2422,6/9/2014,283,285,282,285,284,1169000,6,2014,9,7.05,7.39,87.5014,1.5,5.5,8.22,2.7,8.5
2423,6/6/2014,281,290,280,290,282,180100,6,2014,6,7.05,7.39,87.5069,1.5,5.5,8.22,2.7,8.5
2424,6/5/2014,283,289,280,281,282,135700,6,2014,5,7.05,7.39,87.5056,1.5,5.5,8.22,2.7,8.5
2425,6/4/2014,280,283,278,280,282,242800,6,2014,4,7.05,7.39,87.5722,1.5,5.5,8.22,2.7,8.5
2426,6/3/2014,283,284,280,284,284,691900,6,2014,3,7.05,7.39,87.7389,1.5,5.5,8.22,2.7,8.5
2427,5/30/2014,283,285,282,283,284,1582600,5,2014,30,6.85,7.3,87.7972,1.5,5.5,8.22,2.7,8.5
2428,5/29/2014,271,283,271,280,275,1041200,5,2014,29,6.85,7.3,87.8164,1.5,5.5,8.22,2.7,8.5
2429,5/28/2014,273,273,271,271,272,1636000,5,2014,28,6.85,7.3,87.84,1.5,5.5,8.22,2.7,8.5
2430,5/27/2014,274,277,265,270,272,105100,5,2014,27,6.85,7.3,87.8569,1.5,5.5,8.22,2.7,8.5
2431,5/26/2014,275,275,252,270,272,68100,5,2014,26,6.85,7.3,87.8289,1.5,5.5,8.22,2.7,8.5
2432,5/23/2014,283,283,276,279,280,146100,5,2014,23,6.85,7.3,87.8583,1.5,5.5,8.22,2.7,8.5
2433,5/22/2014,289,289,275,283,287,144900,5,2014,22,6.85,7.3,87.8319,1.5,5.5,8.22,2.7,8.5
2434,5/21/2014,290,294,289,289,292,779600,5,2014,21,6.85,7.3,87.8042,1.5,5.5,8.22,2.7,8.5
2435,5/20/2014,294,294,290,292,293,272200,5,2014,20,6.85,7.3,87.6847,1.5,5.5,8.22,2.7,8.5
2436,5/19/2014,293,298,292,295,296,67500,5,2014,19,6.85,7.3,87.5333,1.5,5.5,8.22,2.7,8.5
2437,5/16/2014,299,300,295,295,298,59700,5,2014,16,6.85,7.3,87.3892,1.5,5.5,8.22,2.7,8.5
2438,5/15/2014,300,302,299,299,301,934000,5,2014,15,6.85,7.3,87.3211,1.5,5.5,8.22,2.7,8.5
2439,5/14/2014,302,302,300,300,302,30000,5,2014,14,6.85,7.3,87.2208,1.5,5.5,8.22,2.7,8.5
2440,5/13/2014,303,305,300,301,303,262300,5,2014,13,6.85,7.3,87.0917,1.5,5.5,8.22,2.7,8.5
2441,5/12/2014,305,305,301,305,304,39000,5,2014,12,6.85,7.3,87.1222,1.5,5.5,8.22,2.7,8.5
2442,5/9/2014,297,300,297,300,300,84800,5,2014,9,6.85,7.3,87.0322,1.5,5.5,8.22,2.7,8.5
2443,5/8/2014,296,300,296,299,299,172000,5,2014,8,6.85,7.3,86.9653,1.5,5.5,8.22,2.7,8.5
2444,5/7/2014,298,298,291,291,298,192000,5,2014,7,6.85,7.3,86.9594,1.5,5.5,8.22,2.7,8.5
2445,5/6/2014,298,300,297,298,299,721400,5,2014,6,6.85,7.3,86.9292,1.5,5.5,8.22,2.7,8.5
2446,5/5/2014,289,299,298,298,299,29600,5,2014,5,6.85,7.3,86.8944,1.5,5.5,8.22,2.7,8.5
2447,5/2/2014,294,299,294,299,298,198000,5,2014,2,6.85,7.3,86.8667,1.5,5.5,8.22,2.7,8.5
2448,4/30/2014,289,297,289,297,294,123400,4,2014,30,6.58,6.41,86.8711,1.5,5.5,8.22,2.7,8.5
2449,4/29/2014,290,297,286,295,295,236900,4,2014,29,6.58,6.41,86.8572,1.5,5.5,8.22,2.7,8.5
2450,4/28/2014,290,292,290,292,291,75200,4,2014,28,6.58,6.41,86.8375,1.5,5.5,8.22,2.7,8.5
2451,4/25/2014,290,295,287,294,294,462900,4,2014,25,6.58,6.41,86.8736,1.5,5.5,8.22,2.7,8.5
2452,4/24/2014,285,298,283,293,297,258000,4,2014,24,6.58,6.41,86.9208,1.5,5.5,8.22,2.7,8.5
2453,4/23/2014,284,288,280,288,285,108400,4,2014,23,6.58,6.41,87.0806,1.5,5.5,8.22,2.7,8.5
2454,4/22/2014,275,284,275,280,283,338800,4,2014,22,6.58,6.41,86.8958,1.5,5.5,8.22,2.7,8.5
2455,4/17/2014,286,286,278,284,285,106600,4,2014,17,6.58,6.41,86.8278,1.5,5.5,8.22,2.7,8.5
2456,4/16/2014,279,290,271,287,283,417200,4,2014,16,6.58,6.41,86.9042,1.5,5.5,8.22,2.7,8.5
2457,4/15/2014,265,275,265,275,271,117000,4,2014,15,6.58,6.41,86.7053,1.5,5.5,8.22,2.7,8.5
2458,4/14/2014,265,265,263,265,265,154300,4,2014,14,6.58,6.41,86.6264,1.5,5.5,8.22,2.7,8.5
2459,4/11/2014,263,266,260,266,265,506000,4,2014,11,6.58,6.41,86.5572,1.5,5.5,8.22,2.7,8.5
2460,4/10/2014,265,265,261,265,265,533300,4,2014,10,6.58,6.41,86.5611,1.5,5.5,8.22,2.7,8.5
2461,4/9/2014,258,265,258,264,263,158400,4,2014,9,6.58,6.41,86.5889,1.5,5.5,8.22,2.7,8.5
2462,4/8/2014,260,260,258,259,260,1507600,4,2014,8,6.58,6.41,86.6042,1.5,5.5,8.22,2.7,8.5
2463,4/7/2014,256,260,255,260,260,701200,4,2014,7,6.58,6.41,86.6586,1.5,5.5,8.22,2.7,8.5
2464,4/4/2014,245,265,255,263,265,116700,4,2014,4,6.58,6.41,86.5819,1.5,5.5,8.22,2.7,8.5
2465,4/3/2014,260,267,256,266,266,140800,4,2014,3,6.58,6.41,86.5472,1.5,5.5,8.22,2.7,8.5
2466,4/2/2014,268,268,267,267,268,52700,4,2014,2,6.58,6.41,86.4264,1.5,5.5,8.22,2.7,8.5
2467,4/1/2014,269,269,260,260,268,882000,4,2014,1,6.58,6.41,86.4,1.5,5.5,8.22,2.7,8.5
2468,3/31/2014,270,270,260,269,270,74500,3,2014,31,6.39,6.27,86.4414,1.5,5.5,8.22,2.8,8.5
2469,3/28/2014,280,270,269,270,270,1140600,3,2014,28,6.39,6.27,86.5333,1.5,5.5,8.22,2.8,8.5
2470,3/27/2014,270,275,270,270,271,1421800,3,2014,27,6.39,6.27,86.6675,1.5,5.5,8.22,2.8,8.5
2471,3/26/2014,269,272,260,270,270,871000,3,2014,26,6.39,6.27,86.5853,1.5,5.5,8.22,2.8,8.5
2472,3/25/2014,269,275,268,274,271,353100,3,2014,25,6.39,6.27,86.5725,1.5,5.5,8.22,2.8,8.5
2473,3/24/2014,263,270,262,270,267,116200,3,2014,24,6.39,6.27,86.6167,1.5,5.5,8.22,2.8,8.5
2474,3/21/2014,255,263,255,263,262,31500,3,2014,21,6.39,6.27,86.5014,1.5,5.5,8.22,2.8,8.5
2475,3/20/2014,250,260,250,259,260,199800,3,2014,20,6.39,6.27,86.4917,1.5,5.5,8.22,2.8,8.5
2476,3/19/2014,255,259,255,259,256,421300,3,2014,19,6.39,6.27,86.5417,1.5,5.5,8.22,2.8,8.5
2477,3/18/2014,251,258,246,255,256,127700,3,2014,18,6.39,6.27,86.4861,1.5,5.5,8.22,2.8,8.5
2478,3/17/2014,260,260,255,258,260,58700,3,2014,17,6.39,6.27,86.4667,1.5,5.5,8.22,2.8,8.5
2479,3/14/2014,262,262,260,260,261,650400,3,2014,14,6.39,6.27,86.4444,1.5,5.5,8.22,2.8,8.5
2480,3/13/2014,262,262,261,261,262,60300,3,2014,13,6.39,6.27,86.4361,1.5,5.5,8.22,2.8,8.5
2481,3/12/2014,262,263,260,262,262,210300,3,2014,12,6.39,6.27,86.3861,1.5,5.5,8.22,2.8,8.5
2482,3/11/2014,263,264,260,260,264,126600,3,2014,11,6.39,6.27,86.4844,1.5,5.5,8.22,2.8,8.5
2483,3/10/2014,261,265,261,264,264,172900,3,2014,10,6.39,6.27,86.5111,1.5,5.5,8.22,2.8,8.5
2484,3/7/2014,260,264,260,262,261,134800,3,2014,7,6.39,6.27,86.5194,1.5,5.5,8.22,2.8,8.5
2485,3/6/2014,263,265,263,264,264,936700,3,2014,6,6.39,6.27,86.5306,1.5,5.5,8.22,2.8,8.5
2486,3/5/2014,262,264,262,263,264,217400,3,2014,5,6.39,6.27,86.3839,1.5,5.5,8.22,2.8,8.5
2487,3/4/2014,262,264,262,263,264,481200,3,2014,4,6.39,6.27,86.3875,1.5,5.5,8.22,2.8,8.5
2488,3/3/2014,264,264,258,262,263,343100,3,2014,3,6.39,6.27,86.2758,1.5,5.5,8.22,2.8,8.5
2489,2/28/2014,265,265,260,265,265,942100,2,2014,28,6.21,6.86,86.3264,1.5,5.5,8.22,2.8,8.5
2490,2/27/2014,269,269,264,268,266,475800,2,2014,27,6.21,6.86,86.4806,1.5,5.5,8.22,2.8,8.5
2491,2/26/2014,272,272,265,270,269,153000,2,2014,26,6.21,6.86,86.4083,1.5,5.5,8.22,2.8,8.5
2492,2/25/2014,273,273,265,273,271,492500,2,2014,25,6.21,6.86,86.2458,1.5,5.5,8.22,2.8,8.5
2493,2/24/2014,250,268,250,267,265,253000,2,2014,24,6.21,6.86,86.1611,1.5,5.5,8.22,2.8,8.5
2494,2/21/2014,237,249,237,249,245,67600,2,2014,21,6.21,6.86,86.1033,1.5,5.5,8.22,2.8,8.5
2495,2/20/2014,219,240,219,240,228,555000,2,2014,20,6.21,6.86,86.1764,1.5,5.5,8.22,2.8,8.5
2496,2/19/2014,221,230,212,219,220,1710300,2,2014,19,6.21,6.86,86.2575,1.5,5.5,8.22,2.8,8.5
2497,2/18/2014,231,231,220,221,223,327300,2,2014,18,6.21,6.86,86.3431,1.5,5.5,8.22,2.8,8.5
2498,2/17/2014,243,243,230,230,232,199600,2,2014,17,6.21,6.86,86.3569,1.5,5.5,8.22,2.8,8.5
2499,2/14/2014,250,250,240,240,244,328500,2,2014,14,6.21,6.86,86.3778,1.5,5.5,8.22,2.8,8.5
2500,2/13/2014,250,253,247,248,250,238400,2,2014,13,6.21,6.86,86.2444,4,5.5,8.22,2.8,8.5
2501,2/12/2014,256,256,249,250,253,268500,2,2014,12,6.21,6.86,86.1922,4,5.5,8.22,2.8,8.5
2502,2/11/2014,259,259,254,256,257,638400,2,2014,11,6.21,6.86,86.1875,4,5.5,8.22,2.8,8.5
2503,2/10/2014,259,262,258,259,260,128400,2,2014,10,6.21,6.86,86.0569,4,5.5,8.22,2.8,8.5
2504,2/7/2014,261,263,256,260,260,96800,2,2014,7,6.21,6.86,86.0611,4,5.5,8.22,2.8,8.5
2505,2/6/2014,266,268,258,260,263,457200,2,2014,6,6.21,6.86,86.1056,4,5.5,8.22,2.8,8.5
2506,2/5/2014,273,274,266,270,270,226700,2,2014,5,6.21,6.86,86.3361,4,5.5,8.22,2.8,8.5
2507,2/4/2014,273,276,268,270,273,175600,2,2014,4,6.21,6.86,86.5839,4,5.5,8.22,2.8,8.5
2508,2/3/2014,264,271,262,266,267,509600,2,2014,3,6.21,6.86,86.5519,4,5.5,8.22,2.8,8.5
2509,1/31/2014,270,270,250,261,260,465800,1,2014,31,6.01,7.21,86.2361,4,5.5,8.22,2.8,8.5
2510,1/30/2014,279,279,275,275,277,84600,1,2014,30,6.01,7.21,86.0833,4,5.5,8.22,2.8,8.5
2511,1/29/2014,279,279,277,278,278,271800,1,2014,29,6.01,7.21,85.9611,4,5.5,8.22,2.8,8.5
2512,1/28/2014,280,282,278,279,280,614700,1,2014,28,6.01,7.21,85.8278,4,5.5,8.22,2.8,8.5
2513,1/27/2014,285,285,280,282,284,125200,1,2014,27,6.01,7.21,85.8125,4,5.5,8.22,2.8,8.5
2514,1/24/2014,283,285,283,284,285,774900,1,2014,24,6.01,7.21,85.5333,4,5.5,8.22,2.8,8.5
2515,1/23/2014,285,286,280,285,284,947600,1,2014,23,6.01,7.21,85.8181,4,5.5,8.22,2.8,8.5
2516,1/22/2014,285,287,280,280,286,500600,1,2014,22,6.01,7.21,85.8806,4,5.5,8.22,2.8,8.5
2517,1/21/2014,288,290,284,289,286,472900,1,2014,21,6.01,7.21,85.8792,4,5.5,8.22,2.8,8.5
2518,1/20/2014,290,295,288,288,289,60900,1,2014,20,6.01,7.21,85.4572,4,5.5,8.22,2.8,8.5
2519,1/17/2014,289,292,289,289,290,633900,1,2014,17,6.01,7.21,85.8972,4,5.5,8.22,2.8,8.5
2520,1/16/2014,291,291,285,289,290,92300,1,2014,16,6.01,7.21,85.8508,4,5.5,8.22,2.8,8.5
2521,1/15/2014,293,293,288,290,292,137800,1,2014,15,6.01,7.21,86.2344,4,5.5,8.22,2.8,8.5
2522,1/14/2014,298,298,293,293,295,576200,1,2014,14,6.01,7.21,86.2806,4,5.5,8.22,2.8,8.5
2523,1/13/2014,298,298,295,298,297,33300,1,2014,13,6.01,7.21,86.4372,4,5.5,8.22,2.8,8.5
2524,1/10/2014,300,300,296,296,300,166400,1,2014,10,6.01,7.21,86.6306,4,5.5,8.22,2.8,8.5
2525,1/9/2014,300,300,299,300,300,373600,1,2014,9,6.01,7.21,86.8639,4,5.5,8.22,2.8,8.5
2526,1/8/2014,298,300,298,299,300,702200,1,2014,8,6.01,7.21,86.9611,4,5.5,8.22,2.8,8.5
2527,1/7/2014,302,303,298,298,301,170200,1,2014,7,6.01,7.21,86.9583,4,5.5,8.22,2.8,8.5
2528,1/6/2014,292,305,295,301,298,192000,1,2014,6,6.01,7.21,86.8228,4,5.5,8.22,2.8,8.5
2529,1/3/2014,295,297,290,297,295,241900,1,2014,3,6.01,7.21,86.8722,4,5.5,8.22,2.8,8.5
2530,1/2/2014,291,295,290,295,291,27400,1,2014,2,6.01,7.21,86.4167,4,5.5,8.22,2.8,8.5
2531,12/31/2013,290,295,290,290,291,126200,12,2013,31,5.72,7.15,86.3097,4,5.5,8.55,2.8,8.5
2532,12/30/2013,290,290,287,290,290,1159100,12,2013,30,5.72,7.15,85.8903,4,5.5,8.55,2.8,8.5
2533,12/27/2013,291,295,290,290,291,443900,12,2013,27,5.72,7.15,85.8164,4,5.5,8.55,2.8,8.5
2534,12/24/2013,290,290,287,290,290,165700,12,2013,24,5.72,7.15,85.7197,4,5.5,8.55,2.8,8.5
2535,12/23/2013,292,292,289,289,290,41600,12,2013,23,5.72,7.15,85.7208,4,5.5,8.55,2.8,8.5
2536,12/20/2013,290,291,289,290,290,1237200,12,2013,20,5.72,7.15,85.8278,4,5.5,8.55,2.8,8.5
2537,12/19/2013,289,293,289,290,291,495900,12,2013,19,5.72,7.15,86.1722,4,5.5,8.55,2.8,8.5
2538,12/18/2013,290,290,285,290,290,157600,12,2013,18,5.72,7.15,86.0431,4,5.5,8.55,2.8,8.5
2539,12/17/2013,280,290,280,290,290,244600,12,2013,17,5.72,7.15,86.4286,4,5.5,8.55,2.8,8.5
2540,12/16/2013,289,296,282,292,292,857900,12,2013,16,5.72,7.15,86.5542,4,5.5,8.55,2.8,8.5
2541,12/11/2013,291,296,291,295,295,476500,12,2013,11,5.72,7.15,86.6789,4,5.5,8.55,2.8,8.5
2542,12/10/2013,296,296,275,291,291,939900,12,2013,10,5.72,7.15,86.6511,4,5.5,8.55,2.8,8.5
2543,12/9/2013,300,305,295,295,300,602300,12,2013,9,5.72,7.15,86.625,4,5.5,8.55,2.8,8.5
2544,12/6/2013,305,305,300,300,302,44600,12,2013,6,5.72,7.15,86.5589,4,5.5,8.55,2.8,8.5
2545,12/5/2013,312,314,300,305,312,143900,12,2013,5,5.72,7.15,86.4886,4,5.5,8.55,2.8,8.5
2546,12/4/2013,308,325,315,315,319,21900,12,2013,4,5.72,7.15,86.7139,4,5.5,8.55,2.8,8.5
2547,12/3/2013,323,326,323,325,326,76000,12,2013,3,5.72,7.15,86.7192,4,5.5,8.55,2.8,8.5
2548,12/2/2013,321,327,321,326,327,561200,12,2013,2,5.72,7.15,86.6506,4,5.5,8.55,2.8,8.5
2549,11/29/2013,325,328,321,325,326,145100,11,2013,29,5.39,7.36,86.9931,4,5.5,8.55,2.8,8.5
2550,11/28/2013,324,324,319,321,323,48100,11,2013,28,5.39,7.36,86.9875,4,5.5,8.55,2.8,8.5
2551,11/27/2013,320,328,320,328,325,53000,11,2013,27,5.39,7.36,86.8889,4,5.5,8.55,2.8,8.5
2552,11/26/2013,320,324,320,323,322,301300,11,2013,26,5.39,7.36,86.6528,4,5.5,8.55,2.8,8.5
2553,11/25/2013,315,320,315,320,319,94700,11,2013,25,5.39,7.36,86.6842,4,5.5,8.55,2.8,8.5
2554,11/22/2013,315,319,307,316,315,222300,11,2013,22,5.39,7.36,86.2972,4,5.5,8.55,2.8,8.5
2555,11/21/2013,305,320,306,306,312,58400,11,2013,21,5.39,7.36,86.1667,4,5.5,8.55,2.8,8.5
2556,11/20/2013,320,325,320,320,321,45500,11,2013,20,5.39,7.36,86.3075,4,5.5,8.55,2.8,8.5
2557,11/19/2013,320,320,320,320,320,165300,11,2013,19,5.39,7.36,86.4658,4,5.5,8.55,2.8,8.5
2558,11/18/2013,320,320,319,320,320,185900,11,2013,18,5.39,7.36,86.4556,4,5.5,8.55,2.8,8.5
2559,11/15/2013,320,320,319,320,320,132200,11,2013,15,5.39,7.36,86.2819,4,5.5,8.55,2.8,8.5
2560,11/14/2013,320,322,320,322,321,37500,11,2013,14,5.39,7.36,86.2569,4,5.5,8.55,2.8,8.5
2561,11/13/2013,320,321,310,320,320,155900,11,2013,13,5.39,7.36,86.0042,4,5.5,8.55,2.8,8.5
2562,11/12/2013,320,320,315,320,320,183700,11,2013,12,5.39,7.36,85.7,4,5.5,8.55,2.8,8.5
2563,11/11/2013,320,322,320,322,322,110700,11,2013,11,5.39,7.36,85.5872,4,5.5,8.55,2.8,8.5
2564,11/8/2013,323,323,323,323,323,203400,11,2013,8,5.39,7.36,85.5153,4,5.5,8.55,2.8,8.5
2565,11/7/2013,320,327,320,322,325,23200,11,2013,7,5.39,7.36,85.3069,4,5.5,8.55,2.8,8.5
2566,11/6/2013,321,325,321,325,325,346300,11,2013,6,5.39,7.36,85.3736,4,5.5,8.55,2.8,8.5
2567,11/5/2013,322,323,321,323,323,26000,11,2013,5,5.39,7.36,85.5197,4,5.5,8.55,2.8,8.5
2568,11/4/2013,305,323,320,322,322,578400,11,2013,4,5.39,7.36,85.4472,4,5.5,8.55,2.8,8.5
2569,11/1/2013,320,325,318,320,320,707200,11,2013,1,5.39,7.36,85.2714,4,5.5,8.55,2.8,8.5
2570,10/31/2013,320,320,318,320,320,209400,10,2013,31,5.05,7.76,85.1469,4,5.5,8.55,2.8,8.5
2571,10/30/2013,290,320,310,318,316,410800,10,2013,30,5.05,7.76,85.1667,4,5.5,8.55,2.8,8.5
2572,10/28/2013,310,312,310,310,311,2500,10,2013,28,5.05,7.76,84.8678,4,5.5,8.55,2.8,8.5
2573,10/25/2013,317,320,310,314,315,294100,10,2013,25,5.05,7.76,84.7431,4,5.5,8.55,2.8,8.5
2574,10/24/2013,322,330,310,310,320,735300,10,2013,24,5.05,7.76,84.7389,4,5.5,8.55,2.8,8.5
2575,10/23/2013,317,322,317,320,320,112600,10,2013,23,5.05,7.76,84.785,4,5.5,8.55,2.8,8.5
2576,10/22/2013,315,320,315,319,318,248700,10,2013,22,5.05,7.76,84.7194,4,5.5,8.55,2.8,8.5
2577,10/18/2013,312,320,311,319,316,228400,10,2013,18,5.05,7.76,84.8708,4,5.5,8.55,2.8,8.5
2578,10/17/2013,310,314,310,310,311,444700,10,2013,17,5.05,7.76,84.9736,4,5.5,8.55,2.8,8.5
2579,10/16/2013,316,320,315,315,316,110800,10,2013,16,5.05,7.76,84.9894,4,5.5,8.55,2.8,8.5
2580,10/15/2013,320,324,315,316,317,269100,10,2013,15,5.05,7.76,84.9944,4,5.5,8.55,2.8,8.5
2581,10/14/2013,333,333,320,320,324,35500,10,2013,14,5.05,7.76,84.9714,4,5.5,8.55,2.8,8.5
2582,10/11/2013,340,340,336,336,338,197900,10,2013,11,5.05,7.76,85.1986,4,5.5,8.55,2.8,8.5
2583,10/10/2013,340,340,337,338,339,73100,10,2013,10,5.05,7.76,85.3917,4,5.5,8.55,2.8,8.5
2584,10/9/2013,346,346,335,340,345,193800,10,2013,9,5.05,7.76,84.9639,4,5.5,8.55,2.8,8.5
2585,10/8/2013,343,345,342,345,345,217900,10,2013,8,5.05,7.76,85.2583,4,5.5,8.55,2.8,8.5
2586,10/7/2013,340,345,340,342,342,45200,10,2013,7,5.05,7.76,86.1306,4,5.5,8.55,2.8,8.5
2587,10/4/2013,339,342,338,342,341,149900,10,2013,4,5.05,7.76,86.5236,4,5.5,8.55,2.8,8.5
2588,9/30/2013,325,335,323,328,330,311200,9,2013,30,4.75,8.29,86.6458,4,5.5,8.55,2.8,8.5
2589,9/27/2013,315,322,315,320,319,102900,9,2013,27,4.75,8.29,86.9903,4,5.5,8.55,2.8,8.5
2590,9/26/2013,315,315,313,315,315,99500,9,2013,26,4.75,8.29,87.2292,4,5.5,8.55,2.8,8.5
2591,9/25/2013,309,315,308,310,310,158600,9,2013,25,4.75,8.29,87.4097,4,5.5,8.55,2.8,8.5
2592,9/24/2013,305,309,303,309,308,327300,9,2013,24,4.75,8.29,87.4611,4,5.5,8.55,2.8,8.5
2593,9/23/2013,303,309,303,309,305,280800,9,2013,23,4.75,8.29,87.4194,4,5.5,8.55,2.8,8.5
2594,9/20/2013,303,305,300,304,304,380300,9,2013,20,4.75,8.29,87.3861,4,5.5,8.55,2.8,8.5
2595,9/19/2013,300,305,300,302,302,385100,9,2013,19,4.75,8.29,87.4542,4,5.5,8.55,2.8,8.5
2596,9/18/2013,303,305,300,300,301,343300,9,2013,18,4.75,8.29,87.5406,4,5.5,8.55,2.8,8.5
2597,9/17/2013,300,301,299,300,300,697000,9,2013,17,4.75,8.29,87.5361,4,5.5,8.55,2.8,8.5
2598,9/16/2013,300,300,298,300,299,1170800,9,2013,16,4.75,8.29,87.5806,4,5.5,8.55,2.8,8.5
2599,9/13/2013,300,300,297,300,300,95200,9,2013,13,4.75,8.29,87.5444,4,5.5,8.55,2.8,8.5
2600,9/12/2013,300,300,297,300,300,22100,9,2013,12,4.75,8.29,87.5458,4,5.5,8.55,2.8,8.5
2601,9/11/2013,300,300,297,300,300,360300,9,2013,11,4.75,8.29,87.5158,4,5.5,8.55,2.8,8.5
2602,9/10/2013,300,305,300,300,301,186500,9,2013,10,4.75,8.29,87.4792,4,5.5,8.55,2.8,8.5
2603,9/9/2013,296,299,296,299,297,201200,9,2013,9,4.75,8.29,87.4028,4,5.5,8.55,2.8,8.5
2604,9/6/2013,300,300,296,296,297,412600,9,2013,6,4.75,8.29,87.4236,4,5.5,8.55,2.8,8.5
2605,9/5/2013,290,296,287,293,293,307300,9,2013,5,4.75,8.29,87.4986,4,5.5,8.55,2.8,8.5
2606,9/4/2013,287,290,285,287,286,491600,9,2013,4,4.75,8.29,87.5325,4,5.5,8.55,2.8,8.5
2607,9/3/2013,285,287,285,285,286,263000,9,2013,3,4.75,8.29,87.5178,4,5.5,8.55,2.8,8.5
2608,9/2/2013,286,286,285,286,286,408200,9,2013,2,4.75,8.29,87.5567,4,5.5,8.55,2.8,8.5
2609,8/30/2013,287,290,282,285,285,793200,8,2013,30,4.5,6.67,87.5967,4,5.5,8.55,2.8,8.5
2610,8/29/2013,299,299,282,284,287,490200,8,2013,29,4.5,6.67,87.5775,4,5.5,8.55,2.8,8.5
2611,8/28/2013,305,309,299,299,302,112200,8,2013,28,4.5,6.67,87.4928,4,5.5,8.55,2.8,8.5
2612,8/27/2013,310,315,305,308,307,157400,8,2013,27,4.5,6.67,87.525,4,5.5,8.55,2.8,8.5
2613,8/26/2013,311,311,305,310,311,376900,8,2013,26,4.5,6.67,87.5611,4,5.5,8.55,2.8,8.5
2614,8/23/2013,308,311,306,310,309,201500,8,2013,23,4.5,6.67,87.5303,4,5.5,8.55,2.8,8.5
2615,8/22/2013,305,308,305,308,306,513200,8,2013,22,4.5,6.67,87.4572,1.5,5.5,8.55,2.8,8.5
2616,8/21/2013,308,320,305,308,306,553000,8,2013,21,4.5,6.67,87.4606,1.5,5.5,8.55,2.8,8.5
2617,8/20/2013,320,320,304,304,315,496400,8,2013,20,4.5,6.67,87.5389,1.5,5.5,8.55,2.8,8.5
2618,8/19/2013,325,330,320,320,322,309600,8,2013,19,4.5,6.67,87.4711,1.5,5.5,8.55,2.8,8.5
2619,8/16/2013,330,330,325,327,328,19600,8,2013,16,4.5,6.67,87.4997,1.5,5.5,8.55,2.8,8.5
2620,8/15/2013,334,334,330,334,331,42900,8,2013,15,4.5,6.67,87.5906,1.5,5.5,8.55,2.8,8.5
2621,8/14/2013,335,336,331,333,335,353300,8,2013,14,4.5,6.67,87.7042,1.5,5.5,8.55,2.8,8.5
2622,8/13/2013,335,336,335,335,336,112300,8,2013,13,4.5,6.67,87.6083,1.5,5.5,8.55,2.8,8.5
2623,8/12/2013,338,339,335,335,338,29200,8,2013,12,4.5,6.67,87.3858,1.5,5.5,8.55,2.8,8.5
2624,8/8/2013,339,339,335,339,339,221000,8,2013,8,4.5,6.67,87.3908,1.5,5.5,8.55,2.8,8.5
2625,8/7/2013,340,340,331,340,340,686800,8,2013,7,4.5,6.67,87.3983,1.5,5.5,8.55,2.8,8.5
2626,8/6/2013,340,340,336,340,340,301000,8,2013,6,4.5,6.67,87.3844,1.5,5.5,8.55,2.8,8.5
2627,8/5/2013,336,345,335,345,345,131200,8,2013,5,4.5,6.67,87.3731,1.5,5.5,8.55,2.8,8.5
2628,8/2/2013,346,346,335,335,346,1985700,8,2013,2,4.5,6.67,87.4075,1.5,5.5,8.55,2.8,8.5
2629,7/31/2013,328,345,328,336,336,179800,7,2013,31,4.44,6.03,87.2797,1.5,5.5,8.55,2.8,8.5
2630,7/30/2013,346,355,346,355,350,439600,7,2013,30,4.44,6.03,87.2333,1.5,5.5,8.55,2.8,8.5
2631,7/29/2013,352,352,321,335,347,121600,7,2013,29,4.44,6.03,87.2361,1.5,5.5,8.55,2.8,8.5
2632,7/26/2013,352,360,352,355,353,101200,7,2013,26,4.44,6.03,87.4028,1.5,5.5,8.55,2.8,8.5
2633,7/25/2013,350,355,347,352,352,184200,7,2013,25,4.44,6.03,87.4056,1.5,5.5,8.55,2.8,8.5
2634,7/24/2013,352,352,350,352,351,73000,7,2013,24,4.44,6.03,87.3431,1.5,5.5,8.55,2.8,8.5
2635,7/23/2013,352,355,349,350,352,86800,7,2013,23,4.44,6.03,87.1697,1.5,5.5,8.55,2.8,8.5
2636,7/22/2013,348,352,348,350,350,40800,7,2013,22,4.44,6.03,87.0808,1.5,5.5,8.55,2.8,8.5
2637,7/19/2013,346,350,345,348,349,23600,7,2013,19,4.44,6.03,87.1583,1.5,5.5,8.55,2.8,8.5
2638,7/18/2013,345,346,345,345,346,74400,7,2013,18,4.44,6.03,86.8919,1.5,5.5,8.55,2.8,8.5
2639,7/17/2013,344,345,344,345,345,193300,7,2013,17,4.44,6.03,86.7875,1.5,5.5,8.55,2.8,8.5
2640,7/16/2013,345,348,343,345,345,223800,7,2013,16,4.44,6.03,86.9986,1.5,5.5,8.55,2.8,8.5
2641,7/15/2013,335,350,335,340,345,168900,7,2013,15,4.44,6.03,87.2364,1.5,5.5,8.55,2.8,8.5
2642,7/12/2013,340,350,335,350,344,145100,7,2013,12,4.44,6.03,87.1725,1.5,5.5,8.55,2.8,8.5
2643,7/11/2013,333,340,331,340,335,537600,7,2013,11,4.44,6.03,86.8556,1.5,5.5,8.55,2.8,8.5
2644,7/10/2013,328,331,325,330,330,812100,7,2013,10,4.44,6.03,86.8972,1.5,5.5,8.55,2.8,8.5
2645,7/9/2013,327,328,320,328,328,791000,7,2013,9,4.44,6.03,86.7969,1.5,5.5,8.55,2.8,8.5
2646,7/8/2013,328,328,324,328,327,186800,7,2013,8,4.44,6.03,86.6831,1.5,5.5,8.55,2.8,8.5
2647,7/5/2013,325,325,324,325,325,93700,7,2013,5,4.44,6.03,86.2583,1.5,5.5,8.55,2.8,8.5
2648,7/4/2013,325,325,325,325,325,940200,7,2013,4,4.44,6.03,86.2,1.5,5.5,8.55,2.8,8.5
2649,7/3/2013,325,325,320,325,325,130300,7,2013,3,4.44,6.03,85.9897,1.5,5.5,8.55,2.8,8.5
2650,7/2/2013,330,330,325,325,326,3700,7,2013,2,4.44,6.03,85.8561,1.5,5.5,8.55,2.8,8.5
2651,7/1/2013,333,333,321,325,332,105700,7,2013,1,4.44,6.03,85.8347,1.5,5.5,8.55,2.8,8.5
2652,6/28/2013,330,352,322,340,334,84400,6,2013,28,4.56,4.91,86.0075,1.5,5.5,8.55,2.8,8.5
2653,6/27/2013,320,320,320,320,320,65400,6,2013,27,4.56,4.91,86.0269,1.5,5.5,8.55,2.8,8.5
2654,6/26/2013,328,335,320,320,330,330200,6,2013,26,4.56,4.91,86.025,1.5,5.5,8.55,2.8,8.5
2655,6/25/2013,339,339,332,333,336,11300,6,2013,25,4.56,4.91,86.0603,1.5,5.5,8.55,2.8,8.5
2656,6/24/2013,340,340,330,335,336,72500,6,2013,24,4.56,4.91,85.8875,1.5,5.5,8.55,2.8,8.5
2657,6/21/2013,352,355,340,340,341,100500,6,2013,21,4.56,4.91,85.7375,1.5,5.5,8.55,2.8,8.5
2658,6/20/2013,350,351,340,345,342,94600,6,2013,20,4.56,4.91,85.6772,1.5,5.5,8.55,2.8,8.5
2659,6/19/2013,340,341,333,340,340,594400,6,2013,19,4.56,4.91,85.7236,1.5,5.5,8.55,2.8,8.5
2660,6/18/2013,332,340,331,332,337,153400,6,2013,18,4.56,4.91,85.7103,1.5,5.5,8.55,2.8,8.5
2661,6/17/2013,340,340,340,340,340,0,6,2013,17,4.56,4.91,85.6083,1.5,5.5,8.55,2.8,8.5
2662,6/14/2013,345,351,327,331,341,181100,6,2013,14,4.56,4.91,85.3878,1.5,5.5,8.55,2.8,8.5
2663,6/13/2013,355,359,340,340,351,281100,6,2013,13,4.56,4.91,85.3531,1.5,5.5,8.55,2.8,8.5
2664,6/12/2013,360,364,355,359,359,351400,6,2013,12,4.56,4.91,85.0539,1.5,5.5,8.55,2.8,8.5
2665,6/11/2013,365,365,362,365,365,51300,6,2013,11,4.56,4.91,85.0528,1.5,5.5,8.55,2.8,8.5
2666,6/10/2013,365,370,356,365,370,342200,6,2013,10,4.56,4.91,84.8806,1.5,5.5,8.55,2.8,8.5
2667,6/7/2013,372,372,370,370,371,1000,6,2013,7,4.56,4.91,84.95,1.5,5.5,8.55,2.8,8.5
2668,6/6/2013,371,375,370,375,375,261400,6,2013,6,4.56,4.91,85.1806,1.5,5.5,8.55,2.8,8.5
2669,6/5/2013,375,375,373,375,375,338000,6,2013,5,4.56,4.91,85.0972,1.5,5.5,8.55,2.8,8.5
2670,6/4/2013,375,378,374,375,376,2495600,6,2013,4,4.56,4.91,85.2208,1.5,5.5,8.55,2.8,8.5
2671,6/3/2013,370,375,370,370,374,525100,6,2013,3,4.56,4.91,85.1281,1.5,5.5,8.55,2.8,8.5
2672,5/31/2013,365,375,360,374,368,329200,5,2013,31,4.96,4.05,85.1236,1.5,5.5,8.55,2.8,8.5
2673,5/30/2013,365,365,360,365,365,152500,5,2013,30,4.96,4.05,84.9042,1.5,5.5,8.55,2.8,8.5
2674,5/29/2013,374,374,360,365,366,121800,5,2013,29,4.96,4.05,85.2861,1.5,5.5,8.55,2.8,8.5
2675,5/28/2013,395,395,365,375,378,126600,5,2013,28,4.96,4.05,84.9833,1.5,5.5,8.55,2.8,8.5
2676,5/27/2013,377,380,375,377,380,341500,5,2013,27,4.96,4.05,84.4261,1.5,5.5,8.55,2.8,8.5
2677,5/24/2013,375,390,375,385,389,30100,5,2013,24,4.96,4.05,84.37,1.5,5.5,8.55,2.8,8.5
2678,5/23/2013,425,425,394,394,409,41300,5,2013,23,4.96,4.05,84.4764,1.5,5.5,8.55,2.8,8.5
2679,5/22/2013,420,426,416,420,424,560300,5,2013,22,4.96,4.05,84.2597,1.5,5.5,8.55,2.8,8.5
2680,5/21/2013,396,420,396,415,410,351300,5,2013,21,4.96,4.05,83.8508,1.5,5.5,8.55,2.8,8.5
2681,5/20/2013,391,400,391,396,400,45500,5,2013,20,4.96,4.05,83.8375,1.5,5.5,8.55,2.8,8.5
2682,5/17/2013,385,400,385,400,392,237800,5,2013,17,4.96,4.05,83.7972,1.5,5.5,8.55,2.8,8.5
2683,5/16/2013,385,388,385,388,386,22800,5,2013,16,4.96,4.05,83.8242,1.5,5.5,8.55,2.8,8.5
2684,5/15/2013,360,385,360,380,370,102700,5,2013,15,4.96,4.05,83.8069,1.5,5.5,8.55,2.8,8.5
2685,5/14/2013,350,360,347,360,356,1073500,5,2013,14,4.96,4.05,83.8361,1.5,5.5,8.55,2.8,8.5
2686,5/13/2013,343,350,342,350,350,51000,5,2013,13,4.96,4.05,83.8609,1.5,5.5,8.55,2.8,8.5
2687,5/10/2013,342,345,342,343,344,198000,5,2013,10,4.96,4.05,83.725,1.5,5.5,8.55,2.8,8.5
2688,5/9/2013,340,345,340,345,341,174200,5,2013,9,4.96,4.05,83.7917,1.5,5.5,8.55,2.8,8.5
2689,5/8/2013,335,340,335,340,339,244700,5,2013,8,4.96,4.05,83.8989,1.5,5.5,8.55,2.8,8.5
2690,5/7/2013,331,340,331,340,335,152700,5,2013,7,4.96,4.05,83.8906,1.5,5.5,8.55,2.8,8.5
2691,5/6/2013,320,331,320,330,328,430100,5,2013,6,4.96,4.05,83.7164,1.5,5.5,8.55,2.8,8.5
2692,5/3/2013,316,322,312,312,321,79200,5,2013,3,4.96,4.05,83.7553,1.5,5.5,8.55,2.8,8.5
2693,5/2/2013,306,325,306,325,318,595200,5,2013,2,4.96,4.05,83.795,1.5,5.5,8.55,2.8,8.5
2694,4/30/2013,305,306,301,305,306,27600,4,2013,30,5.61,4.14,83.8208,1.5,5.5,8.55,2.8,8.5
2695,4/29/2013,300,305,300,305,301,349700,4,2013,29,5.61,4.14,83.8131,1.5,5.5,8.55,2.8,8.5
2696,4/26/2013,296,298,296,298,298,125400,4,2013,26,5.61,4.14,83.7944,1.5,5.5,8.55,2.8,8.5
2697,4/25/2013,298,300,296,300,300,30800,4,2013,25,5.61,4.14,83.7681,1.5,5.5,8.55,2.8,8.5
2698,4/24/2013,296,300,295,295,299,230600,4,2013,24,5.61,4.14,83.7833,1.5,5.5,8.55,2.8,8.5
2699,4/23/2013,295,301,295,295,297,164100,4,2013,23,5.61,4.14,83.8836,1.5,5.5,8.55,2.8,8.5
2700,4/22/2013,300,300,295,298,298,14600,4,2013,22,5.61,4.14,83.8831,1.5,5.5,8.55,2.8,8.5
2701,4/19/2013,292,300,292,293,300,127900,4,2013,19,5.61,4.14,83.82,1.5,5.5,8.55,2.8,8.5
2702,4/18/2013,302,303,295,296,303,565000,4,2013,18,5.61,4.14,83.7933,1.5,5.5,8.55,2.8,8.5
2703,4/17/2013,303,304,302,304,303,925100,4,2013,17,5.61,4.14,83.8989,1.5,5.5,8.55,2.8,8.5
2704,4/16/2013,305,305,302,302,305,134000,4,2013,16,5.61,4.14,83.8781,1.5,5.5,8.55,2.8,8.5
2705,4/15/2013,307,308,305,308,307,16400,4,2013,15,5.61,4.14,83.9889,1.5,5.5,8.55,2.8,8.5
2706,4/12/2013,302,305,302,304,305,183000,4,2013,12,5.61,4.14,84.1861,1.5,5.5,8.55,2.8,8.5
2707,4/11/2013,303,310,303,305,304,161300,4,2013,11,5.61,4.14,84.3039,1.5,5.5,8.55,2.8,8.5
2708,4/10/2013,305,305,295,302,303,203600,4,2013,10,5.61,4.14,84.6792,1.5,5.5,8.55,2.8,8.5
2709,4/8/2013,305,305,291,291,293,2600,4,2013,8,5.61,4.14,84.7917,1.5,5.5,8.55,2.8,8.5
2710,4/5/2013,307,308,307,307,308,879500,4,2013,5,5.61,4.14,84.8639,1.5,5.5,8.55,2.8,8.5
2711,4/4/2013,309,310,308,308,310,139100,4,2013,4,5.61,4.14,84.8569,1.5,5.5,8.55,2.8,8.5
2712,4/3/2013,310,311,306,306,310,385300,4,2013,3,5.61,4.14,84.9903,1.5,5.5,8.55,2.8,8.5
2713,4/2/2013,312,312,308,311,311,272500,4,2013,2,5.61,4.14,84.9833,1.5,5.5,8.55,2.8,8.5
2714,3/28/2013,315,320,310,311,312,557700,3,2013,28,6.33,4.11,85.6386,1.5,5.5,8.55,2.8,8.5
2715,3/27/2013,310,312,310,312,312,429400,3,2013,27,6.33,4.11,85.8083,1.5,5.5,8.55,2.8,8.5
2716,3/26/2013,315,315,310,312,312,254000,3,2013,26,6.33,4.11,85.8486,1.5,5.5,8.55,2.8,8.5
2717,3/25/2013,310,312,310,312,311,403800,3,2013,25,6.33,4.11,85.8258,1.5,5.5,8.55,2.8,8.5
2718,3/22/2013,310,310,309,310,310,189500,3,2013,22,6.33,4.11,85.7628,1.5,5.5,8.55,2.8,8.5
2719,3/21/2013,310,311,305,310,310,202800,3,2013,21,6.33,4.11,85.725,1.5,5.5,8.55,2.8,8.5
2720,3/20/2013,309,319,307,310,310,162900,3,2013,20,6.33,4.11,85.7139,1.5,5.5,8.55,2.8,8.5
2721,3/19/2013,304,311,301,308,308,90600,3,2013,19,6.33,4.11,85.8083,1.5,5.5,8.55,2.8,8.5
2722,3/18/2013,305,305,300,305,305,423500,3,2013,18,6.33,4.11,85.6014,1.5,5.5,8.55,2.8,8.5
2723,3/15/2013,305,309,300,300,304,11100,3,2013,15,6.33,4.11,85.6361,1.5,5.5,8.55,2.8,8.5
2724,3/14/2013,311,311,310,311,311,626300,3,2013,14,6.33,4.11,85.34,1.5,5.5,8.55,2.8,8.5
2725,3/13/2013,320,320,300,320,320,140800,3,2013,13,6.33,4.11,85.3222,1.5,5.5,8.55,2.8,8.5
2726,3/12/2013,318,325,318,323,321,1411600,3,2013,12,6.33,4.11,85.5889,1.5,5.5,8.55,2.8,8.5
2727,3/11/2013,300,320,299,320,308,25300,3,2013,11,6.33,4.11,85.8236,1.5,5.5,8.55,2.8,8.5
2728,3/8/2013,296,300,296,300,298,165900,3,2013,8,6.33,4.11,86.1639,1.5,5.5,8.55,2.8,8.5
2729,3/7/2013,295,300,292,300,296,77300,3,2013,7,6.33,4.11,86.5833,1.5,5.5,8.55,2.8,8.5
2730,3/6/2013,282,293,268,293,292,63700,3,2013,6,6.33,4.11,86.1667,1.5,5.5,8.55,2.8,8.5
2731,3/5/2013,285,291,285,291,288,66700,3,2013,5,6.33,4.11,86.0375,1.5,5.5,8.55,2.8,8.5
2732,2/28/2013,281,286,281,286,283,44500,2,2013,28,7.24,4.45,86.2361,1.5,5.5,8.55,2.8,9.5
2733,2/27/2013,280,281,280,281,281,1072100,2,2013,27,7.24,4.45,87.2319,1.5,5.5,8.55,2.8,9.5
2734,2/26/2013,276,290,263,280,280,376000,2,2013,26,7.24,4.45,87.3194,1.5,5.5,8.55,2.8,9.5
2735,2/25/2013,280,290,278,280,281,3153100,2,2013,25,7.24,4.45,87.4764,1.5,5.5,8.55,2.8,9.5
2736,2/22/2013,280,285,278,285,281,326400,2,2013,22,7.24,4.45,87.5419,1.5,5.5,8.55,2.8,9.5
2737,2/21/2013,275,280,275,278,278,1454900,2,2013,21,7.24,4.45,87.5964,1.5,5.5,8.55,2.8,9.5
2738,2/20/2013,275,277,272,277,274,399000,2,2013,20,7.24,4.45,87.6336,1.5,5.5,8.55,2.8,9.5
2739,2/19/2013,280,280,271,280,278,1095300,2,2013,19,7.24,4.45,87.6094,1.5,5.5,8.55,2.8,9.5
2740,2/18/2013,290,290,272,272,288,582500,2,2013,18,7.24,4.45,87.4108,1.5,5.5,8.55,2.8,9.5
2741,2/15/2013,300,300,294,295,296,5900,2,2013,15,7.24,4.45,87.4194,1.5,5.5,8.55,2.8,9.5
2742,2/14/2013,309,310,307,307,309,219200,2,2013,14,7.24,4.45,87.3428,6.25,5.5,8.55,2.8,9.5
2743,2/13/2013,312,315,312,312,315,2005100,2,2013,13,7.24,4.45,87.4519,6.25,5.5,8.55,2.8,9.5
2744,2/12/2013,314,316,314,315,315,1430100,2,2013,12,7.24,4.45,87.5756,6.25,5.5,8.55,2.8,9.5
2745,2/11/2013,307,312,307,312,312,411400,2,2013,11,7.24,4.45,87.5681,6.25,5.5,8.55,2.8,9.5
2746,2/8/2013,307,309,307,308,308,438100,2,2013,8,7.24,4.45,87.5539,6.25,5.5,8.55,2.8,9.5
2747,2/7/2013,308,309,307,308,308,730000,2,2013,7,7.24,4.45,87.6133,6.25,5.5,8.55,2.8,9.5
2748,2/6/2013,306,309,306,308,308,257100,2,2013,6,7.24,4.45,87.6025,6.25,5.5,8.55,2.8,9.5
2749,2/5/2013,306,308,306,307,307,887400,2,2013,5,7.24,4.45,87.5775,6.25,5.5,8.55,2.8,9.5
2750,2/4/2013,303,306,301,306,305,299500,2,2013,4,7.24,4.45,87.5669,6.25,5.5,8.55,2.8,9.5
2751,2/1/2013,300,304,300,304,304,466700,2,2013,1,7.24,4.45,87.5828,6.25,5.5,8.55,2.8,9.5
2752,1/31/2013,301,303,301,301,302,105900,1,2013,31,8.2,3.67,87.6111,6.25,5.5,8.55,2.8,9.5
2753,1/30/2013,300,300,300,300,300,156800,1,2013,30,8.2,3.67,87.5861,6.25,5.5,8.55,2.8,9.5
2754,1/29/2013,290,300,285,300,300,281200,1,2013,29,8.2,3.67,87.5906,6.25,5.5,8.55,2.8,9.5
2755,1/28/2013,296,300,296,297,300,141100,1,2013,28,8.2,3.67,87.5828,6.25,5.5,8.55,2.8,9.5
2756,1/25/2013,295,300,295,300,298,114700,1,2013,25,8.2,3.67,87.5206,6.25,5.5,8.55,2.8,9.5
2757,1/24/2013,294,295,294,295,295,99600,1,2013,24,8.2,3.67,87.4694,6.25,5.5,8.55,2.8,9.5
2758,1/23/2013,295,298,294,295,297,385200,1,2013,23,8.2,3.67,87.3794,6.25,5.5,8.55,2.8,9.5
2759,1/22/2013,290,295,290,295,295,18100,1,2013,22,8.2,3.67,86.9792,6.25,5.5,8.55,2.8,9.5
2760,1/21/2013,290,299,290,299,296,11700,1,2013,21,8.2,3.67,86.8531,6.25,5.5,8.55,2.8,9.5
2761,1/18/2013,300,300,295,295,296,50600,1,2013,18,8.2,3.67,86.8653,6.25,5.5,8.55,2.8,9.5
2762,1/17/2013,300,305,300,300,302,307500,1,2013,17,8.2,3.67,86.7042,6.25,5.5,8.55,2.8,9.5
2763,1/16/2013,305,305,295,300,305,672100,1,2013,16,8.2,3.67,86.6989,6.25,5.5,8.55,2.8,9.5
2764,1/15/2013,300,305,300,301,304,694000,1,2013,15,8.2,3.67,86.6853,6.25,5.5,8.55,2.8,9.5
2765,1/14/2013,297,306,295,301,300,89300,1,2013,14,8.2,3.67,86.6844,6.25,5.5,8.55,2.8,9.5
2766,1/11/2013,292,297,291,295,295,142100,1,2013,11,8.2,3.67,86.6722,6.25,5.5,8.55,2.8,9.5
2767,1/10/2013,291,292,291,292,292,642700,1,2013,10,8.2,3.67,86.6053,6.25,5.5,8.55,2.8,9.5
2768,1/9/2013,287,295,287,291,291,1006100,1,2013,9,8.2,3.67,86.5242,6.25,5.5,8.55,2.8,9.5
2769,1/8/2013,275,295,272,295,281,22600,1,2013,8,8.2,3.67,86.4775,6.25,5.5,8.55,2.8,9.5
2770,1/7/2013,270,275,270,275,273,9100,1,2013,7,8.2,3.67,86.4264,6.25,5.5,8.55,2.8,9.5
2771,1/4/2013,270,280,270,275,275,65200,1,2013,4,8.2,3.67,86.4417,6.25,5.5,8.55,2.8,9.5
2772,1/3/2013,265,268,265,268,268,9100,1,2013,3,8.2,3.67,86.3569,6.25,5.5,8.55,2.8,9.5
2773,1/2/2013,267,267,267,267,267,1100,1,2013,2,8.2,3.67,86.0769,6.25,5.5,8.55,2.8,9.5
2774,12/31/2012,263,266,263,265,266,119200,12,2012,31,9.38,3.2,86.0286,6.25,8.75,13.46,2.8,9.5
2775,12/28/2012,263,265,263,265,265,28400,12,2012,28,9.38,3.2,85.9611,6.25,8.75,13.46,2.8,9.5
2776,12/27/2012,263,263,263,263,263,83500,12,2012,27,9.38,3.2,85.8628,6.25,8.75,13.46,2.8,9.5
2777,12/24/2012,262,262,260,262,262,21500,12,2012,24,9.38,3.2,85.9039,6.25,8.75,13.46,2.8,9.5
2778,12/21/2012,260,264,259,262,262,130800,12,2012,21,9.38,3.2,86.0008,6.25,8.75,13.46,2.8,9.5
2779,12/20/2012,260,261,259,259,260,1833000,12,2012,20,9.38,3.2,86.0472,6.25,8.75,13.46,2.8,9.5
2780,12/19/2012,259,260,235,235,260,530300,12,2012,19,9.38,3.2,86.0744,6.25,8.75,13.46,2.8,9.5
2781,12/18/2012,260,261,247,247,261,62400,12,2012,18,9.38,3.2,86.0611,6.25,8.75,13.46,2.8,9.5
2782,12/17/2012,260,262,260,260,261,1130000,12,2012,17,9.38,3.2,86.0672,6.25,8.75,13.46,2.8,9.5
2783,12/14/2012,260,261,256,261,261,79100,12,2012,14,9.38,3.2,86.0383,6.25,8.75,13.46,2.8,9.5
2784,12/13/2012,260,260,256,260,260,608300,12,2012,13,9.38,3.2,86.0422,6.25,8.75,13.46,2.8,9.5
2785,12/11/2012,255,260,255,256,258,215900,12,2012,11,9.38,3.2,86.0522,6.25,8.75,13.46,2.8,9.5
2786,12/10/2012,252,255,252,255,255,153400,12,2012,10,9.38,3.2,85.9889,6.25,8.75,13.46,2.8,9.5
2787,12/7/2012,251,253,251,253,252,49800,12,2012,7,9.38,3.2,85.9575,6.25,8.75,13.46,2.8,9.5
2788,12/6/2012,249,250,249,250,250,129600,12,2012,6,9.38,3.2,85.9889,6.25,8.75,13.46,2.8,9.5
2789,12/5/2012,246,248,246,248,248,89000,12,2012,5,9.38,3.2,85.9417,6.25,8.75,13.46,2.8,9.5
2790,12/4/2012,246,247,246,247,247,193000,12,2012,4,9.38,3.2,85.9639,6.25,8.75,13.46,2.8,9.5
2791,12/3/2012,246,246,246,246,246,691400,12,2012,3,9.38,3.2,85.9111,6.25,8.75,13.46,2.8,9.5
2792,11/30/2012,240,250,240,247,248,269900,11,2012,30,10.67,3.25,85.9347,6.25,8.75,13.46,2.8,9.5
2793,11/29/2012,243,245,243,245,245,368900,11,2012,29,10.67,3.25,85.9431,6.25,8.75,13.46,2.8,9.5
2794,11/28/2012,242,243,242,243,243,235200,11,2012,28,10.67,3.25,85.9708,6.25,8.75,13.46,2.8,9.5
2795,11/27/2012,240,240,240,240,240,9100,11,2012,27,10.67,3.25,85.9903,6.25,8.75,13.46,2.8,9.5
2796,11/26/2012,240,243,240,243,243,519700,11,2012,26,10.67,3.25,85.7975,6.25,8.75,13.46,2.8,9.5
2797,11/23/2012,242,243,240,243,243,492900,11,2012,23,10.67,3.25,85.7211,6.25,8.75,13.46,2.8,9.5
2798,11/22/2012,242,242,230,231,242,217600,11,2012,22,10.67,3.25,85.7097,6.25,8.75,13.46,2.8,9.5
2799,11/21/2012,242,243,242,243,243,507300,11,2012,21,10.67,3.25,85.7114,6.25,8.75,13.46,2.8,9.5
2800,11/20/2012,242,243,240,243,243,94000,11,2012,20,10.67,3.25,85.7139,6.25,8.75,13.46,2.8,9.5
2801,11/19/2012,241,243,240,242,242,317800,11,2012,19,10.67,3.25,85.6597,6.25,8.75,13.46,2.8,9.5
2802,11/16/2012,231,243,231,242,242,137200,11,2012,16,10.67,3.25,85.645,6.25,8.75,13.46,2.8,9.5
2803,11/15/2012,242,244,242,242,243,63900,11,2012,15,10.67,3.25,85.6261,6.25,8.75,13.46,2.8,9.5
2804,11/14/2012,241,243,241,243,243,230200,11,2012,14,10.67,3.25,85.6428,6.25,8.75,13.46,2.8,9.5
2805,11/13/2012,242,242,241,242,242,1083200,11,2012,13,10.67,3.25,85.5283,6.25,8.75,13.46,2.8,9.5
2806,11/12/2012,240,244,240,244,243,74700,11,2012,12,10.67,3.25,85.3994,6.25,8.75,13.46,2.8,9.5
2807,11/9/2012,240,242,239,241,241,23000,11,2012,9,10.67,3.25,85.3778,6.25,8.75,13.46,2.8,9.5
2808,11/8/2012,240,242,240,241,242,219900,11,2012,8,10.67,3.25,85.41,6.25,8.75,13.46,2.8,9.5
2809,11/7/2012,239,241,239,240,241,323600,11,2012,7,10.67,3.25,85.5069,6.25,8.75,13.46,2.8,9.5
2810,11/6/2012,240,241,220,240,240,236700,11,2012,6,10.67,3.25,85.55,6.25,8.75,13.46,2.8,9.5
2811,11/5/2012,239,241,239,240,241,112500,11,2012,5,10.67,3.25,85.4456,6.25,8.75,13.46,2.8,9.5
2812,11/2/2012,240,241,240,241,241,212600,11,2012,2,10.67,3.25,85.3083,6.25,8.75,13.46,2.8,9.5
2813,11/1/2012,239,241,239,241,240,91700,11,2012,1,10.67,3.25,85.2361,6.25,8.75,13.46,2.8,9.5
2814,10/31/2012,240,241,240,241,241,49400,10,2012,31,12.04,4.14,85.1775,6.25,8.75,13.46,2.8,13
2815,10/30/2012,241,242,240,240,241,77800,10,2012,30,12.04,4.14,85.1678,6.25,8.75,13.46,2.8,13
2816,10/29/2012,238,240,238,240,240,1074800,10,2012,29,12.04,4.14,85.1692,6.25,8.75,13.46,2.8,13
2817,10/26/2012,239,240,237,240,240,897100,10,2012,26,12.04,4.14,85.1342,6.25,8.75,13.46,2.8,13
2818,10/25/2012,240,240,228,239,238,6000,10,2012,25,12.04,4.14,85.1472,6.25,8.75,13.46,2.8,13
2819,10/24/2012,240,240,238,240,240,223000,10,2012,24,12.04,4.14,85.2208,6.25,8.75,13.46,2.8,13
2820,10/23/2012,237,240,237,240,240,1404300,10,2012,23,12.04,4.14,85.2328,6.25,8.75,13.46,2.8,13
2821,10/22/2012,240,240,237,237,240,438200,10,2012,22,12.04,4.14,85.1819,6.25,8.75,13.46,2.8,13
2822,10/19/2012,240,240,235,235,240,957800,10,2012,19,12.04,4.14,85.1667,6.25,8.75,13.46,2.8,13
2823,10/18/2012,238,238,237,237,238,8200,10,2012,18,12.04,4.14,85.0422,6.25,8.75,13.46,2.8,13
2824,10/17/2012,238,238,237,238,238,360200,10,2012,17,12.04,4.14,85.0342,6.25,8.75,13.46,2.8,13
2825,10/16/2012,237,238,236,238,238,674000,10,2012,16,12.04,4.14,85.1261,6.25,8.75,13.46,2.8,13
2826,10/15/2012,236,238,236,237,238,102600,10,2012,15,12.04,4.14,85.1383,6.25,8.75,13.46,2.8,13
2827,10/12/2012,236,236,235,235,236,1700,10,2012,12,12.04,4.14,85.1339,6.25,8.75,13.46,2.8,13
2828,10/11/2012,231,236,231,236,236,674100,10,2012,11,12.04,4.14,85.1175,6.25,8.75,13.46,2.8,13
2829,10/10/2012,230,231,230,231,231,6800,10,2012,10,12.04,4.14,85.0978,6.25,8.75,13.46,2.8,13
2830,10/9/2012,230,234,230,230,234,7000,10,2012,9,12.04,4.14,85.1019,6.25,8.75,13.46,2.8,13
2831,10/8/2012,234,235,230,234,233,56400,10,2012,8,12.04,4.14,84.9153,6.25,8.75,13.46,2.8,13
2832,10/5/2012,235,235,235,235,235,728800,10,2012,5,12.04,4.14,84.9125,6.25,8.75,13.46,2.8,13
2833,10/4/2012,235,236,235,235,236,3011100,10,2012,4,12.04,4.14,84.925,6.25,8.75,13.46,2.8,13
2834,10/3/2012,234,240,231,238,240,1292700,10,2012,3,12.04,4.14,84.9714,6.25,8.75,13.46,2.8,13
2835,10/2/2012,233,235,233,235,235,66500,10,2012,2,12.04,4.14,85.1764,6.25,8.75,13.46,2.8,13
2836,10/1/2012,232,235,232,235,235,314100,10,2012,1,12.04,4.14,85.2764,6.25,8.75,13.46,2.8,13
2837,9/28/2012,230,235,228,230,234,909600,9,2012,28,13.29,5.32,85.2833,6.25,8.75,13.46,2.8,13
2838,9/27/2012,230,230,226,227,230,147900,9,2012,27,13.29,5.32,85.1764,6.25,8.75,13.46,2.8,13
2839,9/26/2012,223,223,220,221,222,800,9,2012,26,13.29,5.32,85.0097,6.25,8.75,13.46,2.8,13
2840,9/25/2012,223,232,223,232,230,2942600,9,2012,25,13.29,5.32,84.8444,6.25,8.75,13.46,2.8,13
2841,9/24/2012,222,225,222,225,224,47200,9,2012,24,13.29,5.32,84.8667,6.25,8.75,13.46,2.8,13
2842,9/21/2012,226,228,226,227,227,54700,9,2012,21,13.29,5.32,84.8264,6.25,8.75,13.46,2.8,13
2843,9/20/2012,222,227,222,226,227,1618900,9,2012,20,13.29,5.32,84.8275,6.25,8.75,13.46,2.8,13
2844,9/19/2012,228,230,226,227,227,181800,9,2012,19,13.29,5.32,84.8847,6.25,8.75,13.46,2.8,13
2845,9/18/2012,228,229,227,229,229,100700,9,2012,18,13.29,5.32,84.7531,6.25,8.75,13.46,2.8,13
2846,9/17/2012,229,229,228,229,229,72500,9,2012,17,13.29,5.32,84.3817,6.25,8.75,13.46,2.8,13
2847,9/14/2012,228,230,228,228,230,282200,9,2012,14,13.29,5.32,84.4042,6.25,8.75,13.46,2.8,13
2848,9/13/2012,230,232,228,229,230,87900,9,2012,13,13.29,5.32,84.2139,6.25,8.75,13.46,2.8,13
2849,9/12/2012,228,230,228,230,229,586000,9,2012,12,13.29,5.32,84.1417,6.25,8.75,13.46,2.8,13
2850,9/11/2012,227,230,227,229,230,244700,9,2012,11,13.29,5.32,84.2403,6.25,8.75,13.46,2.8,13
2851,9/10/2012,230,230,225,225,226,5916300,9,2012,10,13.29,5.32,84.3389,6.25,8.75,13.46,2.8,13
2852,9/7/2012,230,230,230,230,230,2600,9,2012,7,13.29,5.32,84.4056,6.25,8.75,13.46,2.8,13
2853,9/6/2012,226,229,226,229,228,257800,9,2012,6,13.29,5.32,84.3872,6.25,8.75,13.46,2.8,13
2854,9/5/2012,229,230,229,230,230,1201900,9,2012,5,13.29,5.32,84.8653,6.25,8.75,13.46,2.8,13
2855,9/4/2012,226,226,226,226,226,1600,9,2012,4,13.29,5.32,84.2667,6.25,8.75,13.46,2.8,13
2856,9/3/2012,216,229,216,226,226,26500,9,2012,3,13.29,5.32,84.1483,6.25,8.75,13.46,2.8,13
2857,8/31/2012,226,226,226,226,226,12800,8,2012,31,14.33,6.09,84.3208,6.25,8.75,13.46,2.8,16.5
2858,8/30/2012,228,228,225,226,226,18100,8,2012,30,14.33,6.09,84.1422,6.25,8.75,13.46,2.8,16.5
2859,8/29/2012,225,225,222,223,224,5100,8,2012,29,14.33,6.09,84.1181,6.25,8.75,13.46,2.8,16.5
2860,8/28/2012,220,223,220,223,222,43600,8,2012,28,14.33,6.09,84.0961,6.25,8.75,13.46,2.8,16.5
2861,8/27/2012,221,224,221,223,223,243700,8,2012,27,14.33,6.09,84.0236,6.25,8.75,13.46,2.8,16.5
2862,8/24/2012,228,229,220,222,224,143400,8,2012,24,14.33,6.09,84.0056,6.25,8.75,13.46,2.8,16.5
2863,8/23/2012,236,238,229,230,230,178900,8,2012,23,14.33,6.09,83.9903,2.5,8.75,13.46,2.8,16.5
2864,8/22/2012,227,230,227,230,230,228800,8,2012,22,14.33,6.09,84.0056,2.5,8.75,13.46,2.8,16.5
2865,8/21/2012,230,232,221,227,230,389700,8,2012,21,14.33,6.09,83.975,2.5,8.75,13.46,2.8,16.5
2866,8/17/2012,230,240,230,230,233,895800,8,2012,17,14.33,6.09,84.0672,2.5,8.75,13.46,2.8,16.5
2867,8/16/2012,230,232,227,231,231,33600,8,2012,16,14.33,6.09,83.9833,2.5,8.75,13.46,2.8,16.5
2868,8/15/2012,226,230,226,226,228,19600,8,2012,15,14.33,6.09,83.9333,2.5,8.75,13.46,2.8,16.5
2869,8/14/2012,227,227,225,226,226,10400,8,2012,14,14.33,6.09,83.8975,2.5,8.75,13.46,2.8,16.5
2870,8/13/2012,225,227,225,225,226,6100,8,2012,13,14.33,6.09,84.0506,2.5,8.75,13.46,2.8,16.5
2871,8/10/2012,230,235,228,230,232,696800,8,2012,10,14.33,6.09,84.0139,2.5,8.75,13.46,2.8,16.5
2872,8/9/2012,226,230,226,229,230,55600,8,2012,9,14.33,6.09,84.0875,2.5,8.75,13.46,2.8,16.5
2873,8/8/2012,222,226,222,226,226,194700,8,2012,8,14.33,6.09,83.9367,2.5,8.75,13.46,2.8,16.5
2874,8/7/2012,221,225,221,225,224,11700,8,2012,7,14.33,6.09,84.095,2.5,8.75,13.46,2.8,16.5
2875,8/6/2012,220,222,220,221,221,7600,8,2012,6,14.33,6.09,84.2022,2.5,8.75,13.46,2.8,16.5
2876,8/3/2012,220,222,220,222,221,645400,8,2012,3,14.33,6.09,84.2506,2.5,8.75,13.46,2.8,16.5
2877,8/2/2012,222,222,209,209,220,499600,8,2012,2,14.33,6.09,84.2264,2.5,8.75,13.46,2.8,16.5
2878,8/1/2012,211,222,211,222,222,330100,8,2012,1,14.33,6.09,84.2383,2.5,8.75,13.46,2.8,16.5
2879,7/31/2012,220,224,220,220,222,17900,7,2012,31,15.27,7.74,84.2125,2.5,8.75,13.46,2.8,16.5
2880,7/30/2012,226,227,224,224,225,10000,7,2012,30,15.27,7.74,84.2014,2.5,8.75,13.46,2.8,16.5
2881,7/27/2012,227,230,225,226,227,61600,7,2012,27,15.27,7.74,84.2011,2.5,8.75,13.46,2.8,16.5
2882,7/26/2012,226,229,225,225,227,269700,7,2012,26,15.27,7.74,84.2292,2.5,8.75,13.46,2.8,16.5
2883,7/25/2012,228,229,226,226,228,3000,7,2012,25,15.27,7.74,84.2997,2.5,8.75,13.46,2.8,16.5
2884,7/24/2012,227,228,225,227,228,402800,7,2012,24,15.27,7.74,84.2617,2.5,8.75,13.46,2.8,16.5
2885,7/23/2012,228,228,227,227,228,357400,7,2012,23,15.27,7.74,84.1917,2.5,8.75,13.46,2.8,16.5
2886,7/20/2012,227,229,227,227,228,250500,7,2012,20,15.27,7.74,84.1447,2.5,8.75,13.46,2.8,16.5
2887,7/19/2012,225,230,225,230,228,472500,7,2012,19,15.27,7.74,84.1558,2.5,8.75,13.46,2.8,16.5
2888,7/18/2012,223,225,223,225,225,509300,7,2012,18,15.27,7.74,84.1794,2.5,8.75,13.46,2.8,16.5
2889,7/17/2012,221,225,221,223,225,619000,7,2012,17,15.27,7.74,84.1889,2.5,8.75,13.46,2.8,16.5
2890,7/16/2012,216,223,216,223,223,110400,7,2012,16,15.27,7.74,84.1222,2.5,8.75,13.46,2.8,16.5
2891,7/13/2012,223,224,223,223,224,2400,7,2012,13,15.27,7.74,84.0265,2.5,8.75,13.46,2.8,16.5
2892,7/12/2012,234,234,223,234,231,300,7,2012,12,15.27,7.74,83.9292,2.5,8.75,13.46,2.8,16.5
2893,7/11/2012,237,237,229,235,235,375700,7,2012,11,15.27,7.74,83.9588,2.5,8.75,13.46,2.8,16.5
2894,7/10/2012,237,238,236,236,237,406500,7,2012,10,15.27,7.74,83.9368,2.5,8.75,13.46,2.8,16.5
2895,7/9/2012,235,238,235,237,238,325300,7,2012,9,15.27,7.74,84.0972,2.5,8.75,13.46,2.8,16.5
2896,7/6/2012,242,242,238,238,241,256900,7,2012,6,15.27,7.74,84.5292,2.5,8.75,13.46,2.8,16.5
2897,7/5/2012,241,242,238,240,241,572000,7,2012,5,15.27,7.74,84.0347,2.5,8.75,13.46,2.8,16.5
2898,7/4/2012,235,241,235,241,240,622600,7,2012,4,15.27,7.74,84.0278,2.5,8.75,13.46,2.8,16.5
2899,7/3/2012,231,237,231,237,237,50800,7,2012,3,15.27,7.74,84.1231,2.5,8.75,13.46,2.8,16.5
2900,7/2/2012,230,233,229,231,231,380400,7,2012,2,15.27,7.74,84.1322,2.5,8.75,13.46,2.8,16.5
2901,6/29/2012,226,228,226,228,228,35500,6,2012,29,15.97,10.05,84.2333,2.5,8.75,13.46,2.8,18
2902,6/28/2012,226,228,220,226,224,135400,6,2012,28,15.97,10.05,84.1478,2.5,8.75,13.46,2.8,18
2903,6/27/2012,226,228,226,226,227,103700,6,2012,27,15.97,10.05,84.1625,2.5,8.75,13.46,2.8,18
2904,6/26/2012,225,230,225,226,227,303700,6,2012,26,15.97,10.05,84.2519,2.5,8.75,13.46,2.8,18
2905,6/25/2012,225,229,225,229,226,4200,6,2012,25,15.97,10.05,83.9472,2.5,8.75,13.46,2.8,18
2906,6/22/2012,225,225,225,225,225,59900,6,2012,22,15.97,10.05,84.0125,2.5,8.75,13.46,2.8,18
2907,6/21/2012,222,225,219,225,225,323400,6,2012,21,15.97,10.05,83.6403,2.5,8.75,13.46,2.8,18
2908,6/20/2012,225,230,222,225,225,981100,6,2012,20,15.97,10.05,84.1556,2.5,8.75,13.46,2.8,18
2909,6/19/2012,221,235,220,235,224,525300,6,2012,19,15.97,10.05,84.525,2.5,8.75,13.46,2.8,18
2910,6/18/2012,221,222,220,220,221,19200,6,2012,18,15.97,10.05,84.8847,2.5,8.75,13.46,2.8,18
2911,6/15/2012,219,221,215,220,221,37300,6,2012,15,15.97,10.05,85.1306,2.5,8.75,13.46,2.8,18
2912,6/14/2012,220,220,218,220,219,209900,6,2012,14,15.97,10.05,85.2667,2.5,8.75,13.46,2.8,18
2913,6/13/2012,220,220,219,219,220,472300,6,2012,13,15.97,10.05,85.4556,2.5,8.75,13.46,2.8,18
2914,6/12/2012,218,220,218,220,220,548300,6,2012,12,15.97,10.05,85.2431,2.5,8.75,13.46,2.8,18
2915,6/11/2012,219,219,218,218,219,7200,6,2012,11,15.97,10.05,84.8125,2.5,8.75,13.46,2.8,18
2916,6/8/2012,219,220,218,219,219,397600,6,2012,8,15.97,10.05,84.6722,2.5,8.75,13.46,2.8,18
2917,6/7/2012,219,220,218,220,220,184000,6,2012,7,15.97,10.05,85.5111,2.5,8.75,13.46,2.8,18
2918,6/6/2012,218,221,218,221,220,777300,6,2012,6,15.97,10.05,85.6486,2.5,8.75,13.46,2.8,18
2919,6/5/2012,218,218,215,218,218,1379700,6,2012,5,15.97,10.05,85.9569,2.5,8.75,13.46,2.8,18
2920,6/4/2012,217,219,217,218,218,63400,6,2012,4,15.97,10.05,86.1167,2.5,8.75,13.46,2.8,18
2921,5/31/2012,218,218,217,217,218,686100,5,2012,31,16.4,12.22,86.825,2.5,8.75,13.46,2.8,18
2922,5/30/2012,218,220,217,220,219,13000,5,2012,30,16.4,12.22,85.9556,2.5,8.75,13.46,2.8,18
2923,5/29/2012,215,218,215,218,218,101200,5,2012,29,16.4,12.22,85.5819,2.5,8.75,13.46,2.8,18
2924,5/28/2012,210,219,210,218,218,676900,5,2012,28,16.4,12.22,85.3958,2.5,8.75,13.46,2.8,18
2925,5/25/2012,215,217,215,215,216,124000,5,2012,25,16.4,12.22,85.3153,2.5,8.75,13.46,2.8,18
2926,5/24/2012,218,219,217,219,219,86000,5,2012,24,16.4,12.22,85.2558,2.5,8.75,13.46,2.8,18
2927,5/23/2012,220,220,217,217,220,272800,5,2012,23,16.4,12.22,85.1625,2.5,8.75,13.46,2.8,18
2928,5/22/2012,219,220,218,218,220,252800,5,2012,22,16.4,12.22,84.5639,2.5,8.75,13.46,2.8,18
2929,5/21/2012,216,218,215,217,217,312100,5,2012,21,16.4,12.22,84.9572,2.5,8.75,13.46,2.8,18
2930,5/18/2012,215,215,215,215,215,532600,5,2012,18,16.4,12.22,85.1625,2.5,8.75,13.46,2.8,18
2931,5/17/2012,216,217,215,216,216,105800,5,2012,17,16.4,12.22,84.5639,2.5,8.75,13.46,2.8,18
2932,5/16/2012,218,218,212,217,215,466300,5,2012,16,16.4,12.22,84.9572,2.5,8.75,13.46,2.8,18
2933,5/15/2012,217,220,216,220,219,134800,5,2012,15,16.4,12.22,83.9469,2.5,8.75,13.46,2.8,18
2934,5/14/2012,218,218,216,217,218,26500,5,2012,14,16.4,12.22,83.6764,2.5,8.75,13.46,2.8,18
2935,5/11/2012,216,217,216,217,217,161300,5,2012,11,16.4,12.22,83.6181,2.5,8.75,13.46,2.8,18
2936,5/10/2012,216,216,215,216,216,374300,5,2012,10,16.4,12.22,83.3972,2.5,8.75,13.46,2.8,18
2937,5/9/2012,214,215,213,215,215,716400,5,2012,9,16.4,12.22,83.2958,2.5,8.75,13.46,2.8,18
2938,5/8/2012,211,215,205,214,214,1230000,5,2012,8,16.4,12.22,83.2831,2.5,8.75,13.46,2.8,18
2939,5/7/2012,210,213,210,213,213,709700,5,2012,7,16.4,12.22,83.2703,2.5,8.75,13.46,2.8,18
2940,5/4/2012,215,219,210,210,217,506600,5,2012,4,16.4,12.22,83.2806,2.5,8.75,13.46,2.8,18
2941,5/3/2012,209,217,209,216,216,1667400,5,2012,3,16.4,12.22,83.4053,2.5,8.75,13.46,2.8,18
2942,5/2/2012,209,210,209,209,210,1000,5,2012,2,16.4,12.22,83.2903,2.5,8.75,13.46,2.8,18
2943,4/30/2012,210,210,209,210,210,869300,4,2012,30,16.5,13.06,83.2164,2.5,8.75,13.46,2.8,18
2944,4/27/2012,209,215,209,210,213,1362100,4,2012,27,16.5,13.06,83.25,2.5,8.75,13.46,2.8,18
2945,4/26/2012,210,210,200,205,210,234500,4,2012,26,16.5,13.06,83.265,2.5,8.75,13.46,2.8,18
2946,4/25/2012,220,221,215,216,217,2340300,4,2012,25,16.5,13.06,83.2531,2.5,8.75,13.46,2.8,18
2947,4/23/2012,210,216,210,216,216,1432900,4,2012,23,16.5,13.06,83.2178,2.5,8.75,13.46,2.8,18
2948,4/20/2012,210,216,209,214,213,240800,4,2012,20,16.5,13.06,83.1969,2.5,8.75,13.46,2.8,18
2949,4/19/2012,206,212,206,210,209,277200,4,2012,19,16.5,13.06,83.1542,2.5,8.75,13.46,2.8,18
2950,4/18/2012,203,207,203,207,207,227700,4,2012,18,16.5,13.06,83.1389,2.5,8.75,13.46,2.8,18
2951,4/17/2012,204,204,202,203,203,24200,4,2012,17,16.5,13.06,83.15,2.5,8.75,13.46,2.8,18
2952,4/16/2012,203,205,202,205,205,50000,4,2012,16,16.5,13.06,83.1611,2.5,8.75,13.46,2.8,18
2953,4/13/2012,202,206,202,204,205,109100,4,2012,13,16.5,13.06,83.3681,2.5,8.75,13.46,2.8,18
2954,4/12/2012,203,203,203,203,203,56400,4,2012,12,16.5,13.06,83.2541,2.5,8.75,13.46,2.8,18
2955,4/11/2012,202,203,200,203,203,28900,4,2012,11,16.5,13.06,83.1961,2.5,8.75,13.46,2.8,18
2956,4/10/2012,202,203,201,202,202,229800,4,2012,10,16.5,13.06,83.1031,2.5,8.75,13.46,2.8,18
2957,4/5/2012,203,203,200,201,202,16100,4,2012,5,16.5,13.06,83.0667,2.5,8.75,13.46,2.8,18
2958,4/4/2012,204,204,201,202,203,264300,4,2012,4,16.5,13.06,83.1764,2.5,8.75,13.46,2.8,18
2959,4/3/2012,201,204,200,202,203,53300,4,2012,3,16.5,13.06,83.0694,2.5,8.75,13.46,2.8,18
2960,4/2/2012,201,203,201,201,202,31000,4,2012,2,16.5,13.06,83.1014,2.5,8.75,13.46,2.8,18
2961,3/30/2012,204,204,201,202,203,26900,3,2012,30,16.45,15.61,83.0556,2.5,8.75,13.46,2.85,18
2962,3/29/2012,200,201,200,200,201,15700,3,2012,29,16.45,15.61,83.0153,2.5,8.75,13.46,2.85,18
2963,3/28/2012,200,202,200,200,201,634100,3,2012,28,16.45,15.61,83.0278,2.5,8.75,13.46,2.85,18
2964,3/27/2012,200,200,200,200,200,27700,3,2012,27,16.45,15.61,83.1042,2.5,8.75,13.46,2.85,18
2965,3/26/2012,200,205,198,200,205,1179500,3,2012,26,16.45,15.61,83.0324,2.5,8.75,13.46,2.85,18
2966,3/23/2012,200,200,200,200,200,188200,3,2012,23,16.45,15.61,83.1083,2.5,8.75,13.46,2.85,18
2967,3/22/2012,200,200,197,200,200,142700,3,2012,22,16.45,15.61,82.8611,2.5,8.75,13.46,2.85,18
2968,3/21/2012,180,198,180,197,197,430000,3,2012,21,16.45,15.61,82.8489,2.5,8.75,13.46,2.85,18
2969,3/20/2012,200,200,180,180,185,3000,3,2012,20,16.45,15.61,82.6344,2.5,8.75,13.46,2.85,18
2970,3/19/2012,200,201,200,200,201,111900,3,2012,19,16.45,15.61,82.9611,2.5,8.75,13.46,2.85,18
2971,3/16/2012,200,201,200,200,201,620100,3,2012,16,16.45,15.61,82.9617,2.5,8.75,13.46,2.85,18
2972,3/15/2012,200,201,200,200,201,25200,3,2012,15,16.45,15.61,82.3472,2.5,8.75,13.46,2.85,18
2973,3/14/2012,199,200,185,200,200,115300,3,2012,14,16.45,15.61,82.2694,2.5,8.75,13.46,2.85,18
2974,3/13/2012,200,200,200,200,200,28500,3,2012,13,16.45,15.61,82.2686,2.5,8.75,13.46,2.85,18
2975,3/12/2012,199,202,196,201,202,239200,3,2012,12,16.45,15.61,82.7125,2.5,8.75,13.46,2.85,18
2976,3/9/2012,198,202,195,200,202,127200,3,2012,9,16.45,15.61,82.7514,2.5,8.75,13.46,2.85,18
2977,3/9/2012,198,202,195,200,202,127200,3,2012,9,16.45,15.61,84.1483,2.5,8.75,13.46,2.85,18
2978,3/9/2012,198,202,195,200,202,127200,3,2012,9,16.45,15.61,84.1483,2.5,8.75,13.46,2.85,18
2979,3/8/2012,199,200,199,200,200,55600,3,2012,8,16.45,15.61,82.8292,2.5,8.75,13.46,2.85,18
2980,3/7/2012,198,198,198,198,198,182300,3,2012,7,16.45,15.61,82.8222,2.5,8.75,13.46,2.85,18
2981,3/6/2012,197,197,197,197,197,17500,3,2012,6,16.45,15.61,83.3625,2.5,8.75,13.46,2.85,18
2982,3/5/2012,193,200,190,200,197,535500,3,2012,5,16.45,15.61,83.2347,2.5,8.75,13.46,2.85,18
2983,3/2/2012,188,195,185,195,193,45900,3,2012,2,16.45,15.61,83.2561,2.5,8.75,13.46,2.85,18
2984,3/1/2012,190,191,190,190,191,5900,3,2012,1,16.45,15.61,83.2625,2.5,8.75,13.46,2.85,18
2985,2/29/2012,187,191,185,190,191,87600,2,2012,29,15.93,16.69,82.9708,2.5,8.75,13.46,2.85,18
2986,2/28/2012,185,187,185,187,187,9000,2,2012,28,15.93,16.69,82.7514,2.5,8.75,13.46,2.85,18
2987,2/27/2012,183,187,182,187,185,323800,2,2012,27,15.93,16.69,82.6519,2.5,8.75,13.46,2.85,18
2988,2/24/2012,183,183,182,182,183,214300,2,2012,24,15.93,16.69,82.6986,2.5,8.75,13.46,2.85,18
2989,2/23/2012,172,183,172,182,182,48500,2,2012,23,15.93,16.69,82.7569,2.5,8.75,13.46,2.85,18
2990,2/22/2012,180,183,180,181,181,223600,2,2012,22,15.93,16.69,83.2944,2.5,8.75,13.46,2.85,18
2991,2/21/2012,182,184,179,179,184,53600,2,2012,21,15.93,16.69,83.2972,2.5,8.75,13.46,2.85,18
2992,2/20/2012,179,180,175,175,179,267200,2,2012,20,15.93,16.69,82.9097,2.5,8.75,13.46,2.85,18
2993,2/17/2012,179,180,177,180,180,264600,2,2012,17,15.93,16.69,83.0722,2.5,8.75,13.46,2.85,18
2994,2/16/2012,175,180,175,175,177,9800,2,2012,16,15.93,16.69,83.1667,6.25,8.75,13.46,2.85,18
2995,2/15/2012,175,175,175,175,175,100000,2,2012,15,15.93,16.69,82.93,6.25,8.75,13.46,2.85,18
2996,2/14/2012,176,178,170,170,176,46300,2,2012,14,15.93,16.69,82.9583,6.25,8.75,13.46,2.85,18
2997,2/13/2012,177,180,177,180,179,52700,2,2012,13,15.93,16.69,82.8125,6.25,8.75,13.46,2.85,18
2998,2/10/2012,177,177,176,177,177,20400,2,2012,10,15.93,16.69,83.9278,6.25,8.75,13.46,2.85,18
2999,2/9/2012,174,177,174,177,177,91500,2,2012,9,15.93,16.69,82.7167,6.25,8.75,13.46,2.85,18
3000,2/8/2012,173,176,173,175,175,108700,2,2012,8,15.93,16.69,83.1403,6.25,8.75,13.46,2.85,18
3001,2/7/2012,174,174,170,174,174,123100,2,2012,7,15.93,16.69,83.4903,6.25,8.75,13.46,2.85,18
3002,2/6/2012,170,174,170,174,172,7100,2,2012,6,15.93,16.69,83.8125,6.25,8.75,13.46,2.85,18
3003,2/3/2012,170,173,170,173,171,3400,2,2012,3,15.93,16.69,83.8708,6.25,8.75,13.46,2.85,18
3004,2/2/2012,169,170,169,170,170,317800,2,2012,2,15.93,16.69,83.5861,6.25,8.75,13.46,2.85,18
3005,2/1/2012,166,166,165,166,166,21400,2,2012,1,15.93,16.69,83.8833,6.25,8.75,13.46,2.85,18
3006,1/31/2012,165,168,163,165,167,214300,1,2012,31,15.1,18.31,84.5875,6.25,8.75,13.46,2.85,18
3007,1/30/2012,165,169,165,168,168,292900,1,2012,30,15.1,18.31,84.9167,6.25,8.75,13.46,2.85,18
3008,1/27/2012,165,168,165,168,168,301400,1,2012,27,15.1,18.31,85.0306,6.25,8.75,13.46,2.85,18
3009,1/26/2012,164,170,164,166,166,1700,1,2012,26,15.1,18.31,85.3639,6.25,8.75,13.46,2.85,18
3010,1/25/2012,165,170,165,165,166,6100,1,2012,25,15.1,18.31,85.8444,6.25,8.75,13.46,2.85,18
3011,1/24/2012,162,165,162,165,165,173900,1,2012,24,15.1,18.31,86.1,6.25,8.75,13.46,2.85,18
3012,1/23/2012,162,162,162,162,162,4100,1,2012,23,15.1,18.31,86.0444,6.25,8.75,13.46,2.85,18
3013,1/20/2012,174,174,173,173,174,198000,1,2012,20,15.1,18.31,85.6778,6.25,8.75,13.46,2.85,18
3014,1/19/2012,174,174,173,174,174,11800,1,2012,19,15.1,18.31,86.2197,6.25,8.75,13.46,2.85,18
3015,1/18/2012,174,175,173,174,174,36100,1,2012,18,15.1,18.31,86.3331,6.25,8.75,13.46,2.85,18
3016,1/17/2012,175,175,174,174,175,31400,1,2012,17,15.1,18.31,86.9583,6.25,8.75,13.46,2.85,18
3017,1/16/2012,174,175,174,174,175,27300,1,2012,16,15.1,18.31,87.4958,6.25,8.75,13.46,2.85,18
3018,1/13/2012,179,179,174,174,175,2700,1,2012,13,15.1,18.31,87.5889,6.25,8.75,13.46,2.85,18
3019,1/12/2012,180,180,179,179,180,23000,1,2012,12,15.1,18.31,87.4208,6.25,8.75,13.46,2.85,18
3020,1/11/2012,176,180,175,175,180,23000,1,2012,11,15.1,18.31,87.3164,6.25,8.75,13.46,2.85,18
3021,1/10/2012,175,184,175,184,181,329100,1,2012,10,15.1,18.31,87.1778,6.25,8.75,13.46,2.85,18
3022,1/9/2012,177,179,177,178,178,34700,1,2012,9,15.1,18.31,86.9786,6.25,8.75,13.46,2.85,18
3023,1/6/2012,176,179,176,178,178,259600,1,2012,6,15.1,18.31,87.0361,6.25,8.75,13.46,2.85,18
3024,1/5/2012,176,176,175,175,176,3100,1,2012,5,15.1,18.31,88.4403,6.25,8.75,13.46,2.85,18
3025,1/4/2012,172,175,172,175,174,2400,1,2012,4,15.1,18.31,85.5722,6.25,8.75,13.46,2.85,18
3026,1/3/2012,172,176,172,175,176,449600,1,2012,3,15.1,18.31,85.0906,6.25,8.75,13.46,2.85,18
3027,12/30/2011,175,175,172,175,173,17200,12,2011,30,14.02,18.93,85.0681,6.25,8.75,9.3,2.9,18
3028,12/29/2011,172,173,172,172,173,101400,12,2011,29,14.02,18.93,84.6667,6.25,8.75,9.3,2.9,18
3029,12/28/2011,172,172,171,172,172,202600,12,2011,28,14.02,18.93,83.7167,6.25,8.75,9.3,2.9,18
3030,12/27/2011,172,172,171,172,172,3900,12,2011,27,14.02,18.93,83.6472,6.25,8.75,9.3,2.9,18
3031,12/23/2011,172,172,171,172,172,1700,12,2011,23,14.02,18.93,83.6864,6.25,8.75,9.3,2.9,18
3032,12/22/2011,171,172,171,171,172,66000,12,2011,22,14.02,18.93,83.5542,6.25,8.75,9.3,2.9,18
3033,12/21/2011,170,170,170,170,170,629400,12,2011,21,14.02,18.93,83.5167,6.25,8.75,9.3,2.9,18
3034,12/20/2011,171,172,170,171,171,58200,12,2011,20,14.02,18.93,83.8306,6.25,8.75,9.3,2.9,18
3035,12/19/2011,172,172,168,172,171,86800,12,2011,19,14.02,18.93,83.6939,6.25,8.75,9.3,2.9,18
3036,12/16/2011,170,170,168,170,170,27100,12,2011,16,14.02,18.93,84.5972,6.25,8.75,9.3,2.9,18
3037,12/15/2011,170,175,167,170,170,80400,12,2011,15,14.02,18.93,87.2792,6.25,8.75,9.3,2.9,18
3038,12/14/2011,168,175,163,170,170,211800,12,2011,14,14.02,18.93,88.9764,6.25,8.75,9.3,2.9,18
3039,12/13/2011,163,168,163,167,168,146000,12,2011,13,14.02,18.93,89.55,6.25,8.75,9.3,2.9,18
3040,12/9/2011,170,170,165,170,169,500,12,2011,9,14.02,18.93,89.4986,6.25,8.75,9.3,2.9,18
3041,12/8/2011,162,165,162,162,165,736100,12,2011,8,14.02,18.93,89.6669,6.25,8.75,9.3,2.9,18
3042,12/7/2011,162,162,162,162,162,13600,12,2011,7,14.02,18.93,89.6236,6.25,8.75,9.3,2.9,18
3043,12/6/2011,162,164,160,162,162,153800,12,2011,6,14.02,18.93,89.5467,6.25,8.75,9.3,2.9,18
3044,12/5/2011,161,161,160,161,161,31300,12,2011,5,14.02,18.93,89.8281,6.25,8.75,9.3,2.9,18
3045,12/2/2011,160,161,160,160,161,65400,12,2011,2,14.02,18.93,89.7125,6.25,8.75,9.3,2.9,18
3046,12/1/2011,160,160,159,160,160,110500,12,2011,1,14.02,18.93,89.5972,6.25,8.75,9.3,2.9,18
3047,11/30/2011,160,164,160,160,161,514400,11,2011,30,12.82,19.72,89.7208,6.25,8.75,9.3,2.9,16.5
3048,11/29/2011,165,169,164,165,165,20000,11,2011,29,12.82,19.72,90.1681,6.25,8.75,9.3,2.9,16.5
3049,11/28/2011,160,165,156,160,163,5900,11,2011,28,12.82,19.72,90.5611,6.25,8.75,9.3,2.9,16.5
3050,11/25/2011,160,165,160,160,162,471600,11,2011,25,12.82,19.72,90.2681,6.25,8.75,9.3,2.9,16.5
3051,11/24/2011,164,170,164,164,166,2200,11,2011,24,12.82,19.72,90.3097,6.25,8.75,9.3,2.9,16.5
3052,11/23/2011,170,170,170,170,170,3600,11,2011,23,12.82,19.72,90.0611,6.25,8.75,9.3,2.9,16.5
3053,11/22/2011,170,171,170,170,171,201000,11,2011,22,12.82,19.72,90.6722,6.25,8.75,9.3,2.9,16.5
3054,11/21/2011,172,172,171,171,172,4600,11,2011,21,12.82,19.72,91.0417,6.25,8.75,9.3,2.9,16.5
3055,11/18/2011,170,180,170,170,172,165900,11,2011,18,12.82,19.72,92.5433,6.25,8.75,9.3,2.9,16.5
3056,11/17/2011,165,169,165,168,168,158100,11,2011,17,12.82,19.72,93.6806,6.25,8.75,9.3,2.9,16.5
3057,11/16/2011,162,167,162,165,166,24300,11,2011,16,12.82,19.72,94.1458,6.25,8.75,9.3,2.9,16.5
3058,11/15/2011,165,167,164,164,166,43200,11,2011,15,12.82,19.72,93.7208,6.25,8.75,9.3,2.9,16.5
3059,11/14/2011,162,163,162,162,163,13400,11,2011,14,12.82,19.72,93.2164,6.25,8.75,9.3,2.9,16.5
3060,11/11/2011,162,164,157,162,162,39600,11,2011,11,12.82,19.72,94.7989,6.25,8.75,9.3,2.9,16.5
3061,11/10/2011,155,156,155,156,156,31000,11,2011,10,12.82,19.72,95.6903,6.25,8.75,9.3,2.9,16.5
3062,11/9/2011,157,157,155,155,156,201600,11,2011,9,12.82,19.72,96.2694,6.25,8.75,9.3,2.9,16.5
3063,11/7/2011,155,157,155,157,156,252500,11,2011,7,12.82,19.72,97.3819,6.25,8.75,9.3,2.9,16.5
3064,11/4/2011,155,156,155,156,156,429300,11,2011,4,12.82,19.72,96.975,6.25,8.75,9.3,2.9,16.5
3065,11/3/2011,155,157,155,157,156,334900,11,2011,3,12.82,19.72,96.8097,6.25,8.75,9.3,2.9,16.5
3066,11/2/2011,155,155,155,155,155,420000,11,2011,2,12.82,19.72,96.5222,6.25,8.75,9.3,2.9,16.5
3067,11/1/2011,157,157,155,155,156,325300,11,2011,1,12.82,19.72,99.3347,6.25,8.75,9.3,2.9,16.5
3068,10/31/2011,156,157,155,155,156,216700,10,2011,31,11.49,18.91,99.7783,6.25,8.75,9.3,2.9,11
3069,10/28/2011,154,156,153,156,156,32900,10,2011,28,11.49,18.91,99.0319,6.25,8.75,9.3,2.9,11
3070,10/27/2011,154,156,152,154,153,19500,10,2011,27,11.49,18.91,100.632,6.25,8.75,9.3,2.9,11
3071,10/26/2011,150,154,150,150,152,1004700,10,2011,26,11.49,18.91,101.443,6.25,8.75,9.3,2.9,11
3072,10/25/2011,150,152,150,150,151,266000,10,2011,25,11.49,18.91,100.596,6.25,8.75,9.3,2.9,11
3073,10/24/2011,151,152,150,151,152,254300,10,2011,24,11.49,18.91,100.117,6.25,8.75,9.3,2.9,11
3074,10/21/2011,151,154,150,154,151,229400,10,2011,21,11.49,18.91,99.7014,6.25,8.75,9.3,2.9,11
3075,10/19/2011,152,153,150,152,151,37800,10,2011,19,11.49,18.91,99.5181,6.25,8.75,9.3,2.9,11
3076,10/18/2011,154,154,150,154,153,54600,10,2011,18,11.49,18.91,99.1861,6.25,8.75,9.3,2.9,11
3077,10/17/2011,153,153,150,153,153,43400,10,2011,17,11.49,18.91,100.512,6.25,8.75,9.3,2.9,11
3078,10/14/2011,153,155,150,153,153,54400,10,2011,14,11.49,18.91,101.426,6.25,8.75,9.3,2.9,11
3079,10/13/2011,154,158,154,154,156,65400,10,2011,13,11.49,18.91,104.01,6.25,8.75,9.3,2.9,11
3080,10/12/2011,160,160,148,160,159,209100,10,2011,12,11.49,18.91,105.961,6.25,8.75,9.3,2.9,11
3081,10/11/2011,155,160,155,155,156,17500,10,2011,11,11.49,18.91,103.908,6.25,8.75,9.3,2.9,11
3082,10/10/2011,156,160,156,156,160,5800,10,2011,10,11.49,18.91,102.811,6.25,8.75,9.3,2.9,11
3083,10/7/2011,155,162,155,155,158,6700,10,2011,7,11.49,18.91,101.947,6.25,8.75,9.3,2.9,11
3084,10/6/2011,160,164,160,160,163,46100,10,2011,6,11.49,18.91,100.949,6.25,8.75,9.3,2.9,11
3085,10/5/2011,161,164,161,161,163,95300,10,2011,5,11.49,18.91,101.715,6.25,8.75,9.3,2.9,11
3086,10/4/2011,165,165,160,165,165,154800,10,2011,4,11.49,18.91,101.674,6.25,8.75,9.3,2.9,11
3087,10/3/2011,164,175,160,164,166,39700,10,2011,3,11.49,18.91,100.479,6.25,8.75,9.3,2.9,11
3088,9/30/2011,164,167,160,164,163,109100,9,2011,30,10.18,17.32,99.8319,6.25,8.75,9.3,2.85,7
3089,9/29/2011,167,171,165,167,168,62600,9,2011,29,10.18,17.32,101.232,6.25,8.75,9.3,2.85,7
3090,9/28/2011,168,171,167,168,170,27600,9,2011,28,10.18,17.32,102.011,6.25,8.75,9.3,2.85,7
3091,9/27/2011,172,175,170,172,171,22300,9,2011,27,10.18,17.32,101.949,6.25,8.75,9.3,2.85,7
3092,9/26/2011,170,180,170,170,176,15600,9,2011,26,10.18,17.32,99.0556,6.25,8.75,9.3,2.85,7
3093,9/23/2011,180,182,178,180,181,273400,9,2011,23,10.18,17.32,98.8944,6.25,8.75,9.3,2.85,7
3094,9/22/2011,181,184,181,181,182,5500,9,2011,22,10.18,17.32,97.5806,6.25,8.75,9.3,2.85,7
3095,9/21/2011,183,185,183,183,185,7700,9,2011,21,10.18,17.32,96.0278,6.25,8.75,9.3,2.85,7
3096,9/20/2011,185,186,185,185,186,20600,9,2011,20,10.18,17.32,95.8361,6.25,8.75,9.3,2.85,7
3097,9/19/2011,184,186,184,184,186,23200,9,2011,19,10.18,17.32,95.1928,6.25,8.75,9.3,2.85,7
3098,9/16/2011,185,187,185,187,186,27800,9,2011,16,10.18,17.32,94.8056,6.25,8.75,9.3,2.85,7
3099,9/15/2011,185,188,185,185,187,189000,9,2011,15,10.18,17.32,94.9708,6.25,8.75,9.3,2.85,7
3100,9/14/2011,187,187,185,187,187,14300,9,2011,14,10.18,17.32,94.7819,6.25,8.75,9.3,2.85,7
3101,9/13/2011,186,186,181,186,185,140200,9,2011,13,10.18,17.32,95.4306,6.25,8.75,9.3,2.85,7
3102,9/12/2011,182,182,180,182,182,16800,9,2011,12,10.18,17.32,94.1111,6.25,8.75,9.3,2.85,7
3103,9/9/2011,183,183,180,183,181,21600,9,2011,9,10.18,17.32,93.7083,6.25,8.75,9.3,2.85,7
3104,9/8/2011,180,180,177,180,180,136400,9,2011,8,10.18,17.32,93.9903,6.25,8.75,9.3,2.85,7
3105,9/7/2011,175,180,172,175,175,27600,9,2011,7,10.18,17.32,93.4597,6.25,8.75,9.3,2.85,7
3106,9/6/2011,172,175,172,172,173,24900,9,2011,6,10.18,17.32,94.7722,6.25,8.75,9.3,2.85,7
3107,9/5/2011,176,176,170,172,173,12500,9,2011,5,10.18,17.32,94.4278,6.25,8.75,9.3,2.85,7
3108,9/2/2011,174,175,172,174,175,245400,9,2011,2,10.18,17.32,94.1097,6.25,8.75,9.3,2.85,7
3109,9/1/2011,175,175,173,175,175,433000,9,2011,1,10.18,17.32,93.6806,6.25,8.75,9.3,2.85,7
3110,8/30/2011,175,180,174,175,176,147700,8,2011,30,9,16.67,93.6222,6.25,8.75,9.3,2.85,6.25
3111,8/29/2011,175,176,172,175,174,47600,8,2011,29,9,16.67,92.8489,6.25,8.75,9.3,2.85,6.25
3112,8/26/2011,174,174,171,174,173,86200,8,2011,26,9,16.67,92.8931,6.25,8.75,9.3,2.85,6.25
3113,8/25/2011,165,174,165,165,171,3300,8,2011,25,9,16.67,92.4042,2.5,8.75,9.3,2.85,6.25
3114,8/24/2011,174,174,172,174,174,34900,8,2011,24,9,16.67,92.7306,2.5,8.75,9.3,2.85,6.25
3115,8/23/2011,174,175,174,174,175,6300,8,2011,23,9,16.67,92.8056,2.5,8.75,9.3,2.85,6.25
3116,8/22/2011,172,175,172,172,175,17600,8,2011,22,9,16.67,93.0097,2.5,8.75,9.3,2.85,6.25
3117,8/19/2011,175,177,175,175,176,7400,8,2011,19,9,16.67,92.9028,2.5,8.75,9.3,2.85,6.25
3118,8/18/2011,175,175,175,175,175,482000,8,2011,18,9,16.67,93.1361,2.5,8.75,9.3,2.85,6.25
3119,8/17/2011,175,180,175,175,176,151300,8,2011,17,9,16.67,93.1431,2.5,8.75,9.3,2.85,6.25
3120,8/16/2011,175,176,172,175,176,184500,8,2011,16,9,16.67,92.85,2.5,8.75,9.3,2.85,6.25
3121,8/15/2011,175,175,170,170,175,181900,8,2011,15,9,16.67,92.7183,2.5,8.75,9.3,2.85,6.25
3122,8/12/2011,170,176,170,170,175,27900,8,2011,12,9,16.67,93.2328,2.5,8.75,9.3,2.85,6.25
3123,8/11/2011,180,180,176,180,180,465100,8,2011,11,9,16.67,93.9131,2.5,8.75,9.3,2.85,6.25
3124,8/10/2011,180,182,172,180,181,503200,8,2011,10,9,16.67,94.5167,2.5,8.75,9.3,2.85,6.25
3125,8/9/2011,164,184,164,164,173,36200,8,2011,9,9,16.67,93.7375,2.5,8.75,9.3,2.85,6.25
3126,8/8/2011,183,184,180,183,183,2700,8,2011,8,9,16.67,92.7667,2.5,8.75,9.3,2.85,6.25
3127,8/5/2011,185,189,184,185,185,272900,8,2011,5,9,16.67,92.3528,2.5,8.75,9.3,2.85,6.25
3128,8/4/2011,190,190,184,190,185,299400,8,2011,4,9,16.67,91.9361,2.5,8.75,9.3,2.85,6.25
3129,8/3/2011,185,185,184,185,185,276900,8,2011,3,9,16.67,91.5847,2.5,8.75,9.3,2.85,6.25
3130,8/2/2011,185,185,183,185,185,46500,8,2011,2,9,16.67,91.2111,2.5,8.75,9.3,2.85,6.25
3131,8/1/2011,184,184,182,184,184,10900,8,2011,1,9,16.67,90.975,2.5,8.75,9.3,2.85,6.25
3132,7/29/2011,184,184,182,184,183,7600,7,2011,29,7.88,15.53,91.1,2.5,8.75,9.3,2.85,6.25
3133,7/28/2011,184,184,180,184,183,5700,7,2011,28,7.88,15.53,90.8444,2.5,8.75,9.3,2.85,6.25
3134,7/27/2011,184,185,183,184,185,1046200,7,2011,27,7.88,15.53,90.5111,2.5,8.75,9.3,2.85,6.25
3135,7/26/2011,183,185,182,183,185,33500,7,2011,26,7.88,15.53,90.375,2.5,8.75,9.3,2.85,6.25
3136,7/25/2011,184,187,184,184,186,159600,7,2011,25,7.88,15.53,90.2878,2.5,8.75,9.3,2.85,6.25
3137,7/22/2011,186,187,186,186,187,26300,7,2011,22,7.88,15.53,89.9611,2.5,8.75,9.3,2.85,6.25
3138,7/21/2011,186,188,186,186,188,589800,7,2011,21,7.88,15.53,90.0583,2.5,8.75,9.3,2.85,6.25
3139,7/20/2011,188,188,186,188,188,486800,7,2011,20,7.88,15.53,90.1681,2.5,8.75,9.3,2.85,6.25
3140,7/19/2011,188,189,188,188,189,82400,7,2011,19,7.88,15.53,90.1861,2.5,8.75,9.3,2.85,6.25
3141,7/18/2011,188,190,188,188,189,3300,7,2011,18,7.88,15.53,89.6847,2.5,8.75,9.3,2.85,6.25
3142,7/15/2011,190,193,190,190,191,794700,7,2011,15,7.88,15.53,89.5833,2.5,8.75,9.3,2.85,6.25
3143,7/14/2011,191,193,190,191,191,231300,7,2011,14,7.88,15.53,89.475,2.5,8.75,9.3,2.85,6.25
3144,7/13/2011,188,193,185,188,188,133400,7,2011,13,7.88,15.53,89.6708,2.5,8.75,9.3,2.85,6.25
3145,7/12/2011,185,185,185,185,185,400,7,2011,12,7.88,15.53,90.4417,2.5,8.75,9.3,2.85,6.25
3146,7/11/2011,194,195,193,194,195,15400,7,2011,11,7.88,15.53,90.2417,2.5,8.75,9.3,2.85,6.25
3147,7/7/2011,195,195,194,195,195,234100,7,2011,7,7.88,15.53,89.8583,2.5,8.75,9.3,2.85,6.25
3148,7/6/2011,196,196,194,194,195,24500,7,2011,6,7.88,15.53,88.9694,2.5,8.75,9.3,2.85,6.25
3149,7/5/2011,195,196,195,196,196,608000,7,2011,5,7.88,15.53,88.4514,2.5,8.75,9.3,2.85,6.25
3150,7/4/2011,196,198,195,196,197,343000,7,2011,4,7.88,15.53,88.6856,2.5,8.75,9.3,2.85,6.25
3151,7/1/2011,195,197,195,195,196,253900,7,2011,1,7.88,15.53,89.3597,2.5,8.75,9.3,2.85,6.25
3152,6/30/2011,196,197,194,195,196,169000,6,2011,30,6.88,14.48,89.8639,2.5,8.75,9.3,2.8,6.25
3153,6/29/2011,193,197,191,195,194,821800,6,2011,29,6.88,14.48,90.0236,2.5,8.75,9.3,2.8,6.25
3154,6/28/2011,190,193,190,190,191,553700,6,2011,28,6.88,14.48,90.8278,2.5,8.75,9.3,2.8,6.25
3155,6/27/2011,188,190,188,188,189,5100,6,2011,27,6.88,14.48,90.4625,2.5,8.75,9.3,2.8,6.25
3156,6/24/2011,187,189,185,189,188,141800,6,2011,24,6.88,14.48,90.4486,2.5,8.75,9.3,2.8,6.25
3157,6/23/2011,190,190,185,185,189,133100,6,2011,23,6.88,14.48,90.5597,2.5,8.75,9.3,2.8,6.25
3158,6/22/2011,190,190,187,187,189,26300,6,2011,22,6.88,14.48,91.6556,2.5,8.75,9.3,2.8,6.25
3159,6/21/2011,195,195,190,193,193,33000,6,2011,21,6.88,14.48,90.7333,2.5,8.75,9.3,2.8,6.25
3160,6/20/2011,195,195,190,192,194,26600,6,2011,20,6.88,14.48,89.8,2.5,8.75,9.3,2.8,6.25
3161,6/17/2011,194,195,194,194,195,35700,6,2011,17,6.88,14.48,90.0444,2.5,8.75,9.3,2.8,6.25
3162,6/16/2011,195,195,193,194,195,268000,6,2011,16,6.88,14.48,88.9764,2.5,8.75,9.3,2.8,6.25
3163,6/15/2011,200,200,195,195,196,118900,6,2011,15,6.88,14.48,89.2361,2.5,8.75,9.3,2.8,6.25
3164,6/14/2011,203,203,200,200,201,119200,6,2011,14,6.88,14.48,89.3708,2.5,8.75,9.3,2.8,6.25
3165,6/13/2011,209,209,203,206,207,73100,6,2011,13,6.88,14.48,88.0931,2.5,8.75,9.3,2.8,6.25
3166,6/10/2011,208,209,206,206,209,7000,6,2011,10,6.88,14.48,87.6625,2.5,8.75,9.3,2.8,6.25
3167,6/9/2011,212,212,209,210,211,4300,6,2011,9,6.88,14.48,87.5569,2.5,8.75,9.3,2.8,6.25
3168,6/8/2011,215,216,212,212,215,647000,6,2011,8,6.88,14.48,87.7219,2.5,8.75,9.3,2.8,6.25
3169,6/7/2011,214,216,213,215,215,2299500,6,2011,7,6.88,14.48,87.0422,2.5,8.75,9.3,2.8,6.25
3170,6/6/2011,212,215,212,215,214,87300,6,2011,6,6.88,14.48,86.8292,2.5,8.75,9.3,2.8,6.25
3171,6/3/2011,212,215,212,215,215,196900,6,2011,3,6.88,14.48,86.7514,2.5,8.75,9.3,2.8,6.25
3172,6/2/2011,210,215,210,215,213,92600,6,2011,2,6.88,14.48,86.375,2.5,8.75,9.3,2.8,6.25
3173,5/31/2011,208,212,208,212,210,91600,5,2011,31,5.96,12.95,85.7044,2.5,8.75,9.3,2.8,6
3174,5/30/2011,210,210,208,208,209,9900,5,2011,30,5.96,12.95,85.5161,2.5,8.75,9.3,2.8,6
3175,5/27/2011,207,210,207,209,209,353800,5,2011,27,5.96,12.95,85.4417,2.5,8.75,9.3,2.8,6
3176,5/26/2011,205,209,205,208,208,7100,5,2011,26,5.96,12.95,86.0111,2.5,8.75,9.3,2.8,6
3177,5/25/2011,200,208,200,208,204,92000,5,2011,25,5.96,12.95,86.4208,2.5,8.75,9.3,2.8,6
3178,5/24/2011,200,205,200,203,203,3000,5,2011,24,5.96,12.95,86.1472,2.5,8.75,9.3,2.8,6
3179,5/23/2011,205,205,203,203,204,6500,5,2011,23,5.96,12.95,86.1528,2.5,8.75,9.3,2.8,6
3180,5/20/2011,205,205,204,205,205,415100,5,2011,20,5.96,12.95,86.0261,2.5,8.75,9.3,2.8,6
3181,5/19/2011,207,207,205,207,206,13600,5,2011,19,5.96,12.95,87.0486,2.5,8.75,9.3,2.8,6
3182,5/18/2011,205,206,205,205,206,24700,5,2011,18,5.96,12.95,86.5611,2.5,8.75,9.3,2.8,6
3183,5/17/2011,208,208,203,205,205,714700,5,2011,17,5.96,12.95,86.2514,2.5,8.75,9.3,2.8,6
3184,5/16/2011,203,208,203,205,205,877800,5,2011,16,5.96,12.95,85.9333,2.5,8.75,9.3,2.8,6
3185,5/13/2011,206,206,200,205,204,55000,5,2011,13,5.96,12.95,86.1139,2.5,8.75,9.3,2.8,6
3186,5/12/2011,208,208,200,200,202,45000,5,2011,12,5.96,12.95,85.9244,2.5,8.75,9.3,2.8,6
3187,5/11/2011,208,209,205,205,206,26700,5,2011,11,5.96,12.95,85.2222,2.5,8.75,9.3,2.8,6
3188,5/10/2011,209,210,209,209,210,301700,5,2011,10,5.96,12.95,84.7056,2.5,8.75,9.3,2.8,6
3189,5/9/2011,215,217,210,215,216,588000,5,2011,9,5.96,12.95,84.2208,2.5,8.75,9.3,2.8,6
3190,5/6/2011,212,217,212,216,216,454800,5,2011,6,5.96,12.95,84.05,2.5,8.75,9.3,2.8,6
3191,5/5/2011,205,216,205,215,215,2291500,5,2011,5,5.96,12.95,83.6556,2.5,8.75,9.3,2.8,6
3192,5/4/2011,204,210,204,210,209,693200,5,2011,4,5.96,12.95,83.5278,2.5,8.75,9.3,2.8,6
3193,5/3/2011,204,207,204,207,207,335900,5,2011,3,5.96,12.95,83.4583,2.5,8.75,9.3,2.8,6
3194,4/29/2011,203,206,203,205,205,751100,4,2011,29,5.2,12.05,83.4194,2.5,8.75,9.3,2.8,6
3195,4/28/2011,203,204,200,200,203,113400,4,2011,28,5.2,12.05,83.625,2.5,8.75,9.3,2.8,6
3196,4/27/2011,205,207,203,205,206,46900,4,2011,27,5.2,12.05,83.5708,2.5,8.75,9.3,2.8,6
3197,4/26/2011,207,207,205,207,206,478500,4,2011,26,5.2,12.05,83.9278,2.5,8.75,9.3,2.8,6
3198,4/21/2011,205,207,205,206,207,70700,4,2011,21,5.2,12.05,83.9828,2.5,8.75,9.3,2.8,6
3199,4/20/2011,202,207,200,207,206,367800,4,2011,20,5.2,12.05,83.9181,2.5,8.75,9.3,2.8,6
3200,4/19/2011,202,202,202,202,202,134200,4,2011,19,5.2,12.05,83.8417,2.5,8.75,9.3,2.8,6
3201,4/18/2011,200,205,200,202,201,239800,4,2011,18,5.2,12.05,84.0056,2.5,8.75,9.3,2.8,6
3202,4/15/2011,200,200,200,200,200,33900,4,2011,15,5.2,12.05,84.1472,2.5,8.75,9.3,2.8,6
3203,4/14/2011,196,205,196,205,201,189500,4,2011,14,5.2,12.05,84.0736,2.5,8.75,9.3,2.8,6
3204,4/13/2011,195,205,195,205,204,360000,4,2011,13,5.2,12.05,83.9431,2.5,8.75,9.3,2.8,6
3205,4/12/2011,205,209,203,205,206,1278100,4,2011,12,5.2,12.05,84.2428,2.5,8.75,9.3,2.8,6
3206,4/11/2011,200,210,200,210,206,599300,4,2011,11,5.2,12.05,84.1431,2.5,8.75,9.3,2.8,6
3207,4/8/2011,195,205,195,200,200,37200,4,2011,8,5.2,12.05,84.2917,2.5,8.75,9.3,2.8,6
3208,4/7/2011,200,200,190,195,196,82400,4,2011,7,5.2,12.05,84.7664,2.5,8.75,9.3,2.8,6
3209,4/6/2011,190,198,190,195,195,225000,4,2011,6,5.2,12.05,83.7325,2.5,8.75,9.3,2.8,6
3210,4/5/2011,185,190,185,190,190,137200,4,2011,5,5.2,12.05,83.7444,2.5,8.75,9.3,2.8,6
3211,4/4/2011,183,183,183,183,183,600,4,2011,4,5.2,12.05,83.3722,2.5,8.75,9.3,2.8,6
3212,4/1/2011,182,184,182,183,183,17100,4,2011,1,5.2,12.05,83.1583,2.5,8.75,9.3,2.8,6
3213,3/31/2011,180,183,180,183,182,108100,3,2011,31,4.49,9.19,82.9889,2.5,8.75,9.3,2.8,6
3214,3/30/2011,176,178,176,178,178,24700,3,2011,30,4.49,9.19,83.5511,2.5,8.75,9.3,2.8,6
3215,3/29/2011,173,178,173,178,177,178100,3,2011,29,4.49,9.19,83.8206,2.5,8.75,9.3,2.8,6
3216,3/28/2011,172,174,172,173,174,115800,3,2011,28,4.49,9.19,84.2944,2.5,8.75,9.3,2.8,6
3217,3/25/2011,170,173,170,171,172,145500,3,2011,25,4.49,9.19,84.9444,2.5,8.75,9.3,2.8,6
3218,3/24/2011,170,173,170,171,172,92900,3,2011,24,4.49,9.19,84.9931,2.5,8.75,9.3,2.8,6
3219,3/23/2011,175,179,172,172,174,107500,3,2011,23,4.49,9.19,84.7847,2.5,8.75,9.3,2.8,6
3220,3/22/2011,176,179,174,178,176,214200,3,2011,22,4.49,9.19,85.1486,2.5,8.75,9.3,2.8,6
3221,3/21/2011,176,181,175,175,177,7800,3,2011,21,4.49,9.19,84.5917,2.5,8.75,9.3,2.8,6
3222,3/18/2011,180,182,180,180,182,223600,3,2011,18,4.49,9.19,85.0417,2.5,8.75,9.3,2.8,6
3223,3/17/2011,180,182,180,181,182,650000,3,2011,17,4.49,9.19,85.8108,2.5,8.75,9.3,2.8,6
3224,3/16/2011,176,180,176,180,180,698900,3,2011,16,4.49,9.19,85.8572,2.5,8.75,9.3,2.8,6
3225,3/15/2011,176,176,172,176,176,49800,3,2011,15,4.49,9.19,86.3239,2.5,8.75,9.3,2.8,6
3226,3/14/2011,167,171,167,171,170,141900,3,2011,14,4.49,9.19,84.9294,2.5,8.75,9.3,2.8,6
3227,3/11/2011,165,169,165,167,168,289200,3,2011,11,4.49,9.19,84.6569,2.5,8.75,9.3,2.8,6
3228,3/10/2011,172,172,162,164,165,6200,3,2011,10,4.49,9.19,84.0447,2.5,8.75,9.3,2.8,6
3229,3/9/2011,174,175,170,170,172,33900,3,2011,9,4.49,9.19,83.4667,2.5,8.75,9.3,2.8,6
3230,3/8/2011,180,180,173,175,175,35000,3,2011,8,4.49,9.19,83.0833,2.5,8.75,9.3,2.8,6
3231,3/7/2011,175,179,175,178,176,3000,3,2011,7,4.49,9.19,83.0081,2.5,8.75,9.3,2.8,6
3232,3/4/2011,180,180,179,180,180,141600,3,2011,4,4.49,9.19,83.0542,2.5,8.75,9.3,2.8,6
3233,3/3/2011,181,181,180,180,181,253300,3,2011,3,4.49,9.19,82.9278,2.5,8.75,9.3,2.8,6
3234,3/2/2011,182,182,181,181,182,142600,3,2011,2,4.49,9.19,82.8031,2.5,8.75,9.3,2.8,6
3235,3/1/2011,183,185,180,180,182,127200,3,2011,1,4.49,9.19,82.6014,2.5,8.75,9.3,2.8,6
3236,2/28/2011,185,185,182,185,183,106900,2,2011,28,4.05,6.54,82.3639,2.5,8.75,9.3,2.8,5.75
3237,2/25/2011,182,185,182,183,184,799900,2,2011,25,4.05,6.54,81.9992,2.5,8.75,9.3,2.8,5.75
3238,2/24/2011,181,183,180,182,182,665600,2,2011,24,4.05,6.54,81.8917,2.5,8.75,9.3,2.8,5.75
3239,2/23/2011,180,181,180,181,181,427900,2,2011,23,4.05,6.54,81.875,2.5,8.75,9.3,2.8,5.75
3240,2/22/2011,180,184,180,181,181,354700,2,2011,22,4.05,6.54,81.8611,2.5,8.75,9.3,2.8,5.75
3241,2/21/2011,188,188,180,180,182,77800,2,2011,21,4.05,6.54,81.7936,2.5,8.75,9.3,2.8,5.75
3242,2/18/2011,190,190,188,188,190,28000,2,2011,18,4.05,6.54,81.4456,2.5,8.75,9.3,2.8,5.75
3243,2/17/2011,190,190,190,190,190,46200,2,2011,17,4.05,6.54,81.3942,2.5,8.75,9.3,2.8,5.75
3244,2/16/2011,189,191,189,190,191,6900,2,2011,16,4.05,6.54,81.3583,2.5,8.75,9.3,2.8,5.75
3245,2/15/2011,190,190,189,190,190,349400,2,2011,15,4.05,6.54,81.3869,2.5,8.75,9.3,2.8,5.75
3246,2/14/2011,190,204,189,189,191,4200,2,2011,14,4.05,6.54,81.4428,2.5,8.75,9.3,2.8,5.75
3247,2/11/2011,190,200,189,190,191,137100,2,2011,11,4.05,6.54,81.3014,2.5,8.75,9.3,2.8,5.75
3248,2/10/2011,190,191,190,191,191,494800,2,2011,10,4.05,6.54,81.2375,2.5,8.75,9.3,2.8,5.75
3249,2/9/2011,191,192,190,190,191,562500,2,2011,9,4.05,6.54,81.2167,2.5,8.75,9.3,2.8,5.75
3250,2/8/2011,190,192,189,190,191,362400,2,2011,8,4.05,6.54,81.2042,2.5,8.75,9.3,2.8,5.75
3251,2/7/2011,190,191,189,190,191,994500,2,2011,7,4.05,6.54,81.1472,2.5,8.75,9.3,2.8,5.75
3252,2/4/2011,189,190,187,190,190,700900,2,2011,4,4.05,6.54,81.1889,2.5,8.75,9.3,2.8,5.75
3253,2/3/2011,185,190,185,189,188,28600,2,2011,3,4.05,6.54,81.0667,2.5,8.75,9.3,2.8,5.75
3254,2/2/2011,186,188,185,186,186,79100,2,2011,2,4.05,6.54,81.1014,2.5,8.75,9.3,2.8,5.75
3255,2/1/2011,184,190,184,186,186,386100,2,2011,1,4.05,6.54,81.1917,2.5,8.75,9.3,2.8,5.75
3256,1/31/2011,192,192,181,182,185,252700,1,2011,31,3.93,5.42,81.2722,2.5,8.75,9.3,2.8,5.75
3257,1/28/2011,200,202,190,190,194,58300,1,2011,28,3.93,5.42,81.025,2.5,8.75,9.3,2.8,5.75
3258,1/27/2011,203,206,202,203,203,34000,1,2011,27,3.93,5.42,80.9986,2.5,8.75,9.3,2.8,5.75
3259,1/26/2011,203,207,203,206,207,124000,1,2011,26,3.93,5.42,81.0031,2.5,8.75,9.3,2.8,5.75
3260,1/25/2011,208,208,203,203,208,23400,1,2011,25,3.93,5.42,81.0217,2.5,8.75,9.3,2.8,5.75
3261,1/24/2011,209,209,208,208,209,4700,1,2011,24,3.93,5.42,81.0147,2.5,8.75,9.3,2.8,5.75
3262,1/21/2011,210,210,208,209,210,82700,1,2011,21,3.93,5.42,81.0764,2.5,8.75,9.3,2.8,5.75
3263,1/20/2011,210,211,208,210,211,72900,1,2011,20,3.93,5.42,81.0661,2.5,8.75,9.3,2.8,5.75
3264,1/19/2011,211,213,210,210,212,116400,1,2011,19,3.93,5.42,80.9333,2.5,8.75,9.3,2.8,5.75
3265,1/18/2011,210,212,210,212,212,92700,1,2011,18,3.93,5.42,81.0708,2.5,8.75,9.3,2.8,5.75
3266,1/17/2011,212,212,208,211,211,344700,1,2011,17,3.93,5.42,80.9736,2.5,8.75,9.3,2.8,5.75
3267,1/14/2011,210,212,209,209,212,51300,1,2011,14,3.93,5.42,80.7431,2.5,8.75,9.3,2.8,5.75
3268,1/13/2011,209,211,207,211,211,107700,1,2011,13,3.93,5.42,80.9417,2.5,8.75,9.3,2.8,5.75
3269,1/12/2011,206,210,206,210,209,155600,1,2011,12,3.93,5.42,81.0708,2.5,8.75,9.3,2.8,5.75
3270,1/11/2011,206,210,206,210,209,115100,1,2011,11,3.93,5.42,81.2181,2.5,8.75,9.3,2.8,5.75
3271,1/10/2011,211,218,206,210,211,35100,1,2011,10,3.93,5.42,81.1747,2.5,8.75,9.3,2.8,5.75
3272,1/7/2011,225,225,212,220,220,354300,1,2011,7,3.93,5.42,81.1444,2.5,8.75,9.3,2.8,5.75
3273,1/6/2011,220,230,220,230,228,248600,1,2011,6,3.93,5.42,81.1322,2.5,8.75,9.3,2.8,5.75
3274,1/5/2011,212,220,212,220,214,495900,1,2011,5,3.93,5.42,80.9389,2.5,8.75,9.3,2.8,5.75
3275,1/4/2011,208,215,208,212,212,87300,1,2011,4,3.93,5.42,80.995,2.5,8.75,9.3,2.8,5.75
3276,1/3/2011,202,210,202,209,209,62900,1,2011,3,3.93,5.42,80.7961,2.5,8.75,9.3,2.8,5.75
3277,12/31/2010,200,204,200,204,202,5500,12,2010,31,3.96,4.51,80.7519,2.5,8.75,9.08,2.8,6
3278,12/30/2010,203,203,201,201,203,56800,12,2010,30,3.96,4.51,80.6714,2.5,8.75,9.08,2.8,6
3279,12/29/2010,203,203,200,200,201,2700,12,2010,29,3.96,4.51,80.6292,2.5,8.75,9.08,2.8,6
3280,12/28/2010,204,204,202,202,203,29000,12,2010,28,3.96,4.51,80.6144,2.5,8.75,9.08,2.8,6
3281,12/27/2010,205,205,202,205,204,2500,12,2010,27,3.96,4.51,80.6625,2.5,8.75,9.08,2.8,6
3282,12/24/2010,208,208,200,205,207,48200,12,2010,24,3.96,4.51,80.5903,2.5,8.75,9.08,2.8,6
3283,12/23/2010,212,212,209,209,210,14000,12,2010,23,3.96,4.51,80.5733,2.5,8.75,9.08,2.8,6
3284,12/22/2010,207,210,205,210,210,1002600,12,2010,22,3.96,4.51,80.4906,2.5,8.75,9.08,2.8,6
3285,12/21/2010,207,210,207,210,209,14500,12,2010,21,3.96,4.51,80.4886,2.5,8.75,9.08,2.8,6
3286,12/20/2010,209,209,206,206,207,3800,12,2010,20,3.96,4.51,80.5308,2.5,8.75,9.08,2.8,6
3287,12/17/2010,208,212,208,212,212,794000,12,2010,17,3.96,4.51,80.5375,2.5,8.75,9.08,2.8,6
3288,12/16/2010,208,212,208,212,210,626000,12,2010,16,3.96,4.51,80.6325,2.5,8.75,9.08,2.8,6
3289,12/15/2010,210,210,208,210,210,309500,12,2010,15,3.96,4.51,80.5239,2.5,8.75,9.08,2.8,6
3290,12/14/2010,207,210,207,210,210,405400,12,2010,14,3.96,4.51,80.5153,2.5,8.75,9.08,2.8,6
3291,12/10/2010,206,208,206,208,208,40200,12,2010,10,3.96,4.51,80.5578,2.5,8.75,9.08,2.8,6
3292,12/9/2010,206,207,206,207,207,497900,12,2010,9,3.96,4.51,80.5736,2.5,8.75,9.08,2.8,6
3293,12/8/2010,204,207,204,207,206,124300,12,2010,8,3.96,4.51,80.5525,2.5,8.75,9.08,2.8,6
3294,12/7/2010,208,208,203,205,205,20800,12,2010,7,3.96,4.51,80.4831,2.5,8.75,9.08,2.8,6
3295,12/6/2010,206,210,205,210,209,436300,12,2010,6,3.96,4.51,80.4364,2.5,8.75,9.08,2.8,6
3296,12/3/2010,206,210,206,206,207,71700,12,2010,3,3.96,4.51,80.4625,2.5,8.75,9.08,2.8,6
3297,12/2/2010,195,210,195,208,209,41300,12,2010,2,3.96,4.51,80.3208,2.5,8.75,9.08,2.8,6
3298,12/1/2010,216,216,210,210,213,1600,12,2010,1,3.96,4.51,80.8972,2.5,8.75,9.08,2.8,6
3299,11/30/2010,216,218,216,216,217,721800,11,2010,30,4.02,3.84,80.9742,2.5,8.75,9.08,2.8,6
3300,11/29/2010,216,218,216,217,217,187400,11,2010,29,4.02,3.84,80.7764,2.5,8.75,9.08,2.8,6
3301,11/26/2010,216,217,216,216,217,236900,11,2010,26,4.02,3.84,80.3892,2.5,8.75,9.08,2.8,6
3302,11/25/2010,216,219,211,211,217,102000,11,2010,25,4.02,3.84,80.2931,2.5,8.75,9.08,2.8,6
3303,11/24/2010,219,220,215,220,220,537600,11,2010,24,4.02,3.84,80.3486,2.5,8.75,9.08,2.8,6
3304,11/23/2010,225,225,220,220,224,59000,11,2010,23,4.02,3.84,80.1625,2.5,8.75,9.08,2.8,6
3305,11/22/2010,225,226,222,224,226,315800,11,2010,22,4.02,3.84,80.0397,2.5,8.75,9.08,2.8,6
3306,11/19/2010,225,226,225,225,226,1187300,11,2010,19,4.02,3.84,80.1006,2.5,8.75,9.08,2.8,6
3307,11/18/2010,222,225,222,225,225,232600,11,2010,18,4.02,3.84,80.1639,2.5,8.75,9.08,2.8,6
3308,11/17/2010,220,223,220,223,223,77500,11,2010,17,4.02,3.84,80.45,2.5,8.75,9.08,2.8,6
3309,11/16/2010,220,225,220,221,222,272500,11,2010,16,4.02,3.84,80.4572,2.5,8.75,9.08,2.8,6
3310,11/15/2010,217,222,217,221,220,342400,11,2010,15,4.02,3.84,80.5147,2.5,8.75,9.08,2.8,6
3311,11/12/2010,217,218,217,217,218,149600,11,2010,12,4.02,3.84,80.5986,2.5,8.75,9.08,2.8,6
